,number,value,datetime_start,datetime_complete,duration,params_bootstrap,params_criterion,params_max_depth,params_max_leaf_nodes,params_min_samples_leaf,params_n_estimators,state
950,950,0.8068714074063758,2023-04-04 23:27:08.416682,2023-04-04 23:27:24.193689,0 days 00:00:15.777007,False,entropy,10,10,5,964,COMPLETE
951,951,0.806941305021622,2023-04-04 23:27:24.196718,2023-04-04 23:27:38.933542,0 days 00:00:14.736824,False,entropy,8,10,6,915,COMPLETE
952,952,0.8064011106801402,2023-04-04 23:27:38.937664,2023-04-04 23:27:54.254514,0 days 00:00:15.316850,False,entropy,10,10,4,945,COMPLETE
953,953,0.8063747773964703,2023-04-04 23:27:54.257846,2023-04-04 23:28:09.913034,0 days 00:00:15.655188,False,entropy,9,10,5,971,COMPLETE
954,954,0.7892247338176046,2023-04-04 23:28:09.916202,2023-04-04 23:28:19.580982,0 days 00:00:09.664780,False,entropy,10,3,10,935,COMPLETE
955,955,0.8066703356602473,2023-04-04 23:28:19.584387,2023-04-04 23:28:33.999078,0 days 00:00:14.414691,False,entropy,8,10,8,897,COMPLETE
956,956,0.806941740966912,2023-04-04 23:28:34.002814,2023-04-04 23:28:49.484737,0 days 00:00:15.481923,False,entropy,10,10,6,955,COMPLETE
957,957,0.8061406522885841,2023-04-04 23:28:49.487818,2023-04-04 23:29:05.130102,0 days 00:00:15.642284,False,gini,8,10,4,981,COMPLETE
958,958,0.806314462594805,2023-04-04 23:29:05.133326,2023-04-04 23:29:19.960064,0 days 00:00:14.826738,False,entropy,10,10,5,909,COMPLETE
959,959,0.8065090712945324,2023-04-04 23:29:19.961785,2023-04-04 23:29:35.518618,0 days 00:00:15.556833,False,entropy,8,10,6,962,COMPLETE
960,960,0.8072712025575088,2023-04-04 23:29:35.522198,2023-04-04 23:29:45.664053,0 days 00:00:10.141855,True,entropy,10,10,5,929,COMPLETE
961,961,0.8063989861313552,2023-04-04 23:29:45.666971,2023-04-04 23:29:55.686131,0 days 00:00:10.019160,True,entropy,10,10,5,933,COMPLETE
962,962,0.803057474906576,2023-04-04 23:29:55.689274,2023-04-04 23:30:09.717181,0 days 00:00:14.027907,False,entropy,10,8,5,932,COMPLETE
963,963,0.8072181781441474,2023-04-04 23:30:09.720660,2023-04-04 23:30:19.665740,0 days 00:00:09.945080,True,entropy,8,10,5,912,COMPLETE
964,964,0.80589925891556,2023-04-04 23:30:19.668701,2023-04-04 23:30:29.524094,0 days 00:00:09.855393,True,entropy,10,9,5,917,COMPLETE
965,965,0.8070649761379476,2023-04-04 23:30:29.527363,2023-04-04 23:30:39.162966,0 days 00:00:09.635603,True,entropy,7,10,5,898,COMPLETE
966,966,0.8066934373108724,2023-04-04 23:30:39.166230,2023-04-04 23:30:48.967125,0 days 00:00:09.800895,True,entropy,8,10,5,905,COMPLETE
967,967,0.80629989285927,2023-04-04 23:30:48.970746,2023-04-04 23:30:58.782081,0 days 00:00:09.811335,True,entropy,10,10,5,912,COMPLETE
968,968,0.8067439232749287,2023-04-04 23:30:58.785065,2023-04-04 23:31:08.765978,0 days 00:00:09.980913,True,entropy,8,10,5,918,COMPLETE
969,969,0.7957970784929265,2023-04-04 23:31:08.769214,2023-04-04 23:31:17.051428,0 days 00:00:08.282214,True,entropy,9,5,5,908,COMPLETE
970,970,0.8060744894240418,2023-04-04 23:31:17.054903,2023-04-04 23:31:26.795247,0 days 00:00:09.740344,True,entropy,10,10,5,895,COMPLETE
971,971,0.801187805582621,2023-04-04 23:31:26.798354,2023-04-04 23:31:40.252757,0 days 00:00:13.454403,False,entropy,10,7,5,928,COMPLETE
972,972,0.806536030652117,2023-04-04 23:31:40.257188,2023-04-04 23:31:49.956206,0 days 00:00:09.699018,True,entropy,10,10,5,888,COMPLETE
973,973,0.8021696151353661,2023-04-04 23:31:49.959165,2023-04-04 23:31:57.526795,0 days 00:00:07.567630,True,entropy,3,10,5,919,COMPLETE
974,974,0.8063828173123418,2023-04-04 23:31:57.528137,2023-04-04 23:32:07.655125,0 days 00:00:10.126988,True,entropy,7,10,5,941,COMPLETE
975,975,0.8065756926857978,2023-04-04 23:32:07.658651,2023-04-04 23:32:17.369549,0 days 00:00:09.710898,True,entropy,8,10,5,889,COMPLETE
976,976,0.8063975100905182,2023-04-04 23:32:17.372777,2023-04-04 23:32:27.551021,0 days 00:00:10.178244,True,entropy,10,10,5,928,COMPLETE
977,977,0.8048124408889874,2023-04-04 23:32:27.554362,2023-04-04 23:32:42.200164,0 days 00:00:14.645802,False,entropy,6,9,5,950,COMPLETE
978,978,0.8062475506364757,2023-04-04 23:32:42.203924,2023-04-04 23:32:51.780152,0 days 00:00:09.576228,True,gini,10,10,5,885,COMPLETE
979,979,0.8066242665081429,2023-04-04 23:32:51.783694,2023-04-04 23:33:01.375333,0 days 00:00:09.591639,True,entropy,8,10,5,906,COMPLETE
980,980,0.8066505438263555,2023-04-04 23:33:01.378872,2023-04-04 23:33:11.495704,0 days 00:00:10.116832,True,entropy,10,10,5,929,COMPLETE
981,981,0.8061672203546966,2023-04-04 23:33:11.498909,2023-04-04 23:33:21.659658,0 days 00:00:10.160749,True,entropy,8,10,5,941,COMPLETE
982,982,0.8060731923332376,2023-04-04 23:33:21.662641,2023-04-04 23:33:26.381171,0 days 00:00:04.718530,True,entropy,9,10,5,427,COMPLETE
983,983,0.8063811622789656,2023-04-04 23:33:26.384512,2023-04-04 23:33:41.103953,0 days 00:00:14.719441,False,entropy,10,10,5,909,COMPLETE
984,984,0.8060236566213679,2023-04-04 23:33:41.108095,2023-04-04 23:33:46.157452,0 days 00:00:05.049357,True,entropy,9,10,5,455,COMPLETE
985,985,0.8058233007039461,2023-04-04 23:33:46.160598,2023-04-04 23:33:48.320781,0 days 00:00:02.160183,True,entropy,10,10,5,181,COMPLETE
986,986,0.8061021308500461,2023-04-04 23:33:48.323861,2023-04-04 23:33:53.608838,0 days 00:00:05.284977,True,entropy,8,10,4,480,COMPLETE
987,987,0.80689561589551,2023-04-04 23:33:53.613199,2023-04-04 23:34:03.206495,0 days 00:00:09.593296,True,entropy,10,10,5,885,COMPLETE
988,988,0.8062990095453604,2023-04-04 23:34:03.209787,2023-04-04 23:34:07.406696,0 days 00:00:04.196909,True,entropy,10,10,5,372,COMPLETE
989,989,0.8052461058725088,2023-04-04 23:34:07.410283,2023-04-04 23:34:21.427604,0 days 00:00:14.017321,False,entropy,5,9,4,948,COMPLETE
990,990,0.806730661484125,2023-04-04 23:34:21.430500,2023-04-04 23:34:31.802195,0 days 00:00:10.371695,True,entropy,8,10,5,968,COMPLETE
991,991,0.8063308218523053,2023-04-04 23:34:31.805517,2023-04-04 23:34:41.862441,0 days 00:00:10.056924,True,entropy,10,10,4,923,COMPLETE
992,992,0.8063323647698952,2023-04-04 23:34:41.865757,2023-04-04 23:34:46.276857,0 days 00:00:04.411100,True,entropy,10,10,5,394,COMPLETE
993,993,0.8065907432839561,2023-04-04 23:34:46.280143,2023-04-04 23:34:56.858190,0 days 00:00:10.578047,True,entropy,8,10,4,983,COMPLETE
994,994,0.8066605848451764,2023-04-04 23:34:56.861895,2023-04-04 23:34:59.576479,0 days 00:00:02.714584,True,entropy,10,10,5,235,COMPLETE
995,995,0.8065818761682546,2023-04-04 23:34:59.580077,2023-04-04 23:35:09.098937,0 days 00:00:09.518860,True,entropy,8,10,5,897,COMPLETE
996,996,0.8062639319957763,2023-04-04 23:35:09.099518,2023-04-04 23:35:24.465166,0 days 00:00:15.365648,False,gini,10,10,4,950,COMPLETE
997,997,0.8067799846617995,2023-04-04 23:35:24.467813,2023-04-04 23:35:34.964701,0 days 00:00:10.496888,True,entropy,9,10,5,968,COMPLETE
998,998,0.8068858429642575,2023-04-04 23:35:34.967800,2023-04-04 23:35:45.608758,0 days 00:00:10.640958,True,entropy,10,10,3,984,COMPLETE
999,999,0.8065861811927822,2023-04-04 23:35:45.612468,2023-04-04 23:35:55.600026,0 days 00:00:09.987558,True,entropy,10,10,5,923,COMPLETE
