,number,value,datetime_start,datetime_complete,duration,params_bootstrap,params_criterion,params_max_depth,params_max_leaf_nodes,params_min_samples_leaf,params_n_estimators,state
792,792,0.8064841021780174,2023-04-04 23:01:48.980071,2023-04-04 23:01:53.545166,0 days 00:00:04.565095,True,entropy,8,10,5,409,COMPLETE
793,793,0.7937291106588444,2023-04-04 23:01:53.548603,2023-04-04 23:02:02.134836,0 days 00:00:08.586233,True,entropy,10,4,6,999,COMPLETE
794,794,0.8048237680216594,2023-04-04 23:02:02.138044,2023-04-04 23:02:17.206862,0 days 00:00:15.068818,False,entropy,9,9,6,967,COMPLETE
795,795,0.8069822415574119,2023-04-04 23:02:17.208029,2023-04-04 23:02:27.558593,0 days 00:00:10.350564,True,entropy,7,10,8,974,COMPLETE
796,796,0.806685755439848,2023-04-04 23:02:27.560872,2023-04-04 23:02:36.447402,0 days 00:00:08.886530,True,entropy,10,10,4,817,COMPLETE
797,797,0.8071396482087854,2023-04-04 23:02:36.450635,2023-04-04 23:02:47.267923,0 days 00:00:10.817288,True,entropy,8,10,5,1000,COMPLETE
798,798,0.8061236448436133,2023-04-04 23:02:47.271456,2023-04-04 23:02:57.873795,0 days 00:00:10.602339,True,entropy,8,10,5,992,COMPLETE
799,799,0.8067319251367178,2023-04-04 23:02:57.875756,2023-04-04 23:03:08.436380,0 days 00:00:10.560624,True,entropy,8,10,5,989,COMPLETE
800,800,0.8065042630545947,2023-04-04 23:03:08.439493,2023-04-04 23:03:19.238260,0 days 00:00:10.798767,True,entropy,8,10,5,1000,COMPLETE
801,801,0.8067120326576465,2023-04-04 23:03:19.241244,2023-04-04 23:03:29.975008,0 days 00:00:10.733764,True,entropy,8,10,5,982,COMPLETE
802,802,0.8069006029543082,2023-04-04 23:03:29.977946,2023-04-04 23:03:45.938778,0 days 00:00:15.960832,False,entropy,8,10,5,1000,COMPLETE
803,803,0.806531624905837,2023-04-04 23:03:45.943195,2023-04-04 23:03:56.384323,0 days 00:00:10.441128,True,entropy,8,10,5,981,COMPLETE
804,804,0.8068127810389681,2023-04-04 23:03:56.387212,2023-04-04 23:04:05.450684,0 days 00:00:09.063472,True,entropy,8,10,5,840,COMPLETE
805,805,0.8056742691736017,2023-04-04 23:04:05.451224,2023-04-04 23:04:14.711570,0 days 00:00:09.260346,True,entropy,8,9,5,864,COMPLETE
806,806,0.8061723751834657,2023-04-04 23:04:14.714450,2023-04-04 23:04:25.263935,0 days 00:00:10.549485,True,gini,8,10,5,981,COMPLETE
807,807,0.8066566043837652,2023-04-04 23:04:25.267763,2023-04-04 23:04:35.570445,0 days 00:00:10.302682,True,entropy,8,10,5,965,COMPLETE
808,808,0.8064666810979698,2023-04-04 23:04:35.572534,2023-04-04 23:04:46.229233,0 days 00:00:10.656699,True,entropy,8,10,5,999,COMPLETE
809,809,0.8067925641311259,2023-04-04 23:04:46.230602,2023-04-04 23:04:57.047033,0 days 00:00:10.816431,True,entropy,8,10,6,1000,COMPLETE
810,810,0.8060136825657077,2023-04-04 23:04:57.049481,2023-04-04 23:05:10.570147,0 days 00:00:13.520666,False,entropy,8,10,5,849,COMPLETE
811,811,0.8009779564166404,2023-04-04 23:05:10.574028,2023-04-04 23:05:14.315573,0 days 00:00:03.741545,True,entropy,3,10,4,440,COMPLETE
812,812,0.8064522564166493,2023-04-04 23:05:14.319415,2023-04-04 23:05:23.065485,0 days 00:00:08.746070,True,entropy,8,10,5,807,COMPLETE
813,813,0.80690277234951,2023-04-04 23:05:23.068628,2023-04-04 23:05:32.643732,0 days 00:00:09.575104,True,entropy,8,10,6,880,COMPLETE
814,814,0.8063158491792043,2023-04-04 23:05:32.646946,2023-04-04 23:05:36.485485,0 days 00:00:03.838539,True,entropy,9,10,4,343,COMPLETE
815,815,0.8062427648114715,2023-04-04 23:05:36.488701,2023-04-04 23:05:46.950830,0 days 00:00:10.462129,True,entropy,8,10,7,975,COMPLETE
816,816,0.8071256599211944,2023-04-04 23:05:46.953997,2023-04-04 23:05:51.265989,0 days 00:00:04.311992,True,entropy,8,10,5,384,COMPLETE
817,817,0.8069313642887176,2023-04-04 23:05:51.269261,2023-04-04 23:06:00.220509,0 days 00:00:08.951248,True,entropy,8,10,6,827,COMPLETE
818,818,0.8065157579821142,2023-04-04 23:06:00.223413,2023-04-04 23:06:15.683027,0 days 00:00:15.459614,False,entropy,8,10,4,970,COMPLETE
819,819,0.8045196783203922,2023-04-04 23:06:15.686586,2023-04-04 23:06:19.621035,0 days 00:00:03.934449,True,entropy,9,9,5,364,COMPLETE
820,820,0.8066015338072683,2023-04-04 23:06:19.624703,2023-04-04 23:06:29.326869,0 days 00:00:09.702166,True,entropy,8,10,6,869,COMPLETE
821,821,0.8069503398668736,2023-04-04 23:06:29.330152,2023-04-04 23:06:39.947239,0 days 00:00:10.617087,True,entropy,7,10,3,980,COMPLETE
822,822,0.8066761281841182,2023-04-04 23:06:39.950353,2023-04-04 23:06:44.537047,0 days 00:00:04.586694,True,entropy,8,10,5,417,COMPLETE
823,823,0.8070285903013306,2023-04-04 23:06:44.540401,2023-04-04 23:06:53.474417,0 days 00:00:08.934016,True,entropy,8,10,10,834,COMPLETE
824,824,0.806658371066536,2023-04-04 23:06:53.477558,2023-04-04 23:07:04.365088,0 days 00:00:10.887530,True,entropy,9,10,6,1000,COMPLETE
825,825,0.8066263350929637,2023-04-04 23:07:04.367932,2023-04-04 23:07:13.577449,0 days 00:00:09.209517,True,entropy,10,10,6,857,COMPLETE
826,826,0.804289645605207,2023-04-04 23:07:13.581014,2023-04-04 23:07:28.538790,0 days 00:00:14.957776,False,gini,9,9,4,958,COMPLETE
827,827,0.8066248479881356,2023-04-04 23:07:28.542083,2023-04-04 23:07:38.112711,0 days 00:00:09.570628,True,entropy,8,10,5,894,COMPLETE
828,828,0.8062132334515747,2023-04-04 23:07:38.116284,2023-04-04 23:07:48.823091,0 days 00:00:10.706807,True,entropy,10,10,6,983,COMPLETE
829,829,0.8058792320496343,2023-04-04 23:07:48.825998,2023-04-04 23:07:51.848053,0 days 00:00:03.022055,True,entropy,10,10,4,269,COMPLETE
830,830,0.806924711016691,2023-04-04 23:07:51.851217,2023-04-04 23:07:56.286667,0 days 00:00:04.435450,True,entropy,10,10,5,401,COMPLETE
831,831,0.7988490923176371,2023-04-04 23:07:56.290103,2023-04-04 23:08:04.106950,0 days 00:00:07.816847,True,entropy,8,6,6,821,COMPLETE
832,832,0.8061795761763154,2023-04-04 23:08:04.110525,2023-04-04 23:08:14.568848,0 days 00:00:10.458323,True,entropy,8,10,6,965,COMPLETE
833,833,0.8068434192696026,2023-04-04 23:08:14.572056,2023-04-04 23:08:23.730931,0 days 00:00:09.158875,True,entropy,10,10,4,850,COMPLETE
834,834,0.796454067101151,2023-04-04 23:08:23.733839,2023-04-04 23:08:35.108463,0 days 00:00:11.374624,False,entropy,7,5,5,882,COMPLETE
835,835,0.8068406460651621,2023-04-04 23:08:35.109155,2023-04-04 23:08:43.676490,0 days 00:00:08.567335,True,entropy,10,10,7,798,COMPLETE
836,836,0.8070225632003171,2023-04-04 23:08:43.680617,2023-04-04 23:08:54.268157,0 days 00:00:10.587540,True,entropy,10,10,10,979,COMPLETE
837,837,0.8064119681997797,2023-04-04 23:08:54.271572,2023-04-04 23:09:04.483810,0 days 00:00:10.212238,True,entropy,10,10,6,948,COMPLETE
838,838,0.806735357987645,2023-04-04 23:09:04.486909,2023-04-04 23:09:13.788818,0 days 00:00:09.301909,True,entropy,8,10,5,868,COMPLETE
839,839,0.8062898850215143,2023-04-04 23:09:13.791631,2023-04-04 23:09:24.554573,0 days 00:00:10.762942,True,entropy,9,10,4,983,COMPLETE
840,840,0.806521639502025,2023-04-04 23:09:24.557376,2023-04-04 23:09:33.689006,0 days 00:00:09.131630,True,entropy,10,10,6,838,COMPLETE
841,841,0.8064774378934334,2023-04-04 23:09:33.690009,2023-04-04 23:09:43.437858,0 days 00:00:09.747849,True,entropy,8,10,5,906,COMPLETE
842,842,0.8057594188055519,2023-04-04 23:09:43.441254,2023-04-04 23:09:50.414196,0 days 00:00:06.972942,False,entropy,10,10,6,425,COMPLETE
843,843,0.8061638770327291,2023-04-04 23:09:50.417222,2023-04-04 23:10:01.080343,0 days 00:00:10.663121,True,gini,10,10,7,999,COMPLETE
844,844,0.8066748418602936,2023-04-04 23:10:01.083493,2023-04-04 23:10:11.642885,0 days 00:00:10.559392,True,entropy,8,10,4,963,COMPLETE
845,845,0.8050715240276869,2023-04-04 23:10:11.646106,2023-04-04 23:10:13.983946,0 days 00:00:02.337840,True,entropy,10,9,10,208,COMPLETE
846,846,0.8066947455892031,2023-04-04 23:10:13.987179,2023-04-04 23:10:22.421053,0 days 00:00:08.433874,True,entropy,8,10,5,781,COMPLETE
847,847,0.8068610754127048,2023-04-04 23:10:22.423982,2023-04-04 23:10:32.519786,0 days 00:00:10.095804,True,entropy,10,10,6,939,COMPLETE
848,848,0.8068512465130091,2023-04-04 23:10:32.522909,2023-04-04 23:10:41.354926,0 days 00:00:08.832017,True,entropy,10,10,4,816,COMPLETE
849,849,0.8060006671158767,2023-04-04 23:10:41.358058,2023-04-04 23:10:43.040356,0 days 00:00:01.682298,True,entropy,8,10,5,134,COMPLETE
850,850,0.806640435331935,2023-04-04 23:10:43.041631,2023-04-04 23:10:47.967015,0 days 00:00:04.925384,True,entropy,9,10,6,452,COMPLETE
851,851,0.806499835031125,2023-04-04 23:10:47.970467,2023-04-04 23:11:02.134940,0 days 00:00:14.164473,False,entropy,10,10,4,886,COMPLETE
852,852,0.8064501207122134,2023-04-04 23:11:02.137974,2023-04-04 23:11:12.823537,0 days 00:00:10.685563,True,entropy,10,10,6,981,COMPLETE
853,853,0.8066326528038402,2023-04-04 23:11:12.826438,2023-04-04 23:11:23.224193,0 days 00:00:10.397755,True,entropy,8,10,5,956,COMPLETE
854,854,0.8060477089457988,2023-04-04 23:11:23.226857,2023-04-04 23:11:27.550042,0 days 00:00:04.323185,True,entropy,10,10,10,387,COMPLETE
855,855,0.8070770747402622,2023-04-04 23:11:27.553696,2023-04-04 23:11:36.704592,0 days 00:00:09.150896,True,entropy,8,10,5,853,COMPLETE
856,856,0.8048290012767317,2023-04-04 23:11:36.708118,2023-04-04 23:11:47.372198,0 days 00:00:10.664080,True,entropy,10,9,6,1000,COMPLETE
857,857,0.8065809817558975,2023-04-04 23:11:47.375073,2023-04-04 23:11:56.336185,0 days 00:00:08.961112,True,entropy,8,10,4,832,COMPLETE
858,858,0.8066131630147911,2023-04-04 23:11:56.340180,2023-04-04 23:12:11.603580,0 days 00:00:15.263400,False,entropy,9,10,8,926,COMPLETE
859,859,0.8064831293671819,2023-04-04 23:12:11.607250,2023-04-04 23:12:21.020333,0 days 00:00:09.413083,True,entropy,10,10,6,867,COMPLETE
860,860,0.8059024459233246,2023-04-04 23:12:21.022679,2023-04-04 23:12:25.047026,0 days 00:00:04.024347,True,entropy,10,10,7,358,COMPLETE
861,861,0.806583732385109,2023-04-04 23:12:25.050033,2023-04-04 23:12:35.748597,0 days 00:00:10.698564,True,entropy,7,10,5,1000,COMPLETE
862,862,0.806323676580873,2023-04-04 23:12:35.752192,2023-04-04 23:12:46.182516,0 days 00:00:10.430324,True,gini,10,10,4,967,COMPLETE
863,863,0.8066884278468784,2023-04-04 23:12:46.185567,2023-04-04 23:12:56.653242,0 days 00:00:10.467675,True,entropy,8,10,6,983,COMPLETE
864,864,0.8048672430535522,2023-04-04 23:12:56.656500,2023-04-04 23:13:06.267158,0 days 00:00:09.610658,True,entropy,10,9,5,907,COMPLETE
865,865,0.8067360847820442,2023-04-04 23:13:06.270544,2023-04-04 23:13:16.422169,0 days 00:00:10.151625,True,entropy,6,10,10,957,COMPLETE
866,866,0.8064865398601381,2023-04-04 23:13:16.425425,2023-04-04 23:13:29.595489,0 days 00:00:13.170064,False,entropy,10,10,5,809,COMPLETE
867,867,0.8069788983271338,2023-04-04 23:13:29.598399,2023-04-04 23:13:38.671737,0 days 00:00:09.073338,True,entropy,8,10,6,847,COMPLETE
868,868,0.8061878170926239,2023-04-04 23:13:38.674697,2023-04-04 23:13:43.245726,0 days 00:00:04.571029,True,entropy,10,10,4,401,COMPLETE
869,869,0.8066629109117365,2023-04-04 23:13:43.246308,2023-04-04 23:13:53.672228,0 days 00:00:10.425920,True,entropy,8,10,6,939,COMPLETE
870,870,0.7865586611562594,2023-04-04 23:13:53.673841,2023-04-04 23:14:00.294151,0 days 00:00:06.620310,True,entropy,5,2,7,971,COMPLETE
871,871,0.8060391882659556,2023-04-04 23:14:00.297359,2023-04-04 23:14:09.941622,0 days 00:00:09.644263,True,entropy,10,10,4,896,COMPLETE
872,872,0.8059941703113491,2023-04-04 23:14:09.944837,2023-04-04 23:14:14.871779,0 days 00:00:04.926942,True,entropy,9,10,3,438,COMPLETE
873,873,0.806735525741359,2023-04-04 23:14:14.875034,2023-04-04 23:14:24.354965,0 days 00:00:09.479931,True,entropy,10,10,5,871,COMPLETE
874,874,0.8063933615238792,2023-04-04 23:14:24.357904,2023-04-04 23:14:40.094433,0 days 00:00:15.736529,False,entropy,8,10,6,981,COMPLETE
875,875,0.806950228096899,2023-04-04 23:14:40.097855,2023-04-04 23:14:49.146657,0 days 00:00:09.048802,True,entropy,10,10,10,840,COMPLETE
876,876,0.8068755109593484,2023-04-04 23:14:49.150028,2023-04-04 23:15:00.039811,0 days 00:00:10.889783,True,entropy,10,10,5,1000,COMPLETE
877,877,0.807037647746245,2023-04-04 23:15:00.040416,2023-04-04 23:15:10.266130,0 days 00:00:10.225714,True,entropy,8,10,6,953,COMPLETE
878,878,0.8063101800338689,2023-04-04 23:15:10.268976,2023-04-04 23:15:20.123520,0 days 00:00:09.854544,True,entropy,10,10,4,918,COMPLETE
879,879,0.8066396305062128,2023-04-04 23:15:20.126935,2023-04-04 23:15:29.065464,0 days 00:00:08.938529,True,entropy,10,10,6,825,COMPLETE
880,880,0.8012932726457382,2023-04-04 23:15:29.068360,2023-04-04 23:15:38.967011,0 days 00:00:09.898651,True,entropy,9,7,5,981,COMPLETE
881,881,0.8069193214502739,2023-04-04 23:15:38.970221,2023-04-04 23:15:48.555780,0 days 00:00:09.585559,True,entropy,8,10,6,883,COMPLETE
882,882,0.8057431045385142,2023-04-04 23:15:48.558668,2023-04-04 23:15:55.261918,0 days 00:00:06.703250,False,gini,10,10,8,416,COMPLETE
883,883,0.8052493821900697,2023-04-04 23:15:55.265140,2023-04-04 23:15:58.809089,0 days 00:00:03.543949,True,entropy,7,9,4,322,COMPLETE
884,884,0.8065558113657678,2023-04-04 23:15:58.812330,2023-04-04 23:16:09.009541,0 days 00:00:10.197211,True,entropy,10,10,1,940,COMPLETE
885,885,0.8064633487200888,2023-04-04 23:16:09.012167,2023-04-04 23:16:18.191298,0 days 00:00:09.179131,True,entropy,8,10,3,851,COMPLETE
886,886,0.8065375401854122,2023-04-04 23:16:18.194582,2023-04-04 23:16:28.572644,0 days 00:00:10.378062,True,entropy,10,10,5,963,COMPLETE
887,887,0.8067138442357994,2023-04-04 23:16:28.575845,2023-04-04 23:16:37.299354,0 days 00:00:08.723509,True,entropy,8,10,10,812,COMPLETE
888,888,0.8062088167339981,2023-04-04 23:16:37.302910,2023-04-04 23:16:47.970114,0 days 00:00:10.667204,True,entropy,10,10,6,983,COMPLETE
889,889,0.8068766292868592,2023-04-04 23:16:47.973350,2023-04-04 23:16:57.327511,0 days 00:00:09.354161,True,entropy,9,10,5,864,COMPLETE
890,890,0.8069168279728338,2023-04-04 23:16:57.330872,2023-04-04 23:17:04.994919,0 days 00:00:07.664047,False,entropy,8,10,4,471,COMPLETE
891,891,0.803214311298402,2023-04-04 23:17:04.997878,2023-04-04 23:17:08.963275,0 days 00:00:03.965397,True,entropy,10,8,6,372,COMPLETE
892,892,0.8065015346857454,2023-04-04 23:17:08.965980,2023-04-04 23:17:18.735172,0 days 00:00:09.769192,True,entropy,10,10,7,891,COMPLETE
893,893,0.797722724018806,2023-04-04 23:17:18.739059,2023-04-04 23:17:24.635755,0 days 00:00:05.896696,True,entropy,10,6,5,606,COMPLETE
894,894,0.8064204665371513,2023-04-04 23:17:24.639003,2023-04-04 23:17:35.397212,0 days 00:00:10.758209,True,entropy,8,10,6,1000,COMPLETE
895,895,0.8063675651979093,2023-04-04 23:17:35.400830,2023-04-04 23:17:45.866258,0 days 00:00:10.465428,True,entropy,10,10,4,969,COMPLETE
896,896,0.8067154878805581,2023-04-04 23:17:45.870507,2023-04-04 23:17:54.560120,0 days 00:00:08.689613,True,entropy,10,10,5,798,COMPLETE
897,897,0.8064005180228163,2023-04-04 23:17:54.562694,2023-04-04 23:18:04.754168,0 days 00:00:10.191474,True,entropy,8,10,6,942,COMPLETE
898,898,0.8070292721914578,2023-04-04 23:18:04.757399,2023-04-04 23:18:13.977090,0 days 00:00:09.219691,False,entropy,9,10,10,567,COMPLETE
899,899,0.806329535757907,2023-04-04 23:18:13.980261,2023-04-04 23:18:23.026624,0 days 00:00:09.046363,True,entropy,10,10,6,830,COMPLETE
900,900,0.8047559057520731,2023-04-04 23:18:23.029174,2023-04-04 23:18:31.213215,0 days 00:00:08.184041,True,gini,10,9,4,769,COMPLETE
901,901,0.806324503972289,2023-04-04 23:18:31.216158,2023-04-04 23:18:41.015565,0 days 00:00:09.799407,True,entropy,8,10,5,906,COMPLETE
902,902,0.8066059170939404,2023-04-04 23:18:41.018528,2023-04-04 23:18:51.642026,0 days 00:00:10.623498,True,entropy,7,10,6,984,COMPLETE
903,903,0.8067766972903379,2023-04-04 23:18:51.645393,2023-04-04 23:19:00.977201,0 days 00:00:09.331808,True,entropy,10,10,5,852,COMPLETE
904,904,0.8063759627802118,2023-04-04 23:19:00.980699,2023-04-04 23:19:11.057709,0 days 00:00:10.077010,True,entropy,10,10,5,925,COMPLETE
905,905,0.8067175565357626,2023-04-04 23:19:11.060838,2023-04-04 23:19:21.462141,0 days 00:00:10.401303,True,entropy,8,10,7,961,COMPLETE
906,906,0.8058915993798728,2023-04-04 23:19:21.465617,2023-04-04 23:19:25.854542,0 days 00:00:04.388925,True,entropy,10,10,4,396,COMPLETE
907,907,0.8049229508151197,2023-04-04 23:19:25.856459,2023-04-04 23:19:39.718907,0 days 00:00:13.862448,False,entropy,9,9,6,883,COMPLETE
908,908,0.8070555273320323,2023-04-04 23:19:39.721928,2023-04-04 23:19:50.408572,0 days 00:00:10.686644,True,entropy,8,10,10,984,COMPLETE
909,909,0.8068512129251328,2023-04-04 23:19:50.411886,2023-04-04 23:20:00.636775,0 days 00:00:10.224889,True,entropy,10,10,8,946,COMPLETE
910,910,0.8063663687574687,2023-04-04 23:20:00.640183,2023-04-04 23:20:10.056335,0 days 00:00:09.416152,True,entropy,10,10,4,868,COMPLETE
911,911,0.8065221652006596,2023-04-04 23:20:10.059264,2023-04-04 23:20:20.924519,0 days 00:00:10.865255,True,entropy,10,10,6,1000,COMPLETE
912,912,0.8067378517251269,2023-04-04 23:20:20.927547,2023-04-04 23:20:25.666783,0 days 00:00:04.739236,True,entropy,9,10,5,423,COMPLETE
913,913,0.806842502390848,2023-04-04 23:20:25.670158,2023-04-04 23:20:34.188476,0 days 00:00:08.518318,True,entropy,8,10,4,788,COMPLETE
914,914,0.8061898299753298,2023-04-04 23:20:34.192271,2023-04-04 23:20:43.322402,0 days 00:00:09.130131,True,entropy,10,10,6,834,COMPLETE
915,915,0.8064788133815005,2023-04-04 23:20:43.325830,2023-04-04 23:20:58.880269,0 days 00:00:15.554439,False,entropy,8,10,6,967,COMPLETE
916,916,0.8069756333327731,2023-04-04 23:20:58.883618,2023-04-04 23:21:09.039983,0 days 00:00:10.156365,True,entropy,10,10,5,927,COMPLETE
917,917,0.8067904061682633,2023-04-04 23:21:09.043357,2023-04-04 23:21:19.440653,0 days 00:00:10.397296,True,entropy,7,10,3,973,COMPLETE
918,918,0.8065834193020969,2023-04-04 23:21:19.444124,2023-04-04 23:21:28.449981,0 days 00:00:09.005857,True,entropy,10,10,10,821,COMPLETE
919,919,0.8063390180461377,2023-04-04 23:21:28.453403,2023-04-04 23:21:38.642539,0 days 00:00:10.189136,True,gini,8,10,5,951,COMPLETE
920,920,0.8051360655389812,2023-04-04 23:21:38.645800,2023-04-04 23:21:45.367204,0 days 00:00:06.721404,True,entropy,10,9,4,622,COMPLETE
921,921,0.8061245281254668,2023-04-04 23:21:45.370372,2023-04-04 23:21:55.016155,0 days 00:00:09.645783,True,entropy,10,10,6,894,COMPLETE
922,922,0.806736207709237,2023-04-04 23:21:55.019405,2023-04-04 23:22:04.322341,0 days 00:00:09.302936,True,entropy,8,10,7,849,COMPLETE
923,923,0.8062552215587099,2023-04-04 23:22:04.324023,2023-04-04 23:22:11.634983,0 days 00:00:07.310960,False,entropy,10,10,6,444,COMPLETE
924,924,0.8065854208211898,2023-04-04 23:22:11.638234,2023-04-04 23:22:22.551882,0 days 00:00:10.913648,True,entropy,9,10,5,1000,COMPLETE
925,925,0.8070963634554822,2023-04-04 23:22:22.555333,2023-04-04 23:22:30.457517,0 days 00:00:07.902184,True,entropy,8,10,6,728,COMPLETE
926,926,0.8068226992655345,2023-04-04 23:22:30.459317,2023-04-04 23:22:41.101875,0 days 00:00:10.642558,True,entropy,10,10,4,982,COMPLETE
927,927,0.8065370817661328,2023-04-04 23:22:41.104923,2023-04-04 23:22:51.080159,0 days 00:00:09.975236,True,entropy,10,10,5,912,COMPLETE
928,928,0.8065910340481801,2023-04-04 23:22:51.083083,2023-04-04 23:22:55.347766,0 days 00:00:04.264683,True,entropy,8,10,8,383,COMPLETE
929,929,0.8068173206419512,2023-04-04 23:22:55.350922,2023-04-04 23:23:04.808736,0 days 00:00:09.457814,True,entropy,10,10,4,872,COMPLETE
930,930,0.8063658431183326,2023-04-04 23:23:04.811885,2023-04-04 23:23:15.075451,0 days 00:00:10.263566,True,entropy,10,10,6,949,COMPLETE
931,931,0.8064685146522645,2023-04-04 23:23:15.078824,2023-04-04 23:23:30.663046,0 days 00:00:15.584222,False,entropy,8,10,5,968,COMPLETE
932,932,0.8068486745664742,2023-04-04 23:23:30.664483,2023-04-04 23:23:39.432140,0 days 00:00:08.767657,True,entropy,10,10,10,804,COMPLETE
933,933,0.8066958638166447,2023-04-04 23:23:39.435110,2023-04-04 23:23:43.422388,0 days 00:00:03.987278,True,entropy,8,10,6,353,COMPLETE
934,934,0.8053095962922633,2023-04-04 23:23:43.423349,2023-04-04 23:23:52.522207,0 days 00:00:09.098858,True,entropy,10,9,6,861,COMPLETE
935,935,0.8063343327718331,2023-04-04 23:23:52.526321,2023-04-04 23:24:01.488526,0 days 00:00:08.962205,True,entropy,10,10,5,837,COMPLETE
936,936,0.8063662792432804,2023-04-04 23:24:01.491463,2023-04-04 23:24:06.060962,0 days 00:00:04.569499,True,entropy,6,10,3,409,COMPLETE
937,937,0.8067223423243522,2023-04-04 23:24:06.064343,2023-04-04 23:24:16.722397,0 days 00:00:10.658054,True,entropy,8,10,4,983,COMPLETE
938,938,0.8064654956645876,2023-04-04 23:24:16.724560,2023-04-04 23:24:27.497046,0 days 00:00:10.772486,True,gini,9,10,4,1000,COMPLETE
939,939,0.8072207948518987,2023-04-04 23:24:27.500120,2023-04-04 23:24:42.541017,0 days 00:00:15.040897,False,entropy,10,10,7,934,COMPLETE
940,940,0.8066431748533589,2023-04-04 23:24:42.544147,2023-04-04 23:24:57.656867,0 days 00:00:15.112720,False,entropy,10,10,7,931,COMPLETE
941,941,0.806294458294303,2023-04-04 23:24:57.660056,2023-04-04 23:25:12.601247,0 days 00:00:14.941191,False,entropy,9,10,5,925,COMPLETE
942,942,0.8066466412339766,2023-04-04 23:25:12.603485,2023-04-04 23:25:27.440909,0 days 00:00:14.837424,False,entropy,10,10,6,923,COMPLETE
943,943,0.8069591957796695,2023-04-04 23:25:27.444076,2023-04-04 23:25:42.080774,0 days 00:00:14.636698,False,entropy,8,10,10,909,COMPLETE
944,944,0.8067652359051349,2023-04-04 23:25:42.083983,2023-04-04 23:25:57.400928,0 days 00:00:15.316945,False,entropy,10,10,5,941,COMPLETE
945,945,0.8069499597822155,2023-04-04 23:25:57.404133,2023-04-04 23:26:12.480900,0 days 00:00:15.076767,False,entropy,10,10,6,937,COMPLETE
946,946,0.8066687477959242,2023-04-04 23:26:12.484112,2023-04-04 23:26:27.341871,0 days 00:00:14.857759,False,entropy,8,10,4,924,COMPLETE
947,947,0.8067445493477029,2023-04-04 23:26:27.344743,2023-04-04 23:26:42.604475,0 days 00:00:15.259732,False,entropy,10,10,6,951,COMPLETE
948,948,0.8053845032994097,2023-04-04 23:26:42.605149,2023-04-04 23:26:57.611641,0 days 00:00:15.006492,False,entropy,8,9,2,956,COMPLETE
949,949,0.7922824949942354,2023-04-04 23:26:57.615306,2023-04-04 23:27:08.413600,0 days 00:00:10.798294,False,entropy,10,4,7,902,COMPLETE
