,number,value,datetime_start,datetime_complete,duration,params_bootstrap,params_criterion,params_max_depth,params_max_leaf_nodes,params_min_samples_leaf,params_n_estimators,state
633,633,0.8067038923220753,2023-04-04 22:37:45.008087,2023-04-04 22:37:54.274861,0 days 00:00:09.266774,True,entropy,8,10,4,851,COMPLETE
634,634,0.8064766998644028,2023-04-04 22:37:54.277306,2023-04-04 22:38:03.175304,0 days 00:00:08.897998,True,gini,8,10,4,831,COMPLETE
635,635,0.8071472407378903,2023-04-04 22:38:03.178073,2023-04-04 22:38:11.953187,0 days 00:00:08.775114,True,entropy,8,10,4,820,COMPLETE
636,636,0.8064304182955689,2023-04-04 22:38:11.956080,2023-04-04 22:38:20.712483,0 days 00:00:08.756403,True,entropy,8,10,4,812,COMPLETE
637,637,0.8052124820326629,2023-04-04 22:38:20.715456,2023-04-04 22:38:29.099046,0 days 00:00:08.383590,True,entropy,8,9,4,784,COMPLETE
638,638,0.8063918633888341,2023-04-04 22:38:29.102215,2023-04-04 22:38:37.944620,0 days 00:00:08.842405,True,entropy,8,10,4,824,COMPLETE
639,639,0.802938108785115,2023-04-04 22:38:37.947368,2023-04-04 22:38:46.501852,0 days 00:00:08.554484,True,entropy,8,8,4,820,COMPLETE
640,640,0.8068053338571811,2023-04-04 22:38:46.505060,2023-04-04 22:38:55.138563,0 days 00:00:08.633503,True,entropy,8,10,4,799,COMPLETE
641,641,0.8060966405394456,2023-04-04 22:38:55.141658,2023-04-04 22:39:08.757753,0 days 00:00:13.616095,False,entropy,8,10,3,845,COMPLETE
642,642,0.8051264490904115,2023-04-04 22:39:08.760851,2023-04-04 22:39:11.636504,0 days 00:00:02.875653,True,entropy,8,10,4,254,COMPLETE
643,643,0.8065665906087613,2023-04-04 22:39:11.639273,2023-04-04 22:39:20.734895,0 days 00:00:09.095622,True,entropy,8,10,4,848,COMPLETE
644,644,0.8067474679820883,2023-04-04 22:39:20.738014,2023-04-04 22:39:29.840774,0 days 00:00:09.102760,True,entropy,8,10,4,831,COMPLETE
645,645,0.8063182534400533,2023-04-04 22:39:29.843684,2023-04-04 22:39:38.290341,0 days 00:00:08.446657,True,entropy,8,10,3,766,COMPLETE
646,646,0.8068171753833147,2023-04-04 22:39:38.293249,2023-04-04 22:39:47.509178,0 days 00:00:09.215929,True,entropy,7,10,4,867,COMPLETE
647,647,0.8066273526370257,2023-04-04 22:39:47.512373,2023-04-04 22:39:55.867619,0 days 00:00:08.355246,True,entropy,8,10,4,777,COMPLETE
648,648,0.8053363545620279,2023-04-04 22:39:55.870809,2023-04-04 22:40:04.527701,0 days 00:00:08.656892,True,entropy,8,9,4,817,COMPLETE
649,649,0.8062576812598236,2023-04-04 22:40:04.531259,2023-04-04 22:40:18.343340,0 days 00:00:13.812081,False,entropy,8,10,5,860,COMPLETE
650,650,0.8066840782053827,2023-04-04 22:40:18.346740,2023-04-04 22:40:27.346028,0 days 00:00:08.999288,True,entropy,8,10,6,838,COMPLETE
651,651,0.8068184836637983,2023-04-04 22:40:27.349314,2023-04-04 22:40:36.656885,0 days 00:00:09.307571,True,entropy,9,10,5,866,COMPLETE
652,652,0.8068884148057569,2023-04-04 22:40:36.659989,2023-04-04 22:40:46.243566,0 days 00:00:09.583577,True,entropy,8,10,4,878,COMPLETE
653,653,0.8069420653379249,2023-04-04 22:40:46.246743,2023-04-04 22:40:54.950907,0 days 00:00:08.704164,True,entropy,8,10,5,807,COMPLETE
654,654,0.8061396012585232,2023-04-04 22:40:54.953478,2023-04-04 22:41:05.582942,0 days 00:00:10.629464,True,gini,8,10,6,999,COMPLETE
655,655,0.8065053813007763,2023-04-04 22:41:05.585654,2023-04-04 22:41:15.031961,0 days 00:00:09.446307,True,entropy,9,10,6,887,COMPLETE
656,656,0.8064904199242958,2023-04-04 22:41:15.034746,2023-04-04 22:41:24.109123,0 days 00:00:09.074377,True,entropy,8,10,7,834,COMPLETE
657,657,0.8067600139066373,2023-04-04 22:41:24.109968,2023-04-04 22:41:37.893830,0 days 00:00:13.783862,False,entropy,8,10,5,860,COMPLETE
658,658,0.8066880923928343,2023-04-04 22:41:37.894363,2023-04-04 22:41:47.703372,0 days 00:00:09.809009,True,entropy,7,10,4,910,COMPLETE
659,659,0.8052503325368635,2023-04-04 22:41:47.705895,2023-04-04 22:41:56.201293,0 days 00:00:08.495398,True,entropy,8,9,6,792,COMPLETE
660,660,0.806087448993833,2023-04-04 22:41:56.204069,2023-04-04 22:42:05.984286,0 days 00:00:09.780217,True,entropy,7,10,5,914,COMPLETE
661,661,0.8067154095920742,2023-04-04 22:42:05.987589,2023-04-04 22:42:15.459206,0 days 00:00:09.471617,True,entropy,8,10,3,876,COMPLETE
662,662,0.8011145981558103,2023-04-04 22:42:15.462318,2023-04-04 22:42:22.194238,0 days 00:00:06.731920,True,entropy,3,10,6,818,COMPLETE
663,663,0.806526839194413,2023-04-04 22:42:22.197159,2023-04-04 22:42:31.257842,0 days 00:00:09.060683,True,entropy,9,10,6,845,COMPLETE
664,664,0.806586930289075,2023-04-04 22:42:31.260767,2023-04-04 22:42:41.848808,0 days 00:00:10.588041,True,entropy,8,10,5,978,COMPLETE
665,665,0.8059727906495564,2023-04-04 22:42:41.851767,2023-04-04 22:42:56.271181,0 days 00:00:14.419414,False,entropy,10,10,5,894,COMPLETE
666,666,0.8066544798388284,2023-04-04 22:42:56.273913,2023-04-04 22:43:06.853453,0 days 00:00:10.579540,True,entropy,8,10,4,987,COMPLETE
667,667,0.8062893147795066,2023-04-04 22:43:06.856483,2023-04-04 22:43:15.993333,0 days 00:00:09.136850,True,entropy,10,10,6,856,COMPLETE
668,668,0.8068482944555214,2023-04-04 22:43:15.994208,2023-04-04 22:43:24.027015,0 days 00:00:08.032807,True,entropy,9,10,4,735,COMPLETE
669,669,0.8067424137945451,2023-04-04 22:43:24.030150,2023-04-04 22:43:33.010787,0 days 00:00:08.980637,True,entropy,10,10,7,830,COMPLETE
670,670,0.8067646766877402,2023-04-04 22:43:33.013714,2023-04-04 22:43:43.792139,0 days 00:00:10.778425,True,entropy,10,10,5,1000,COMPLETE
671,671,0.8069438769165582,2023-04-04 22:43:43.794584,2023-04-04 22:43:53.251374,0 days 00:00:09.456790,True,entropy,10,10,6,871,COMPLETE
672,672,0.8067188199112991,2023-04-04 22:43:53.254532,2023-04-04 22:44:03.317673,0 days 00:00:10.063141,True,entropy,8,10,6,914,COMPLETE
673,673,0.8060089861572756,2023-04-04 22:44:03.320577,2023-04-04 22:44:16.385440,0 days 00:00:13.064863,False,gini,10,10,5,805,COMPLETE
674,674,0.8048768258449197,2023-04-04 22:44:16.388489,2023-04-04 22:44:26.678337,0 days 00:00:10.289848,True,entropy,10,9,4,981,COMPLETE
675,675,0.8065874782158133,2023-04-04 22:44:26.681481,2023-04-04 22:44:36.181450,0 days 00:00:09.499969,True,entropy,8,10,7,891,COMPLETE
676,676,0.8060827080047354,2023-04-04 22:44:36.184200,2023-04-04 22:44:45.506541,0 days 00:00:09.322341,True,entropy,10,10,6,857,COMPLETE
677,677,0.7857402406507024,2023-04-04 22:44:45.507030,2023-04-04 22:44:51.954662,0 days 00:00:06.447632,True,entropy,9,2,6,965,COMPLETE
678,678,0.8068286033647327,2023-04-04 22:44:51.958214,2023-04-04 22:45:00.881561,0 days 00:00:08.923347,True,entropy,10,10,5,830,COMPLETE
679,679,0.8070883124921917,2023-04-04 22:45:00.884549,2023-04-04 22:45:10.783305,0 days 00:00:09.898756,True,entropy,8,10,4,922,COMPLETE
680,680,0.8063554887956933,2023-04-04 22:45:10.786535,2023-04-04 22:45:21.418271,0 days 00:00:10.631736,True,entropy,10,10,6,984,COMPLETE
681,681,0.8065650477035199,2023-04-04 22:45:21.421299,2023-04-04 22:45:35.192955,0 days 00:00:13.771656,False,entropy,6,10,5,877,COMPLETE
682,682,0.8060528414226736,2023-04-04 22:45:35.195713,2023-04-04 22:45:44.900088,0 days 00:00:09.704375,True,entropy,10,10,6,904,COMPLETE
683,683,0.8065596689231749,2023-04-04 22:45:44.903212,2023-04-04 22:45:55.524066,0 days 00:00:10.620854,True,entropy,8,10,5,997,COMPLETE
684,684,0.8064519320400999,2023-04-04 22:45:55.527454,2023-04-04 22:46:06.044299,0 days 00:00:10.516845,True,entropy,10,10,6,968,COMPLETE
685,685,0.8065274766210931,2023-04-04 22:46:06.047267,2023-04-04 22:46:15.193272,0 days 00:00:09.146005,True,entropy,10,10,4,844,COMPLETE
686,686,0.8065473020250138,2023-04-04 22:46:15.196248,2023-04-04 22:46:25.214389,0 days 00:00:10.018141,True,entropy,8,10,5,932,COMPLETE
687,687,0.8065052247476647,2023-04-04 22:46:25.217425,2023-04-04 22:46:33.602089,0 days 00:00:08.384664,True,entropy,10,10,3,780,COMPLETE
688,688,0.8021181562373443,2023-04-04 22:46:33.602616,2023-04-04 22:46:35.806041,0 days 00:00:02.203425,True,entropy,10,8,6,198,COMPLETE
689,689,0.8062929598916544,2023-04-04 22:46:35.809114,2023-04-04 22:46:51.920682,0 days 00:00:16.111568,False,entropy,8,10,4,1000,COMPLETE
690,690,0.8065733892628998,2023-04-04 22:46:51.923040,2023-04-04 22:47:00.696823,0 days 00:00:08.773783,True,entropy,10,10,5,813,COMPLETE
691,691,0.8063550414967902,2023-04-04 22:47:00.699960,2023-04-04 22:47:11.199061,0 days 00:00:10.499101,True,entropy,10,10,6,974,COMPLETE
692,692,0.8046709123439191,2023-04-04 22:47:11.201485,2023-04-04 22:47:20.553621,0 days 00:00:09.352136,True,gini,7,9,7,882,COMPLETE
693,693,0.806235686674268,2023-04-04 22:47:20.556626,2023-04-04 22:47:24.669187,0 days 00:00:04.112561,True,entropy,9,10,6,365,COMPLETE
694,694,0.8065693301016701,2023-04-04 22:47:24.671656,2023-04-04 22:47:34.921228,0 days 00:00:10.249572,True,entropy,10,10,2,950,COMPLETE
695,695,0.8062964933950152,2023-04-04 22:47:34.921752,2023-04-04 22:47:44.211581,0 days 00:00:09.289829,True,entropy,10,10,5,857,COMPLETE
696,696,0.8013585297460505,2023-04-04 22:47:44.214915,2023-04-04 22:47:53.369041,0 days 00:00:09.154126,True,entropy,8,7,4,915,COMPLETE
697,697,0.8064315700121683,2023-04-04 22:47:53.372415,2023-04-04 22:48:09.285107,0 days 00:00:15.912692,False,entropy,10,10,6,983,COMPLETE
698,698,0.7988923547593394,2023-04-04 22:48:09.288116,2023-04-04 22:48:17.284724,0 days 00:00:07.996608,True,entropy,10,6,5,836,COMPLETE
699,699,0.8069795914546531,2023-04-04 22:48:17.288266,2023-04-04 22:48:27.658375,0 days 00:00:10.370109,True,entropy,8,10,6,961,COMPLETE
700,700,0.8065517970420123,2023-04-04 22:48:27.660942,2023-04-04 22:48:37.452390,0 days 00:00:09.791448,True,entropy,10,10,5,898,COMPLETE
701,701,0.8067783856976032,2023-04-04 22:48:37.455135,2023-04-04 22:48:47.547421,0 days 00:00:10.092286,True,entropy,10,10,6,935,COMPLETE
702,702,0.8067741588397197,2023-04-04 22:48:47.550661,2023-04-04 22:48:51.260157,0 days 00:00:03.709496,True,entropy,8,10,4,336,COMPLETE
703,703,0.8066163833474344,2023-04-04 22:48:51.262911,2023-04-04 22:49:00.729740,0 days 00:00:09.466829,True,entropy,10,10,5,873,COMPLETE
704,704,0.8077604636681995,2023-04-04 22:49:00.732628,2023-04-04 22:49:04.992139,0 days 00:00:04.259511,True,entropy,9,10,4,382,COMPLETE
705,705,0.8038585525426161,2023-04-04 22:49:04.995580,2023-04-04 22:49:08.807132,0 days 00:00:03.811552,True,entropy,9,9,4,347,COMPLETE
706,706,0.7938663899415307,2023-04-04 22:49:08.810751,2023-04-04 22:49:20.507417,0 days 00:00:11.696666,False,entropy,9,4,4,983,COMPLETE
707,707,0.8067080183689704,2023-04-04 22:49:20.510561,2023-04-04 22:49:25.115819,0 days 00:00:04.605258,True,entropy,9,10,4,409,COMPLETE
708,708,0.8061145874766522,2023-04-04 22:49:25.118099,2023-04-04 22:49:29.668304,0 days 00:00:04.550205,True,entropy,9,10,4,407,COMPLETE
709,709,0.8068064745474265,2023-04-04 22:49:29.669080,2023-04-04 22:49:33.993446,0 days 00:00:04.324366,True,entropy,7,10,3,393,COMPLETE
710,710,0.8065407270003006,2023-04-04 22:49:33.996453,2023-04-04 22:49:44.698137,0 days 00:00:10.701684,True,entropy,9,10,4,1000,COMPLETE
711,711,0.8059189390517743,2023-04-04 22:49:44.701165,2023-04-04 22:49:48.952657,0 days 00:00:04.251492,True,gini,8,10,4,383,COMPLETE
712,712,0.8049994011752718,2023-04-04 22:49:48.955874,2023-04-04 22:49:53.253872,0 days 00:00:04.297998,True,entropy,8,9,4,395,COMPLETE
713,713,0.8063444857811044,2023-04-04 22:49:53.256684,2023-04-04 22:49:59.502086,0 days 00:00:06.245402,False,entropy,8,10,4,377,COMPLETE
714,714,0.8068366206462898,2023-04-04 22:49:59.504814,2023-04-04 22:50:08.127437,0 days 00:00:08.622623,True,entropy,8,10,4,798,COMPLETE
715,715,0.8066136661491121,2023-04-04 22:50:08.130727,2023-04-04 22:50:12.117939,0 days 00:00:03.987212,True,entropy,9,10,4,362,COMPLETE
716,716,0.8062175832886999,2023-04-04 22:50:12.118768,2023-04-04 22:50:22.546007,0 days 00:00:10.427239,True,entropy,8,10,3,971,COMPLETE
717,717,0.8066882491775249,2023-04-04 22:50:22.549200,2023-04-04 22:50:26.738965,0 days 00:00:04.189765,True,entropy,8,10,6,379,COMPLETE
718,718,0.8065259222751926,2023-04-04 22:50:26.742256,2023-04-04 22:50:37.028657,0 days 00:00:10.286401,True,entropy,9,10,7,959,COMPLETE
719,719,0.79483602262401,2023-04-04 22:50:37.031667,2023-04-04 22:50:40.513694,0 days 00:00:03.482027,True,entropy,8,5,4,367,COMPLETE
720,720,0.8069227430013248,2023-04-04 22:50:40.516361,2023-04-04 22:50:49.320913,0 days 00:00:08.804552,True,entropy,8,10,6,813,COMPLETE
721,721,0.8069570380613869,2023-04-04 22:50:49.322710,2023-04-04 22:51:05.404426,0 days 00:00:16.081716,False,entropy,10,10,6,999,COMPLETE
722,722,0.8069280209240937,2023-04-04 22:51:05.405146,2023-04-04 22:51:13.841655,0 days 00:00:08.436509,True,entropy,5,10,4,829,COMPLETE
723,723,0.8063979236613479,2023-04-04 22:51:13.844681,2023-04-04 22:51:21.207942,0 days 00:00:07.363261,True,entropy,8,10,6,682,COMPLETE
724,724,0.8065066000434555,2023-04-04 22:51:21.210881,2023-04-04 22:51:31.908466,0 days 00:00:10.697585,True,entropy,9,10,6,982,COMPLETE
725,725,0.8065933489408149,2023-04-04 22:51:31.912719,2023-04-04 22:51:36.200043,0 days 00:00:04.287324,True,entropy,10,10,4,386,COMPLETE
726,726,0.8065142037018711,2023-04-04 22:51:36.204485,2023-04-04 22:51:40.767983,0 days 00:00:04.563498,True,entropy,7,10,8,418,COMPLETE
727,727,0.8053487660299542,2023-04-04 22:51:40.771935,2023-04-04 22:51:44.094742,0 days 00:00:03.322807,True,entropy,8,9,7,291,COMPLETE
728,728,0.8065583048264111,2023-04-04 22:51:44.097556,2023-04-04 22:51:54.370423,0 days 00:00:10.272867,True,entropy,10,10,6,945,COMPLETE
729,729,0.8064273432451786,2023-04-04 22:51:54.373218,2023-04-04 22:52:08.042104,0 days 00:00:13.668886,False,entropy,10,10,6,849,COMPLETE
730,730,0.8056619247031879,2023-04-04 22:52:08.045034,2023-04-04 22:52:11.875767,0 days 00:00:03.830733,True,gini,10,10,4,330,COMPLETE
731,731,0.8069093471780164,2023-04-04 22:52:11.878004,2023-04-04 22:52:22.509066,0 days 00:00:10.631062,True,entropy,10,10,7,971,COMPLETE
732,732,0.8068521521778825,2023-04-04 22:52:22.512198,2023-04-04 22:52:33.187263,0 days 00:00:10.675065,True,entropy,9,10,6,983,COMPLETE
733,733,0.8067292080381947,2023-04-04 22:52:33.190418,2023-04-04 22:52:43.472104,0 days 00:00:10.281686,True,entropy,10,10,4,953,COMPLETE
734,734,0.8066284932632566,2023-04-04 22:52:43.475021,2023-04-04 22:52:52.316017,0 days 00:00:08.840996,True,entropy,8,10,6,823,COMPLETE
735,735,0.8066792923038507,2023-04-04 22:52:52.319334,2023-04-04 22:53:02.816143,0 days 00:00:10.496809,True,entropy,10,10,4,967,COMPLETE
736,736,0.8062078327042927,2023-04-04 22:53:02.817505,2023-04-04 22:53:13.627792,0 days 00:00:10.810287,True,entropy,8,10,6,1000,COMPLETE
737,737,0.8064289757671231,2023-04-04 22:53:13.630640,2023-04-04 22:53:23.761832,0 days 00:00:10.131192,True,entropy,10,10,8,939,COMPLETE
738,738,0.8064042863649373,2023-04-04 22:53:23.763134,2023-04-04 22:53:37.315183,0 days 00:00:13.552049,False,entropy,10,10,6,844,COMPLETE
739,739,0.8063610237717022,2023-04-04 22:53:37.318359,2023-04-04 22:53:41.283571,0 days 00:00:03.965212,True,entropy,10,10,7,355,COMPLETE
740,740,0.8055904279446275,2023-04-04 22:53:41.286397,2023-04-04 22:53:45.608255,0 days 00:00:04.321858,True,entropy,8,9,6,394,COMPLETE
741,741,0.8069412824610671,2023-04-04 22:53:45.611216,2023-04-04 22:53:54.055318,0 days 00:00:08.444102,True,entropy,10,10,4,783,COMPLETE
742,742,0.8067111939393168,2023-04-04 22:53:54.058070,2023-04-04 22:54:04.491010,0 days 00:00:10.432940,True,entropy,8,10,3,966,COMPLETE
743,743,0.8065463067661683,2023-04-04 22:54:04.493783,2023-04-04 22:54:13.704093,0 days 00:00:09.210310,True,entropy,9,10,5,854,COMPLETE
744,744,0.806622007801742,2023-04-04 22:54:13.704772,2023-04-04 22:54:22.435176,0 days 00:00:08.730404,True,entropy,10,10,4,805,COMPLETE
745,745,0.8064164409573834,2023-04-04 22:54:22.438285,2023-04-04 22:54:38.191497,0 days 00:00:15.753212,False,entropy,10,10,6,982,COMPLETE
746,746,0.8064201309721076,2023-04-04 22:54:38.194657,2023-04-04 22:54:45.199324,0 days 00:00:07.004667,True,entropy,7,10,6,646,COMPLETE
747,747,0.8065531722872322,2023-04-04 22:54:45.202658,2023-04-04 22:54:55.105088,0 days 00:00:09.902430,True,entropy,10,10,5,922,COMPLETE
748,748,0.8069767626352412,2023-04-04 22:54:55.108553,2023-04-04 22:55:05.468559,0 days 00:00:10.360006,True,entropy,10,10,6,958,COMPLETE
749,749,0.8057755768027537,2023-04-04 22:55:05.471648,2023-04-04 22:55:10.080930,0 days 00:00:04.609282,True,entropy,8,10,4,421,COMPLETE
750,750,0.8069429485074583,2023-04-04 22:55:10.083785,2023-04-04 22:55:19.153416,0 days 00:00:09.069631,True,entropy,9,10,6,832,COMPLETE
751,751,0.8053909440775637,2023-04-04 22:55:19.156576,2023-04-04 22:55:29.396855,0 days 00:00:10.240279,True,gini,10,10,5,946,COMPLETE
752,752,0.8067456117157805,2023-04-04 22:55:29.399949,2023-04-04 22:55:40.020441,0 days 00:00:10.620492,True,entropy,8,10,7,983,COMPLETE
753,753,0.8062032369427209,2023-04-04 22:55:40.023526,2023-04-04 22:55:56.075006,0 days 00:00:16.051480,False,entropy,10,10,5,999,COMPLETE
754,754,0.8066368796739068,2023-04-04 22:55:56.078153,2023-04-04 22:56:05.285200,0 days 00:00:09.207047,True,entropy,10,10,2,854,COMPLETE
755,755,0.8049485461191221,2023-04-04 22:56:05.288726,2023-04-04 22:56:13.227290,0 days 00:00:07.938564,True,entropy,10,9,8,751,COMPLETE
756,756,0.8067859558124422,2023-04-04 22:56:13.231198,2023-04-04 22:56:22.711021,0 days 00:00:09.479823,True,entropy,8,10,3,869,COMPLETE
757,757,0.8066578568389062,2023-04-04 22:56:22.713388,2023-04-04 22:56:33.300384,0 days 00:00:10.586996,True,entropy,8,10,4,976,COMPLETE
758,758,0.8065979555183542,2023-04-04 22:56:33.305143,2023-04-04 22:56:43.352052,0 days 00:00:10.046909,True,entropy,10,10,6,932,COMPLETE
759,759,0.8064885079184461,2023-04-04 22:56:43.355160,2023-04-04 22:56:52.203142,0 days 00:00:08.847982,True,entropy,10,10,4,818,COMPLETE
760,760,0.8068141788709546,2023-04-04 22:56:52.206805,2023-04-04 22:57:02.983247,0 days 00:00:10.776442,True,entropy,10,10,6,958,COMPLETE
761,761,0.8067951024307813,2023-04-04 22:57:02.984606,2023-04-04 22:57:12.828214,0 days 00:00:09.843608,True,entropy,8,10,5,911,COMPLETE
762,762,0.8054375051601085,2023-04-04 22:57:12.831736,2023-04-04 22:57:26.536716,0 days 00:00:13.704980,False,entropy,10,9,6,877,COMPLETE
763,763,0.8069142114253177,2023-04-04 22:57:26.540030,2023-04-04 22:57:35.603287,0 days 00:00:09.063257,True,entropy,7,10,4,844,COMPLETE
764,764,0.8060305000476831,2023-04-04 22:57:35.607211,2023-04-04 22:57:40.029545,0 days 00:00:04.422334,True,entropy,9,10,6,399,COMPLETE
765,765,0.8059687875540783,2023-04-04 22:57:40.031047,2023-04-04 22:57:49.123899,0 days 00:00:09.092852,True,entropy,4,10,5,968,COMPLETE
766,766,0.8027620732356187,2023-04-04 22:57:49.127183,2023-04-04 22:57:58.840276,0 days 00:00:09.713093,True,entropy,10,7,4,982,COMPLETE
767,767,0.8063351489395629,2023-04-04 22:57:58.843357,2023-04-04 22:58:08.972096,0 days 00:00:10.128739,True,gini,8,10,5,943,COMPLETE
768,768,0.8063702376759909,2023-04-04 22:58:08.975075,2023-04-04 22:58:17.913566,0 days 00:00:08.938491,True,entropy,10,10,6,822,COMPLETE
769,769,0.8067684786513988,2023-04-04 22:58:17.916693,2023-04-04 22:58:26.612358,0 days 00:00:08.695665,True,entropy,10,10,6,801,COMPLETE
770,770,0.8060423080456337,2023-04-04 22:58:26.615227,2023-04-04 22:58:31.716737,0 days 00:00:05.101510,False,entropy,9,10,5,307,COMPLETE
771,771,0.8064538105749472,2023-04-04 22:58:31.719881,2023-04-04 22:58:35.886851,0 days 00:00:04.166970,True,entropy,8,10,7,375,COMPLETE
772,772,0.8069602133379327,2023-04-04 22:58:35.889812,2023-04-04 22:58:45.291375,0 days 00:00:09.401563,True,entropy,10,10,6,862,COMPLETE
773,773,0.8058444120058781,2023-04-04 22:58:45.294451,2023-04-04 22:58:54.901034,0 days 00:00:09.606583,True,entropy,10,10,4,894,COMPLETE
774,774,0.8067902495409645,2023-04-04 22:58:54.904037,2023-04-04 22:59:05.463731,0 days 00:00:10.559694,True,entropy,8,10,4,985,COMPLETE
775,775,0.8062173035794945,2023-04-04 22:59:05.464488,2023-04-04 22:59:10.139344,0 days 00:00:04.674856,True,entropy,10,10,5,430,COMPLETE
776,776,0.8066956625013789,2023-04-04 22:59:10.141913,2023-04-04 22:59:21.046431,0 days 00:00:10.904518,True,entropy,10,10,6,1000,COMPLETE
777,777,0.8069017099537128,2023-04-04 22:59:21.049279,2023-04-04 22:59:31.039860,0 days 00:00:09.990581,True,entropy,10,10,10,922,COMPLETE
778,778,0.807091096753001,2023-04-04 22:59:31.042997,2023-04-04 22:59:41.285239,0 days 00:00:10.242242,True,entropy,8,10,6,958,COMPLETE
779,779,0.8065306409446024,2023-04-04 22:59:41.288126,2023-04-04 22:59:54.450243,0 days 00:00:13.162117,False,entropy,6,10,5,842,COMPLETE
780,780,0.8068204071114323,2023-04-04 22:59:54.453868,2023-04-04 23:00:04.724613,0 days 00:00:10.270745,True,entropy,10,10,8,942,COMPLETE
781,781,0.803409758579255,2023-04-04 23:00:04.728171,2023-04-04 23:00:13.744543,0 days 00:00:09.016372,True,entropy,10,8,7,881,COMPLETE
782,782,0.806319539064339,2023-04-04 23:00:13.747647,2023-04-04 23:00:24.001303,0 days 00:00:10.253656,True,entropy,8,10,4,968,COMPLETE
783,783,0.8049707643123247,2023-04-04 23:00:24.004572,2023-04-04 23:00:32.848632,0 days 00:00:08.844060,True,entropy,10,9,6,834,COMPLETE
784,784,0.7903673939553741,2023-04-04 23:00:32.851596,2023-04-04 23:00:39.593187,0 days 00:00:06.741591,True,entropy,9,3,5,861,COMPLETE
785,785,0.8069182032755637,2023-04-04 23:00:39.596791,2023-04-04 23:00:49.353918,0 days 00:00:09.757127,True,entropy,10,10,6,905,COMPLETE
786,786,0.8063550974240472,2023-04-04 23:00:49.357222,2023-04-04 23:01:01.981446,0 days 00:00:12.624224,False,gini,10,10,10,793,COMPLETE
787,787,0.8069127241432923,2023-04-04 23:01:01.984390,2023-04-04 23:01:12.641549,0 days 00:00:10.657159,True,entropy,8,10,4,986,COMPLETE
788,788,0.806614426442564,2023-04-04 23:01:12.644650,2023-04-04 23:01:22.656945,0 days 00:00:10.012295,True,entropy,10,10,5,924,COMPLETE
789,789,0.8065608654046889,2023-04-04 23:01:22.660415,2023-04-04 23:01:31.045803,0 days 00:00:08.385388,True,entropy,8,10,6,772,COMPLETE
790,790,0.8063961683164134,2023-04-04 23:01:31.049031,2023-04-04 23:01:41.318407,0 days 00:00:10.269376,True,entropy,10,10,4,952,COMPLETE
791,791,0.806560183422332,2023-04-04 23:01:41.321818,2023-04-04 23:01:48.976702,0 days 00:00:07.654884,True,entropy,10,10,3,711,COMPLETE
