,number,value,datetime_start,datetime_complete,duration,params_bootstrap,params_criterion,params_max_depth,params_max_leaf_nodes,params_min_samples_leaf,params_n_estimators,state
475,475,0.8068987469288974,2023-04-04 22:13:32.745406,2023-04-04 22:13:43.027648,0 days 00:00:10.282242,True,entropy,10,10,10,948,COMPLETE
476,476,0.7989353375834657,2023-04-04 22:13:43.030836,2023-04-04 22:13:51.500930,0 days 00:00:08.470094,True,entropy,10,6,9,868,COMPLETE
477,477,0.8065281140147643,2023-04-04 22:13:51.501407,2023-04-04 22:14:01.713072,0 days 00:00:10.211665,True,entropy,10,10,5,928,COMPLETE
478,478,0.8051233291492453,2023-04-04 22:14:01.715774,2023-04-04 22:14:17.200042,0 days 00:00:15.484268,False,entropy,8,9,6,982,COMPLETE
479,479,0.8065709962788435,2023-04-04 22:14:17.203387,2023-04-04 22:14:27.411602,0 days 00:00:10.208215,True,gini,10,10,10,955,COMPLETE
480,480,0.8065256203866689,2023-04-04 22:14:27.414491,2023-04-04 22:14:32.403560,0 days 00:00:04.989069,True,entropy,10,10,6,446,COMPLETE
481,481,0.8015136777706344,2023-04-04 22:14:32.406130,2023-04-04 22:14:42.320981,0 days 00:00:09.914851,True,entropy,10,7,9,1000,COMPLETE
482,482,0.806578722912405,2023-04-04 22:14:42.324496,2023-04-04 22:14:47.832019,0 days 00:00:05.507523,True,entropy,8,10,9,498,COMPLETE
483,483,0.8069248675675598,2023-04-04 22:14:47.834796,2023-04-04 22:14:57.651202,0 days 00:00:09.816406,True,entropy,10,10,6,915,COMPLETE
484,484,0.8069632324962877,2023-04-04 22:14:57.654132,2023-04-04 22:15:13.161553,0 days 00:00:15.507421,False,entropy,7,10,10,963,COMPLETE
485,485,0.8068681198330353,2023-04-04 22:15:13.164374,2023-04-04 22:15:22.733835,0 days 00:00:09.569461,True,entropy,10,10,6,885,COMPLETE
486,486,0.8067627870720975,2023-04-04 22:15:22.736888,2023-04-04 22:15:30.564319,0 days 00:00:07.827431,True,entropy,10,10,9,711,COMPLETE
487,487,0.8063797645709571,2023-04-04 22:15:30.566663,2023-04-04 22:15:35.218238,0 days 00:00:04.651575,True,entropy,9,10,5,421,COMPLETE
488,488,0.8064212155886196,2023-04-04 22:15:35.221070,2023-04-04 22:15:44.507231,0 days 00:00:09.286161,True,entropy,8,10,10,855,COMPLETE
489,489,0.8064826372515475,2023-04-04 22:15:44.508057,2023-04-04 22:15:55.063596,0 days 00:00:10.555539,True,entropy,10,10,9,985,COMPLETE
490,490,0.8060611045894644,2023-04-04 22:15:55.064462,2023-04-04 22:15:56.987891,0 days 00:00:01.923429,False,entropy,10,10,6,106,COMPLETE
491,491,0.8069132719541923,2023-04-04 22:15:56.990912,2023-04-04 22:16:03.678274,0 days 00:00:06.687362,True,entropy,10,10,9,618,COMPLETE
492,492,0.8065199400565529,2023-04-04 22:16:03.681523,2023-04-04 22:16:13.858731,0 days 00:00:10.177208,True,entropy,9,10,6,937,COMPLETE
493,493,0.806128028064883,2023-04-04 22:16:13.861696,2023-04-04 22:16:23.681436,0 days 00:00:09.819740,True,entropy,10,10,9,901,COMPLETE
494,494,0.8059647061176471,2023-04-04 22:16:23.684700,2023-04-04 22:16:27.990307,0 days 00:00:04.305607,True,entropy,10,10,6,388,COMPLETE
495,495,0.8050809278475206,2023-04-04 22:16:27.992903,2023-04-04 22:16:38.148640,0 days 00:00:10.155737,True,entropy,10,9,2,970,COMPLETE
496,496,0.8060156616536549,2023-04-04 22:16:38.150153,2023-04-04 22:16:45.626588,0 days 00:00:07.476435,False,entropy,8,10,10,457,COMPLETE
497,497,0.8068069776373281,2023-04-04 22:16:45.629150,2023-04-04 22:16:55.753167,0 days 00:00:10.124017,True,entropy,10,10,7,934,COMPLETE
498,498,0.8064972633594636,2023-04-04 22:16:55.755943,2023-04-04 22:17:05.127692,0 days 00:00:09.371749,True,gini,10,10,3,871,COMPLETE
499,499,0.8067408259581142,2023-04-04 22:17:05.130574,2023-04-04 22:17:15.888729,0 days 00:00:10.758155,True,entropy,8,10,9,1000,COMPLETE
500,500,0.8064333591121832,2023-04-04 22:17:15.892126,2023-04-04 22:17:26.243944,0 days 00:00:10.351818,True,entropy,10,10,6,956,COMPLETE
501,501,0.8068068658532802,2023-04-04 22:17:26.246595,2023-04-04 22:17:30.721834,0 days 00:00:04.475239,True,entropy,10,10,10,407,COMPLETE
502,502,0.8050221783230815,2023-04-04 22:17:30.724758,2023-04-04 22:17:39.597749,0 days 00:00:08.872991,True,entropy,10,9,5,844,COMPLETE
503,503,0.7956476333142566,2023-04-04 22:17:39.600803,2023-04-04 22:17:52.097368,0 days 00:00:12.496565,False,entropy,8,5,9,975,COMPLETE
504,504,0.8063290438481647,2023-04-04 22:17:52.100133,2023-04-04 22:18:02.096738,0 days 00:00:09.996605,True,entropy,10,10,6,918,COMPLETE
505,505,0.8066708724176215,2023-04-04 22:18:02.099717,2023-04-04 22:18:06.833343,0 days 00:00:04.733626,True,entropy,7,10,9,430,COMPLETE
506,506,0.8066879917023202,2023-04-04 22:18:06.836268,2023-04-04 22:18:17.359091,0 days 00:00:10.522823,True,entropy,10,10,6,981,COMPLETE
507,507,0.806910454298848,2023-04-04 22:18:17.362101,2023-04-04 22:18:27.582972,0 days 00:00:10.220871,True,entropy,9,10,10,950,COMPLETE
508,508,0.8066297792677588,2023-04-04 22:18:27.585995,2023-04-04 22:18:37.262927,0 days 00:00:09.676932,True,entropy,10,10,5,885,COMPLETE
509,509,0.8060541944077111,2023-04-04 22:18:37.265960,2023-04-04 22:18:52.569802,0 days 00:00:15.303842,False,entropy,10,10,7,945,COMPLETE
510,510,0.8062398127685979,2023-04-04 22:18:52.572634,2023-04-04 22:18:57.797709,0 days 00:00:05.225075,True,entropy,8,10,9,477,COMPLETE
511,511,0.8068149278781762,2023-04-04 22:18:57.800963,2023-04-04 22:19:08.152161,0 days 00:00:10.351198,True,entropy,10,10,10,968,COMPLETE
512,512,0.7937759403243219,2023-04-04 22:19:08.155293,2023-04-04 22:19:15.595376,0 days 00:00:07.440083,True,entropy,10,4,9,857,COMPLETE
513,513,0.8063948712122933,2023-04-04 22:19:15.598219,2023-04-04 22:19:25.472431,0 days 00:00:09.874212,True,entropy,10,10,6,913,COMPLETE
514,514,0.8064743966742768,2023-04-04 22:19:25.475807,2023-04-04 22:19:36.037415,0 days 00:00:10.561608,True,entropy,8,10,9,985,COMPLETE
515,515,0.8065504553870018,2023-04-04 22:19:36.040226,2023-04-04 22:19:43.196394,0 days 00:00:07.156168,False,entropy,10,10,10,439,COMPLETE
516,516,0.7907859298859788,2023-04-04 22:19:43.199261,2023-04-04 22:19:50.541605,0 days 00:00:07.342344,True,entropy,10,3,8,928,COMPLETE
517,517,0.8063246941303213,2023-04-04 22:19:50.544464,2023-04-04 22:19:59.408962,0 days 00:00:08.864498,True,gini,10,10,6,824,COMPLETE
518,518,0.8063369716635765,2023-04-04 22:19:59.412452,2023-04-04 22:20:09.662937,0 days 00:00:10.250485,True,entropy,10,10,5,956,COMPLETE
519,519,0.8062008440182457,2023-04-04 22:20:09.665515,2023-04-04 22:20:19.299797,0 days 00:00:09.634282,True,entropy,10,10,4,899,COMPLETE
520,520,0.8051388160511467,2023-04-04 22:20:19.302469,2023-04-04 22:20:28.569522,0 days 00:00:09.267053,True,entropy,9,9,9,840,COMPLETE
521,521,0.8065489791794629,2023-04-04 22:20:28.572367,2023-04-04 22:20:44.442351,0 days 00:00:15.869984,False,entropy,8,10,6,985,COMPLETE
522,522,0.8067837865129807,2023-04-04 22:20:44.444958,2023-04-04 22:20:55.140388,0 days 00:00:10.695430,True,entropy,10,10,9,999,COMPLETE
523,523,0.806337843832323,2023-04-04 22:20:55.142457,2023-04-04 22:20:59.625526,0 days 00:00:04.483069,True,entropy,10,10,10,405,COMPLETE
524,524,0.8066304499824076,2023-04-04 22:20:59.628658,2023-04-04 22:21:09.111921,0 days 00:00:09.483263,True,entropy,10,10,6,876,COMPLETE
525,525,0.8061318522480858,2023-04-04 22:21:09.114637,2023-04-04 22:21:14.122110,0 days 00:00:05.007473,True,entropy,8,10,9,454,COMPLETE
526,526,0.8069339249389094,2023-04-04 22:21:14.125122,2023-04-04 22:21:24.466799,0 days 00:00:10.341677,True,entropy,9,10,6,964,COMPLETE
527,527,0.8036371297742189,2023-04-04 22:21:24.468246,2023-04-04 22:21:28.404799,0 days 00:00:03.936553,True,entropy,10,8,7,373,COMPLETE
528,528,0.8055630996401881,2023-04-04 22:21:28.407584,2023-04-04 22:21:38.095171,0 days 00:00:09.687587,True,entropy,5,10,4,942,COMPLETE
529,529,0.8062454260140959,2023-04-04 22:21:38.098258,2023-04-04 22:21:51.990439,0 days 00:00:13.892181,False,entropy,10,10,10,861,COMPLETE
530,530,0.8047677917349769,2023-04-04 22:21:51.993198,2023-04-04 22:22:02.421354,0 days 00:00:10.428156,True,entropy,10,9,9,985,COMPLETE
531,531,0.8070155858201927,2023-04-04 22:22:02.424469,2023-04-04 22:22:12.349506,0 days 00:00:09.925037,True,entropy,10,10,6,929,COMPLETE
532,532,0.8065113300995996,2023-04-04 22:22:12.352312,2023-04-04 22:22:22.287256,0 days 00:00:09.934944,True,entropy,8,10,9,907,COMPLETE
533,533,0.8063599951290126,2023-04-04 22:22:22.287712,2023-04-04 22:22:28.567848,0 days 00:00:06.280136,True,entropy,10,10,10,577,COMPLETE
534,534,0.8068300233281152,2023-04-04 22:22:28.570599,2023-04-04 22:22:44.142739,0 days 00:00:15.572140,False,entropy,10,10,8,968,COMPLETE
535,535,0.806512884233441,2023-04-04 22:22:44.145557,2023-04-04 22:22:49.791618,0 days 00:00:05.646061,True,entropy,10,10,3,515,COMPLETE
536,536,0.8065357511610547,2023-04-04 22:22:49.794533,2023-04-04 22:22:57.120814,0 days 00:00:07.326281,True,gini,8,10,6,667,COMPLETE
537,537,0.8068315218191675,2023-04-04 22:22:57.123658,2023-04-04 22:23:01.758548,0 days 00:00:04.634890,True,entropy,6,10,9,431,COMPLETE
538,538,0.8072277386996465,2023-04-04 22:23:01.761634,2023-04-04 22:23:11.960642,0 days 00:00:10.199008,True,entropy,10,10,5,952,COMPLETE
539,539,0.8052971061137381,2023-04-04 22:23:11.963353,2023-04-04 22:23:14.740414,0 days 00:00:02.777061,True,entropy,10,10,5,244,COMPLETE
540,540,0.8067655824077683,2023-04-04 22:23:14.743252,2023-04-04 22:23:25.037951,0 days 00:00:10.294699,True,entropy,9,10,5,946,COMPLETE
541,541,0.8068193111958017,2023-04-04 22:23:25.040918,2023-04-04 22:23:35.492031,0 days 00:00:10.451113,True,entropy,10,10,4,961,COMPLETE
542,542,0.8065874559438978,2023-04-04 22:23:35.494650,2023-04-04 22:23:46.064273,0 days 00:00:10.569623,True,entropy,10,10,5,983,COMPLETE
543,543,0.8069239171473288,2023-04-04 22:23:46.066925,2023-04-04 22:23:56.197109,0 days 00:00:10.130184,True,entropy,8,10,5,950,COMPLETE
544,544,0.8068555403308426,2023-04-04 22:23:56.200120,2023-04-04 22:24:06.352406,0 days 00:00:10.152286,True,entropy,10,10,5,936,COMPLETE
545,545,0.8070307931766273,2023-04-04 22:24:06.355269,2023-04-04 22:24:16.875691,0 days 00:00:10.520422,True,entropy,10,10,5,969,COMPLETE
546,546,0.8068808111812051,2023-04-04 22:24:16.878575,2023-04-04 22:24:27.671005,0 days 00:00:10.792430,True,entropy,10,10,5,998,COMPLETE
547,547,0.8068087107818863,2023-04-04 22:24:27.674179,2023-04-04 22:24:37.861840,0 days 00:00:10.187661,True,entropy,10,10,6,952,COMPLETE
548,548,0.8065742724925542,2023-04-04 22:24:37.862321,2023-04-04 22:24:48.410661,0 days 00:00:10.548340,True,entropy,7,10,6,979,COMPLETE
549,549,0.8071632195811173,2023-04-04 22:24:48.411630,2023-04-04 22:24:58.876155,0 days 00:00:10.464525,True,entropy,10,10,5,968,COMPLETE
550,550,0.8048950968794438,2023-04-04 22:24:58.876714,2023-04-04 22:25:07.873641,0 days 00:00:08.996927,True,entropy,4,9,5,973,COMPLETE
551,551,0.8066699891316494,2023-04-04 22:25:07.876279,2023-04-04 22:25:17.840039,0 days 00:00:09.963760,True,entropy,8,10,5,930,COMPLETE
552,552,0.8063826383998338,2023-04-04 22:25:17.842921,2023-04-04 22:25:28.119479,0 days 00:00:10.276558,True,entropy,10,10,5,952,COMPLETE
553,553,0.7991730186957621,2023-04-04 22:25:28.122704,2023-04-04 22:25:37.428163,0 days 00:00:09.305459,True,entropy,10,6,5,966,COMPLETE
554,554,0.8049186347672469,2023-04-04 22:25:37.431487,2023-04-04 22:25:47.775679,0 days 00:00:10.344192,True,entropy,10,9,5,988,COMPLETE
555,555,0.8070643721788718,2023-04-04 22:25:47.778428,2023-04-04 22:25:57.787348,0 days 00:00:10.008920,True,entropy,8,10,5,933,COMPLETE
556,556,0.8063063670334139,2023-04-04 22:25:57.790589,2023-04-04 22:26:08.184000,0 days 00:00:10.393411,True,gini,9,10,5,965,COMPLETE
557,557,0.8063924335510506,2023-04-04 22:26:08.186903,2023-04-04 22:26:18.710309,0 days 00:00:10.523406,True,entropy,10,10,4,985,COMPLETE
558,558,0.806562732868118,2023-04-04 22:26:18.711248,2023-04-04 22:26:29.466426,0 days 00:00:10.755178,True,entropy,10,10,5,1000,COMPLETE
559,559,0.8065549390912505,2023-04-04 22:26:29.469338,2023-04-04 22:26:39.530986,0 days 00:00:10.061648,True,entropy,10,10,5,943,COMPLETE
560,560,0.806598190587388,2023-04-04 22:26:39.531752,2023-04-04 22:26:50.076473,0 days 00:00:10.544721,True,entropy,8,10,6,955,COMPLETE
561,561,0.8067818631349952,2023-04-04 22:26:50.078694,2023-04-04 22:27:00.041167,0 days 00:00:09.962473,True,entropy,10,10,7,916,COMPLETE
562,562,0.8068374928899364,2023-04-04 22:27:00.043148,2023-04-04 22:27:10.467835,0 days 00:00:10.424687,True,entropy,10,10,4,972,COMPLETE
563,563,0.8067221746288386,2023-04-04 22:27:10.470934,2023-04-04 22:27:21.075229,0 days 00:00:10.604295,True,entropy,10,10,6,985,COMPLETE
564,564,0.8055967570049309,2023-04-04 22:27:21.078125,2023-04-04 22:27:22.875235,0 days 00:00:01.797110,True,entropy,10,10,6,147,COMPLETE
565,565,0.8062943465203449,2023-04-04 22:27:22.877918,2023-04-04 22:27:33.108397,0 days 00:00:10.230479,True,entropy,10,10,5,952,COMPLETE
566,566,0.8066535964183906,2023-04-04 22:27:33.109776,2023-04-04 22:27:43.059353,0 days 00:00:09.949577,True,entropy,9,10,6,924,COMPLETE
567,567,0.8063210598944123,2023-04-04 22:27:43.062281,2023-04-04 22:27:51.803966,0 days 00:00:08.741685,True,entropy,8,10,6,824,COMPLETE
568,568,0.8048555021375188,2023-04-04 22:27:51.804486,2023-04-04 22:28:02.101442,0 days 00:00:10.296956,True,entropy,10,9,6,973,COMPLETE
569,569,0.8065764305573392,2023-04-04 22:28:02.104467,2023-04-04 22:28:12.208273,0 days 00:00:10.103806,True,entropy,10,10,5,939,COMPLETE
570,570,0.8062838805100284,2023-04-04 22:28:12.211339,2023-04-04 22:28:20.931147,0 days 00:00:08.719808,True,entropy,10,10,4,806,COMPLETE
571,571,0.8066320827166511,2023-04-04 22:28:20.933780,2023-04-04 22:28:26.894338,0 days 00:00:05.960558,True,entropy,8,10,6,546,COMPLETE
572,572,0.8058343484166297,2023-04-04 22:28:26.897282,2023-04-04 22:28:37.417612,0 days 00:00:10.520330,True,entropy,10,10,7,964,COMPLETE
573,573,0.8067848487132085,2023-04-04 22:28:37.420782,2023-04-04 22:28:47.946323,0 days 00:00:10.525541,True,entropy,10,10,8,980,COMPLETE
574,574,0.806717903077204,2023-04-04 22:28:47.948999,2023-04-04 22:28:58.060801,0 days 00:00:10.111802,True,entropy,10,10,5,949,COMPLETE
575,575,0.8064662673345413,2023-04-04 22:28:58.063758,2023-04-04 22:29:07.960725,0 days 00:00:09.896967,True,gini,8,10,6,928,COMPLETE
576,576,0.8066622512217455,2023-04-04 22:29:07.963426,2023-04-04 22:29:18.955169,0 days 00:00:10.991743,True,entropy,9,10,4,998,COMPLETE
577,577,0.8068857648715533,2023-04-04 22:29:18.957857,2023-04-04 22:29:28.742305,0 days 00:00:09.784448,True,entropy,10,10,6,907,COMPLETE
578,578,0.8066497499418842,2023-04-04 22:29:28.745199,2023-04-04 22:29:39.104182,0 days 00:00:10.358983,True,entropy,10,10,5,967,COMPLETE
579,579,0.8067422796330282,2023-04-04 22:29:39.107457,2023-04-04 22:29:49.230541,0 days 00:00:10.123084,True,entropy,7,10,6,953,COMPLETE
580,580,0.8070067074812028,2023-04-04 22:29:49.233196,2023-04-04 22:29:59.917598,0 days 00:00:10.684402,True,entropy,10,10,6,987,COMPLETE
581,581,0.8050205123091214,2023-04-04 22:29:59.920355,2023-04-04 22:30:08.764441,0 days 00:00:08.844086,True,entropy,10,9,8,835,COMPLETE
582,582,0.8060857719252293,2023-04-04 22:30:08.766648,2023-04-04 22:30:16.952257,0 days 00:00:08.185609,True,entropy,10,10,6,757,COMPLETE
583,583,0.8067818296495062,2023-04-04 22:30:16.955209,2023-04-04 22:30:27.008791,0 days 00:00:10.053582,True,entropy,10,10,9,935,COMPLETE
584,584,0.8064343878531943,2023-04-04 22:30:27.011751,2023-04-04 22:30:37.598230,0 days 00:00:10.586479,True,entropy,8,10,4,972,COMPLETE
585,585,0.8069331646245346,2023-04-04 22:30:37.600733,2023-04-04 22:30:46.301592,0 days 00:00:08.700859,True,entropy,10,10,7,795,COMPLETE
586,586,0.8069798598288955,2023-04-04 22:30:46.304529,2023-04-04 22:30:56.925688,0 days 00:00:10.621159,True,entropy,8,10,5,1000,COMPLETE
587,587,0.8065210804718201,2023-04-04 22:30:56.928362,2023-04-04 22:31:07.159779,0 days 00:00:10.231417,True,entropy,9,10,9,956,COMPLETE
588,588,0.8068713514479553,2023-04-04 22:31:07.162852,2023-04-04 22:31:12.993992,0 days 00:00:05.831140,True,entropy,10,10,6,532,COMPLETE
589,589,0.806678051045651,2023-04-04 22:31:12.996942,2023-04-04 22:31:22.961619,0 days 00:00:09.964677,True,entropy,10,10,9,915,COMPLETE
590,590,0.8065618383242507,2023-04-04 22:31:22.963544,2023-04-04 22:31:33.471395,0 days 00:00:10.507851,True,entropy,10,10,6,985,COMPLETE
591,591,0.80621602911365,2023-04-04 22:31:33.474027,2023-04-04 22:31:37.754048,0 days 00:00:04.280021,True,entropy,10,10,9,389,COMPLETE
592,592,0.8071154619544544,2023-04-04 22:31:37.757549,2023-04-04 22:31:47.426377,0 days 00:00:09.668828,True,entropy,10,10,5,892,COMPLETE
593,593,0.8060898420418438,2023-04-04 22:31:47.429071,2023-04-04 22:31:57.186433,0 days 00:00:09.757362,True,entropy,8,10,5,896,COMPLETE
594,594,0.8067604611266421,2023-04-04 22:31:57.189102,2023-04-04 22:32:06.451485,0 days 00:00:09.262383,True,entropy,10,10,5,859,COMPLETE
595,595,0.8064520215724803,2023-04-04 22:32:06.454275,2023-04-04 22:32:15.631374,0 days 00:00:09.177099,True,gini,6,10,5,869,COMPLETE
596,596,0.8072251668710655,2023-04-04 22:32:15.634409,2023-04-04 22:32:25.219324,0 days 00:00:09.584915,True,entropy,10,10,5,886,COMPLETE
597,597,0.7899053830417369,2023-04-04 22:32:25.222247,2023-04-04 22:32:32.266047,0 days 00:00:07.043800,True,entropy,5,3,5,893,COMPLETE
598,598,0.8069584354791133,2023-04-04 22:32:32.269734,2023-04-04 22:32:41.279455,0 days 00:00:09.009721,True,entropy,10,10,5,843,COMPLETE
599,599,0.8068299673995151,2023-04-04 22:32:41.283318,2023-04-04 22:32:50.792986,0 days 00:00:09.509668,True,entropy,9,10,5,885,COMPLETE
600,600,0.8052582493534087,2023-04-04 22:32:50.796316,2023-04-04 22:33:00.035702,0 days 00:00:09.239386,True,entropy,8,9,5,874,COMPLETE
601,601,0.8063280262305007,2023-04-04 22:33:00.037291,2023-04-04 22:33:09.319510,0 days 00:00:09.282219,True,entropy,10,10,5,851,COMPLETE
602,602,0.8065945899344863,2023-04-04 22:33:09.322705,2023-04-04 22:33:18.706382,0 days 00:00:09.383677,True,entropy,10,10,5,880,COMPLETE
603,603,0.8013551417095964,2023-04-04 22:33:18.709448,2023-04-04 22:33:27.733075,0 days 00:00:09.023627,True,entropy,10,7,5,864,COMPLETE
604,604,0.8064758836063713,2023-04-04 22:33:27.736013,2023-04-04 22:33:36.842652,0 days 00:00:09.106639,True,entropy,10,10,5,840,COMPLETE
605,605,0.8064721041854579,2023-04-04 22:33:36.845305,2023-04-04 22:33:46.641151,0 days 00:00:09.795846,True,entropy,10,10,5,897,COMPLETE
606,606,0.8061996701098298,2023-04-04 22:33:46.644296,2023-04-04 22:33:52.103135,0 days 00:00:05.458839,True,entropy,10,10,5,501,COMPLETE
607,607,0.8063253538645287,2023-04-04 22:33:52.106171,2023-04-04 22:34:00.901513,0 days 00:00:08.795342,True,entropy,8,10,5,827,COMPLETE
608,608,0.8066253846844434,2023-04-04 22:34:00.904467,2023-04-04 22:34:10.211846,0 days 00:00:09.307379,True,entropy,10,10,5,854,COMPLETE
609,609,0.8058291710624677,2023-04-04 22:34:10.214797,2023-04-04 22:34:14.200680,0 days 00:00:03.985883,True,entropy,9,10,4,351,COMPLETE
610,610,0.807158590241144,2023-04-04 22:34:14.203355,2023-04-04 22:34:23.546685,0 days 00:00:09.343330,True,entropy,10,10,5,873,COMPLETE
611,611,0.8068512016585053,2023-04-04 22:34:23.549274,2023-04-04 22:34:32.987669,0 days 00:00:09.438395,True,entropy,10,10,5,879,COMPLETE
612,612,0.8061997483087324,2023-04-04 22:34:32.992512,2023-04-04 22:34:42.324444,0 days 00:00:09.331932,True,entropy,7,10,5,868,COMPLETE
613,613,0.8061741753360764,2023-04-04 22:34:42.326876,2023-04-04 22:34:51.752998,0 days 00:00:09.426122,True,entropy,10,10,5,862,COMPLETE
614,614,0.8068518279475546,2023-04-04 22:34:51.756166,2023-04-04 22:35:01.107255,0 days 00:00:09.351089,True,entropy,8,10,5,877,COMPLETE
615,615,0.8045547331618048,2023-04-04 22:35:01.109324,2023-04-04 22:35:14.856879,0 days 00:00:13.747555,False,gini,10,9,5,893,COMPLETE
616,616,0.8061664375258214,2023-04-04 22:35:14.860072,2023-04-04 22:35:23.772188,0 days 00:00:08.912116,True,entropy,10,10,5,819,COMPLETE
617,617,0.806239745766149,2023-04-04 22:35:23.775323,2023-04-04 22:35:33.018736,0 days 00:00:09.243413,True,entropy,10,10,5,845,COMPLETE
618,618,0.806339688882814,2023-04-04 22:35:33.022025,2023-04-04 22:35:42.701573,0 days 00:00:09.679548,True,entropy,8,10,5,903,COMPLETE
619,619,0.8063723734781403,2023-04-04 22:35:42.703980,2023-04-04 22:35:49.061193,0 days 00:00:06.357213,True,entropy,10,10,5,588,COMPLETE
620,620,0.7956463252263568,2023-04-04 22:35:49.064708,2023-04-04 22:35:57.169207,0 days 00:00:08.104499,True,entropy,10,5,4,887,COMPLETE
621,621,0.8062193611198818,2023-04-04 22:35:57.172416,2023-04-04 22:36:06.448585,0 days 00:00:09.276169,True,entropy,8,10,5,846,COMPLETE
622,622,0.8070395372153436,2023-04-04 22:36:06.450958,2023-04-04 22:36:15.696703,0 days 00:00:09.245745,True,entropy,10,10,1,864,COMPLETE
623,623,0.8066795495161931,2023-04-04 22:36:15.700019,2023-04-04 22:36:29.953989,0 days 00:00:14.253970,False,entropy,10,10,6,888,COMPLETE
624,624,0.8064282376137017,2023-04-04 22:36:29.957778,2023-04-04 22:36:39.835627,0 days 00:00:09.877849,True,entropy,9,10,5,903,COMPLETE
625,625,0.8051147079721618,2023-04-04 22:36:39.838420,2023-04-04 22:36:44.354365,0 days 00:00:04.515945,True,entropy,10,9,6,411,COMPLETE
626,626,0.8071810321119646,2023-04-04 22:36:44.357282,2023-04-04 22:36:53.230169,0 days 00:00:08.872887,True,entropy,8,10,4,822,COMPLETE
627,627,0.8064438476504062,2023-04-04 22:36:53.232873,2023-04-04 22:37:01.938897,0 days 00:00:08.706024,True,entropy,8,10,5,812,COMPLETE
628,628,0.806782019854096,2023-04-04 22:37:01.942178,2023-04-04 22:37:05.576483,0 days 00:00:03.634305,True,entropy,8,10,4,318,COMPLETE
629,629,0.8070219259307061,2023-04-04 22:37:05.579181,2023-04-04 22:37:14.245412,0 days 00:00:08.666231,True,entropy,8,10,4,790,COMPLETE
630,630,0.8067136315699137,2023-04-04 22:37:14.248443,2023-04-04 22:37:23.095832,0 days 00:00:08.847389,True,entropy,8,10,4,825,COMPLETE
631,631,0.8067167513966895,2023-04-04 22:37:23.098622,2023-04-04 22:37:32.071611,0 days 00:00:08.972989,True,entropy,8,10,4,839,COMPLETE
632,632,0.8067039370436587,2023-04-04 22:37:32.074742,2023-04-04 22:37:45.005118,0 days 00:00:12.930376,False,entropy,8,10,4,803,COMPLETE
