,number,value,datetime_start,datetime_complete,duration,params_ccp_alpha,params_criterion,params_learning_rate,params_loss,params_max_depth,params_max_features,params_min_impurity_decrease,params_min_samples_leaf,params_min_samples_split,params_min_weight_fraction_leaf,params_n_estimators,params_subsample,params_tol,state
399,399,0.6924588259517466,2023-04-05 06:17:40.155333,2023-04-05 06:17:41.297689,0 days 00:00:01.142356,0.009981439504492482,friedman_mse,0.004149839276404498,exponential,4,sqrt,0.40962581185888053,6,7,0.19567330947028136,414,0.13628426436682764,0.0004867548950969783,COMPLETE
400,400,0.5,2023-04-05 06:17:41.298526,2023-04-05 06:17:43.300194,0 days 00:00:02.001668,0.2124652517579248,friedman_mse,0.007417426511015846,exponential,4,sqrt,0.36407056938790633,5,8,0.008623929757490626,353,0.476446980677253,0.007239189254902705,COMPLETE
401,401,0.755660095227631,2023-04-05 06:17:43.300932,2023-04-05 06:17:44.669343,0 days 00:00:01.368411,0.01784969553141769,friedman_mse,0.009041536996362122,exponential,4,sqrt,0.32398046805718855,5,8,0.02954853722834826,394,0.17544520138403807,0.04586325427291597,COMPLETE
402,402,0.7411592793614619,2023-04-05 06:17:44.670345,2023-04-05 06:17:46.756347,0 days 00:00:02.086002,0.00029806459357363654,friedman_mse,0.004699743168117058,exponential,4,sqrt,0.3752290450878736,6,7,0.11275953161877511,571,0.14616465549574617,0.013075953450972858,COMPLETE
403,403,0.6773893919985481,2023-04-05 06:17:46.757327,2023-04-05 06:17:48.594734,0 days 00:00:01.837407,0.032605287270010684,friedman_mse,0.012771890511192987,exponential,4,sqrt,0.40443767296886235,5,8,0.2661095012381351,875,0.11320737498600458,0.02391943476876446,COMPLETE
404,404,0.5,2023-04-05 06:17:48.595475,2023-04-05 06:17:49.940456,0 days 00:00:01.344981,0.009893876560091138,squared_error,0.009881660296397343,exponential,4,sqrt,0.4328608200471375,5,7,0.01865259108667203,370,0.4169012507264781,0.010227838444770331,COMPLETE
405,405,0.5,2023-04-05 06:17:49.941200,2023-04-05 06:17:51.587827,0 days 00:00:01.646627,0.4270741030006527,friedman_mse,0.012748178496452982,exponential,4,sqrt,0.3833778968482133,7,6,0.04162723062955864,388,0.24999260247269808,0.024405887977595568,COMPLETE
406,406,0.5,2023-04-05 06:17:51.588533,2023-04-05 06:17:53.623414,0 days 00:00:02.034881,0.24280511057879411,friedman_mse,0.003425296028037962,exponential,4,sqrt,0.35756994892993427,5,8,0.009285114351696568,606,0.2089514646515279,0.012235848827377873,COMPLETE
407,407,0.6605756727302735,2023-04-05 06:17:53.624226,2023-04-05 06:17:54.789913,0 days 00:00:01.165687,0.017525138999014273,friedman_mse,0.0005766740056999339,exponential,4,sqrt,0.3376666606986153,6,8,0.25646792699257853,431,0.16369156029204635,0.0510685140383312,COMPLETE
408,408,0.5,2023-04-05 06:17:54.790732,2023-04-05 06:17:56.033070,0 days 00:00:01.242338,0.15878051739024515,friedman_mse,0.013961934491912424,exponential,4,sqrt,0.3695483333620689,4,7,0.2353049651116374,348,0.3001633766554399,0.014463539506930941,COMPLETE
409,409,0.5,2023-04-05 06:17:56.033957,2023-04-05 06:17:57.247029,0 days 00:00:01.213072,0.25265370866644576,friedman_mse,0.0034615747155063536,exponential,4,sqrt,0.3929630154505296,6,8,0.02842509287183145,411,0.11198786608764402,0.013524364134961518,COMPLETE
410,410,0.5973805311656455,2023-04-05 06:17:57.247891,2023-04-05 06:17:58.996565,0 days 00:00:01.748674,0.15682446251918397,friedman_mse,0.003803953990023463,exponential,4,sqrt,0.4140805739725565,5,8,0.016711018924179553,546,0.18802734454484524,0.01660193869361447,COMPLETE
411,411,0.7732031539757831,2023-04-05 06:17:58.997297,2023-04-05 06:18:01.191135,0 days 00:00:02.193838,0.00014778594533059174,friedman_mse,0.010002551072690253,exponential,4,sqrt,0.3522218087100544,5,8,0.009018341704183344,371,0.33061285778743793,0.03517786954828597,COMPLETE
412,412,0.7567556247177006,2023-04-05 06:18:01.191862,2023-04-05 06:18:03.302204,0 days 00:00:02.110342,0.008986406026833824,friedman_mse,0.007777363283133712,exponential,4,sqrt,0.3425047445367839,5,8,0.00022619768803277922,369,0.40226142363490086,0.03594052296483821,COMPLETE
413,413,0.5,2023-04-05 06:18:03.302901,2023-04-05 06:18:04.284850,0 days 00:00:00.981949,0.09617069254086788,friedman_mse,0.010508078134385933,exponential,4,log2,0.3514836350548206,5,8,0.34080330998472036,326,0.2271262321840637,0.00946080272200665,COMPLETE
414,414,0.5,2023-04-05 06:18:04.285950,2023-04-05 06:18:05.629792,0 days 00:00:01.343842,0.1398315106517261,friedman_mse,0.0063358287630921805,exponential,4,sqrt,0.3276239065042399,5,8,0.3873301263605093,355,0.4407788331046547,0.019749984128068634,COMPLETE
415,415,0.5,2023-04-05 06:18:05.630598,2023-04-05 06:18:06.964426,0 days 00:00:01.333828,0.17086399309586542,friedman_mse,0.010527129168858474,exponential,4,sqrt,0.3567855206164578,5,8,0.0003282510008626189,376,0.20956949122426516,0.0422585031873655,COMPLETE
416,416,0.7480831089342427,2023-04-05 06:18:06.965245,2023-04-05 06:18:08.502815,0 days 00:00:01.537570,0.025083173259221877,friedman_mse,0.009560656540194994,exponential,4,sqrt,0.370512889911707,5,8,0.07558536211130057,346,0.2946299675426597,0.0004378271432935619,COMPLETE
417,417,0.7116125439746314,2023-04-05 06:18:08.503542,2023-04-05 06:18:10.148092,0 days 00:00:01.644550,0.0005556365457459935,friedman_mse,0.008371011518741867,exponential,4,sqrt,0.4415794032911807,5,7,0.16956951490273958,388,0.2536265790729222,0.03127763248795008,COMPLETE
418,418,0.5,2023-04-05 06:18:10.148817,2023-04-05 06:18:11.722786,0 days 00:00:01.573969,0.3520924718864413,friedman_mse,0.004328868449787308,exponential,4,sqrt,0.3413421332055671,5,8,0.024595629809249182,366,0.28672758630917405,0.03546861592740841,COMPLETE
419,419,0.7182144871651501,2023-04-05 06:18:11.723602,2023-04-05 06:18:13.386318,0 days 00:00:01.662716,0.061203735138310476,friedman_mse,0.013402818108227561,exponential,4,sqrt,0.3811769201353772,7,8,0.00994778615956658,334,0.3569376691175686,0.04310796993693804,COMPLETE
420,420,0.7506425145230391,2023-04-05 06:18:13.387163,2023-04-05 06:18:14.944222,0 days 00:00:01.557059,0.016050643545910088,friedman_mse,0.005632263021005919,exponential,9,sqrt,0.3150053993033814,5,8,0.08625496010429036,399,0.23775813204261437,0.05202923364138392,COMPLETE
421,421,0.7301110643194109,2023-04-05 06:18:14.945042,2023-04-05 06:18:17.109024,0 days 00:00:02.163982,0.04616913828459618,friedman_mse,0.016200780162180562,exponential,4,sqrt,0.36272827510966194,4,8,0.03540645580823659,378,0.4886468542223014,0.005510678182207876,COMPLETE
422,422,0.7566110633155423,2023-04-05 06:18:17.110112,2023-04-05 06:18:18.404889,0 days 00:00:01.294777,0.007728771332347649,friedman_mse,0.0031306438275548088,exponential,4,sqrt,0.06511516595569133,7,7,0.016060104883702346,313,0.1798446122384423,0.009145492929678579,COMPLETE
423,423,0.5,2023-04-05 06:18:18.405767,2023-04-05 06:18:19.296569,0 days 00:00:00.890802,0.00046201078741095144,squared_error,0.011513516988362992,exponential,4,sqrt,0.33205324350211735,6,8,0.06226587085222719,362,0.14404660494783822,0.029663995777629862,COMPLETE
424,424,0.6229400462211727,2023-04-05 06:18:19.297408,2023-04-05 06:18:21.083485,0 days 00:00:01.786077,0.11795582093961342,friedman_mse,0.005129535995960887,exponential,4,sqrt,0.3519913581803843,5,8,0.0461880965017341,395,0.3347316329121536,0.03919847684253274,COMPLETE
425,425,0.7502090460541526,2023-04-05 06:18:21.084316,2023-04-05 06:18:23.603076,0 days 00:00:02.518760,0.034250691452448925,friedman_mse,0.004086356254254097,exponential,7,sqrt,0.2949736620773354,10,8,0.02303051588474283,346,0.434920911311138,0.025639515733638985,COMPLETE
426,426,0.7092221532715259,2023-04-05 06:18:23.603877,2023-04-05 06:18:24.837862,0 days 00:00:01.233985,0.07548343286994708,friedman_mse,0.0033358101122408627,exponential,4,sqrt,0.3677340403271511,5,6,0.007961678317958158,379,0.17047503665435793,0.0003629540362012428,COMPLETE
427,427,0.5,2023-04-05 06:18:24.838707,2023-04-05 06:18:26.481279,0 days 00:00:01.642572,0.26606434771927545,friedman_mse,0.0029980487995309156,exponential,4,sqrt,0.39822991559046095,6,7,0.13682753953468046,412,0.323883326049602,0.0004632954085798899,COMPLETE
428,428,0.7530664500077868,2023-04-05 06:18:26.482108,2023-04-05 06:18:28.385112,0 days 00:00:01.903004,0.0186323466616066,friedman_mse,0.007255724992541453,exponential,4,sqrt,0.4287474799239098,1,8,0.016776631749646213,359,0.3909139246448727,0.008578540217825966,COMPLETE
429,429,0.6537817118587738,2023-04-05 06:18:28.385848,2023-04-05 06:18:29.361554,0 days 00:00:00.975706,0.00029662895208383636,friedman_mse,0.006281325888188133,exponential,4,sqrt,0.4161909692075265,10,8,0.31038766157963343,387,0.10014268996762143,0.019436535370328963,COMPLETE
430,430,0.7025133080860894,2023-04-05 06:18:29.362418,2023-04-05 06:18:31.073339,0 days 00:00:01.710921,0.010838673178439923,friedman_mse,0.004483740871096814,exponential,4,sqrt,0.28119940292356294,10,7,0.15674575872676375,434,0.19341751891346773,0.025777887316795752,COMPLETE
431,431,0.5,2023-04-05 06:18:31.074183,2023-04-05 06:18:34.645931,0 days 00:00:03.571748,0.24828833535715666,friedman_mse,0.00019063323105171867,exponential,4,sqrt,0.4473687289132998,5,7,0.008771960631771021,681,0.45221603198642,0.006378090078124823,COMPLETE
432,432,0.5,2023-04-05 06:18:34.647289,2023-04-05 06:18:36.024247,0 days 00:00:01.376958,0.1568591959444003,friedman_mse,0.009601466495249516,exponential,4,log2,0.3776451119497295,7,8,0.37639924572660727,368,0.4764944276335965,0.021451724566320676,COMPLETE
433,433,0.6215938709901028,2023-04-05 06:18:36.024989,2023-04-05 06:18:37.274039,0 days 00:00:01.249050,0.02435390059636033,friedman_mse,0.0007053968728570399,exponential,5,sqrt,0.3503699306102297,10,8,0.4330301551901526,403,0.2683446598899172,0.03311899786331376,COMPLETE
434,434,0.7556201877790107,2023-04-05 06:18:37.274742,2023-04-05 06:18:38.479980,0 days 00:00:01.205238,0.009889684228143101,friedman_mse,0.0038565478190311737,exponential,4,sqrt,0.3095494157077959,8,7,0.034183505123676475,333,0.15925993884425704,0.017374255574456376,COMPLETE
435,435,0.5,2023-04-05 06:18:38.480872,2023-04-05 06:18:40.408707,0 days 00:00:01.927835,0.18240537753169878,friedman_mse,0.0008658199754444059,exponential,4,sqrt,0.32747583867940067,5,8,0.10809151494429683,589,0.21747514398467452,0.030019729405955663,COMPLETE
436,436,0.7142954923106546,2023-04-05 06:18:40.409461,2023-04-05 06:18:42.275241,0 days 00:00:01.865780,0.050821176710923184,friedman_mse,0.05189852877406965,exponential,4,sqrt,0.38852852089954093,4,8,0.02439518639683102,389,0.3654598369812635,0.038251532897481795,COMPLETE
437,437,0.7557612529837127,2023-04-05 06:18:42.275963,2023-04-05 06:18:43.886407,0 days 00:00:01.610444,0.0176447911516152,friedman_mse,0.00290131057768754,exponential,4,sqrt,0.34520996694696415,10,8,2.3953570769202903e-05,428,0.20072253587203315,0.004289570934524919,COMPLETE
438,438,0.5,2023-04-05 06:18:43.887124,2023-04-05 06:18:45.740806,0 days 00:00:01.853682,0.3325842073004101,friedman_mse,0.0035272565006062378,exponential,4,sqrt,0.36694702642579147,5,5,6.428997748516413e-05,344,0.4128970122762534,0.06249831715975327,COMPLETE
439,439,0.632348100975401,2023-04-05 06:18:45.741526,2023-04-05 06:18:46.824162,0 days 00:00:01.082636,0.12990891949477607,friedman_mse,0.01676724608156616,exponential,4,sqrt,0.40604220648827544,4,6,0.014104241017409813,371,0.14153509635541706,0.007037855045139406,COMPLETE
440,440,0.5,2023-04-05 06:18:46.824975,2023-04-05 06:18:48.129476,0 days 00:00:01.304501,0.1861813194855904,friedman_mse,0.012868634064675916,exponential,4,sqrt,0.3170981940420714,6,7,0.027130591612144695,288,0.2840552797554443,0.027881311629890014,COMPLETE
441,441,0.5455893287974873,2023-04-05 06:18:48.130332,2023-04-05 06:18:50.499567,0 days 00:00:02.369235,0.14513490604485643,friedman_mse,0.008813780281346958,exponential,4,sqrt,0.3358939132126731,10,8,0.01564621167528952,411,0.49909068606437396,0.0005328446959378696,COMPLETE
442,442,0.5,2023-04-05 06:18:50.500308,2023-04-05 06:18:51.854322,0 days 00:00:01.354014,0.009232238631827532,squared_error,0.004812437194244889,exponential,4,sqrt,0.29506338706221,10,8,0.04656662070709964,356,0.45644661765789984,0.021464154619172233,COMPLETE
443,443,0.5,2023-04-05 06:18:51.855155,2023-04-05 06:18:52.929664,0 days 00:00:01.074509,0.22946005347159734,friedman_mse,0.0030801752341817804,exponential,4,sqrt,0.3562714818470673,8,8,0.14522778907377965,313,0.2270471633555112,0.03480983723795789,COMPLETE
444,444,0.6234841001383075,2023-04-05 06:18:52.930409,2023-04-05 06:18:53.887180,0 days 00:00:00.956771,0.02820676546796628,friedman_mse,0.0004776596079924523,exponential,4,sqrt,0.26832077613956457,5,7,0.29562908013272093,392,0.1306803607134194,0.0007008329238148229,COMPLETE
445,445,0.6777856367550092,2023-04-05 06:18:53.888004,2023-04-05 06:18:55.167271,0 days 00:00:01.279267,0.1012403931447014,friedman_mse,0.003495742393454704,exponential,3,sqrt,0.2854590388117221,10,8,0.009183577749930881,374,0.1648006781668401,0.0003287424835667937,COMPLETE
446,446,0.6437318298761018,2023-04-05 06:18:55.168093,2023-04-05 06:18:56.606792,0 days 00:00:01.438699,0.0002791178759147585,friedman_mse,0.002707810180403811,log_loss,4,sqrt,0.45590448420513957,5,7,0.3995307111860133,449,0.2476594561671343,0.0037369022715388225,COMPLETE
447,447,0.5,2023-04-05 06:18:56.607617,2023-04-05 06:18:58.103699,0 days 00:00:01.496082,0.3047098864169212,friedman_mse,0.01081120318458119,exponential,4,sqrt,0.38500149856585586,8,10,0.2513863404507413,424,0.33735290165530185,0.04443732587502117,COMPLETE
448,448,0.6329545456056656,2023-04-05 06:18:58.104500,2023-04-05 06:18:59.201919,0 days 00:00:01.097419,0.017391051600056308,friedman_mse,0.003928441099787387,exponential,4,sqrt,0.4395261814546325,10,8,0.41845375724758754,403,0.18800548858183272,0.015658116247979557,COMPLETE
449,449,0.5,2023-04-05 06:18:59.202699,2023-04-05 06:19:00.874670,0 days 00:00:01.671971,0.06544315076306256,friedman_mse,0.007951369681885331,log_loss,4,sqrt,0.4240426747770557,10,8,0.03480616764020852,335,0.355635169883221,0.008309191370568937,COMPLETE
450,450,0.7626831029250234,2023-04-05 06:19:00.875499,2023-04-05 06:19:02.719421,0 days 00:00:01.843922,5.8723622001427144e-05,friedman_mse,0.0029229468837642597,exponential,4,sqrt,0.3441699512776718,5,7,0.020472548632966873,355,0.26763498516198386,0.011082838914594339,COMPLETE
451,451,0.682867471420266,2023-04-05 06:19:02.720157,2023-04-05 06:19:04.064673,0 days 00:00:01.344516,0.008400451349696943,friedman_mse,0.0031135728842742595,exponential,4,sqrt,0.3411674717599309,5,7,0.20512197573346874,348,0.30532860270622486,0.00025557356253127497,COMPLETE
452,452,0.5,2023-04-05 06:19:04.065372,2023-04-05 06:19:05.176867,0 days 00:00:01.111495,0.22857214616229662,friedman_mse,0.0028380078232300037,exponential,4,log2,0.3253012519310583,5,7,0.019872374204127234,323,0.22030531716797397,0.011628344922498658,COMPLETE
453,453,0.7064305677333547,2023-04-05 06:19:05.177574,2023-04-05 06:19:07.126684,0 days 00:00:01.949110,0.00045752092539462676,friedman_mse,0.005822616765452566,exponential,4,sqrt,0.35222223436955435,5,7,0.17821045304652028,360,0.5287278374508301,0.010658385087686791,COMPLETE
454,454,0.5,2023-04-05 06:19:07.127412,2023-04-05 06:19:08.666559,0 days 00:00:01.539147,0.272302729675611,friedman_mse,0.024406740419939742,exponential,4,sqrt,0.37377643558149437,5,7,0.01034084881833429,382,0.23967642075741663,0.013418218270089073,COMPLETE
455,455,0.63717105646826,2023-04-05 06:19:08.667292,2023-04-05 06:19:09.834910,0 days 00:00:01.167618,0.0185335117176968,friedman_mse,0.0033850139763147128,exponential,4,sqrt,0.35993810876912186,5,7,0.26761282399193204,361,0.26697942705795447,0.010138447086973246,COMPLETE
456,456,0.7322261516231994,2023-04-05 06:19:09.835653,2023-04-05 06:19:12.809514,0 days 00:00:02.973861,3.49246736881805e-05,friedman_mse,0.004301490808324663,exponential,4,sqrt,0.3347636229733842,5,7,0.1218978876972147,384,0.8714524277993834,0.005272535734495733,COMPLETE
457,457,0.7497480966319069,2023-04-05 06:19:12.810287,2023-04-05 06:19:15.581574,0 days 00:00:02.771287,0.03858913072304287,friedman_mse,0.0037747853035855912,exponential,5,sqrt,0.34383927138847314,5,7,0.026071561855270854,334,0.7581587109573903,0.01628022102137311,COMPLETE
458,458,0.757581423983067,2023-04-05 06:19:15.582348,2023-04-05 06:19:17.168405,0 days 00:00:01.586057,0.010541805618559073,friedman_mse,0.002985299951913982,exponential,4,sqrt,0.3635327986802998,6,7,0.00047916486442990414,407,0.18620131652453922,0.0005898491675196679,COMPLETE
459,459,0.5,2023-04-05 06:19:17.169109,2023-04-05 06:19:19.174239,0 days 00:00:02.005130,0.4985482099930058,friedman_mse,0.002621242432408729,exponential,4,sqrt,0.30274793103953,7,6,0.08832429009672119,368,0.4941291455936651,0.0007538624025511756,COMPLETE
460,460,0.6229400462211727,2023-04-05 06:19:19.174959,2023-04-05 06:19:22.330513,0 days 00:00:03.155554,0.12481410665494558,friedman_mse,0.004839756746699552,exponential,3,sqrt,0.398745222484,5,8,0.01796301661873174,996,0.21009978224635445,0.023616396457441628,COMPLETE
461,461,0.7245850428661395,2023-04-05 06:19:22.331249,2023-04-05 06:19:24.427060,0 days 00:00:02.095811,0.026037473310373805,friedman_mse,0.007115552067572623,exponential,4,sqrt,0.3210331104545917,5,8,0.10264041552785758,298,0.7765459504479064,0.0008805374968583807,COMPLETE
462,462,0.5,2023-04-05 06:19:24.427775,2023-04-05 06:19:25.985129,0 days 00:00:01.557354,0.08668469499623283,friedman_mse,0.00993052104531632,exponential,4,sqrt,0.35119944094609773,6,7,0.32775763608541475,348,0.7926185937066876,0.018842920465661134,COMPLETE
463,463,0.5,2023-04-05 06:19:25.985915,2023-04-05 06:19:27.099496,0 days 00:00:01.113581,0.2152645153163302,friedman_mse,0.000322471696963306,exponential,4,sqrt,0.3291050536600192,10,6,0.35023881722838035,382,0.25424486960992976,0.012417843355469978,COMPLETE
464,464,0.5,2023-04-05 06:19:27.100231,2023-04-05 06:19:28.396947,0 days 00:00:01.296716,0.009754939486819967,squared_error,0.003268415842857707,exponential,4,sqrt,0.2553562093349753,10,8,0.008006450650028918,417,0.31667821322456924,0.0003900662932489626,COMPLETE
465,465,0.5,2023-04-05 06:19:28.397710,2023-04-05 06:19:29.775387,0 days 00:00:01.377677,0.19451469836181617,friedman_mse,0.00265906520608445,exponential,4,sqrt,0.41315927365238214,4,7,0.36533855294303647,395,0.37277817730462615,0.00044662288863823405,COMPLETE
466,466,0.5,2023-04-05 06:19:29.776098,2023-04-05 06:19:30.755200,0 days 00:00:00.979102,0.4538784549729025,friedman_mse,0.013858949599029337,exponential,4,sqrt,0.3754285342911121,3,8,0.2769484556207498,358,0.17045066144075177,0.012986558269417414,COMPLETE
467,467,0.632714103018278,2023-04-05 06:19:30.756166,2023-04-05 06:19:32.280603,0 days 00:00:01.524437,0.05575970266133741,friedman_mse,0.0041373212864295374,exponential,4,sqrt,0.2754916883785317,5,8,0.17116381380657664,435,0.23348758180382811,0.007462875479290533,COMPLETE
468,468,0.5,2023-04-05 06:19:32.281402,2023-04-05 06:19:33.217959,0 days 00:00:00.936557,0.3816401937501364,friedman_mse,0.0033417701011758203,exponential,4,sqrt,0.184065219904331,7,8,0.23053552213879328,322,0.14993759594280037,0.0148352594164552,COMPLETE
469,469,0.650751477926889,2023-04-05 06:19:33.218702,2023-04-05 06:19:34.801308,0 days 00:00:01.582606,0.0002444895230352635,friedman_mse,0.0028404826752328406,exponential,4,sqrt,0.34252796156433096,10,7,0.2871966810557776,373,0.4719025915700416,0.0006432514821329024,COMPLETE
470,470,0.5,2023-04-05 06:19:34.802269,2023-04-05 06:19:36.327380,0 days 00:00:01.525111,0.29379632040757475,friedman_mse,0.005427711488242488,exponential,4,log2,0.3907500182532334,5,10,0.009310157592964528,395,0.27596409821213397,0.008634591146554547,COMPLETE
471,471,0.7550556951796733,2023-04-05 06:19:36.328345,2023-04-05 06:19:38.256324,0 days 00:00:01.927979,0.01630406175210243,friedman_mse,0.011479091580563148,exponential,4,sqrt,0.36104233660992463,8,8,0.028056005831410786,341,0.41811193095286914,0.0010103610115573332,COMPLETE
472,472,0.7514224214128893,2023-04-05 06:19:38.257152,2023-04-05 06:19:40.401237,0 days 00:00:02.144085,0.03151519955853903,friedman_mse,0.008752122508735668,exponential,4,sqrt,0.30946444376963755,10,9,3.738834751200633e-05,419,0.3931663913529591,0.003013410923832774,COMPLETE
473,473,0.7371124721566581,2023-04-05 06:19:40.402042,2023-04-05 06:19:42.606301,0 days 00:00:02.204259,0.009463125255333904,friedman_mse,0.0045315423642878295,log_loss,4,sqrt,0.1410905731205043,8,7,0.01820173687166767,362,0.5187801754352978,0.018165701795161242,COMPLETE
474,474,0.5,2023-04-05 06:19:42.607553,2023-04-05 06:19:43.810171,0 days 00:00:01.202618,0.20748174773627215,friedman_mse,0.003662487785539182,exponential,5,sqrt,0.37219229764152434,5,8,0.18718055198953634,384,0.198449628969194,0.0008215763639667018,COMPLETE
475,475,0.5,2023-04-05 06:19:43.810961,2023-04-05 06:19:45.181858,0 days 00:00:01.370897,0.13738188119030026,friedman_mse,0.00023685551561706248,exponential,4,sqrt,0.35325229219038706,6,9,0.3182104996707894,404,0.3390687588327767,0.02356223911284752,COMPLETE
476,476,0.6229400462211727,2023-04-05 06:19:45.182723,2023-04-05 06:19:48.252990,0 days 00:00:03.070267,0.021609532014178964,friedman_mse,0.0025178250492916016,log_loss,4,sqrt,0.26365006888682646,10,9,0.04310264305585246,447,0.7379783935271356,0.00013818277841011408,COMPLETE
477,477,0.7571758017834778,2023-04-05 06:19:48.254139,2023-04-05 06:19:51.674169,0 days 00:00:03.420030,0.00935885263784453,friedman_mse,0.006220230401289813,exponential,4,sqrt,0.4503472579083999,10,4,0.017712437246452765,346,0.546948405245972,0.00029616254590214325,COMPLETE
478,478,0.5,2023-04-05 06:19:51.675031,2023-04-05 06:19:53.370781,0 days 00:00:01.695750,0.26885576167429237,friedman_mse,0.0030062461629558755,log_loss,4,sqrt,0.33298998194253554,5,8,0.05668234285020711,378,0.31216125438534037,0.03238527488757577,COMPLETE
