,number,value,datetime_start,datetime_complete,duration,params_ccp_alpha,params_criterion,params_learning_rate,params_loss,params_max_depth,params_max_features,params_min_impurity_decrease,params_min_samples_leaf,params_min_samples_split,params_min_weight_fraction_leaf,params_n_estimators,params_subsample,params_tol,state
961,961,0.5,2023-04-05 06:43:52.858867,2023-04-05 06:43:57.081875,0 days 00:00:04.223008,0.23100474083796801,friedman_mse,0.05717914718146959,exponential,5,log2,0.19384926581785303,4,8,0.060957227221364915,637,0.9988889437068424,0.010900357649611557,COMPLETE
962,962,0.7377186828509487,2023-04-05 06:43:57.082945,2023-04-05 06:44:00.212901,0 days 00:00:03.129956,0.030719298898231853,friedman_mse,0.04194545329307332,exponential,5,sqrt,0.17165358689445687,4,8,0.07694091376737669,621,0.43019947591719043,0.015059660770939199,COMPLETE
963,963,0.5,2023-04-05 06:44:00.213980,2023-04-05 06:44:03.107510,0 days 00:00:02.893530,0.33356475497954885,friedman_mse,0.07044320293510961,exponential,6,sqrt,0.15759056680422046,4,8,0.051196591752279724,599,0.3590637777917315,0.05798752502175545,COMPLETE
964,964,0.7293759439009705,2023-04-05 06:44:03.108567,2023-04-05 06:44:06.471289,0 days 00:00:03.362722,0.00961501349939199,friedman_mse,0.01925899103943159,exponential,5,sqrt,0.1351193351821373,4,8,0.12118266176079881,658,0.48413329321863097,0.00022693494751345832,COMPLETE
965,965,0.6229400462211727,2023-04-05 06:44:06.472422,2023-04-05 06:44:10.777477,0 days 00:00:04.305055,0.12050210906257808,friedman_mse,0.08857623638959239,exponential,5,sqrt,0.1319028460819883,4,8,0.03519618188053711,635,0.6470109472562359,0.006120380817293943,COMPLETE
966,966,0.5,2023-04-05 06:44:10.778634,2023-04-05 06:44:14.267907,0 days 00:00:03.489273,0.2996352107201827,friedman_mse,0.03372659654095018,exponential,5,log2,0.18325641859094344,4,8,0.10503504778773809,610,0.9576912311577962,0.004382950384034653,COMPLETE
967,967,0.625304495888664,2023-04-05 06:44:14.269648,2023-04-05 06:44:16.232459,0 days 00:00:01.962811,0.020445470463964447,friedman_mse,0.06209487832964721,exponential,5,sqrt,0.021461665917589023,1,8,0.45696727197855946,683,0.2752561024230881,0.03852304546694707,COMPLETE
968,968,0.7508663400559696,2023-04-05 06:44:16.234210,2023-04-05 06:44:22.102543,0 days 00:00:05.868333,0.009570226214224384,friedman_mse,0.0006532370345844721,exponential,5,sqrt,0.1174997816632346,4,8,0.05831970173833684,646,0.9349846486820913,0.027212663001880157,COMPLETE
969,969,0.5477519699725162,2023-04-05 06:44:22.104248,2023-04-05 06:44:24.057211,0 days 00:00:01.952963,0.00012208907281066123,squared_error,0.050244105006635585,exponential,6,sqrt,0.14879131575326668,4,8,0.04618463856797625,583,0.34565893171605566,0.02072133111245134,COMPLETE
970,970,0.6853699019632815,2023-04-05 06:44:24.058328,2023-04-05 06:44:26.758038,0 days 00:00:02.699710,0.017423111669165752,friedman_mse,0.07817532667318333,exponential,5,sqrt,0.1620595576409651,2,8,0.2351249568628877,668,0.3200644594736727,0.012351455967417276,COMPLETE
971,971,0.5,2023-04-05 06:44:26.759378,2023-04-05 06:44:29.370525,0 days 00:00:02.611147,0.10389379942799276,friedman_mse,0.026068580457240968,exponential,5,sqrt,0.21038227555100172,4,8,0.3810636197285989,619,0.8912948578575091,0.009603911891397214,COMPLETE
972,972,0.7570789758840287,2023-04-05 06:44:29.371462,2023-04-05 06:44:33.777355,0 days 00:00:04.405893,0.00834496291002889,friedman_mse,0.016607189078163574,exponential,5,log2,0.16912071901583775,4,8,0.03510024583528462,633,0.910946137154798,0.00013815372307127613,COMPLETE
973,973,0.7432007110708059,2023-04-05 06:44:33.778682,2023-04-05 06:44:38.295876,0 days 00:00:04.517194,0.02746704539307989,friedman_mse,0.03826779874425582,exponential,5,sqrt,0.2309314614729296,3,8,0.06513411779919762,699,0.6147117499528586,0.00859831471789623,COMPLETE
974,974,0.7346810820370545,2023-04-05 06:44:38.296794,2023-04-05 06:44:43.545712,0 days 00:00:05.248918,0.015883448451159566,friedman_mse,0.054598563466754305,exponential,5,sqrt,0.13962145498707587,4,8,0.09102344937398003,596,0.8398297638931551,0.00011195495484844027,COMPLETE
975,975,0.5,2023-04-05 06:44:43.546783,2023-04-05 06:44:45.726129,0 days 00:00:02.179346,0.09688279934691524,friedman_mse,0.00014033991161916615,exponential,5,sqrt,0.10950761373602555,4,8,0.3988793914180229,653,0.39848294062218553,0.0002405956418730684,COMPLETE
976,976,0.5,2023-04-05 06:44:45.727194,2023-04-05 06:44:48.310579,0 days 00:00:02.583385,0.08856560275186293,friedman_mse,0.0001926578803940421,exponential,6,sqrt,0.1260501802869489,4,8,0.3269392440896859,625,0.8621092809049566,0.0757360586691495,COMPLETE
977,977,0.5,2023-04-05 06:44:48.311510,2023-04-05 06:44:50.794461,0 days 00:00:02.482951,0.46855313709242596,friedman_mse,0.06805811595927447,exponential,5,log2,0.03212848918413308,4,10,0.20427014460165757,671,0.4275755163005264,0.00019824010258199127,COMPLETE
978,978,0.682800817095504,2023-04-05 06:44:50.795384,2023-04-05 06:44:53.346244,0 days 00:00:02.550860,0.00030421425059009574,friedman_mse,0.04587945926965249,exponential,5,sqrt,0.17604749016493268,4,8,0.30910973896542593,582,0.8168276095651298,0.00016061225343172496,COMPLETE
979,979,0.5,2023-04-05 06:44:53.347214,2023-04-05 06:44:56.275212,0 days 00:00:02.927998,0.256833074409825,friedman_mse,0.00013278595194421146,exponential,5,sqrt,0.19009368666231483,4,8,0.4223356688093202,723,0.9735390448578221,0.05155981779855856,COMPLETE
980,980,0.5,2023-04-05 06:44:56.276113,2023-04-05 06:44:59.413683,0 days 00:00:03.137570,0.14221114304624113,friedman_mse,0.0004674076927041414,exponential,5,sqrt,0.00016097297714118275,4,8,0.24155699584171553,608,0.9253244822389484,0.030520349812853773,COMPLETE
981,981,0.713143601648871,2023-04-05 06:44:59.414600,2023-04-05 06:45:01.777712,0 days 00:00:02.363112,0.023450453792670543,friedman_mse,0.020378010109483365,exponential,5,sqrt,0.0601725341961179,4,8,0.13996262244246926,643,0.26737868475247717,0.02510139590493472,COMPLETE
982,982,0.6832857048405921,2023-04-05 06:45:01.778646,2023-04-05 06:45:04.397188,0 days 00:00:02.618542,0.03444511466485585,friedman_mse,0.00024878417476914354,exponential,6,log2,0.15333767965747402,3,8,0.1576631282731859,685,0.3759030301820825,0.06355360733146904,COMPLETE
983,983,0.5,2023-04-05 06:45:04.398135,2023-04-05 06:45:08.024219,0 days 00:00:03.626084,0.1897017062478399,friedman_mse,0.07974654860968838,exponential,5,sqrt,0.2568077404485414,4,8,0.047142564942898396,658,0.4687010394924045,0.019036223404558628,COMPLETE
984,984,0.691762752938818,2023-04-05 06:45:08.025164,2023-04-05 06:45:10.664470,0 days 00:00:02.639306,0.009318560245085874,friedman_mse,0.05851110275230992,exponential,5,sqrt,0.4052374897934295,4,8,0.22677905241924082,604,0.5117756226429129,0.00012597390824966686,COMPLETE
985,985,0.5,2023-04-05 06:45:10.665425,2023-04-05 06:45:14.748719,0 days 00:00:04.083294,0.24971700347640313,friedman_mse,0.08598021011070217,exponential,5,sqrt,0.1420693120076998,4,8,0.07920554257133412,628,0.6828260752166755,0.010972809788761443,COMPLETE
986,986,0.7570102665779883,2023-04-05 06:45:14.749921,2023-04-05 06:45:18.436151,0 days 00:00:03.686230,0.011506206253325798,friedman_mse,0.014747218954913108,exponential,5,sqrt,0.16084871973656373,4,8,0.03414905505963696,572,0.5347641872571365,0.007595538105996421,COMPLETE
987,987,0.7168863688679359,2023-04-05 06:45:18.437115,2023-04-05 06:45:21.449508,0 days 00:00:03.012393,9.120190270786738e-05,friedman_mse,0.06817017052861178,exponential,5,log2,0.26286229224375396,4,8,0.2141714516731153,647,0.7892046806164186,0.01528440945210637,COMPLETE
988,988,0.5,2023-04-05 06:45:21.450488,2023-04-05 06:45:23.925604,0 days 00:00:02.475116,0.04857709555413724,squared_error,0.03286226336404946,exponential,7,sqrt,0.19534929826063083,4,8,0.25163265385557354,617,0.6256038722570085,0.00017611330219323762,COMPLETE
989,989,0.5,2023-04-05 06:45:23.926739,2023-04-05 06:45:29.781157,0 days 00:00:05.854418,0.15830680482038492,friedman_mse,0.052284252527753275,exponential,5,sqrt,0.08140031676253963,4,8,0.058246902271649775,674,0.9595703968216908,0.034284255596389736,COMPLETE
990,990,0.7729688115428397,2023-04-05 06:45:29.782312,2023-04-05 06:45:33.599241,0 days 00:00:03.816929,9.172940426394211e-05,friedman_mse,0.042219783178993726,exponential,5,sqrt,0.07408550584222379,4,8,0.07311853013093658,703,0.3279767935091369,0.04306245615098087,COMPLETE
991,991,0.625304495888664,2023-04-05 06:45:33.600193,2023-04-05 06:45:36.182740,0 days 00:00:02.582547,0.01861896514759172,friedman_mse,0.09926954880116937,exponential,5,sqrt,0.24611961957303768,4,4,0.29793081960935675,586,0.8742046999030441,0.003805883677738982,COMPLETE
992,992,0.7286456736834627,2023-04-05 06:45:36.183671,2023-04-05 06:45:41.022894,0 days 00:00:04.839223,0.009251845548486681,friedman_mse,0.060665564188308846,exponential,6,log2,0.1493033445087972,4,2,0.12729113122499822,968,0.7572378807200584,0.00021002460539539046,COMPLETE
993,993,0.6995385557412319,2023-04-05 06:45:41.023831,2023-04-05 06:45:45.234092,0 days 00:00:04.210261,0.023783076539238873,friedman_mse,0.024347190516475777,exponential,5,sqrt,0.1770870731653138,3,8,0.13418499440931703,632,0.9150000705626942,0.006407937712955229,COMPLETE
994,994,0.6858794783639066,2023-04-05 06:45:45.235102,2023-04-05 06:45:48.107895,0 days 00:00:02.872793,7.774823201127894e-05,friedman_mse,0.00033551457154237357,exponential,5,sqrt,0.13009591410771335,4,8,0.17818066486572842,660,0.3062274745061119,0.0002438432365619022,COMPLETE
995,995,0.5,2023-04-05 06:45:48.109052,2023-04-05 06:45:52.154174,0 days 00:00:04.045122,0.056083970987706004,friedman_mse,0.07354767309304643,exponential,5,sqrt,0.09952300549732976,4,8,0.27989814013518244,906,0.9817517843973599,0.004588599136429014,COMPLETE
996,996,0.5,2023-04-05 06:45:52.155293,2023-04-05 06:45:54.172788,0 days 00:00:02.017495,0.3117640341817386,friedman_mse,0.035931194563129765,exponential,5,sqrt,0.11949900756578223,4,8,0.18439349452300294,602,0.2528736445034647,0.012339557653875123,COMPLETE
997,997,0.632714103018278,2023-04-05 06:45:54.173774,2023-04-05 06:45:57.634726,0 days 00:00:03.460952,0.039037257336954866,friedman_mse,0.04636206713135271,exponential,5,log2,0.41782065042937916,4,8,0.40602673713973747,645,0.9426560380908605,0.022668772163767222,COMPLETE
998,998,0.5,2023-04-05 06:45:57.635859,2023-04-05 06:46:00.270461,0 days 00:00:02.634602,0.3976446420069332,friedman_mse,0.08750016539319423,exponential,6,sqrt,0.21753667761494563,4,8,0.0448358151140623,620,0.2886997757484007,0.00015476555904718519,COMPLETE
999,999,0.5,2023-04-05 06:46:00.271551,2023-04-05 06:46:06.015301,0 days 00:00:05.743750,0.36369555660563646,friedman_mse,0.001157350597372119,exponential,5,sqrt,0.23861129783199161,4,5,0.03281348328862875,682,0.8938774934218779,0.004983966334169536,COMPLETE
