,number,value,datetime_start,datetime_complete,duration,params_ccp_alpha,params_criterion,params_learning_rate,params_loss,params_max_depth,params_max_features,params_min_impurity_decrease,params_min_samples_leaf,params_min_samples_split,params_min_weight_fraction_leaf,params_n_estimators,params_subsample,params_tol,state
238,238,0.5,2023-04-05 06:11:29.090226,2023-04-05 06:11:32.457996,0 days 00:00:03.367770,0.23486935680589804,friedman_mse,0.0031911606925170066,log_loss,4,sqrt,0.24162140103373808,9,9,0.0009066609887844086,365,0.5616352497411455,0.0008357038923010359,COMPLETE
239,239,0.5,2023-04-05 06:11:32.458719,2023-04-05 06:11:33.773198,0 days 00:00:01.314479,0.01567211492244589,squared_error,0.0011757146595313085,log_loss,4,sqrt,0.24822729496178894,9,9,0.00023964950408951642,341,0.5746797848540897,0.001133643342689498,COMPLETE
240,240,0.7186451220959176,2023-04-05 06:11:33.773999,2023-04-05 06:11:35.914517,0 days 00:00:02.140518,0.011215464628505069,friedman_mse,0.002475788997633045,log_loss,4,sqrt,0.24059585124420932,9,9,0.013386180381534303,346,0.5432830797620077,0.0009356067004888728,COMPLETE
241,241,0.7506916479585894,2023-04-05 06:11:35.915191,2023-04-05 06:11:38.028028,0 days 00:00:02.112837,0.007457490649219614,friedman_mse,0.0014245917526185155,log_loss,4,sqrt,0.21976706138131638,9,9,0.022282539910920236,323,0.6056372278976184,0.0011195587546157374,COMPLETE
242,242,0.7587534006662805,2023-04-05 06:11:38.028653,2023-04-05 06:11:40.941154,0 days 00:00:02.912501,0.0003048365181360738,friedman_mse,0.0016426730765719347,log_loss,4,sqrt,0.22835260538893748,9,9,0.019396838331966718,383,0.5828412310911044,0.0012905805925009753,COMPLETE
243,243,0.7598037885061959,2023-04-05 06:11:40.941851,2023-04-05 06:11:43.544824,0 days 00:00:02.602973,0.0003884950377061027,friedman_mse,0.00221577251984092,log_loss,4,sqrt,0.23501490651929263,9,9,0.010631426559615024,365,0.5588443319916354,0.0012854921096455388,COMPLETE
244,244,0.7475977305570995,2023-04-05 06:11:43.545464,2023-04-05 06:11:45.890663,0 days 00:00:02.345199,0.009265831093239814,friedman_mse,0.002351880234589369,log_loss,4,sqrt,0.23471557668347423,9,9,0.010120079648233837,371,0.5644662656681289,0.0010420408832182123,COMPLETE
245,245,0.6777856367550092,2023-04-05 06:11:45.891334,2023-04-05 06:11:48.220484,0 days 00:00:02.329150,0.01694717902484907,friedman_mse,0.002868727632043177,log_loss,4,sqrt,0.23411163376324415,9,9,0.015234455755209722,368,0.5877847277163597,0.001250446505397564,COMPLETE
246,246,0.7584997915138859,2023-04-05 06:11:48.221129,2023-04-05 06:11:50.593769,0 days 00:00:02.372640,0.000388268185220005,friedman_mse,0.0020637755067347153,log_loss,4,sqrt,0.3394790321313559,9,9,0.026525957431116753,343,0.5404160149176322,0.0012836446887974765,COMPLETE
247,247,0.7338334252492731,2023-04-05 06:11:50.594415,2023-04-05 06:11:52.732785,0 days 00:00:02.138370,0.0004224867306784367,friedman_mse,0.002177412684902714,log_loss,4,sqrt,0.3166251716377725,9,9,0.09321467016180862,328,0.5464913259750228,0.0012549457812084436,COMPLETE
248,248,0.5,2023-04-05 06:11:52.733400,2023-04-05 06:11:54.836499,0 days 00:00:02.103099,0.02816939687196422,friedman_mse,0.002668877054934141,log_loss,4,sqrt,0.2531930668500907,9,9,0.0264389801008838,348,0.5383312945940902,0.0009020341735602252,COMPLETE
249,249,0.5,2023-04-05 06:11:54.837151,2023-04-05 06:11:56.398572,0 days 00:00:01.561421,0.1686444304214692,friedman_mse,0.002063129746889363,log_loss,4,sqrt,0.22445517852121039,9,9,0.2773044445276198,382,0.5560603660267694,0.001154819837258225,COMPLETE
250,250,0.6777856367550092,2023-04-05 06:11:56.399190,2023-04-05 06:11:58.494699,0 days 00:00:02.095509,0.016914630545947256,friedman_mse,0.0023598835175199506,log_loss,4,sqrt,0.27496072631118884,9,9,0.00023516458074651983,326,0.5756984066679219,0.0014291436921136087,COMPLETE
251,251,0.7588009592445153,2023-04-05 06:11:58.495357,2023-04-05 06:12:01.031597,0 days 00:00:02.536240,0.00024025084597550022,friedman_mse,0.0019054598100246927,log_loss,4,sqrt,0.2142331483709212,9,9,0.0280656486920713,349,0.562055929888575,0.0010388765313111088,COMPLETE
252,252,0.7334194674314325,2023-04-05 06:12:01.032287,2023-04-05 06:12:03.273654,0 days 00:00:02.241367,0.01065230323566282,friedman_mse,0.002037037796785102,log_loss,4,sqrt,0.20744487223694813,9,9,0.020243400165717435,348,0.5573127878444564,0.0009818769986341582,COMPLETE
253,253,0.6229400462211727,2023-04-05 06:12:03.274288,2023-04-05 06:12:05.436887,0 days 00:00:02.162599,0.02320271297543893,friedman_mse,0.0032907257593998594,log_loss,4,sqrt,0.3417119019930619,9,9,0.010428373004501213,356,0.5385249586680436,0.001066672382205812,COMPLETE
254,254,0.6490955405472747,2023-04-05 06:12:05.437529,2023-04-05 06:12:07.160813,0 days 00:00:01.723284,0.010063955200713882,friedman_mse,0.0027575312633217057,log_loss,4,sqrt,0.21300932355605617,9,9,0.12291998995432958,307,0.5723147360886957,0.0008669054299761879,COMPLETE
255,255,0.5,2023-04-05 06:12:07.161478,2023-04-05 06:12:09.266889,0 days 00:00:02.105411,0.49312608940618213,friedman_mse,0.0018459734514274047,log_loss,5,sqrt,0.23218882659466492,9,9,0.0287438739849298,317,0.5832467143550866,0.0007089088322164,COMPLETE
256,256,0.7628104927263228,2023-04-05 06:12:09.267576,2023-04-05 06:12:12.415644,0 days 00:00:03.148068,1.6309928227912877e-05,friedman_mse,0.0023466026041528286,log_loss,4,sqrt,0.24640094105405985,9,9,0.02008748836897329,387,0.7186987367096995,0.0012914294974614203,COMPLETE
257,257,0.7607833374205332,2023-04-05 06:12:12.416292,2023-04-05 06:12:15.403540,0 days 00:00:02.987248,0.0003849539713194306,friedman_mse,0.002444528186002163,log_loss,5,sqrt,0.24510657786244236,9,9,0.0325374573745347,368,0.709404662562013,0.00128889322882314,COMPLETE
258,258,0.6229400462211727,2023-04-05 06:12:15.404162,2023-04-05 06:12:18.180421,0 days 00:00:02.776259,0.017863554564976535,friedman_mse,0.00244918991726451,log_loss,5,sqrt,0.2511107434356971,9,9,0.03263117678569116,370,0.7437673174463816,0.0012971014862036066,COMPLETE
259,259,0.5,2023-04-05 06:12:18.181096,2023-04-05 06:12:19.846502,0 days 00:00:01.665406,0.035006786516694505,friedman_mse,0.0030482419097330135,log_loss,5,sqrt,0.3067158647174998,9,9,0.3856148396831373,396,0.7149817976465795,0.0013396931380151367,COMPLETE
260,260,0.632714103018278,2023-04-05 06:12:19.847198,2023-04-05 06:12:21.548064,0 days 00:00:01.700866,0.008512508507955718,friedman_mse,0.0022761836063109452,log_loss,4,sqrt,0.2860136831254954,9,9,0.25943767281227076,373,0.711202145353263,0.0012135883380277703,COMPLETE
261,261,0.6229400462211727,2023-04-05 06:12:21.548699,2023-04-05 06:12:24.365602,0 days 00:00:02.816903,0.0184173769119669,friedman_mse,0.002548805602469083,log_loss,4,sqrt,0.2427276550941165,9,9,0.030755179790604076,357,0.755315963401216,0.0014626864842781622,COMPLETE
262,262,0.7396105513444916,2023-04-05 06:12:24.366312,2023-04-05 06:12:26.985149,0 days 00:00:02.618837,0.010184945111508907,friedman_mse,0.0021975378960719704,log_loss,4,sqrt,0.26695413655227546,9,9,0.021093403395951102,383,0.7057164975903522,0.001656124554347045,COMPLETE
263,263,0.5,2023-04-05 06:12:26.985818,2023-04-05 06:12:28.444378,0 days 00:00:01.458560,0.24524865204213933,squared_error,0.002839153111424131,log_loss,4,sqrt,0.29857941843233793,5,9,0.02168481712160306,348,0.7122275399393017,0.030083608631499018,COMPLETE
264,264,0.7636760416652082,2023-04-05 06:12:28.445014,2023-04-05 06:12:31.490176,0 days 00:00:03.045162,3.9795791659016615e-05,friedman_mse,0.0035878251160261537,log_loss,4,sqrt,0.24605440899069358,10,9,0.03030651257469914,388,0.685164660338405,0.0011533964286165191,COMPLETE
265,265,0.5,2023-04-05 06:12:31.490849,2023-04-05 06:12:33.692628,0 days 00:00:02.201779,0.02686032409436813,friedman_mse,0.003535117843472684,log_loss,6,sqrt,0.25664870720130134,10,9,0.16632588034042306,393,0.6910454457222301,0.0010674932450017455,COMPLETE
266,266,0.5,2023-04-05 06:12:33.693396,2023-04-05 06:12:35.445328,0 days 00:00:01.751932,0.2066677361526622,friedman_mse,0.003331113212558955,log_loss,4,sqrt,0.24687524679073727,8,9,0.46392895250816263,416,0.6863256831865894,0.0007586247678480443,COMPLETE
267,267,0.7577004033517802,2023-04-05 06:12:35.446087,2023-04-05 06:12:38.263953,0 days 00:00:02.817866,0.0006738086498532796,friedman_mse,0.0028170607325644125,log_loss,4,sqrt,0.2713572722761681,10,9,0.03538978098007317,375,0.7199649478803886,0.0014077947010688327,COMPLETE
268,268,0.6808637270022746,2023-04-05 06:12:38.264816,2023-04-05 06:12:41.022412,0 days 00:00:02.757596,0.012989715765862732,friedman_mse,0.0024481203595369027,log_loss,4,sqrt,0.26044695464513296,10,9,0.012183823155631688,400,0.6861433306927461,0.0016705083962211629,COMPLETE
269,269,0.761587736363737,2023-04-05 06:12:41.023111,2023-04-05 06:12:43.803941,0 days 00:00:02.780830,0.0002264245562406944,friedman_mse,0.0032148431088279226,log_loss,4,sqrt,0.2247451789628066,9,9,0.016417402767739328,361,0.6903585529006804,0.0011163560541701258,COMPLETE
270,270,0.5,2023-04-05 06:12:43.804693,2023-04-05 06:12:45.310622,0 days 00:00:01.505929,0.03934696009856881,friedman_mse,0.003143354198583677,log_loss,4,sqrt,0.2231179397219783,10,9,0.3646667568909244,361,0.7401824875218161,0.0009278441787139341,COMPLETE
271,271,0.5,2023-04-05 06:12:45.311296,2023-04-05 06:12:47.812058,0 days 00:00:02.500762,0.02239402982948302,friedman_mse,0.003712398758413203,log_loss,4,sqrt,0.23322849833353804,10,8,0.12264449128344436,385,0.6706873667847231,0.0011416193316640673,COMPLETE
272,272,0.5,2023-04-05 06:12:47.812715,2023-04-05 06:12:50.607133,0 days 00:00:02.794418,0.08981085774130532,friedman_mse,0.002778692078345857,log_loss,4,sqrt,0.2076403571072663,8,9,0.036559015903176686,366,0.7709498216081467,0.0011736278980814022,COMPLETE
273,273,0.6617498062600703,2023-04-05 06:12:50.607777,2023-04-05 06:12:52.767228,0 days 00:00:02.159451,0.010044134342411986,friedman_mse,0.003089078418438086,log_loss,4,sqrt,0.2189874348487837,9,9,0.0997786359459281,333,0.7360540378715547,0.00105193116187398,COMPLETE
274,274,0.5,2023-04-05 06:12:52.767905,2023-04-05 06:12:54.446567,0 days 00:00:01.678662,0.46042868545465787,friedman_mse,0.0036856008159237485,log_loss,4,sqrt,0.3851742088772838,9,9,0.3399622497692627,401,0.7268300012558543,0.001364148709370789,COMPLETE
275,275,0.5,2023-04-05 06:12:54.447218,2023-04-05 06:12:56.959586,0 days 00:00:02.512368,0.13046047013175313,friedman_mse,0.0025142781644358035,log_loss,4,sqrt,0.24657532576722488,9,9,0.00844041897676754,383,0.62675956539845,0.0008305863055200243,COMPLETE
276,276,0.6665083556338136,2023-04-05 06:12:56.960266,2023-04-05 06:12:58.870166,0 days 00:00:01.909900,0.0004685554550584449,friedman_mse,0.00185626522420702,log_loss,4,sqrt,0.35907460812965986,9,9,0.22983734951201978,361,0.7010238386927292,0.0014966668684870243,COMPLETE
277,277,0.5,2023-04-05 06:12:58.870866,2023-04-05 06:13:01.000109,0 days 00:00:02.129243,0.017857200117327273,friedman_mse,0.000174797432620483,log_loss,4,sqrt,0.1976764738710503,4,9,0.17805359824562,412,0.619944284015513,0.0012122742061807304,COMPLETE
278,278,0.5,2023-04-05 06:13:01.000815,2023-04-05 06:13:04.666732,0 days 00:00:03.665917,0.03015063956167876,friedman_mse,0.0005292665584863095,log_loss,5,sqrt,0.2274596497955082,9,9,0.020565324780065,559,0.594355846492451,0.0009391800571107294,COMPLETE
279,279,0.7355751041918344,2023-04-05 06:13:04.667409,2023-04-05 06:13:06.814694,0 days 00:00:02.147285,0.010573921459333672,friedman_mse,0.002339619169087825,log_loss,4,sqrt,0.2275226261133348,8,9,0.03072493300078574,317,0.6482518571834023,0.07634045787707479,COMPLETE
280,280,0.746145723678373,2023-04-05 06:13:06.815363,2023-04-05 06:13:08.995854,0 days 00:00:02.180491,0.01004299773896027,friedman_mse,0.00010352235892349355,log_loss,4,sqrt,0.37502875059036606,10,10,0.010028961670280712,342,0.5570511044339266,0.0016028006753743122,COMPLETE
281,281,0.5,2023-04-05 06:13:08.996542,2023-04-05 06:13:11.945554,0 days 00:00:02.949012,0.3541182694851643,friedman_mse,0.00024279833764178147,log_loss,4,sqrt,0.4199413724026196,9,9,0.020574633615705377,370,0.8453847518557802,0.0013303324943072673,COMPLETE
282,282,0.6343741975710433,2023-04-05 06:13:11.946216,2023-04-05 06:13:14.386445,0 days 00:00:02.440229,0.0193884562412693,friedman_mse,0.0018178732794512415,log_loss,7,sqrt,0.24143133202688877,9,8,0.04339080358070778,390,0.5039816484861798,0.0018140955964734526,COMPLETE
283,283,0.5,2023-04-05 06:13:14.387118,2023-04-05 06:13:15.864348,0 days 00:00:01.477230,0.21666805943556688,squared_error,0.0015265179166588367,log_loss,4,sqrt,0.21527209670962408,9,9,0.03021235698278922,353,0.599312653387295,0.0001813836106566524,COMPLETE
284,284,0.6447041407966149,2023-04-05 06:13:15.865009,2023-04-05 06:13:17.384001,0 days 00:00:01.518992,0.0006337563010638662,friedman_mse,0.0027312066843245796,log_loss,4,sqrt,0.2497080029466341,9,9,0.2917446570926109,329,0.6745623089873584,0.0006037025715239672,COMPLETE
285,285,0.5,2023-04-05 06:13:17.384659,2023-04-05 06:13:19.087393,0 days 00:00:01.702734,0.310725427401432,friedman_mse,0.0035303760439318755,log_loss,4,sqrt,0.28354801920764255,9,9,0.3233930813613578,427,0.5634722147089436,0.0010782858479061938,COMPLETE
286,286,0.5,2023-04-05 06:13:19.088074,2023-04-05 06:13:21.047573,0 days 00:00:01.959499,0.01009234018596841,friedman_mse,0.093904108861019,log_loss,4,sqrt,0.22848534459730618,9,9,0.30559638502903963,407,0.6135290322932447,0.00146560792354058,COMPLETE
287,287,0.5,2023-04-05 06:13:21.048531,2023-04-05 06:13:23.104475,0 days 00:00:02.055944,0.026992449248372248,friedman_mse,0.002029007407006366,log_loss,4,sqrt,0.33439545003651105,9,9,0.00908160302705162,312,0.5825659352125531,0.001228826426902677,COMPLETE
288,288,0.6970412304432685,2023-04-05 06:13:23.105198,2023-04-05 06:13:26.959532,0 days 00:00:03.854334,0.01070022012907593,friedman_mse,0.03983024387538872,log_loss,4,sqrt,0.13921467301802382,10,9,0.056087760498122405,514,0.6360794286824307,0.0017488107956599582,COMPLETE
289,289,0.5,2023-04-05 06:13:26.960280,2023-04-05 06:13:28.874760,0 days 00:00:01.914480,0.10995326414111223,friedman_mse,0.002299063549588854,log_loss,6,sqrt,0.27793412517509464,9,9,0.2077452104978449,372,0.701245569258423,0.0009755296336693297,COMPLETE
290,290,0.765887340983957,2023-04-05 06:13:28.875499,2023-04-05 06:13:33.136160,0 days 00:00:04.260661,0.00012472687049121435,friedman_mse,0.0030664306885117443,log_loss,4,sqrt,0.3241789939404106,9,8,0.00011914498601767187,583,0.5932445995781115,0.0007997956069754686,COMPLETE
291,291,0.5,2023-04-05 06:13:33.136908,2023-04-05 06:13:36.774732,0 days 00:00:03.637824,0.28252534585715766,friedman_mse,0.0032266526871953826,log_loss,4,sqrt,0.253940738312508,8,7,0.008354033308213164,614,0.5366876993411492,0.0007951544215195957,COMPLETE
292,292,0.7651134839819529,2023-04-05 06:13:36.775480,2023-04-05 06:13:40.144093,0 days 00:00:03.368613,9.514501340419229e-06,friedman_mse,0.002727013853857768,log_loss,4,sqrt,0.29775344239906315,9,8,0.0013197602564718038,461,0.5696884942321578,0.0008735784764680806,COMPLETE
293,293,0.6229400462211727,2023-04-05 06:13:40.144862,2023-04-05 06:13:43.743582,0 days 00:00:03.598720,0.020657963008121664,friedman_mse,0.0029581815395041287,log_loss,4,sqrt,0.3170296165370523,9,8,0.006480045504749156,596,0.555334199406204,0.000694036645727218,COMPLETE
294,294,0.7511821663079262,2023-04-05 06:13:43.744440,2023-04-05 06:13:50.474031,0 days 00:00:06.729591,0.038497039263780564,friedman_mse,0.002646201764549777,exponential,4,sqrt,0.41010289689921814,9,8,0.01741401941088625,950,0.7239182477323103,0.0007663772998149361,COMPLETE
295,295,0.7379845108262615,2023-04-05 06:13:50.474873,2023-04-05 06:13:53.429151,0 days 00:00:02.954278,0.009427866982105314,friedman_mse,0.0035621453684023794,log_loss,4,sqrt,0.27720335304292937,9,8,0.0011319620833170627,464,0.5677580138107499,0.0006243194839072848,COMPLETE
296,296,0.5,2023-04-05 06:13:53.429931,2023-04-05 06:13:56.924132,0 days 00:00:03.494201,0.12114358013124067,friedman_mse,0.0031354616764261586,log_loss,4,sqrt,0.3079156320454173,9,8,0.13789624846534887,644,0.6659548015346242,0.000932497595626597,COMPLETE
297,297,0.6905525887570707,2023-04-05 06:13:56.924816,2023-04-05 06:14:02.097592,0 days 00:00:05.172776,0.07651288744106088,friedman_mse,0.002489249440398604,exponential,4,sqrt,0.29077738063044434,9,7,0.07349388481416855,586,0.5926099883334189,0.0008424940157082371,COMPLETE
298,298,0.6601757432771594,2023-04-05 06:14:02.098284,2023-04-05 06:14:04.180712,0 days 00:00:02.082428,7.264831312499677e-05,friedman_mse,0.000285704968704262,log_loss,5,sqrt,0.3294815052340067,10,8,0.25155236090428085,455,0.5352330724574671,0.0021140507348912986,COMPLETE
299,299,0.5,2023-04-05 06:14:04.181375,2023-04-05 06:14:06.668303,0 days 00:00:02.486928,0.101642892598933,friedman_mse,0.0028061975689610626,log_loss,4,sqrt,0.30601104380745703,9,8,0.0001180469081537329,433,0.4993310454808514,0.0010098060881868836,COMPLETE
300,300,0.7053423507767775,2023-04-05 06:14:06.668965,2023-04-05 06:14:09.348542,0 days 00:00:02.679577,0.017821424553481804,friedman_mse,0.0022098643210813726,exponential,4,sqrt,0.29885357745592245,9,8,0.1431860410987894,468,0.6881888054748837,0.0005496067142411372,COMPLETE
301,301,0.5,2023-04-05 06:14:09.349214,2023-04-05 06:14:12.836687,0 days 00:00:03.487473,0.030656528819691057,friedman_mse,0.0025418889960470057,log_loss,4,sqrt,0.25996348429436045,8,10,0.1598859966898349,491,0.5738703266322586,0.0016051819343597502,COMPLETE
302,302,0.739168282795473,2023-04-05 06:14:12.837374,2023-04-05 06:14:15.153506,0 days 00:00:02.316132,0.010605184712487135,friedman_mse,0.0020215572836325526,log_loss,4,sqrt,0.3689578314402331,9,8,0.02714398248654322,339,0.6195932656601459,0.0019196240575837696,COMPLETE
303,303,0.7580202462798323,2023-04-05 06:14:15.154174,2023-04-05 06:14:16.717191,0 days 00:00:01.563017,0.0004389564860396559,friedman_mse,0.0030559135097699597,exponential,4,sqrt,0.26788456644739356,9,9,0.04582606221884035,300,0.10394635935983898,0.0022747970915540532,COMPLETE
304,304,0.5,2023-04-05 06:14:16.717885,2023-04-05 06:14:18.104368,0 days 00:00:01.386483,0.01891978610082827,squared_error,0.0036704625813894698,log_loss,4,sqrt,0.3554693846069722,9,7,0.3328322811661177,354,0.5534880882424746,0.0008561524674694868,COMPLETE
305,305,0.5,2023-04-05 06:14:18.105008,2023-04-05 06:14:21.238206,0 days 00:00:03.133198,0.09307214107959405,friedman_mse,0.0023657167054187914,log_loss,5,sqrt,0.2900692392523996,9,9,0.015568011710511899,437,0.6513452980155215,0.0010879470508709556,COMPLETE
306,306,0.7307120459534235,2023-04-05 06:14:21.238917,2023-04-05 06:14:22.603248,0 days 00:00:01.364331,0.011853788118182584,friedman_mse,0.001997852163613322,log_loss,4,sqrt,0.24172605569431155,10,9,0.035761040647147184,407,0.17722467535408792,0.0003102672777608494,COMPLETE
307,307,0.6927132789985807,2023-04-05 06:14:22.603929,2023-04-05 06:14:24.535797,0 days 00:00:01.931868,9.265331849913272e-06,friedman_mse,0.002803013853881018,exponential,4,sqrt,0.27171576912503764,9,10,0.18494599962108021,331,0.5950448497545558,0.0006697103446163842,COMPLETE
308,308,0.5,2023-04-05 06:14:24.536507,2023-04-05 06:14:26.819339,0 days 00:00:02.282832,0.14904068541622104,friedman_mse,0.0022513410678835534,log_loss,4,sqrt,0.3205327979711726,9,9,0.02259772648936771,361,0.5752828752750895,0.001443376020392204,COMPLETE
309,309,0.5,2023-04-05 06:14:26.820109,2023-04-05 06:14:29.613713,0 days 00:00:02.793604,0.30118158053351846,friedman_mse,0.002580460074858638,log_loss,4,sqrt,0.2632957174026915,8,9,0.009126370736035486,389,0.7148444192137448,0.0017428231411791004,COMPLETE
310,310,0.6737914863650711,2023-04-05 06:14:29.614439,2023-04-05 06:14:32.315905,0 days 00:00:02.701466,0.025725847071909034,friedman_mse,0.0032212374718741713,exponential,4,sqrt,0.283570672997312,9,9,0.24025015249071996,620,0.5296783618638817,0.0028110888979952934,COMPLETE
311,311,0.7357746067821498,2023-04-05 06:14:32.316663,2023-04-05 06:14:35.530840,0 days 00:00:03.214177,0.010503725378009886,friedman_mse,0.0018361362691484556,log_loss,4,sqrt,0.1981044341292929,9,9,0.00014348428576704863,478,0.6345531179079619,0.0011329878376279243,COMPLETE
312,312,0.6437822523252714,2023-04-05 06:14:35.531629,2023-04-05 06:14:37.712822,0 days 00:00:02.181193,0.01874812130131853,friedman_mse,0.0021507029197714756,log_loss,4,sqrt,0.23625103283445692,9,8,0.03492918871465396,351,0.5572397718097629,0.0019427033952510219,COMPLETE
313,313,0.5,2023-04-05 06:14:37.713552,2023-04-05 06:14:40.768077,0 days 00:00:03.054525,0.20066147258664913,friedman_mse,0.002882318513664926,exponential,4,sqrt,0.4034493746299467,9,9,0.025011985993912036,419,0.7467456890472546,0.001549615068408512,COMPLETE
314,314,0.5512034051699757,2023-04-05 06:14:40.768837,2023-04-05 06:14:43.055393,0 days 00:00:02.286556,0.00931504282143954,friedman_mse,0.0018442875194680571,log_loss,4,sqrt,0.2519639724371154,9,9,0.19870436156988652,444,0.6790532098685576,0.011336456950624199,COMPLETE
315,315,0.6755400376246874,2023-04-05 06:14:43.056103,2023-04-05 06:14:45.098114,0 days 00:00:02.042011,4.564961280443516e-06,friedman_mse,0.003681236859327093,log_loss,4,sqrt,0.4579884977725254,9,9,0.21795133351121226,381,0.612926202274006,0.001347306394392555,COMPLETE
316,316,0.632714103018278,2023-04-05 06:14:45.098988,2023-04-05 06:14:46.379267,0 days 00:00:01.280279,0.03152634406512041,friedman_mse,0.0024562782288818745,exponential,4,log2,0.3884100399640814,10,9,0.31507234366362524,337,0.7024286301257937,0.00010587192573867481,COMPLETE
317,317,0.5,2023-04-05 06:14:46.380059,2023-04-05 06:14:49.886994,0 days 00:00:03.506935,0.2387779432344719,friedman_mse,0.0021699306731531123,log_loss,4,sqrt,0.4885928318171123,9,10,0.05297754229317565,578,0.5891492339656468,0.0009142990862740809,COMPLETE
318,318,0.5,2023-04-05 06:14:49.887811,2023-04-05 06:14:51.685315,0 days 00:00:01.797504,0.017213407109568025,friedman_mse,0.001402398511792411,log_loss,4,sqrt,0.4210854503842326,9,9,0.14778916716820037,318,0.659387142743177,0.0023138321766042027,COMPLETE
