,number,value,datetime_start,datetime_complete,duration,params_ccp_alpha,params_criterion,params_learning_rate,params_loss,params_max_depth,params_max_features,params_min_impurity_decrease,params_min_samples_leaf,params_min_samples_split,params_min_weight_fraction_leaf,params_n_estimators,params_subsample,params_tol,state
880,880,0.7757053587090754,2023-04-05 06:38:44.201895,2023-04-05 06:38:49.428408,0 days 00:00:05.226513,0.00013773107888451832,friedman_mse,0.08583157702294214,exponential,5,sqrt,0.15547148278714126,4,8,0.05094967467615347,639,0.9165136912914367,0.000166467603348386,COMPLETE
881,881,0.5,2023-04-05 06:38:49.429298,2023-04-05 06:38:55.039712,0 days 00:00:05.610414,0.18620538167383183,friedman_mse,0.08067544957488365,exponential,5,sqrt,0.14906152088529398,4,8,0.05424126844758492,645,0.9182627014986563,0.00016745737710198837,COMPLETE
882,882,0.703755949612903,2023-04-05 06:38:55.040597,2023-04-05 06:38:59.464023,0 days 00:00:04.423426,0.027385567287578152,friedman_mse,0.0884329721591023,exponential,5,sqrt,0.16023482514098333,4,8,0.11194307090248783,630,0.9327297580938775,0.00017534667799732552,COMPLETE
883,883,0.5,2023-04-05 06:38:59.464941,2023-04-05 06:39:05.572459,0 days 00:00:06.107518,0.3012657268106575,friedman_mse,0.08308584837997955,exponential,5,sqrt,0.1376170690419927,4,8,0.054526626573513946,687,0.9070298250640902,0.00015329045717572929,COMPLETE
884,884,0.7536003051336447,2023-04-05 06:39:05.573523,2023-04-05 06:39:10.697561,0 days 00:00:05.124038,0.009324274546232985,friedman_mse,0.06851359989927783,exponential,5,sqrt,0.15909157394340545,4,8,0.06693417777757837,659,0.8965993223220261,0.00017656373754561757,COMPLETE
885,885,0.7716102474808834,2023-04-05 06:39:10.698634,2023-04-05 06:39:15.866781,0 days 00:00:05.168147,0.0005057715204898582,friedman_mse,0.058458834067751965,exponential,5,sqrt,0.14796710395244334,4,8,0.04861389680646569,640,0.8672769371849449,0.00023197201860062936,COMPLETE
886,886,0.5,2023-04-05 06:39:15.867868,2023-04-05 06:39:20.729502,0 days 00:00:04.861634,0.3690746090958968,friedman_mse,0.06139580043979558,exponential,5,sqrt,0.14980975984435968,4,8,0.07499708986181146,646,0.8586715448384615,0.00023145967518249397,COMPLETE
887,887,0.5,2023-04-05 06:39:20.730740,2023-04-05 06:39:24.769334,0 days 00:00:04.038594,0.40084121219514396,friedman_mse,0.053826197165085465,exponential,5,log2,0.13351072139673806,4,8,0.05047921010706609,633,0.8829693065864902,0.00020977793781001491,COMPLETE
888,888,0.7750273065304996,2023-04-05 06:39:24.770290,2023-04-05 06:39:30.380518,0 days 00:00:05.610228,3.102425053236015e-05,friedman_mse,0.05444895425499752,exponential,5,sqrt,0.1435180334193578,4,8,0.06888318071885983,671,0.8710856303670379,0.00020568819250995127,COMPLETE
889,889,0.5,2023-04-05 06:39:30.381416,2023-04-05 06:39:35.831714,0 days 00:00:05.450298,0.49806145545896763,friedman_mse,0.045710717260403336,exponential,5,sqrt,0.12282070604519865,4,8,0.08176636590057876,680,0.8955202941737811,0.00019082732152171045,COMPLETE
890,890,0.6229400462211727,2023-04-05 06:39:35.832589,2023-04-05 06:39:40.999059,0 days 00:00:05.166470,0.10543728572707912,friedman_mse,0.03983529362196374,exponential,5,sqrt,0.1674501827330958,4,8,0.06526779058942478,705,0.8561126577649483,0.00016606237716535247,COMPLETE
891,891,0.6229400462211727,2023-04-05 06:39:41.000098,2023-04-05 06:39:46.147391,0 days 00:00:05.147293,0.1263008332165161,friedman_mse,0.0721362257782309,exponential,5,sqrt,0.1341879443331973,4,8,0.08414080309832561,689,0.9049699728830427,0.00011188455399478236,COMPLETE
892,892,0.5,2023-04-05 06:39:46.148473,2023-04-05 06:39:51.123100,0 days 00:00:04.974627,0.16996477869003887,friedman_mse,0.049656221113205466,exponential,5,sqrt,0.15629044617323049,3,8,0.10153187620827273,671,0.966499367027052,0.00013833013606317176,COMPLETE
893,893,0.5,2023-04-05 06:39:51.124134,2023-04-05 06:39:56.416173,0 days 00:00:05.292039,0.4180512814516481,friedman_mse,0.09135298805809415,exponential,5,sqrt,0.14388913724899494,4,8,0.06156556998798164,660,0.9423877331700787,0.00018669703946347407,COMPLETE
894,894,0.7513834606985738,2023-04-05 06:39:56.417225,2023-04-05 06:40:01.383046,0 days 00:00:04.965821,0.014059959460822393,friedman_mse,0.053728142508167855,exponential,5,sqrt,0.19734243455052958,4,8,0.07449751124856972,660,0.8788430915398665,0.00015454530577058506,COMPLETE
895,895,0.5,2023-04-05 06:40:01.384108,2023-04-05 06:40:03.881578,0 days 00:00:02.497470,0.018097197254132568,squared_error,0.06423385410366962,exponential,5,log2,0.1811694089304275,4,8,0.05854490237635239,683,0.8376929747147548,0.00020666843111450696,COMPLETE
896,896,0.5,2023-04-05 06:40:03.882660,2023-04-05 06:40:08.116944,0 days 00:00:04.234284,0.3946194836862965,friedman_mse,0.07750571833268408,exponential,5,sqrt,0.10822415072886477,4,8,0.19116580551374687,708,0.9906138154546421,0.00023894106716797932,COMPLETE
897,897,0.6688293663041363,2023-04-05 06:40:08.118151,2023-04-05 06:40:12.407764,0 days 00:00:04.289613,0.04726240405660993,friedman_mse,0.09812070604263791,exponential,5,sqrt,0.128870453672612,4,8,0.12092441508399743,623,0.9200586070427443,0.009299276746961101,COMPLETE
898,898,0.7621642261499488,2023-04-05 06:40:12.408848,2023-04-05 06:40:17.222499,0 days 00:00:04.813651,0.000446009236048657,friedman_mse,0.05862895322700604,exponential,5,sqrt,0.1731331401185533,4,8,0.09669487140456257,640,0.9972584392767789,0.000129279210340522,COMPLETE
899,899,0.5,2023-04-05 06:40:17.223522,2023-04-05 06:40:20.062466,0 days 00:00:02.838944,0.2707796828751434,friedman_mse,0.06983308581628642,exponential,5,sqrt,0.16662420319078813,3,4,0.32978470151381234,668,0.9577734942740237,0.00015517498660323414,COMPLETE
900,900,0.5,2023-04-05 06:40:20.063374,2023-04-05 06:40:26.304671,0 days 00:00:06.241297,0.25911260089183913,friedman_mse,0.08444279272797939,exponential,5,sqrt,0.20704766484494289,4,8,0.07071160562837929,734,0.8639498621188872,0.0001150299223334479,COMPLETE
901,901,0.5,2023-04-05 06:40:26.305773,2023-04-05 06:40:30.295609,0 days 00:00:03.989836,0.3773976727449348,friedman_mse,0.05015322309706467,exponential,5,sqrt,0.15401415804804694,4,8,0.15525802669499428,649,0.9279207593413892,0.00018865930196752505,COMPLETE
902,902,0.6559100671840807,2023-04-05 06:40:30.296662,2023-04-05 06:40:35.517696,0 days 00:00:05.221034,0.09861258993120137,friedman_mse,0.03559902113239759,exponential,5,sqrt,0.14272349783301214,4,8,0.04286502473917219,615,0.8772111312910871,0.007412491324845251,COMPLETE
903,903,0.7732149344301733,2023-04-05 06:40:35.518771,2023-04-05 06:40:38.939646,0 days 00:00:03.420875,3.692430302742783e-05,friedman_mse,0.04126522152717602,exponential,5,log2,0.15970472891165402,4,8,0.057717684683266934,628,0.4315456715288345,0.0826772915968423,COMPLETE
904,904,0.7471297032274704,2023-04-05 06:40:38.940679,2023-04-05 06:40:41.385473,0 days 00:00:02.444794,0.027787293754976225,friedman_mse,0.038608244353247737,exponential,5,log2,0.16426185348644268,4,8,0.062013667670328496,623,0.3117576074029493,0.029001987241513403,COMPLETE
905,905,0.7521797878712974,2023-04-05 06:40:41.386591,2023-04-05 06:40:45.594839,0 days 00:00:04.208248,0.010966997153500958,friedman_mse,0.04370834372197136,exponential,5,log2,0.18430099598746139,4,8,0.07155826716187631,642,0.8901738655285107,0.05629870990078891,COMPLETE
906,906,0.7515107375159849,2023-04-05 06:40:45.595938,2023-04-05 06:40:48.595808,0 days 00:00:02.999870,0.009242732648520028,friedman_mse,0.03079225181182303,exponential,5,log2,0.1558752881005052,4,8,0.08906719703383473,613,0.4425662409327233,0.05921268572891196,COMPLETE
907,907,0.6232707741472382,2023-04-05 06:40:48.596875,2023-04-05 06:40:50.875491,0 days 00:00:02.278616,0.02114439901258595,friedman_mse,0.025131860644610857,exponential,5,log2,0.13567471346802856,4,8,0.4513804817358249,656,0.9678564346271142,0.08083628272278708,COMPLETE
908,908,0.7400373269833397,2023-04-05 06:40:50.876540,2023-04-05 06:40:53.707060,0 days 00:00:02.830520,0.03683825777987096,friedman_mse,0.043462430205166096,exponential,5,log2,0.17327248549208155,4,8,0.051955059748949164,629,0.43295298346878386,0.011107071866950601,COMPLETE
909,909,0.7556669237198166,2023-04-05 06:40:53.708105,2023-04-05 06:40:56.343752,0 days 00:00:02.635647,0.008683216259755709,friedman_mse,0.052630785056698846,exponential,5,log2,0.12074835488616338,4,8,0.0796168157843601,668,0.35509255431641285,0.08813259786487002,COMPLETE
910,910,0.5,2023-04-05 06:40:56.344701,2023-04-05 06:40:59.538098,0 days 00:00:03.193397,0.2672426574772854,friedman_mse,0.04717047957505843,exponential,5,log2,0.1465100096179815,4,8,0.054611241815242274,696,0.4591154867633655,0.013226440600461806,COMPLETE
911,911,0.5,2023-04-05 06:40:59.539013,2023-04-05 06:41:02.937118,0 days 00:00:03.398105,0.38392640510442305,friedman_mse,0.0003439651186363444,exponential,6,sqrt,0.15524657702445513,3,8,0.06417282282845736,611,0.29499807057024663,0.05266350835987582,COMPLETE
912,912,0.5,2023-04-05 06:41:02.938058,2023-04-05 06:41:04.818502,0 days 00:00:01.880444,0.01670084291496199,squared_error,0.06071306431490258,exponential,5,log2,0.16508915682357442,4,8,0.49824355851622,635,0.3273069543266985,0.011976154039964002,COMPLETE
913,913,0.7758979232397978,2023-04-05 06:41:04.819407,2023-04-05 06:41:09.299805,0 days 00:00:04.480398,6.412550165768488e-05,friedman_mse,0.03983493593853563,exponential,5,log2,0.18010774652495418,4,8,0.04669622506562126,652,0.9116353107002801,0.059357021770061184,COMPLETE
914,914,0.5,2023-04-05 06:41:09.300709,2023-04-05 06:41:12.274439,0 days 00:00:02.973730,0.4660348225026287,friedman_mse,0.03856406055923124,exponential,5,log2,0.18661692669689817,4,8,0.049347742752397325,675,0.38653049632280323,0.045278994822400866,COMPLETE
915,915,0.7540787901160358,2023-04-05 06:41:12.275330,2023-04-05 06:41:17.424900,0 days 00:00:05.149570,0.009549968099163891,friedman_mse,0.03570261943129186,exponential,5,log2,0.1358668129378909,4,8,0.060462580511634834,690,0.9033031275604323,0.09288086737596303,COMPLETE
916,916,0.5,2023-04-05 06:41:17.425816,2023-04-05 06:41:20.960961,0 days 00:00:03.535145,0.15195159201877406,friedman_mse,0.036569128501205445,exponential,5,log2,0.10568839015063075,4,8,0.39110015836063805,656,0.9212268576339019,0.0572968152632652,COMPLETE
917,917,0.6229400462211727,2023-04-05 06:41:20.962185,2023-04-05 06:41:24.092266,0 days 00:00:03.130081,0.13995270911069319,friedman_mse,0.0430528788168569,exponential,5,log2,0.19291521290992364,4,8,0.0421492972858491,675,0.4241281821973248,0.0933526448326297,COMPLETE
918,918,0.5,2023-04-05 06:41:24.093202,2023-04-05 06:41:28.083128,0 days 00:00:03.989926,0.2235757174824655,friedman_mse,0.02904785721697419,exponential,5,log2,0.14382047672545006,4,8,0.0727804553025597,651,0.9110541786864194,0.00017751669494624938,COMPLETE
919,919,0.7452730333841636,2023-04-05 06:41:28.084066,2023-04-05 06:41:32.751352,0 days 00:00:04.667286,0.025148569078005292,friedman_mse,0.026835380332628368,exponential,5,log2,0.12584850702185488,3,8,0.052869367514863326,719,0.9467849065893074,0.00015204664795868584,COMPLETE
920,920,0.5,2023-04-05 06:41:32.752271,2023-04-05 06:41:35.269154,0 days 00:00:02.516883,0.3708272306518797,friedman_mse,0.04702116989510013,exponential,5,log2,0.23873601580540765,4,8,0.26398326636683533,642,0.941210040773852,0.06963891903199398,COMPLETE
921,921,0.5,2023-04-05 06:41:35.270101,2023-04-05 06:41:39.565784,0 days 00:00:04.295683,0.4855134421551593,friedman_mse,0.02051002217795652,exponential,5,log2,0.08679957221604453,4,8,0.04007424604216138,664,0.8486513210462107,0.01029474445699636,COMPLETE
922,922,0.7014920933628656,2023-04-05 06:41:39.566680,2023-04-05 06:41:42.555237,0 days 00:00:02.988557,0.057134216518750225,friedman_mse,0.0341289784180735,exponential,5,log2,0.06471378379505369,4,8,0.06337619987032327,635,0.40157063446110697,0.08282693312634552,COMPLETE
923,923,0.5,2023-04-05 06:41:42.556122,2023-04-05 06:41:47.525090,0 days 00:00:04.968968,0.42362299913764334,friedman_mse,0.05311439432077769,exponential,5,log2,0.1609347605673182,4,8,0.04838287364107738,702,0.8907375823445624,0.0758536606830259,COMPLETE
924,924,0.6621296245999727,2023-04-05 06:41:47.526030,2023-04-05 06:41:49.831292,0 days 00:00:02.305262,0.009066531745902145,friedman_mse,0.03107706120596942,exponential,5,log2,0.15176462058230472,4,8,0.4093951240471206,676,0.49177144249453214,0.09862721024331082,COMPLETE
925,925,0.5,2023-04-05 06:41:49.832190,2023-04-05 06:41:52.016074,0 days 00:00:02.183884,0.320100694437905,friedman_mse,0.0784865190641902,exponential,5,log2,0.11870192359325349,4,8,0.3736341629831692,652,0.4547640935052026,0.013705626974834939,COMPLETE
926,926,0.6390460997150392,2023-04-05 06:41:52.017002,2023-04-05 06:41:54.008705,0 days 00:00:01.991703,0.017983399962975384,friedman_mse,0.04162245334190062,exponential,6,log2,0.17367759523298484,4,8,0.4269288762066233,627,0.37175162225385794,0.08282690336231475,COMPLETE
927,927,0.7686989482334613,2023-04-05 06:41:54.009580,2023-04-05 06:41:57.877456,0 days 00:00:03.867876,0.0003243571993811528,friedman_mse,0.05568238780212641,exponential,5,log2,0.05071832999620213,4,8,0.08119663529227898,604,0.9675030089322665,0.06965399666905199,COMPLETE
928,928,0.716997660985347,2023-04-05 06:41:57.878390,2023-04-05 06:42:01.525940,0 days 00:00:03.647550,0.03846903629114535,friedman_mse,0.021693132806703378,exponential,5,log2,0.20385556845606842,3,8,0.0923962812072277,655,0.8677171876829802,0.008716329908650367,COMPLETE
929,929,0.5,2023-04-05 06:42:01.526847,2023-04-05 06:42:04.503949,0 days 00:00:02.977102,0.11944518782152774,friedman_mse,0.06762634671648876,exponential,5,log2,0.1377237422459796,4,8,0.2274172751385056,636,0.931525214354809,0.06422505609100772,COMPLETE
930,930,0.5,2023-04-05 06:42:04.505175,2023-04-05 06:42:07.849125,0 days 00:00:03.343950,0.20567496202193153,friedman_mse,0.09999768706318268,exponential,5,log2,0.15950219345826416,4,8,0.04169374793241039,686,0.47206824134722736,0.00013797193075324593,COMPLETE
931,931,0.5,2023-04-05 06:42:07.850229,2023-04-05 06:42:09.879177,0 days 00:00:02.028948,0.48806949098445823,friedman_mse,0.047897012950128076,exponential,5,log2,0.14718294820662484,4,8,0.4789426598202709,617,0.4421034010515044,0.00012454623048562138,COMPLETE
932,932,0.661302782369207,2023-04-05 06:42:09.880074,2023-04-05 06:42:11.976377,0 days 00:00:02.096303,0.009135343616216466,friedman_mse,0.04061125543524648,exponential,5,log2,0.21933940213904105,4,8,0.3147236644124731,665,0.4076670571227532,0.0833378350313472,COMPLETE
933,933,0.5,2023-04-05 06:42:11.977264,2023-04-05 06:42:14.225761,0 days 00:00:02.248497,0.24570061378474592,squared_error,0.08460632472123901,exponential,6,log2,0.1818230581931453,4,8,0.16199378215436627,641,0.9989052465714802,0.06767787880122124,COMPLETE
934,934,0.7714273214287035,2023-04-05 06:42:14.226652,2023-04-05 06:42:17.823833,0 days 00:00:03.597181,0.0002491047356655502,friedman_mse,0.07103862337366339,exponential,5,log2,0.16531681153228148,4,8,0.06930016347645022,597,0.8315587560714801,0.00010067383770238775,COMPLETE
935,935,0.5,2023-04-05 06:42:17.824774,2023-04-05 06:42:20.933016,0 days 00:00:03.108242,0.2253068407378764,friedman_mse,0.05418694038279034,exponential,5,log2,0.12975423387953344,4,8,0.14837255581093778,626,0.8984691782819649,0.06408440724577656,COMPLETE
936,936,0.7397391939230061,2023-04-05 06:42:20.933992,2023-04-05 06:42:25.315093,0 days 00:00:04.381101,0.02609809928239694,friedman_mse,0.04779583420818933,exponential,5,log2,0.19941024061434076,4,8,0.05372703408809749,697,0.9147144241519813,0.00020253549732153698,COMPLETE
937,937,0.5,2023-04-05 06:42:25.316110,2023-04-05 06:42:29.564419,0 days 00:00:04.248309,0.15725062325733796,friedman_mse,0.06431926757363088,exponential,5,log2,0.0050430827866329575,3,8,0.059624174026594194,650,0.9485202067651902,0.07263872137290434,COMPLETE
938,938,0.5,2023-04-05 06:42:29.565370,2023-04-05 06:42:33.026882,0 days 00:00:03.461512,0.19104488463052208,friedman_mse,0.024770702214811303,exponential,5,log2,0.14172748452834513,4,8,0.10726560186174727,615,0.9741485466074253,0.00017492981608465945,COMPLETE
939,939,0.7539675417160696,2023-04-05 06:42:33.027775,2023-04-05 06:42:37.327870,0 days 00:00:04.300095,0.015074945112482436,friedman_mse,0.03350689231182471,exponential,5,log2,0.1165237176431407,4,8,0.03881984488552092,673,0.8541832568378958,0.03803817888691066,COMPLETE
940,940,0.6414328740250299,2023-04-05 06:42:37.328779,2023-04-05 06:42:39.298036,0 days 00:00:01.969257,0.0005200838551096332,friedman_mse,0.00036836198190343697,exponential,6,log2,0.15707238434856488,4,10,0.3588451201851047,600,0.3685963499486474,0.04990170515849829,COMPLETE
941,941,0.74234163302208,2023-04-05 06:42:39.298934,2023-04-05 06:42:41.921675,0 days 00:00:02.622741,0.030626266250686724,friedman_mse,0.0818344744636125,exponential,5,log2,0.23344417222886507,3,8,0.03505869479716024,635,0.3405771881360072,0.032013062401795495,COMPLETE
942,942,0.5,2023-04-05 06:42:41.922600,2023-04-05 06:42:44.926600,0 days 00:00:03.004000,0.19754240540525142,friedman_mse,0.05972618296449963,exponential,5,log2,0.17233535522531485,4,8,0.20228660942767435,666,0.8743695768359798,0.011888177700884923,COMPLETE
943,943,0.5,2023-04-05 06:42:44.927486,2023-04-05 06:42:46.993044,0 days 00:00:02.065558,0.06668420678016279,friedman_mse,0.04276316160503847,exponential,5,log2,0.12833064269521752,4,8,0.4703192782964011,620,0.5037162262506818,0.0758347636205946,COMPLETE
944,944,0.5,2023-04-05 06:42:46.993953,2023-04-05 06:42:49.994236,0 days 00:00:03.000283,0.4314683723062762,friedman_mse,0.07435177111304876,exponential,5,log2,0.15082958950417555,4,8,0.21378104683121296,645,0.9859966895661079,0.01678094986461992,COMPLETE
945,945,0.632714103018278,2023-04-05 06:42:49.995173,2023-04-05 06:42:51.863337,0 days 00:00:01.868164,0.00017320033385967865,friedman_mse,0.00021506998578990063,exponential,5,log2,0.10765208426709635,4,8,0.49096244472115835,592,0.4141665290454186,0.00022620287539673928,COMPLETE
946,946,0.5,2023-04-05 06:42:51.864259,2023-04-05 06:42:55.063517,0 days 00:00:03.199258,0.0764577162805713,friedman_mse,0.053195191469070896,exponential,6,sqrt,0.16630728063588673,4,8,0.271581781994948,683,0.8905903693044036,0.0145106760526673,COMPLETE
947,947,0.5,2023-04-05 06:42:55.064594,2023-04-05 06:42:57.531446,0 days 00:00:02.466852,0.35142648119665837,friedman_mse,0.0707556877188326,exponential,5,sqrt,0.09004486000882161,4,8,0.04893117081768642,604,0.2807328536808776,0.09968247184841116,COMPLETE
948,948,0.7486890066152503,2023-04-05 06:42:57.532532,2023-04-05 06:43:03.069367,0 days 00:00:05.536835,0.01793636451275576,friedman_mse,0.039276361042731425,exponential,5,sqrt,0.2545498141232348,4,8,0.06943415951140003,655,0.9223570637879732,0.00015690921718366311,COMPLETE
949,949,0.6599597734006254,2023-04-05 06:43:03.070345,2023-04-05 06:43:06.462216,0 days 00:00:03.391871,0.009584185813755808,friedman_mse,0.08853784137673244,exponential,5,sqrt,0.18742263473711124,4,8,0.30144795893811,718,0.6949782884559725,0.008121041039061272,COMPLETE
950,950,0.7323593024501227,2023-04-05 06:43:06.463136,2023-04-05 06:43:09.521778,0 days 00:00:03.058642,0.00016767776478159065,friedman_mse,0.05969315280569179,exponential,5,log2,0.14196564604489748,4,8,0.18162389679988383,642,0.6703890983251133,0.00011801028660621865,COMPLETE
951,951,0.7188855658845705,2023-04-05 06:43:09.522692,2023-04-05 06:43:14.444526,0 days 00:00:04.921834,0.046209733208291505,friedman_mse,0.022543897857279775,exponential,5,sqrt,0.20914469509324246,4,8,0.08120881006543784,627,0.9569188302247421,0.00020771366822282868,COMPLETE
952,952,0.5,2023-04-05 06:43:14.445624,2023-04-05 06:43:16.973734,0 days 00:00:02.528110,0.16948990951329784,squared_error,0.03091528104068077,exponential,5,sqrt,0.17858443432683352,4,8,0.058765556766297265,609,0.8182380978849065,0.009631951717915602,COMPLETE
953,953,0.6975491349479646,2023-04-05 06:43:16.974725,2023-04-05 06:43:20.068051,0 days 00:00:03.093326,0.0191552268801733,friedman_mse,0.0006853435526358497,exponential,6,sqrt,0.15335711062732002,4,8,0.17450312606532814,665,0.44938391404195516,0.01845687433212103,COMPLETE
954,954,0.5,2023-04-05 06:43:20.068985,2023-04-05 06:43:26.611485,0 days 00:00:06.542500,0.21412322146720847,friedman_mse,0.0503327190898117,exponential,7,sqrt,0.13779548688391927,3,8,0.036904011061636856,699,0.9052192746392741,0.0001399884367181542,COMPLETE
955,955,0.5,2023-04-05 06:43:26.612626,2023-04-05 06:43:29.757380,0 days 00:00:03.144754,0.40832653897791266,friedman_mse,0.09960027128584767,exponential,5,sqrt,0.04531446655368976,4,8,0.04351219728616846,628,0.38927447083247146,0.024073593451093573,COMPLETE
956,956,0.5,2023-04-05 06:43:29.758361,2023-04-05 06:43:31.974842,0 days 00:00:02.216481,0.45197880587197015,friedman_mse,0.0013568987393049571,exponential,5,log2,0.1633334525638895,4,8,0.27717393498775644,590,0.9385916226446909,0.0001654991393969564,COMPLETE
957,957,0.5,2023-04-05 06:43:31.975989,2023-04-05 06:43:36.887503,0 days 00:00:04.911514,0.2875436713419561,friedman_mse,0.027627268897680874,exponential,5,sqrt,0.09994512586333593,4,5,0.08984887277629927,654,0.8526003603424723,0.04425019648115601,COMPLETE
958,958,0.7535058014000834,2023-04-05 06:43:36.888668,2023-04-05 06:43:43.325760,0 days 00:00:06.437092,0.010592257801031145,friedman_mse,0.06537257669006245,exponential,5,sqrt,0.12242358670131241,4,8,0.048306096147460884,680,0.9796034081711034,0.0325291065854309,COMPLETE
959,959,0.5,2023-04-05 06:43:43.326840,2023-04-05 06:43:48.170146,0 days 00:00:04.843306,0.3237743175990456,friedman_mse,0.07828254732492962,exponential,5,sqrt,0.22294470129411043,3,8,0.06946293307262598,613,0.8758807976990496,0.005458735881502104,COMPLETE
960,960,0.5,2023-04-05 06:43:48.171234,2023-04-05 06:43:52.857781,0 days 00:00:04.686547,0.1765951131443866,friedman_mse,0.04685078268759404,exponential,5,sqrt,0.14722713568399426,4,2,0.034662430188915704,578,0.8347695637835387,0.00018654572267351474,COMPLETE
