,number,value,datetime_start,datetime_complete,duration,params_ccp_alpha,params_criterion,params_learning_rate,params_loss,params_max_depth,params_max_features,params_min_impurity_decrease,params_min_samples_leaf,params_min_samples_split,params_min_weight_fraction_leaf,params_n_estimators,params_subsample,params_tol,state
319,319,0.5,2023-04-05 06:14:51.686097,2023-04-05 06:14:54.026191,0 days 00:00:02.340094,0.4029882409141414,friedman_mse,0.0033098625192793637,log_loss,4,sqrt,0.3762532261482058,8,9,0.0151771429743106,366,0.5672483815204276,0.0007203345558138421,COMPLETE
320,320,0.7646543159135684,2023-04-05 06:14:54.026916,2023-04-05 06:14:57.786359,0 days 00:00:03.759443,0.00011315852108943231,friedman_mse,0.0026521856056874707,exponential,4,sqrt,0.32526088559365085,9,9,0.00881902733645949,455,0.7591830576442753,0.0010346755162203073,COMPLETE
321,321,0.5,2023-04-05 06:14:57.787118,2023-04-05 06:15:01.011047,0 days 00:00:03.223929,0.17185633540565498,friedman_mse,0.0049130981937913895,exponential,4,sqrt,0.43613696984390565,9,8,0.042116650617275285,464,0.7567211927523987,0.001824314996239939,COMPLETE
322,322,0.5,2023-04-05 06:15:01.011752,2023-04-05 06:15:04.546307,0 days 00:00:03.534555,0.22563454001218264,friedman_mse,0.002759457039245793,exponential,4,sqrt,0.32244829114164203,9,9,0.0008787906490910752,492,0.7267174204083037,0.0010055156447451303,COMPLETE
323,323,0.5,2023-04-05 06:15:04.546989,2023-04-05 06:15:06.401425,0 days 00:00:01.854436,0.010018380855168676,squared_error,0.003849801918028395,exponential,5,sqrt,0.3026823440524775,9,9,0.08908616371122555,460,0.7739552711254595,0.00020730129199583684,COMPLETE
324,324,0.7475496013188669,2023-04-05 06:15:06.402607,2023-04-05 06:15:09.599271,0 days 00:00:03.196664,0.0392612777945706,friedman_mse,0.0030031979030136604,exponential,4,sqrt,0.2982006615334363,10,9,0.027229450817034234,433,0.7250116645165755,0.0007993802722194161,COMPLETE
325,325,0.7543321062921458,2023-04-05 06:15:09.599982,2023-04-05 06:15:12.817508,0 days 00:00:03.217526,0.02104818594852904,friedman_mse,0.001741718510725815,exponential,4,sqrt,0.31579133486377664,9,9,0.016311374484890742,416,0.808119612366228,0.0015676691528077877,COMPLETE
326,326,0.7569304763671281,2023-04-05 06:15:12.818205,2023-04-05 06:15:16.815077,0 days 00:00:03.996872,0.008895738805622135,friedman_mse,0.002546931977400008,exponential,4,sqrt,0.3494376987167506,9,9,0.00925282977937401,508,0.6975530870430766,0.001332353072440746,COMPLETE
327,327,0.7518562186037159,2023-04-05 06:15:16.815748,2023-04-05 06:15:20.561645,0 days 00:00:03.745897,0.026633683145511407,friedman_mse,0.002050980048462384,exponential,4,sqrt,0.4806091197734441,9,9,0.02814868116450586,450,0.7420531643992927,0.002043111587909783,COMPLETE
328,328,0.7271839482251289,2023-04-05 06:15:20.562345,2023-04-05 06:15:23.144453,0 days 00:00:02.582108,0.010114059024509223,friedman_mse,0.0012557801859704133,exponential,4,sqrt,0.42990233973421615,9,8,0.09929127925496807,400,0.680641696755424,0.0002744308536335015,COMPLETE
329,329,0.5,2023-04-05 06:15:23.145120,2023-04-05 06:15:26.025318,0 days 00:00:02.880198,0.26472392057498795,friedman_mse,0.0032988707325782443,exponential,4,sqrt,0.48099700976234344,8,5,0.01900752465882192,428,0.641717801785255,0.0011721575697483076,COMPLETE
330,330,0.6937329821707028,2023-04-05 06:15:26.026003,2023-04-05 06:15:27.618953,0 days 00:00:01.592950,0.000585423206614393,friedman_mse,0.002442134157140271,exponential,4,sqrt,0.32738408848171086,10,7,0.1910236816598353,477,0.13667610835012406,0.002467014120938239,COMPLETE
331,331,0.6437822523252714,2023-04-05 06:15:27.619633,2023-04-05 06:15:30.617605,0 days 00:00:02.997972,0.017746207676733412,friedman_mse,0.001976663725502209,log_loss,4,sqrt,0.3801017049774731,9,9,0.03749523980491205,393,0.6017069552579571,0.0009248119317252829,COMPLETE
332,332,0.755129325053406,2023-04-05 06:15:30.618290,2023-04-05 06:15:34.045885,0 days 00:00:03.427595,0.00020341128363107319,friedman_mse,0.0015474211893288048,log_loss,7,sqrt,0.0025947938536070025,9,9,0.0648227452984852,450,0.6230877794675135,0.00022781521096806664,COMPLETE
333,333,0.7564373196966517,2023-04-05 06:15:34.046744,2023-04-05 06:15:37.166914,0 days 00:00:03.120170,0.010066050391573066,friedman_mse,0.0028059369301254404,exponential,4,sqrt,0.3985523953936723,9,9,0.008245596533412608,375,0.7122083058085493,0.0016938264452157972,COMPLETE
334,334,0.5,2023-04-05 06:15:37.167699,2023-04-05 06:15:39.322038,0 days 00:00:02.154339,0.08284787026867263,friedman_mse,0.0017601656758752633,log_loss,4,log2,0.46256409328826603,9,9,0.1514771109027256,412,0.5379857865252504,0.0013673530164909754,COMPLETE
335,335,0.5,2023-04-05 06:15:39.322825,2023-04-05 06:15:41.971011,0 days 00:00:02.648186,0.027651228312131487,friedman_mse,0.0021669073637950154,log_loss,4,sqrt,0.2195210129744896,9,10,0.17628355434861162,489,0.6583219700119175,0.001086716123148985,COMPLETE
336,336,0.7546491890476926,2023-04-05 06:15:41.971727,2023-04-05 06:15:45.300218,0 days 00:00:03.328491,0.0162898767553336,friedman_mse,0.003959769193570312,exponential,4,sqrt,0.3131665732511623,8,9,0.0001247917787955688,363,0.9573696583129904,0.002109781245156692,COMPLETE
337,337,0.7453735986438105,2023-04-05 06:15:45.300923,2023-04-05 06:15:48.578819,0 days 00:00:03.277896,0.008472798467370136,friedman_mse,0.0025658070749795298,log_loss,5,sqrt,0.4911325281461605,9,8,0.020073545842010376,393,0.759961673334803,0.001541797226752303,COMPLETE
338,338,0.5,2023-04-05 06:15:48.579515,2023-04-05 06:15:50.764808,0 days 00:00:02.185293,0.13911454183486371,friedman_mse,0.003278838267212369,log_loss,4,sqrt,0.3411193814366799,9,9,0.4098525787995202,559,0.6017038254125712,0.0017743858851288032,COMPLETE
339,339,0.6229400462211727,2023-04-05 06:15:50.765522,2023-04-05 06:15:53.374375,0 days 00:00:02.608853,0.12159876229780525,friedman_mse,0.0019186567122330314,exponential,4,sqrt,0.36353302121511155,9,9,0.052971643095309565,436,0.5579868066165288,0.001010571652915555,COMPLETE
340,340,0.5,2023-04-05 06:15:53.375082,2023-04-05 06:15:57.271709,0 days 00:00:03.896627,0.19209979798191032,friedman_mse,0.000997700253300598,log_loss,4,sqrt,0.2913242449877519,9,9,0.03267542852904451,471,0.9919149620310588,0.0012426644914967746,COMPLETE
341,341,0.5,2023-04-05 06:15:57.272380,2023-04-05 06:15:59.598832,0 days 00:00:02.326452,0.03772228566784486,squared_error,0.001401943493226621,log_loss,4,sqrt,0.2759953989292165,9,9,0.012354547779915242,521,0.789175050842727,0.0027674444620957583,COMPLETE
342,342,0.7626251263758185,2023-04-05 06:15:59.599538,2023-04-05 06:16:02.107485,0 days 00:00:02.507947,0.0004799312659688052,friedman_mse,0.002292073144713544,exponential,4,sqrt,0.4721169235866844,10,9,0.00025097036629227385,352,0.5167001197299879,0.0007734982729407071,COMPLETE
343,343,0.5,2023-04-05 06:16:02.108179,2023-04-05 06:16:03.594014,0 days 00:00:01.485835,0.10696600353545827,friedman_mse,0.0024457887939537647,exponential,4,sqrt,0.47653281495906824,10,9,0.4329148089144589,373,0.5112270502290066,0.000808878176561468,COMPLETE
344,344,0.6279495852940483,2023-04-05 06:16:03.594708,2023-04-05 06:16:06.427656,0 days 00:00:02.832948,0.019396000971636896,friedman_mse,0.002748604815841635,exponential,4,sqrt,0.4517663769150089,10,9,0.2703028916029924,714,0.5121887235130291,0.0006209948210346856,COMPLETE
345,345,0.5,2023-04-05 06:16:06.428515,2023-04-05 06:16:08.146513,0 days 00:00:01.717998,0.32138190854661186,friedman_mse,0.00038280598782649064,exponential,4,sqrt,0.46807725625015145,10,9,0.35271031760271887,408,0.6765296748726609,0.0007244126360139882,COMPLETE
346,346,0.7670784491846673,2023-04-05 06:16:08.147274,2023-04-05 06:16:10.907088,0 days 00:00:02.759814,2.0288910451746187e-05,friedman_mse,0.0030111496822276713,exponential,4,sqrt,0.48686248184371733,10,8,0.007125681731553961,500,0.20317009422208387,0.001982811946774599,COMPLETE
347,347,0.7540790950145227,2023-04-05 06:16:10.907859,2023-04-05 06:16:13.690273,0 days 00:00:02.782414,0.009044768363676584,friedman_mse,0.00011916457645886626,exponential,4,sqrt,0.48546589150976344,10,8,0.005767606931774813,500,0.32226977540186597,0.002335030969957139,COMPLETE
348,348,0.7525680759621549,2023-04-05 06:16:13.691040,2023-04-05 06:16:17.661715,0 days 00:00:03.970675,0.02697048993850495,friedman_mse,0.003519902194108836,exponential,5,sqrt,0.49250191293719736,10,8,0.000316714278369868,535,0.6360563306322814,0.0020272170056295645,COMPLETE
349,349,0.7585578812183835,2023-04-05 06:16:17.662491,2023-04-05 06:16:19.385756,0 days 00:00:01.723265,0.0089954077783066,friedman_mse,0.0030882813731446562,exponential,4,sqrt,0.4884495813260758,10,8,0.012304302436920296,510,0.1219329890527182,0.016866984470278824,COMPLETE
350,350,0.5,2023-04-05 06:16:19.386591,2023-04-05 06:16:21.363607,0 days 00:00:01.977016,0.07399606950270768,friedman_mse,0.0028027179195897673,exponential,4,sqrt,0.47680695160620473,10,8,0.39333633477317204,481,0.30954343479031815,0.00012584757555418298,COMPLETE
351,351,0.5,2023-04-05 06:16:21.364290,2023-04-05 06:16:23.468560,0 days 00:00:02.104270,0.18277458340164462,friedman_mse,0.0004426062153003558,exponential,4,sqrt,0.40898808167536554,10,8,0.016563398248236813,461,0.3451445335194796,0.00041722595874168643,COMPLETE
352,352,0.7543898912498431,2023-04-05 06:16:23.469344,2023-04-05 06:16:25.441100,0 days 00:00:01.971756,0.01753060605067957,friedman_mse,0.0007536225310309758,exponential,4,sqrt,0.34234771758455296,10,8,0.0006986474327291358,492,0.21688278889524049,0.0003548454210353342,COMPLETE
353,353,0.632714103018278,2023-04-05 06:16:25.441896,2023-04-05 06:16:27.011998,0 days 00:00:01.570102,0.000636945097839211,friedman_mse,0.004685692851022439,exponential,4,log2,0.3292082483639908,10,8,0.4899350006468265,449,0.5237995168542517,0.000857824440122652,COMPLETE
354,354,0.6929182019368463,2023-04-05 06:16:27.012819,2023-04-05 06:16:29.593030,0 days 00:00:02.580211,0.009356732847641503,friedman_mse,0.002309236414151941,exponential,4,sqrt,0.46157739126682096,10,10,0.16347421177947608,430,0.818915246373753,0.0004902165216480608,COMPLETE
355,355,0.5,2023-04-05 06:16:29.594119,2023-04-05 06:16:33.338321,0 days 00:00:03.744202,0.22144882424505538,friedman_mse,0.019468623391019176,exponential,4,sqrt,0.26043216398550734,10,9,0.010251788637736865,526,0.49805430512219107,0.001886870397343567,COMPLETE
356,356,0.7641496844971746,2023-04-05 06:16:33.339102,2023-04-05 06:16:35.779635,0 days 00:00:02.440533,0.0005838639537115698,friedman_mse,0.0037830286289498964,exponential,4,sqrt,0.3527666552145191,10,9,0.020212451117260603,389,0.4089083753550272,0.0014101867481618948,COMPLETE
357,357,0.7548953006445756,2023-04-05 06:16:35.780349,2023-04-05 06:16:39.459765,0 days 00:00:03.679416,0.02053140279621361,friedman_mse,0.0034628975877994995,exponential,4,sqrt,0.30434221920861654,10,7,0.019796137801107398,770,0.34702811608064116,0.0013979123097443884,COMPLETE
358,358,0.7676505660092021,2023-04-05 06:16:39.460546,2023-04-05 06:16:41.363890,0 days 00:00:01.903344,6.778718971990002e-05,friedman_mse,0.004088937992832955,exponential,4,sqrt,0.36183838831264625,10,8,0.008784193257128703,393,0.2251234658297374,0.0005655313335377462,COMPLETE
359,359,0.5,2023-04-05 06:16:41.364688,2023-04-05 06:16:42.608793,0 days 00:00:01.244105,0.4766493382379467,friedman_mse,0.004011073389098722,exponential,6,sqrt,0.3357631366008224,10,8,0.12868151954712784,395,0.19413525813734697,0.000581790843948761,COMPLETE
360,360,0.7532123274241062,2023-04-05 06:16:42.609597,2023-04-05 06:16:44.785745,0 days 00:00:02.176148,0.030030819213054012,friedman_mse,0.004769851475272516,exponential,4,sqrt,0.3674684268833411,10,8,0.0001595701617393882,384,0.4393429018071012,0.0006994698198925053,COMPLETE
361,361,0.7561751922954324,2023-04-05 06:16:44.786545,2023-04-05 06:16:46.786098,0 days 00:00:01.999553,0.010229390640871281,friedman_mse,0.003976092263322365,exponential,4,sqrt,0.3575692380687472,10,8,0.020603013818175375,418,0.2810052456901736,0.0005804999045358051,COMPLETE
362,362,0.5,2023-04-05 06:16:46.786886,2023-04-05 06:16:48.022068,0 days 00:00:01.235182,0.017094246334456775,squared_error,0.005177862447396182,exponential,4,sqrt,0.33223654604894526,10,8,0.10594800455527287,422,0.26414201478600946,0.0004943903435880345,COMPLETE
363,363,0.7398983649750563,2023-04-05 06:16:48.022850,2023-04-05 06:16:49.580118,0 days 00:00:01.557268,0.04056793893741393,friedman_mse,0.003716418091110379,exponential,4,sqrt,0.31913901870959793,10,8,0.07384135815108567,402,0.26505351063979266,0.0006274744706995405,COMPLETE
364,364,0.5,2023-04-05 06:16:49.580916,2023-04-05 06:16:50.701502,0 days 00:00:01.120586,0.0982321943680018,friedman_mse,0.00438625434144851,exponential,4,sqrt,0.30825500288417845,10,8,0.2930827467490396,381,0.23930851360898642,0.0005210411212052898,COMPLETE
365,365,0.5,2023-04-05 06:16:50.702314,2023-04-05 06:16:52.036971,0 days 00:00:01.334657,0.340982938695717,friedman_mse,0.0003308172391725239,exponential,4,sqrt,0.3873243217494623,10,8,0.22818213691497222,445,0.22804675474310176,0.0007676040106999304,COMPLETE
366,366,0.5,2023-04-05 06:16:52.037778,2023-04-05 06:16:54.911000,0 days 00:00:02.873222,0.25780293296953105,friedman_mse,0.0031517872597154792,exponential,5,sqrt,0.36995350715756253,10,9,0.009724307064124232,399,0.6165998122569152,0.0009026432219219297,COMPLETE
367,367,0.5,2023-04-05 06:16:54.911683,2023-04-05 06:16:56.340705,0 days 00:00:01.429022,0.2180644934754907,friedman_mse,0.0030521513638030982,exponential,4,sqrt,0.3470640115769915,10,9,0.02169283526172561,413,0.19426213705143655,0.09798619988645901,COMPLETE
368,368,0.7701443802234638,2023-04-05 06:16:56.341378,2023-04-05 06:16:57.993434,0 days 00:00:01.652056,7.593477912535609e-05,friedman_mse,0.006381425171667763,exponential,4,sqrt,0.35914343819685646,7,8,0.010835948190915035,371,0.1701249913339808,0.0014581900427035833,COMPLETE
369,369,0.6541572548618692,2023-04-05 06:16:57.994245,2023-04-05 06:16:59.402775,0 days 00:00:01.408530,0.011232371998738036,friedman_mse,0.0051352554662706515,exponential,4,sqrt,0.3481908954352572,6,8,0.283057702531021,363,0.4509937249858944,0.00016909843816522777,COMPLETE
370,370,0.7675642969820421,2023-04-05 06:16:59.403561,2023-04-05 06:17:01.184871,0 days 00:00:01.781310,0.00016223217301875547,friedman_mse,0.0040749746105484645,exponential,4,sqrt,0.3531942321820622,7,8,0.00020688992611800212,380,0.18967726656512074,0.03800631025797095,COMPLETE
371,371,0.7552745117612387,2023-04-05 06:17:01.185691,2023-04-05 06:17:02.439268,0 days 00:00:01.253577,0.023069244466938404,friedman_mse,0.006550196966037159,exponential,4,sqrt,0.3595853343941642,7,8,0.008523801248445689,391,0.1597819716631163,0.006291612002612902,COMPLETE
372,372,0.7303203527280919,2023-04-05 06:17:02.440052,2023-04-05 06:17:03.802387,0 days 00:00:01.362335,0.009456571702395559,friedman_mse,0.007051999410089399,exponential,4,sqrt,0.3486397280143235,10,8,0.11936582251622474,381,0.20536868074251213,0.002384500940219863,COMPLETE
373,373,0.5,2023-04-05 06:17:03.803233,2023-04-05 06:17:04.734412,0 days 00:00:00.931179,0.10907383263741266,friedman_mse,0.007207869217811427,exponential,4,log2,0.3590980109673504,7,8,0.24529540946101744,354,0.16971521197751527,0.03569842662308922,COMPLETE
374,374,0.7557775915455504,2023-04-05 06:17:04.735197,2023-04-05 06:17:06.215847,0 days 00:00:01.480650,0.016776630466131155,friedman_mse,0.004375038807571603,exponential,4,sqrt,0.3362508307439923,5,8,0.0007116762807763428,408,0.17429122500114533,0.06153193526156297,COMPLETE
375,375,0.7353067615295984,2023-04-05 06:17:06.216647,2023-04-05 06:17:07.511367,0 days 00:00:01.294720,0.0633841207476945,friedman_mse,0.0042472992377841304,exponential,5,sqrt,0.3663244849477438,7,8,0.0003472473232519098,334,0.19539864426695755,0.030591928846660996,COMPLETE
376,376,0.7647730177432711,2023-04-05 06:17:07.512162,2023-04-05 06:17:09.102268,0 days 00:00:01.590106,0.0006605136309055864,friedman_mse,0.003699587715529258,exponential,4,sqrt,0.3982633810471815,6,7,0.015552504581582992,377,0.14947165370948592,0.0003952517592067093,COMPLETE
377,377,0.7502536624466304,2023-04-05 06:17:09.103037,2023-04-05 06:17:10.483716,0 days 00:00:01.380679,0.03205571068071611,friedman_mse,0.006167363265389492,exponential,4,sqrt,0.3861189098573106,7,7,0.014285940304163774,428,0.15275046104394427,0.0004120042398611061,COMPLETE
378,378,0.7715661911039801,2023-04-05 06:17:10.484522,2023-04-05 06:17:12.187070,0 days 00:00:01.702548,0.00016405947773164904,friedman_mse,0.011376928750300214,exponential,4,sqrt,0.39541285405784654,5,8,0.025884608642545534,381,0.18920297808935366,0.016314149936651288,COMPLETE
379,379,0.7593476418958541,2023-04-05 06:17:12.187953,2023-04-05 06:17:13.819092,0 days 00:00:01.631139,0.009219973738389405,friedman_mse,0.005815634189571173,exponential,8,sqrt,0.37232287863148544,5,8,0.020847126742539357,389,0.1847192427811183,0.0004103219405991279,COMPLETE
380,380,0.7671063926453441,2023-04-05 06:17:13.819866,2023-04-05 06:17:15.807867,0 days 00:00:01.988001,0.00012808607856275745,friedman_mse,0.0038247157861634874,exponential,4,sqrt,0.3487698375188728,5,7,0.00884018492061605,412,0.20255905403586275,0.0003579664509619232,COMPLETE
381,381,0.6905613019983285,2023-04-05 06:17:15.808688,2023-04-05 06:17:16.903873,0 days 00:00:01.095185,0.023699640141088957,friedman_mse,0.0055009110658565475,exponential,4,sqrt,0.35192517648872107,5,6,0.2083011907062326,412,0.1410861272353922,0.04094603124182718,COMPLETE
382,382,0.7573915602988806,2023-04-05 06:17:16.904738,2023-04-05 06:17:18.728987,0 days 00:00:01.824249,0.009642712887675433,friedman_mse,0.00382917316731877,exponential,4,sqrt,0.419697007728772,5,7,0.011998380545604153,423,0.2184231980944673,0.0003351649900109351,COMPLETE
383,383,0.5,2023-04-05 06:17:18.729793,2023-04-05 06:17:19.775648,0 days 00:00:01.045855,0.19471922044885026,squared_error,0.004844160043315393,exponential,4,sqrt,0.3890199914618452,5,7,0.09415726361070534,397,0.17455459520646216,0.01977888100328406,COMPLETE
384,384,0.5,2023-04-05 06:17:19.776430,2023-04-05 06:17:21.023777,0 days 00:00:01.247347,0.29782379349434934,friedman_mse,0.003863337108613116,exponential,4,sqrt,0.3958634452782434,6,6,0.023526125254145335,384,0.17863035805868177,0.00038654666836533067,COMPLETE
385,385,0.7719839859469415,2023-04-05 06:17:21.024518,2023-04-05 06:17:22.826040,0 days 00:00:01.801522,0.00028128469134708025,friedman_mse,0.008344465117178273,exponential,4,sqrt,0.37820972590619084,5,7,0.008335375227346706,409,0.1618499351996162,0.006964982174591136,COMPLETE
386,386,0.6597580735904118,2023-04-05 06:17:22.826743,2023-04-05 06:17:23.968127,0 days 00:00:01.141384,0.000261779614633716,friedman_mse,0.008120303795244463,exponential,4,sqrt,0.3717889091751336,5,7,0.3022196431986609,407,0.15334979562426218,0.00034734259203901595,COMPLETE
387,387,0.685628274913276,2023-04-05 06:17:23.968816,2023-04-05 06:17:25.367368,0 days 00:00:01.398552,0.08574178918214587,friedman_mse,0.006694404609896779,exponential,4,sqrt,0.3603853389908784,5,7,0.009242319504829325,381,0.20493787646074385,0.014269339701563284,COMPLETE
388,388,0.7554763012131863,2023-04-05 06:17:25.368060,2023-04-05 06:17:27.308820,0 days 00:00:01.940760,0.016545905480411426,friedman_mse,0.011011868230483068,exponential,4,sqrt,0.38096389276395837,5,7,0.010143756389195171,401,0.16434363670375451,0.00029957494694938245,COMPLETE
389,389,0.7456554308040136,2023-04-05 06:17:27.309661,2023-04-05 06:17:28.950877,0 days 00:00:01.641216,0.04167778195922898,friedman_mse,0.015011873310293855,exponential,4,sqrt,0.3449866514373338,4,7,0.0006811087508674714,422,0.23730985135779192,0.01177314214569262,COMPLETE
390,390,0.7713212538083531,2023-04-05 06:17:28.951598,2023-04-05 06:17:30.480866,0 days 00:00:01.529268,4.42082583081095e-05,friedman_mse,0.009555926848989624,exponential,4,sqrt,0.3762689955429828,5,7,0.018059012970784286,371,0.13622680599888884,0.021965951551820066,COMPLETE
391,391,0.643748986206466,2023-04-05 06:17:30.481572,2023-04-05 06:17:31.650012,0 days 00:00:01.168440,0.13330882302457436,friedman_mse,0.010033550658277466,exponential,4,sqrt,0.3969054939973012,5,7,7.43254175848869e-05,374,0.15902078535240036,0.008039692672289947,COMPLETE
392,392,0.5,2023-04-05 06:17:31.650730,2023-04-05 06:17:33.053083,0 days 00:00:01.402353,0.33749907560282355,friedman_mse,0.007880945198075445,exponential,4,sqrt,0.3776887881321195,5,7,0.014959477531241355,371,0.15170743303905485,0.019203314154681426,COMPLETE
393,393,0.5,2023-04-05 06:17:33.053801,2023-04-05 06:17:34.105327,0 days 00:00:01.051526,0.11440254926728777,friedman_mse,0.008950133915450126,exponential,4,log2,0.3628765137815978,5,7,0.3262483308986064,396,0.18885223319753283,0.021797441887346194,COMPLETE
394,394,0.5,2023-04-05 06:17:34.106626,2023-04-05 06:17:35.092189,0 days 00:00:00.985563,0.3969880593377137,friedman_mse,0.011549092028039028,exponential,4,sqrt,0.3546882272315538,5,7,0.13515136893597196,351,0.12408610767087622,0.026266413341516977,COMPLETE
395,395,0.5,2023-04-05 06:17:35.093608,2023-04-05 06:17:36.534118,0 days 00:00:01.440510,0.280157636438899,friedman_mse,0.00352657617014678,exponential,4,sqrt,0.3795213341725669,5,7,0.025982739577845082,384,0.21422009358437982,0.010422424011982347,COMPLETE
396,396,0.6552380888483096,2023-04-05 06:17:36.535445,2023-04-05 06:17:37.646023,0 days 00:00:01.110578,0.009618720184918902,friedman_mse,0.012043932888275986,exponential,4,sqrt,0.39348358291143043,4,6,0.358714988927366,360,0.19656807506353502,0.01655894344871239,COMPLETE
397,397,0.7555239691149185,2023-04-05 06:17:37.647414,2023-04-05 06:17:39.033335,0 days 00:00:01.385921,0.02545396308977358,friedman_mse,0.0053092535728914815,exponential,10,sqrt,0.33667350018379666,6,7,0.009569620227779338,403,0.12505695456699073,0.00026508068712726096,COMPLETE
398,398,0.5,2023-04-05 06:17:39.034191,2023-04-05 06:17:40.154569,0 days 00:00:01.120378,0.2342889096104976,friedman_mse,0.010981936340149663,exponential,4,sqrt,0.34935555608592667,5,7,0.019386883322563005,377,0.13128599978691954,0.015311284052185304,COMPLETE
