,number,value,datetime_start,datetime_complete,duration,params_ccp_alpha,params_criterion,params_learning_rate,params_loss,params_max_depth,params_max_features,params_min_impurity_decrease,params_min_samples_leaf,params_min_samples_split,params_min_weight_fraction_leaf,params_n_estimators,params_subsample,params_tol,state
639,639,0.5,2023-04-05 06:25:49.862795,2023-04-05 06:25:51.799202,0 days 00:00:01.936407,0.35423949004976296,squared_error,0.03895706270629399,exponential,4,sqrt,0.38542956841094955,10,8,0.02470521751892747,460,0.7809795609182215,0.00028185311775563634,COMPLETE
640,640,0.5,2023-04-05 06:25:51.800034,2023-04-05 06:25:55.710388,0 days 00:00:03.910354,0.2768435427448238,friedman_mse,0.055576494507884926,exponential,4,sqrt,0.3377370104113693,10,8,0.04014568797846249,494,0.8879782815867797,0.00010048992153759521,COMPLETE
641,641,0.7113612781641041,2023-04-05 06:25:55.711311,2023-04-05 06:25:59.054263,0 days 00:00:03.342952,0.05953023816142061,friedman_mse,0.05693057475112573,exponential,4,sqrt,0.3607416385765918,10,6,0.05614840606495125,454,0.7856770978260699,0.0002505956596641645,COMPLETE
642,642,0.5,2023-04-05 06:25:59.055070,2023-04-05 06:26:04.239042,0 days 00:00:05.183972,0.4137878224112765,friedman_mse,0.03427807778695933,exponential,3,sqrt,0.43758055113630934,10,8,0.12096529027374298,928,0.6825248774644299,0.03755296813169246,COMPLETE
643,643,0.5,2023-04-05 06:26:04.239962,2023-04-05 06:26:06.913534,0 days 00:00:02.673572,0.23502878227656776,friedman_mse,0.012110471557983567,exponential,4,sqrt,0.3700708147060008,10,7,0.3991027881190493,640,0.8632746460695857,0.00015478765298679014,COMPLETE
644,644,0.775612542672015,2023-04-05 06:26:06.914391,2023-04-05 06:26:10.978754,0 days 00:00:04.064363,0.0001450113176103954,friedman_mse,0.08647098172085779,exponential,4,sqrt,0.35038590241948786,10,8,0.01804268007127591,524,0.8066039801405132,0.005450545348691018,COMPLETE
645,645,0.6610659671778759,2023-04-05 06:26:10.979688,2023-04-05 06:26:12.984480,0 days 00:00:02.004792,0.0001178752479787887,friedman_mse,0.023249282550808322,exponential,4,log2,0.345950721486019,4,8,0.41287377151172583,535,0.8472809496258862,0.00010313652754882277,COMPLETE
646,646,0.5,2023-04-05 06:26:12.985404,2023-04-05 06:26:16.895279,0 days 00:00:03.909875,0.20466957430654312,friedman_mse,0.0953203096794648,exponential,4,sqrt,0.3246560203722008,10,8,0.00919638304569576,503,0.837100796384156,0.00398749185805766,COMPLETE
647,647,0.5,2023-04-05 06:26:16.896145,2023-04-05 06:26:20.905364,0 days 00:00:04.009219,0.2689590297448785,friedman_mse,0.07301168064708648,exponential,4,sqrt,0.35225084192139794,6,8,0.07881030663544025,531,0.8187840111842969,0.006498628697956523,COMPLETE
648,648,0.6256618329049608,2023-04-05 06:26:20.906316,2023-04-05 06:26:22.995343,0 days 00:00:02.089027,0.02231100805530081,friedman_mse,0.0870245909392771,exponential,4,sqrt,0.3401917026078895,5,8,0.36252046201494537,488,0.7965807101615419,0.007069651595511283,COMPLETE
649,649,0.5,2023-04-05 06:26:22.996328,2023-04-05 06:26:26.872276,0 days 00:00:03.875948,0.48298142243959646,friedman_mse,0.07380553629361059,exponential,4,sqrt,0.3613903099367896,10,8,0.01709229375459366,516,0.8083415539372868,0.0002705857920912639,COMPLETE
650,650,0.7569244733180523,2023-04-05 06:26:26.873245,2023-04-05 06:26:31.963459,0 days 00:00:05.090214,0.016559127404218863,friedman_mse,0.0600000589140832,exponential,4,sqrt,0.3505097466112467,4,8,0.02187014390095593,552,0.891857401510564,0.007882263471316023,COMPLETE
651,651,0.6848394518094816,2023-04-05 06:26:31.964387,2023-04-05 06:26:34.892999,0 days 00:00:02.928612,0.010696923148002387,friedman_mse,0.0570797228731756,exponential,4,sqrt,0.32972918712808874,5,8,0.21992601671168374,526,0.9636564026737526,0.010484288706200176,COMPLETE
652,652,0.5,2023-04-05 06:26:34.893859,2023-04-05 06:26:39.194859,0 days 00:00:04.301000,0.18905979193556566,friedman_mse,0.01683408061384612,exponential,5,sqrt,0.3788041885919865,7,7,0.007185543234516676,517,0.7849752421005436,0.006082816577129972,COMPLETE
653,653,0.5,2023-04-05 06:26:39.195647,2023-04-05 06:26:43.186332,0 days 00:00:03.990685,0.4299584912086695,friedman_mse,0.08626624372629042,exponential,4,sqrt,0.365514695633163,10,8,0.014864293986009827,496,0.8625451443031715,0.009427654305159086,COMPLETE
654,654,0.5,2023-04-05 06:26:43.187228,2023-04-05 06:26:47.494268,0 days 00:00:04.307040,0.44350603887402074,friedman_mse,0.02670795349161206,exponential,4,sqrt,0.4288382067427417,3,8,0.00011401826901748235,555,0.8310912387329323,0.004851819940818243,COMPLETE
655,655,0.5,2023-04-05 06:26:47.495189,2023-04-05 06:26:52.513309,0 days 00:00:05.018120,0.17494077963140667,friedman_mse,0.012547766301806264,exponential,8,sqrt,0.4021386709989309,4,8,0.027773951624430068,577,0.7638608977426808,0.0030022941456358883,COMPLETE
656,656,0.7398426837463221,2023-04-05 06:26:52.514155,2023-04-05 06:26:54.021022,0 days 00:00:01.506867,0.037340396427947516,friedman_mse,0.037328967064625074,exponential,3,sqrt,0.021026088137832244,5,8,0.03431889997637638,471,0.20198356567030343,0.008820780188914154,COMPLETE
657,657,0.5,2023-04-05 06:26:54.021898,2023-04-05 06:26:57.440406,0 days 00:00:03.418508,0.009287040579232788,squared_error,0.04430629233589685,exponential,4,sqrt,0.3409671650631222,10,7,0.018383513174940646,871,0.8826722668399558,0.0053359112052834765,COMPLETE
658,658,0.5,2023-04-05 06:26:57.441191,2023-04-05 06:27:00.407351,0 days 00:00:02.966160,0.10674607015143477,friedman_mse,0.07404845014647693,exponential,4,sqrt,0.39202970918492047,6,8,0.3148822596916588,505,0.856887635012241,0.023182431124005875,COMPLETE
659,659,0.5,2023-04-05 06:27:00.408146,2023-04-05 06:27:04.455644,0 days 00:00:04.047498,0.15358242559843244,friedman_mse,0.036014926721284,exponential,4,sqrt,0.3576487462736572,4,8,0.008463531728111567,547,0.807750139011108,0.0032187809173213375,COMPLETE
660,660,0.752994554945534,2023-04-05 06:27:04.456586,2023-04-05 06:27:09.084215,0 days 00:00:04.627629,0.02608052682413446,friedman_mse,0.04325956009374351,exponential,4,sqrt,0.4557770401726133,5,8,0.023943328458419316,608,0.8277942851364885,0.005555371486175504,COMPLETE
661,661,0.7624825485955962,2023-04-05 06:27:09.085143,2023-04-05 06:27:12.981598,0 days 00:00:03.896455,0.00040747762273079277,friedman_mse,0.0997499046533158,exponential,4,sqrt,0.37123331956962613,10,7,0.10974965191566222,588,0.8282421886305318,0.0001991507180572771,COMPLETE
662,662,0.7533303384138167,2023-04-05 06:27:12.982514,2023-04-05 06:27:16.473925,0 days 00:00:03.491411,0.015815093690195698,friedman_mse,0.046975337279085067,exponential,4,sqrt,0.3265710124644969,5,7,0.04526581289369798,478,0.8231557279780716,0.01793885404681007,COMPLETE
663,663,0.7318535712314718,2023-04-05 06:27:16.474879,2023-04-05 06:27:18.681449,0 days 00:00:02.206570,0.010174700887950196,friedman_mse,0.0717088034501503,exponential,4,sqrt,0.3158967224182034,10,8,0.13018961482675306,521,0.356809710986779,0.04063140417311482,COMPLETE
664,664,0.7680446807578214,2023-04-05 06:27:18.682272,2023-04-05 06:27:22.090974,0 days 00:00:03.408702,0.0002929499037998474,friedman_mse,0.0924016307773083,exponential,4,sqrt,0.3814551753425517,4,3,0.00015142627501033186,603,0.38401657470550854,0.00029653549741390765,COMPLETE
665,665,0.6777856367550092,2023-04-05 06:27:22.091947,2023-04-05 06:27:25.960207,0 days 00:00:03.868260,0.0702507518844883,friedman_mse,0.06244873224966683,exponential,4,log2,0.38707150350900305,10,3,0.008738386374335903,629,0.8201217937568254,0.0002803753517560821,COMPLETE
666,666,0.5,2023-04-05 06:27:25.961119,2023-04-05 06:27:29.014053,0 days 00:00:03.052934,0.16790078506617448,friedman_mse,0.08900018623104942,exponential,4,sqrt,0.18485198155137011,5,3,0.007132285939042119,603,0.3955636818257028,0.0003222458331238304,COMPLETE
667,667,0.743620540257515,2023-04-05 06:27:29.014871,2023-04-05 06:27:31.918588,0 days 00:00:02.903717,0.02954274179750147,friedman_mse,0.06732399429119702,exponential,4,sqrt,0.3810752806964284,6,6,0.0009559542054801155,571,0.38225137459258113,0.00024226195023777667,COMPLETE
668,668,0.632714103018278,2023-04-05 06:27:31.919362,2023-04-05 06:27:34.286613,0 days 00:00:02.367251,0.0454579258492323,friedman_mse,0.09709845668390997,exponential,4,sqrt,0.1091009540563489,10,4,0.2874510838166471,599,0.3654563214606228,0.0002947280113446078,COMPLETE
669,669,0.6286016360094917,2023-04-05 06:27:34.287405,2023-04-05 06:27:36.502384,0 days 00:00:02.214979,0.017775228855301757,friedman_mse,0.07353447934907477,exponential,4,sqrt,0.39902350670918263,4,2,0.44182311260576396,648,0.42112093823763697,0.0003453946464785479,COMPLETE
670,670,0.5,2023-04-05 06:27:36.503310,2023-04-05 06:27:38.605543,0 days 00:00:02.102233,0.3833436985235275,friedman_mse,0.0859239938396139,exponential,4,sqrt,0.37192755105182934,5,6,0.22990304581369078,576,0.34803904756522797,0.03179017978743112,COMPLETE
671,671,0.7600759844131856,2023-04-05 06:27:38.606478,2023-04-05 06:27:41.320802,0 days 00:00:02.714324,0.008851378263707637,friedman_mse,0.04924422367953173,exponential,7,sqrt,0.3532637643269428,4,4,0.014807795545811655,588,0.29169383683168465,0.01299443408518355,COMPLETE
672,672,0.6559100671840807,2023-04-05 06:27:41.321754,2023-04-05 06:27:44.470510,0 days 00:00:03.148756,0.10160077940857494,friedman_mse,0.0832150666056661,exponential,4,sqrt,0.41584553833982235,10,7,0.010493877013643666,608,0.41079229724367405,0.0002075122947292053,COMPLETE
673,673,0.7720169616160522,2023-04-05 06:27:44.471448,2023-04-05 06:27:47.708838,0 days 00:00:03.237390,0.00018664910570013457,friedman_mse,0.06289766524016999,exponential,4,sqrt,0.17658539852993438,5,7,0.019756479073881682,618,0.3016688229659365,0.0002677590067344919,COMPLETE
674,674,0.7730236807254725,2023-04-05 06:27:47.709776,2023-04-05 06:27:51.495683,0 days 00:00:03.785907,7.198064822006906e-05,friedman_mse,0.0725001890872928,exponential,4,sqrt,0.16869486948408471,5,5,0.021738777096231808,646,0.3335915511542768,0.0002776119148843973,COMPLETE
675,675,0.7266837395564831,2023-04-05 06:27:51.496487,2023-04-05 06:27:54.266987,0 days 00:00:02.770500,0.023014255034539938,friedman_mse,0.08427863744118685,exponential,4,sqrt,0.13478161091407795,5,5,0.09910337636605154,664,0.3319162445651772,0.0002614456346715991,COMPLETE
676,676,0.5,2023-04-05 06:27:54.267808,2023-04-05 06:27:56.246281,0 days 00:00:01.978473,0.14859763825278116,friedman_mse,0.06462452050810075,exponential,4,sqrt,0.18240454842784093,5,3,0.4431378305777548,648,0.3333312366112668,0.0003009545852665369,COMPLETE
677,677,0.5,2023-04-05 06:27:56.247078,2023-04-05 06:27:58.117592,0 days 00:00:01.870514,0.4064500116446595,squared_error,0.06440254320281111,exponential,4,sqrt,0.17265697514952716,5,2,0.08272480942840847,632,0.29888949332533565,0.00024500657741927844,COMPLETE
678,678,0.6229400462211727,2023-04-05 06:27:58.118426,2023-04-05 06:28:01.332277,0 days 00:00:03.213851,0.13020098459730242,friedman_mse,0.07611124160872,exponential,4,sqrt,0.15108670347670053,5,4,0.0003323684395062261,692,0.34363378533007577,0.00029427354125540026,COMPLETE
679,679,0.5,2023-04-05 06:28:01.333100,2023-04-05 06:28:03.323975,0 days 00:00:01.990875,0.4713557892118765,friedman_mse,0.07625080252714689,exponential,4,sqrt,0.1483118712413557,5,5,0.40475415593563213,647,0.32593096476818256,0.00021338778563415045,COMPLETE
680,680,0.755933832642398,2023-04-05 06:28:03.324815,2023-04-05 06:28:06.510261,0 days 00:00:03.185446,0.011348385417362513,friedman_mse,0.07987525536864257,exponential,4,sqrt,0.1626539828700912,5,2,0.02235964281236201,670,0.3892859269058499,0.00033825309796870205,COMPLETE
681,681,0.5,2023-04-05 06:28:06.511198,2023-04-05 06:28:08.390795,0 days 00:00:01.879597,0.31752579457400565,friedman_mse,0.06529638790669397,exponential,4,sqrt,0.16076816274157288,5,7,0.4509468444283754,631,0.3095620169726837,0.00026002581473062204,COMPLETE
682,682,0.5,2023-04-05 06:28:08.391681,2023-04-05 06:28:11.104253,0 days 00:00:02.712572,0.47382501281037115,friedman_mse,0.06733960850466592,exponential,4,sqrt,0.1936044927162722,5,3,0.015597764412427067,641,0.31161842227451036,0.09235382405785329,COMPLETE
683,683,0.5,2023-04-05 06:28:11.105064,2023-04-05 06:28:14.176686,0 days 00:00:03.071622,0.4992510160079547,friedman_mse,0.06043469503802436,exponential,4,sqrt,0.13379841751171256,5,5,0.007389681037427525,621,0.36820453378365364,0.000193412908651522,COMPLETE
684,684,0.5,2023-04-05 06:28:14.177514,2023-04-05 06:28:17.895996,0 days 00:00:03.718482,0.42218273507371085,friedman_mse,0.04369833503645953,exponential,4,log2,0.1821910907009238,5,5,0.014351332118122312,622,0.8457490425313584,0.004616583071618853,COMPLETE
685,685,0.5,2023-04-05 06:28:17.896828,2023-04-05 06:28:22.152804,0 days 00:00:04.255976,0.33979874739872296,friedman_mse,0.05028649195596589,exponential,4,sqrt,0.40975360322681637,5,4,0.023775472108525694,721,0.3212136773763547,0.07296751178322836,COMPLETE
686,686,0.5,2023-04-05 06:28:22.153743,2023-04-05 06:28:24.897956,0 days 00:00:02.744213,0.4033293020809047,friedman_mse,0.08108438766302001,exponential,4,sqrt,0.0719191167064987,5,4,0.009586656559000076,684,0.29822631162994606,0.0035874591131628305,COMPLETE
687,687,0.7570198648404989,2023-04-05 06:28:24.898897,2023-04-05 06:28:28.075764,0 days 00:00:03.176867,0.008566523505037131,friedman_mse,0.09470312207717019,exponential,4,sqrt,0.17352204946723285,5,6,4.7803403086672455e-05,654,0.27429415666361945,0.00038019725004544873,COMPLETE
688,688,0.6941378129230559,2023-04-05 06:28:28.076757,2023-04-05 06:28:29.716254,0 days 00:00:01.639497,0.00018342684199976726,friedman_mse,0.05711425588949001,exponential,4,sqrt,0.17304914204039212,5,7,0.2690093594909958,624,0.14850509114261273,0.0003001275531661967,COMPLETE
689,689,0.5,2023-04-05 06:28:29.717052,2023-04-05 06:28:32.406888,0 days 00:00:02.689836,0.22398125701345514,friedman_mse,0.06935089039401476,exponential,4,sqrt,0.14923404346162356,5,7,0.3538254545011391,666,0.9855932557818881,0.00022596944431618057,COMPLETE
690,690,0.7511377433373058,2023-04-05 06:28:32.407929,2023-04-05 06:28:35.435272,0 days 00:00:03.027343,0.019758800268082174,friedman_mse,0.08490082665943503,exponential,4,sqrt,0.08423593225822516,6,3,2.3902896036551505e-05,621,0.36484178510843795,0.005641853661156055,COMPLETE
691,691,0.5,2023-04-05 06:28:35.436180,2023-04-05 06:28:38.262143,0 days 00:00:02.825963,0.20264708509097717,friedman_mse,0.06354015798368462,exponential,4,sqrt,0.09710863349492421,5,6,0.023839559699561783,620,0.3416674759872591,0.04817084754755061,COMPLETE
692,692,0.6766110274378078,2023-04-05 06:28:38.263143,2023-04-05 06:28:40.519727,0 days 00:00:02.256584,0.08093241458864138,friedman_mse,0.09901192723724392,exponential,4,sqrt,0.1620677752943382,5,7,0.032745068272334456,595,0.258439816762449,0.053834568274420444,COMPLETE
693,693,0.5,2023-04-05 06:28:40.520672,2023-04-05 06:28:43.572314,0 days 00:00:03.051642,0.45058020584293546,friedman_mse,0.03875170302760533,exponential,9,sqrt,0.36294218288161995,4,8,0.2356337851604101,598,0.8700566292778389,0.007560071696761447,COMPLETE
694,694,0.5,2023-04-05 06:28:43.573115,2023-04-05 06:28:45.641038,0 days 00:00:02.067923,0.3737157955856725,friedman_mse,0.052352405203352,exponential,4,sqrt,0.154770497261497,6,8,0.0720661079808323,636,0.16803618511942,0.00017457128023099931,COMPLETE
695,695,0.5,2023-04-05 06:28:45.641861,2023-04-05 06:28:47.746250,0 days 00:00:02.104389,0.32385698887533637,friedman_mse,0.029377917416246034,exponential,4,sqrt,0.0752627731735283,5,5,0.1635003057176243,609,0.28289920281054315,0.0001010493353717903,COMPLETE
696,696,0.5,2023-04-05 06:28:47.747037,2023-04-05 06:28:51.369603,0 days 00:00:03.622566,0.3907603873644528,friedman_mse,0.08289319818905906,exponential,4,sqrt,0.3928410006716411,5,7,0.21173260753009462,642,0.958704486596316,0.0002770141519671075,COMPLETE
697,697,0.5,2023-04-05 06:28:51.370576,2023-04-05 06:28:56.713781,0 days 00:00:05.343205,0.29122477317395606,friedman_mse,0.055889803119839356,exponential,4,sqrt,0.1944032071945711,4,8,0.016825957251285814,675,0.9735367529105935,0.00033940297340708057,COMPLETE
698,698,0.5,2023-04-05 06:28:56.714708,2023-04-05 06:28:58.390110,0 days 00:00:01.675402,0.1601132873847797,squared_error,0.014526420528600424,exponential,4,sqrt,0.1800628996367097,7,8,0.25403724920173965,611,0.23268833711434966,0.04088387083917304,COMPLETE
699,699,0.7159486229509928,2023-04-05 06:28:58.391153,2023-04-05 06:28:59.880373,0 days 00:00:01.489220,0.030777694249003038,friedman_mse,0.07104823744326112,exponential,4,sqrt,0.3788852207144811,5,8,0.14518318575777442,592,0.13179055316263782,0.006457290902518007,COMPLETE
700,700,0.6321731677592449,2023-04-05 06:28:59.881452,2023-04-05 06:29:01.875715,0 days 00:00:01.994263,0.060834068893375684,friedman_mse,0.009711137310837902,exponential,4,sqrt,0.2201736345139745,4,7,0.1412884455102454,567,0.25421549743421323,0.004149429984251746,COMPLETE
701,701,0.7494481732735204,2023-04-05 06:29:01.876688,2023-04-05 06:29:06.134248,0 days 00:00:04.257560,0.016291951568771237,friedman_mse,0.041881129826031226,exponential,4,sqrt,0.13272419010217062,5,8,0.018037587816441634,603,0.7721386827216017,0.028995688716629806,COMPLETE
702,702,0.7602540341887943,2023-04-05 06:29:06.135175,2023-04-05 06:29:08.221167,0 days 00:00:02.085992,0.009098763367439155,friedman_mse,0.06590957454523642,exponential,4,sqrt,0.10005620465623517,5,8,0.008287150797594386,654,0.17869141803713448,0.0001586367693657609,COMPLETE
703,703,0.6642191669585011,2023-04-05 06:29:08.222130,2023-04-05 06:29:09.428938,0 days 00:00:01.206808,0.009062202751425349,friedman_mse,0.08513112192864346,exponential,4,log2,0.3392741210467302,3,7,0.3819002865479841,436,0.21687566515973944,0.00013655824494169415,COMPLETE
704,704,0.5,2023-04-05 06:29:09.429990,2023-04-05 06:29:10.776544,0 days 00:00:01.346554,0.2354931095136861,friedman_mse,0.01969688567335518,exponential,4,sqrt,0.17406226491723636,6,8,0.47678152955541575,561,0.1531215049441673,0.00023888545379663115,COMPLETE
705,705,0.7545645685621898,2023-04-05 06:29:10.777513,2023-04-05 06:29:16.375618,0 days 00:00:05.598105,0.0004222437064902496,friedman_mse,0.013947976411900528,exponential,4,sqrt,0.10435941453246517,4,2,0.12048857595956441,625,0.8118309152630655,0.033923046211141734,COMPLETE
706,706,0.6239849297478254,2023-04-05 06:29:16.376632,2023-04-05 06:29:18.224908,0 days 00:00:01.848276,0.024042703458725716,friedman_mse,0.010742980094437122,exponential,4,sqrt,0.19409975924606568,5,8,0.43313783392724203,426,0.9000585404152317,0.00039508662883943794,COMPLETE
707,707,0.774821826511688,2023-04-05 06:29:18.225882,2023-04-05 06:29:21.562920,0 days 00:00:03.337038,0.00010029720751570624,friedman_mse,0.04969600558790181,exponential,4,sqrt,0.140319674061446,4,3,0.027794198499776275,588,0.351965947792633,0.0006898676488313076,COMPLETE
708,708,0.7363108967919973,2023-04-05 06:29:21.563867,2023-04-05 06:29:23.483751,0 days 00:00:01.919884,0.04022621913120445,friedman_mse,0.050388545368602426,exponential,4,sqrt,0.1405621647790547,5,3,0.03271483096034167,405,0.34193912710841645,0.0007299897521742956,COMPLETE
709,709,0.5966593365279397,2023-04-05 06:29:23.485024,2023-04-05 06:29:26.292224,0 days 00:00:02.807200,0.14472667963343017,friedman_mse,0.058818866370625195,exponential,4,sqrt,0.15256290159489372,5,4,0.059382600692229226,608,0.3698981052640542,0.0006482343719531446,COMPLETE
710,710,0.6260631565831793,2023-04-05 06:29:26.293054,2023-04-05 06:29:28.132013,0 days 00:00:01.838959,0.019039350592365008,friedman_mse,0.07529786508422193,exponential,4,sqrt,0.17596647804389287,4,3,0.4595916834931034,444,0.7565903724080989,0.0007683117397840482,COMPLETE
711,711,0.5,2023-04-05 06:29:28.132986,2023-04-05 06:29:29.755568,0 days 00:00:01.622582,0.3598003450576538,friedman_mse,0.06219658546456739,exponential,4,sqrt,0.1313607812524194,6,3,0.19521376660251205,424,0.32113235982030663,0.0009061165742226141,COMPLETE
712,712,0.5,2023-04-05 06:29:29.756589,2023-04-05 06:29:32.333570,0 days 00:00:02.576981,0.2575553050495673,friedman_mse,0.049441251301487445,exponential,4,sqrt,0.1459710881577048,5,7,0.1699978763506838,649,0.35410926781227164,0.0007137447607969973,COMPLETE
713,713,0.6912885027462019,2023-04-05 06:29:32.334586,2023-04-05 06:29:34.593558,0 days 00:00:02.258972,0.0001981539387459887,friedman_mse,0.011203199039806367,exponential,4,sqrt,0.11285082379951512,7,5,0.24483142092566249,548,0.3442316998875127,0.004766024074793316,COMPLETE
714,714,0.5,2023-04-05 06:29:34.594609,2023-04-05 06:29:37.373294,0 days 00:00:02.778685,0.21497012044614602,friedman_mse,0.09974859112757867,exponential,4,sqrt,0.13697033930798422,4,3,0.024261720383973565,579,0.3858756196529453,0.002603173993793046,COMPLETE
715,715,0.5,2023-04-05 06:29:37.374279,2023-04-05 06:29:39.295174,0 days 00:00:01.920895,0.031467437172646266,squared_error,0.0442891186505841,exponential,4,sqrt,0.20518846544499608,5,3,0.3242479881100518,626,0.3277413786299831,0.000577939211565245,COMPLETE
716,716,0.5,2023-04-05 06:29:39.296000,2023-04-05 06:29:43.517807,0 days 00:00:04.221807,0.41270305701090143,friedman_mse,0.06963421756205083,exponential,4,sqrt,0.14404227054569166,8,3,0.03311122202581661,603,0.739089997031992,0.0008128060060058115,COMPLETE
717,717,0.7549511492791455,2023-04-05 06:29:43.518758,2023-04-05 06:29:45.689092,0 days 00:00:02.170334,0.016447797579739902,friedman_mse,0.07875455465740978,exponential,4,sqrt,0.2018831993410663,5,3,0.04210073276404077,405,0.3036928842861075,0.025732333491996974,COMPLETE
718,718,0.5,2023-04-05 06:29:45.690110,2023-04-05 06:29:50.442030,0 days 00:00:04.751920,0.2752498404382433,friedman_mse,0.03167959897975885,exponential,4,sqrt,0.19205801507435777,4,3,0.04993254487571016,586,0.9294798300012337,0.0005977024421915878,COMPLETE
719,719,0.5,2023-04-05 06:29:50.442870,2023-04-05 06:29:53.658330,0 days 00:00:03.215460,0.3314017918676617,friedman_mse,0.008595965509137566,exponential,4,sqrt,0.346977199746867,5,3,0.023034455591732957,423,0.7746667423568627,0.0034504440972779743,COMPLETE
