,number,value,datetime_start,datetime_complete,duration,params_ccp_alpha,params_criterion,params_learning_rate,params_loss,params_max_depth,params_max_features,params_min_impurity_decrease,params_min_samples_leaf,params_min_samples_split,params_min_weight_fraction_leaf,params_n_estimators,params_subsample,params_tol,state
720,720,0.7544713484800833,2023-04-05 06:29:53.659161,2023-04-05 06:29:56.693665,0 days 00:00:03.034504,0.008888490063791277,friedman_mse,0.013547949035350382,exponential,4,sqrt,0.1193304915891561,6,7,0.06769549821072193,398,0.8397047029759871,0.022469096211303385,COMPLETE
721,721,0.6777856367550092,2023-04-05 06:29:56.694476,2023-04-05 06:30:02.178014,0 days 00:00:05.483538,0.07743366887397435,friedman_mse,0.010594762826731196,exponential,4,sqrt,0.16832338959678927,3,3,0.03554587126944938,748,0.8754576985829622,0.047477582453667934,COMPLETE
722,722,0.632714103018278,2023-04-05 06:30:02.178949,2023-04-05 06:30:03.909402,0 days 00:00:01.730453,0.04942701768225266,friedman_mse,0.009655570316605064,exponential,4,sqrt,0.10566878306307237,4,6,0.3049489373542591,641,0.20932485153155772,0.06470981530035234,COMPLETE
723,723,0.7526456588941794,2023-04-05 06:30:03.910413,2023-04-05 06:30:06.721393,0 days 00:00:02.810980,0.00824868527895779,friedman_mse,0.05602041418727262,exponential,4,sqrt,0.2161829018862264,4,3,0.09096027875535545,614,0.3755697767676612,0.007336349453032816,COMPLETE
724,724,0.6896503279890751,2023-04-05 06:30:06.722417,2023-04-05 06:30:09.229479,0 days 00:00:02.507062,0.02351625557861614,friedman_mse,0.06608155610112511,exponential,4,log2,0.3317584441790117,5,7,0.18705372468448667,546,0.8208369906078452,0.005195285302064399,COMPLETE
725,725,0.7567639490187994,2023-04-05 06:30:09.230490,2023-04-05 06:30:11.519324,0 days 00:00:02.288834,0.0005476064741193306,friedman_mse,0.00020301940636025074,exponential,4,sqrt,0.3635236816265915,7,4,0.019463272175785917,385,0.3546968751579782,0.05447768864359364,COMPLETE
726,726,0.5,2023-04-05 06:30:11.520283,2023-04-05 06:30:13.681325,0 days 00:00:02.161042,0.17210359080411716,friedman_mse,0.000397469045523332,exponential,4,sqrt,0.3205744098641765,5,7,0.2558524149390028,452,0.7975889369754383,0.000450998564304737,COMPLETE
727,727,0.7574106664187563,2023-04-05 06:30:13.682361,2023-04-05 06:30:15.561051,0 days 00:00:01.878690,0.016075983399444334,friedman_mse,0.01579361219492731,exponential,4,sqrt,0.3851407925259116,4,7,1.1414734590456643e-05,572,0.18518698626538008,0.0008925732160474393,COMPLETE
728,728,0.6229400462211727,2023-04-05 06:30:15.562107,2023-04-05 06:30:18.012314,0 days 00:00:02.450207,0.12508095375228095,friedman_mse,0.007154942632483431,exponential,4,sqrt,0.1293544857599664,5,8,0.01190841829161985,595,0.2747498095715785,0.03548851629204966,COMPLETE
729,729,0.7541596171429472,2023-04-05 06:30:18.013828,2023-04-05 06:30:19.837637,0 days 00:00:01.823809,0.009049714132781984,friedman_mse,0.0009611600058124769,exponential,4,sqrt,0.14680628615460908,5,6,0.02800041422260781,407,0.23033018694350374,0.00962221757900426,COMPLETE
730,730,0.5,2023-04-05 06:30:19.838597,2023-04-05 06:30:22.560938,0 days 00:00:02.722341,0.11831516415021716,friedman_mse,0.044227900611167964,exponential,4,sqrt,0.15877964277493578,6,7,0.4596064605234635,665,0.9514718330979414,0.003943878926502612,COMPLETE
731,731,0.7643946511467401,2023-04-05 06:30:22.561926,2023-04-05 06:30:24.803731,0 days 00:00:02.241805,0.00031670846155480134,friedman_mse,0.08518300762461738,exponential,4,sqrt,0.21165042616550145,4,8,0.11402808922058386,438,0.40453561758676937,0.03122112025791039,COMPLETE
732,732,0.7755604018199167,2023-04-05 06:30:24.804725,2023-04-05 06:30:26.681301,0 days 00:00:01.876576,0.0003371815830380628,friedman_mse,0.058324197243316916,exponential,4,sqrt,0.16532937596141267,4,8,0.05321471400912431,451,0.17230195688326813,0.04281471870236898,COMPLETE
733,733,0.5,2023-04-05 06:30:26.682311,2023-04-05 06:30:28.125409,0 days 00:00:01.443098,0.434385102139972,friedman_mse,0.049468101184241386,exponential,4,sqrt,0.16442100737173232,4,8,0.050560982095127896,455,0.1712930425169087,0.04645982534030433,COMPLETE
734,734,0.5,2023-04-05 06:30:28.126400,2023-04-05 06:30:29.744180,0 days 00:00:01.617780,0.03560817597178614,squared_error,0.0581283502764693,exponential,4,sqrt,0.12309595409288725,4,8,0.15125665451397302,451,0.18163146588410883,0.041611877915261164,COMPLETE
735,735,0.7545647216431848,2023-04-05 06:30:29.745292,2023-04-05 06:30:31.250812,0 days 00:00:01.505520,0.01721462612278551,friedman_mse,0.06503354020264521,exponential,4,sqrt,0.1682271295783347,4,8,0.043251957561136235,432,0.20241218517503107,0.04105319614310779,COMPLETE
736,736,0.745376492800262,2023-04-05 06:30:31.251787,2023-04-05 06:30:34.806107,0 days 00:00:03.554320,0.027488039313881826,friedman_mse,0.037946102982346505,exponential,4,sqrt,0.30552043020967606,4,8,0.03630084076878321,447,0.9144909571546618,0.03685398224496323,COMPLETE
737,737,0.5,2023-04-05 06:30:34.807088,2023-04-05 06:30:35.901396,0 days 00:00:01.094308,0.45773449105439296,friedman_mse,0.05428082639788988,exponential,4,sqrt,0.17761187225792013,4,8,0.33991431386286464,467,0.12179465815412588,0.054439770371343794,COMPLETE
738,738,0.7068662503978913,2023-04-05 06:30:35.902387,2023-04-05 06:30:37.736843,0 days 00:00:01.834456,0.0657193048804397,friedman_mse,0.07898017283498135,exponential,4,sqrt,0.1635436902418124,4,8,0.06180282287211602,632,0.16621587565950657,0.031049234816670167,COMPLETE
739,739,0.5,2023-04-05 06:30:37.737874,2023-04-05 06:30:39.145258,0 days 00:00:01.407384,0.3432866740983161,friedman_mse,0.04194552706103592,exponential,4,sqrt,0.05233723653413565,4,8,0.014337399669965235,419,0.18401113971969815,0.00017059071179164657,COMPLETE
740,740,0.6611156689108383,2023-04-05 06:30:39.146256,2023-04-05 06:30:41.095817,0 days 00:00:01.949561,0.0003730682543899051,friedman_mse,0.00013233396415359032,exponential,4,sqrt,0.22950129067782363,4,8,0.22899605844134147,556,0.2419190581822731,0.0006972352845104783,COMPLETE
741,741,0.5,2023-04-05 06:30:41.096762,2023-04-05 06:30:43.571398,0 days 00:00:02.474636,0.48839447776160017,friedman_mse,0.011957031165026015,exponential,4,sqrt,0.18655199054248758,4,8,0.15670713861801225,442,0.6951148919654824,0.0005456570081125467,COMPLETE
742,742,0.5,2023-04-05 06:30:43.572418,2023-04-05 06:30:45.743014,0 days 00:00:02.170596,0.18904578726354157,friedman_mse,0.07193910555945146,exponential,5,log2,0.3704877218007684,3,8,0.3419558282832841,610,0.85486394071793,0.00035245394375339403,COMPLETE
743,743,0.5,2023-04-05 06:30:45.743971,2023-04-05 06:30:47.845481,0 days 00:00:02.101510,0.3930961157472269,friedman_mse,0.000678040994645785,exponential,4,sqrt,0.1164872291005389,8,7,0.08342008031306683,585,0.22164599511718244,0.0028402229907180583,COMPLETE
744,744,0.754967836075132,2023-04-05 06:30:47.846339,2023-04-05 06:30:52.454127,0 days 00:00:04.607788,0.013595317851616792,friedman_mse,0.008636980929605888,exponential,4,sqrt,0.15640396960521047,4,8,0.028252546040125604,564,0.9296254845664239,0.027140107254586553,COMPLETE
745,745,0.630703501471616,2023-04-05 06:30:52.455118,2023-04-05 06:30:53.800372,0 days 00:00:01.345254,0.1083953760981027,friedman_mse,0.0523355786808317,exponential,4,sqrt,0.13009716202436947,5,7,0.1374104819539757,485,0.14520856033702892,0.00011551426097871354,COMPLETE
746,746,0.5,2023-04-05 06:30:53.801386,2023-04-05 06:30:56.013028,0 days 00:00:02.211642,0.30967543690648175,friedman_mse,0.017279026732805045,exponential,4,sqrt,0.09859844281948832,7,8,0.009219669257739153,682,0.20392231884277723,0.006320745197468658,COMPLETE
747,747,0.7594637008818701,2023-04-05 06:30:56.014020,2023-04-05 06:30:58.267120,0 days 00:00:02.253100,0.009884541603888223,friedman_mse,0.06485930210856815,exponential,4,sqrt,0.1460771154522061,4,3,0.0545815789449372,531,0.3169834598070512,0.0001281124866218,COMPLETE
748,748,0.7449271216756566,2023-04-05 06:30:58.268093,2023-04-05 06:30:59.718283,0 days 00:00:01.450190,0.02307003983206254,friedman_mse,0.08799907632860801,exponential,4,sqrt,0.07586451992977229,5,8,0.03758838184585779,457,0.168998940174447,0.04114374248548492,COMPLETE
749,749,0.7732282037802539,2023-04-05 06:30:59.719273,2023-04-05 06:31:01.850235,0 days 00:00:02.130962,0.00030004269664697555,friedman_mse,0.013321551626250197,exponential,4,sqrt,0.12519036870105493,5,8,0.021961121978725913,425,0.2631617699803174,0.004569185009878308,COMPLETE
750,750,0.5,2023-04-05 06:31:01.851085,2023-04-05 06:31:05.250085,0 days 00:00:03.399000,0.2024226734992931,friedman_mse,0.014770384334567855,exponential,4,sqrt,0.1156577070446919,5,8,0.025363805235144983,424,0.8817650507425897,0.004847319190410099,COMPLETE
751,751,0.5,2023-04-05 06:31:05.250909,2023-04-05 06:31:07.148929,0 days 00:00:01.898020,0.22593032828261211,friedman_mse,0.00022505799519186107,exponential,4,sqrt,0.12213547166290865,5,8,0.3894178502364224,413,0.6576952325475841,0.005835766067838888,COMPLETE
752,752,0.691552760524928,2023-04-05 06:31:07.149782,2023-04-05 06:31:08.607622,0 days 00:00:01.457840,0.009781182621576297,friedman_mse,0.012481776025248796,exponential,5,sqrt,0.4006743771954944,5,8,0.2084403894047493,401,0.2637125876812574,0.003746810423334708,COMPLETE
753,753,0.6777856367550092,2023-04-05 06:31:08.608438,2023-04-05 06:31:11.824752,0 days 00:00:03.216314,0.08372919429061254,friedman_mse,0.013999720903527328,exponential,4,sqrt,0.12186893299792703,5,8,0.04230824506104589,421,0.8996229773000883,0.004807846315772544,COMPLETE
754,754,0.5,2023-04-05 06:31:11.825575,2023-04-05 06:31:14.280935,0 days 00:00:02.455360,0.35206874352393036,friedman_mse,0.01019362799261518,exponential,4,sqrt,0.1401327254682402,5,8,0.03027243635203075,634,0.2787493047508193,0.00043700202472932924,COMPLETE
755,755,0.5455893287974873,2023-04-05 06:31:14.281803,2023-04-05 06:31:16.695570,0 days 00:00:02.413767,7.086652321913124e-05,squared_error,0.011813944018645698,exponential,4,sqrt,0.13171104693524885,5,8,0.01757003298052765,590,0.9946378688980198,0.06978452151662198,COMPLETE
756,756,0.7500549597963837,2023-04-05 06:31:16.696456,2023-04-05 06:31:20.263657,0 days 00:00:03.567201,0.017607558276693226,friedman_mse,0.000473249975098727,exponential,4,sqrt,0.1535204204406616,5,8,0.07050681165656247,435,0.9405575089293765,0.0043697046585601486,COMPLETE
757,757,0.5,2023-04-05 06:31:20.264530,2023-04-05 06:31:22.124894,0 days 00:00:01.860364,0.25978686585113536,friedman_mse,0.013097545058276991,exponential,4,sqrt,0.11057717016560843,5,8,0.41757505292772484,619,0.30235211297764153,0.058475855447341844,COMPLETE
758,758,0.632714103018278,2023-04-05 06:31:22.125840,2023-04-05 06:31:23.839163,0 days 00:00:01.713323,0.045257912186720595,friedman_mse,0.016827160615840334,exponential,4,sqrt,0.12670316721871316,6,8,0.3200763018152023,604,0.220805609642939,0.005621765161387667,COMPLETE
759,759,0.7639743802208251,2023-04-05 06:31:23.840038,2023-04-05 06:31:25.814191,0 days 00:00:01.974153,1.2531837979760051e-05,friedman_mse,0.007980854229052757,exponential,4,sqrt,0.4199765609283911,5,8,0.05188274066098845,374,0.29491308547125067,0.04975196410262416,COMPLETE
760,760,0.5,2023-04-05 06:31:25.815207,2023-04-05 06:31:28.163461,0 days 00:00:02.348254,0.09716304674788018,friedman_mse,0.028990028331502903,exponential,4,sqrt,0.20434493443360707,5,7,0.16979695416810864,399,0.8640824910894824,0.09654930583024572,COMPLETE
761,761,0.5,2023-04-05 06:31:28.164324,2023-04-05 06:31:30.799687,0 days 00:00:02.635363,0.17654680200981168,friedman_mse,0.009444382533417076,exponential,4,log2,0.3816491687983935,4,8,0.17794324018333807,651,0.502622828061323,0.000484613867699577,COMPLETE
762,762,0.7445426155242311,2023-04-05 06:31:30.800541,2023-04-05 06:31:32.698386,0 days 00:00:01.897845,0.030270901017419645,friedman_mse,0.074943774143507,exponential,4,sqrt,0.16960292382073414,5,7,0.019549560591305085,571,0.19705462158632586,0.020969321619155375,COMPLETE
763,763,0.5,2023-04-05 06:31:32.699226,2023-04-05 06:31:34.018390,0 days 00:00:01.319164,0.15802113350032163,friedman_mse,0.021728702391435435,exponential,4,sqrt,0.39314112728194356,2,8,0.4978033577385656,429,0.26167527902173154,0.003192552146761116,COMPLETE
764,764,0.5,2023-04-05 06:31:34.019447,2023-04-05 06:31:35.732969,0 days 00:00:01.713522,0.24224658463878052,friedman_mse,0.0003106280526904026,exponential,4,sqrt,0.0381282146644375,5,3,0.29793114492221956,411,0.2477450705697157,0.0023770939284516275,COMPLETE
765,765,0.6229400462211727,2023-04-05 06:31:35.734059,2023-04-05 06:31:38.870635,0 days 00:00:03.136576,0.13193333734308127,friedman_mse,0.058536101517816644,exponential,4,sqrt,0.3747291234302086,6,8,0.00013802970283552547,380,0.7112225007126892,0.0003138822065869039,COMPLETE
766,766,0.75775175130823,2023-04-05 06:31:38.871626,2023-04-05 06:31:40.672602,0 days 00:00:01.800976,0.010624298428464187,friedman_mse,0.018742705573672996,exponential,4,sqrt,0.36027965622690544,4,6,0.03862058497568237,541,0.16001734267772288,0.00019165712179592808,COMPLETE
767,767,0.6668019699997298,2023-04-05 06:31:40.673575,2023-04-05 06:31:41.703995,0 days 00:00:01.030420,0.019216036443372664,friedman_mse,0.011075036230874332,exponential,4,sqrt,0.4104674295462485,3,4,0.2631978501004573,395,0.13238364665890515,0.007070054074158166,COMPLETE
768,768,0.5,2023-04-05 06:31:41.704975,2023-04-05 06:31:43.288501,0 days 00:00:01.583526,0.1385387113064043,friedman_mse,0.0068945317903289826,exponential,4,sqrt,0.09375063241865692,5,8,0.2931172858680725,607,0.187681082426499,0.000589219620766901,COMPLETE
769,769,0.5,2023-04-05 06:31:43.289346,2023-04-05 06:31:45.510013,0 days 00:00:02.220667,0.1978374346206024,friedman_mse,0.05134559903397221,exponential,4,sqrt,0.14388324927923604,4,7,0.02570607660086968,632,0.22409699070715017,0.00039452424478976516,COMPLETE
770,770,0.6912231469450185,2023-04-05 06:31:45.510839,2023-04-05 06:31:47.851377,0 days 00:00:02.340538,0.009512077390294006,friedman_mse,0.09784169982511463,exponential,4,sqrt,0.1786516625411902,5,8,0.21579036472175916,440,0.8295514903030865,0.03411967560368885,COMPLETE
771,771,0.705376664868621,2023-04-05 06:31:47.852357,2023-04-05 06:31:49.928462,0 days 00:00:02.076105,0.025077279932701365,friedman_mse,0.014746637536307328,exponential,4,sqrt,0.3846699694518938,4,2,0.18146742334644272,577,0.20664914895198505,0.00023240123540317303,COMPLETE
772,772,0.5,2023-04-05 06:31:49.929481,2023-04-05 06:31:53.750786,0 days 00:00:03.821305,0.4120882381382844,friedman_mse,0.00120512859598081,exponential,5,sqrt,0.37353483485017996,5,8,0.0111889070665422,373,0.9468048545344774,0.0026076973771668338,COMPLETE
773,773,0.5,2023-04-05 06:31:53.752354,2023-04-05 06:31:56.375874,0 days 00:00:02.623520,0.4778584436310029,friedman_mse,0.008958104487242036,exponential,4,sqrt,0.10815341261608834,4,7,0.0325532927414309,424,0.48426083461606095,0.0041043997381416675,COMPLETE
774,774,0.7249844352264643,2023-04-05 06:31:56.377683,2023-04-05 06:31:58.676729,0 days 00:00:02.299046,0.008974649118380713,friedman_mse,0.0638157935014423,exponential,4,sqrt,0.3534876309792978,5,8,0.1496178240220622,590,0.2852076876381167,0.024322949070279716,COMPLETE
775,775,0.5,2023-04-05 06:31:58.677758,2023-04-05 06:32:01.074007,0 days 00:00:02.396249,0.42703400962140353,squared_error,0.0415195063362939,exponential,4,sqrt,0.019243508673180892,6,8,0.01740486257895815,405,0.9044921587523279,0.0006753963767399619,COMPLETE
776,776,0.66080547789079,2023-04-05 06:32:01.074970,2023-04-05 06:32:03.676826,0 days 00:00:02.601856,0.00021127199163448177,friedman_mse,0.00028898501251281534,exponential,4,sqrt,0.13785609150190037,5,7,0.23814307383643052,559,0.46278726390003155,0.005414340079373221,COMPLETE
777,777,0.5,2023-04-05 06:32:03.677876,2023-04-05 06:32:05.207375,0 days 00:00:01.529499,0.18005943371192956,friedman_mse,0.03407477903235635,exponential,4,sqrt,0.3676089664332755,4,8,0.00022960631124077993,383,0.23858716850938275,0.0005298808428809305,COMPLETE
778,778,0.7418577322588562,2023-04-05 06:32:05.208400,2023-04-05 06:32:06.578951,0 days 00:00:01.370551,0.0349122682559523,friedman_mse,0.07880989531063788,exponential,4,sqrt,0.4243384518681711,5,8,0.025226150659118513,440,0.14511120757933482,0.06875579339857459,COMPLETE
779,779,0.6777856367550092,2023-04-05 06:32:06.579941,2023-04-05 06:32:09.251405,0 days 00:00:02.671464,0.09035834107304619,friedman_mse,0.013083959572650138,exponential,4,sqrt,0.3410320902929057,4,7,0.04759212619736994,619,0.3227957036909878,0.008288936302163954,COMPLETE
780,780,0.7747746349356549,2023-04-05 06:32:09.252297,2023-04-05 06:32:11.979102,0 days 00:00:02.726805,6.757151574452992e-05,friedman_mse,0.010152391848365278,exponential,4,log2,0.394599582153924,7,8,0.009658944142649731,659,0.16608585300404516,0.01855098838089967,COMPLETE
781,781,0.5,2023-04-05 06:32:11.979957,2023-04-05 06:32:13.524837,0 days 00:00:01.544880,0.27033054389828154,friedman_mse,0.00011462296508030936,exponential,4,log2,0.18890709258810479,7,8,0.4816530458270722,672,0.17602230845878628,0.019184440032915032,COMPLETE
782,782,0.5,2023-04-05 06:32:13.525721,2023-04-05 06:32:15.965192,0 days 00:00:02.439471,0.24713025813712802,friedman_mse,0.0005248995367430609,exponential,4,log2,0.35807444256568194,7,8,0.4303218140007987,713,0.9198329701983903,0.027130122513921228,COMPLETE
783,783,0.7551749143673063,2023-04-05 06:32:15.966062,2023-04-05 06:32:17.975977,0 days 00:00:02.009915,0.017300335476894184,friedman_mse,0.011749347149530737,exponential,4,log2,0.19967893625100208,7,8,0.008455612267052845,665,0.18987509399164976,0.021831655633317813,COMPLETE
784,784,0.5,2023-04-05 06:32:17.976823,2023-04-05 06:32:20.141507,0 days 00:00:02.164684,0.33066446354252516,friedman_mse,0.009945407055244462,exponential,4,log2,0.38731748801993426,7,8,0.009295657405172651,644,0.25289199583910227,0.017217948784664556,COMPLETE
785,785,0.7352901321917995,2023-04-05 06:32:20.142548,2023-04-05 06:32:22.202184,0 days 00:00:02.059636,0.008020703751781861,friedman_mse,0.007856358162324849,exponential,4,log2,0.1628889778425191,7,8,0.10085531975849121,646,0.2106721682337489,0.014746700524090802,COMPLETE
786,786,0.5,2023-04-05 06:32:22.203608,2023-04-05 06:32:23.909029,0 days 00:00:01.705421,0.11889389063191871,friedman_mse,0.010344342060163419,exponential,4,log2,0.4083649374245035,7,8,0.20325174771431326,686,0.16460218999589032,0.0007894483636044968,COMPLETE
787,787,0.6781336469135042,2023-04-05 06:32:23.910081,2023-04-05 06:32:26.703600,0 days 00:00:02.793519,0.015555400199791677,friedman_mse,0.009078866514993249,exponential,4,sqrt,0.22256181790474588,7,8,0.25219931823725533,670,0.5163669550678038,0.01831847325490794,COMPLETE
788,788,0.7103340732834336,2023-04-05 06:32:26.704651,2023-04-05 06:32:29.960347,0 days 00:00:03.255696,0.025855909319295114,friedman_mse,0.0008488199996913503,exponential,4,log2,0.3486155002259339,7,8,0.11599498231708064,659,0.6511622075804965,0.0001475717505406542,COMPLETE
789,789,0.5,2023-04-05 06:32:29.961273,2023-04-05 06:32:31.955735,0 days 00:00:01.994462,0.3580272099046707,friedman_mse,0.011227305378314395,exponential,4,log2,0.12735053349016168,4,8,0.018358947372628574,696,0.1911870562288604,0.020971254175314768,COMPLETE
790,790,0.6326715122799966,2023-04-05 06:32:31.956777,2023-04-05 06:32:33.781736,0 days 00:00:01.824959,7.665680473337172e-05,friedman_mse,0.01506908474580122,exponential,5,log2,0.3759779796687426,5,8,0.45438430076774916,615,0.33883173746297146,0.0020539972716948933,COMPLETE
791,791,0.5,2023-04-05 06:32:33.782615,2023-04-05 06:32:37.336495,0 days 00:00:03.553880,0.2946224309795244,friedman_mse,0.008183409769167663,exponential,4,log2,0.3349829670537686,5,8,0.03435561905801071,643,0.6750939448050779,0.00647188213446509,COMPLETE
792,792,0.5,2023-04-05 06:32:37.337509,2023-04-05 06:32:39.468796,0 days 00:00:02.131287,0.01005043712389114,squared_error,0.0064144841566981066,exponential,4,log2,0.4288062124544505,4,8,0.13245036842711372,599,0.7901359026397106,0.00021250775795503523,COMPLETE
793,793,0.5,2023-04-05 06:32:39.469850,2023-04-05 06:32:41.883479,0 days 00:00:02.413629,0.3023351486202353,friedman_mse,0.013433480295312288,exponential,4,log2,0.3645279441436421,4,8,0.27003548568320285,641,0.7241244642612705,0.01139209719682594,COMPLETE
794,794,0.7736615478703059,2023-04-05 06:32:41.884327,2023-04-05 06:32:45.755654,0 days 00:00:03.871327,0.0001187507846903882,friedman_mse,0.04867528451210717,exponential,4,log2,0.3884972131243816,5,8,0.058387959722995195,685,0.8456181522783075,0.00018600665056844474,COMPLETE
795,795,0.7089931066949856,2023-04-05 06:32:45.756687,2023-04-05 06:32:49.860008,0 days 00:00:04.103321,0.05011519827029754,friedman_mse,0.049998466974972046,exponential,4,log2,0.3955493465312127,5,3,0.056496322646114185,708,0.8398727192274059,0.00018082893762532605,COMPLETE
796,796,0.5,2023-04-05 06:32:49.861111,2023-04-05 06:32:53.724624,0 days 00:00:03.863513,0.16580311148205784,friedman_mse,0.03668969176975285,exponential,4,log2,0.38591171874800223,5,8,0.05503925638204341,651,0.8550312376050507,0.003485746512875661,COMPLETE
797,797,0.7528992267049117,2023-04-05 06:32:53.725514,2023-04-05 06:32:58.168170,0 days 00:00:04.442656,0.017045257830051896,friedman_mse,0.04927471719851367,exponential,4,log2,0.09140584964516983,5,8,0.044717794132692106,697,0.814097167879174,0.0002510436008065154,COMPLETE
798,798,0.5,2023-04-05 06:32:58.169057,2023-04-05 06:33:03.279960,0 days 00:00:05.110903,0.3258267339886244,friedman_mse,0.059095867414178056,exponential,4,log2,0.4003066827316465,5,8,0.06090530030118884,681,0.8881564913067679,0.0434907401344462,COMPLETE
799,799,0.7297317641859354,2023-04-05 06:33:03.280838,2023-04-05 06:33:05.691895,0 days 00:00:02.411057,0.0394959101694955,friedman_mse,0.06968766042725562,exponential,4,log2,0.3771398332969087,5,8,0.06506240788876748,673,0.3017045004137498,0.00019384883635363028,COMPLETE
