,number,value,datetime_start,datetime_complete,duration,params_ccp_alpha,params_criterion,params_learning_rate,params_loss,params_max_depth,params_max_features,params_min_impurity_decrease,params_min_samples_leaf,params_min_samples_split,params_min_weight_fraction_leaf,params_n_estimators,params_subsample,params_tol,state
158,158,0.7569292273352354,2023-04-05 06:07:29.184703,2023-04-05 06:07:32.118617,0 days 00:00:02.933914,0.0007010690362703351,friedman_mse,0.0013818477039434665,log_loss,4,sqrt,0.46950979107886437,9,9,0.021498895492924264,403,0.5925276884056608,0.001536627511504793,COMPLETE
159,159,0.7579109326623568,2023-04-05 06:07:32.119239,2023-04-05 06:07:36.489335,0 days 00:00:04.370096,0.0004784062804654277,friedman_mse,0.001972757423800496,log_loss,4,sqrt,0.46820959261910094,9,9,0.039222311439788674,449,0.6610241658785199,0.0012460366645359133,COMPLETE
160,160,0.7576459742227061,2023-04-05 06:07:36.490088,2023-04-05 06:07:40.340972,0 days 00:00:03.850884,0.0008148175606312851,friedman_mse,0.0019154066894450617,log_loss,4,sqrt,0.46932055910281945,9,8,0.01997321842155529,446,0.6586388407709499,0.0015182543113562356,COMPLETE
161,161,0.5,2023-04-05 06:07:40.341710,2023-04-05 06:07:43.295010,0 days 00:00:02.953300,0.029381540196194496,friedman_mse,0.0020220937867195584,log_loss,4,sqrt,0.46909698980470604,9,8,0.023379513043883866,448,0.6360516927523014,0.001209579099953948,COMPLETE
162,162,0.7614054713759295,2023-04-05 06:07:43.295714,2023-04-05 06:07:47.075150,0 days 00:00:03.779436,6.800382237114139e-05,friedman_mse,0.0019116034104013236,log_loss,4,sqrt,0.4689001249269948,9,9,0.03528336010353219,506,0.6622965155431682,0.0015540210704518922,COMPLETE
163,163,0.7581083696588062,2023-04-05 06:07:47.075818,2023-04-05 06:07:50.026773,0 days 00:00:02.950955,0.0001287231018744934,friedman_mse,0.0013043321504584563,log_loss,4,sqrt,0.46740193482337034,9,9,0.038792523934647195,399,0.6712071830653206,0.0014760926302426825,COMPLETE
164,164,0.7567748253109812,2023-04-05 06:07:50.027462,2023-04-05 06:07:53.714817,0 days 00:00:03.687355,0.0006462115306324002,friedman_mse,0.0011475148010293883,log_loss,4,sqrt,0.4435322840133397,9,9,0.038386844992285715,506,0.663384225306372,0.0012547231785150618,COMPLETE
165,165,0.6229400462211727,2023-04-05 06:07:53.715498,2023-04-05 06:07:56.572288,0 days 00:00:02.856790,0.021416478451011123,friedman_mse,0.0015314490102384143,log_loss,4,sqrt,0.46392013887708017,9,9,0.040133360891651246,446,0.6695026134564023,0.0009728266738214908,COMPLETE
166,166,0.6229400462211727,2023-04-05 06:07:56.572923,2023-04-05 06:07:59.462891,0 days 00:00:02.889968,0.02140735866299225,friedman_mse,0.0019197465675852658,log_loss,4,sqrt,0.4294376534798875,9,8,0.05332222367538059,460,0.6162934312055786,0.0017513975035570175,COMPLETE
167,167,0.5,2023-04-05 06:07:59.463586,2023-04-05 06:08:03.356652,0 days 00:00:03.893066,0.032980335110251495,friedman_mse,0.0013595936061181855,log_loss,4,sqrt,0.45634404522913513,9,9,0.03117061694576194,527,0.6785060153484743,0.0014530367068717116,COMPLETE
168,168,0.6229400462211727,2023-04-05 06:08:03.357351,2023-04-05 06:08:07.554068,0 days 00:00:04.196717,0.020513351707999943,friedman_mse,0.0018474754569604867,log_loss,4,sqrt,0.4384308758208862,9,9,0.01909054383901793,571,0.6847907485388692,0.0012490231060331447,COMPLETE
169,169,0.5,2023-04-05 06:08:07.554843,2023-04-05 06:08:09.628150,0 days 00:00:02.073307,0.0018953494363937039,squared_error,0.0022215595399540447,log_loss,4,sqrt,0.4813627831567869,9,9,0.0356984341207613,498,0.6425918619266233,0.001789493667448254,COMPLETE
170,170,0.5,2023-04-05 06:08:09.628847,2023-04-05 06:08:12.237207,0 days 00:00:02.608360,0.031258113446914995,friedman_mse,0.0016717259698034305,log_loss,4,sqrt,0.45519496907596113,9,9,0.026035759073183236,398,0.617711154466037,0.0015054900155430533,COMPLETE
171,171,0.7574954596562875,2023-04-05 06:08:12.237952,2023-04-05 06:08:15.146322,0 days 00:00:02.908370,0.0009439319186985701,friedman_mse,0.0013126188955798971,log_loss,4,sqrt,0.470327456230342,9,9,0.0193393529328074,403,0.5960365380903152,0.0015552279605064244,COMPLETE
172,172,0.6229400462211727,2023-04-05 06:08:15.147023,2023-04-05 06:08:17.716131,0 days 00:00:02.569108,0.019704918680522963,friedman_mse,0.0012280375122345132,log_loss,4,sqrt,0.4718429977173888,9,9,0.017458093468324797,389,0.6264487722529983,0.0011326816027467522,COMPLETE
173,173,0.7543372132970465,2023-04-05 06:08:17.716840,2023-04-05 06:08:20.912909,0 days 00:00:03.196069,0.0016930034874005542,friedman_mse,0.0018883840601248273,log_loss,4,sqrt,0.44652731781646504,9,9,0.05351298060648582,468,0.6471229945637541,0.001627375872342165,COMPLETE
174,174,0.7570079722448126,2023-04-05 06:08:20.913605,2023-04-05 06:08:23.862869,0 days 00:00:02.949264,0.0004963949424329223,friedman_mse,0.0010415076683252384,log_loss,4,sqrt,0.4620963919731351,9,9,0.037783159461100904,444,0.553531323832046,0.0013097623490605972,COMPLETE
175,175,0.7561932009049812,2023-04-05 06:08:23.863563,2023-04-05 06:08:26.793690,0 days 00:00:02.930127,0.0007054080053492675,friedman_mse,0.0014208183589114684,log_loss,4,sqrt,0.46145211349415755,9,9,0.03757335343797792,446,0.554887770428049,0.0013740098979877404,COMPLETE
176,176,0.6542569366651347,2023-04-05 06:08:26.794394,2023-04-05 06:08:29.335301,0 days 00:00:02.540907,0.017503764872921237,friedman_mse,0.0010964515678853976,log_loss,4,sqrt,0.4709011823875019,9,9,0.02630716034377814,406,0.591272002355228,0.0018204181923947894,COMPLETE
177,177,0.5,2023-04-05 06:08:29.335991,2023-04-05 06:08:31.773946,0 days 00:00:02.437955,0.03061914182107578,friedman_mse,0.0010246376478877965,log_loss,4,sqrt,0.48033885274710836,9,9,0.05464669549347413,380,0.6110924937379754,0.001026799252034539,COMPLETE
178,178,0.6229400462211727,2023-04-05 06:08:31.774658,2023-04-05 06:08:35.274078,0 days 00:00:03.499420,0.02182287758840274,friedman_mse,0.0016162097448926612,log_loss,4,sqrt,0.45536538967724377,9,9,0.04012915219818403,519,0.6382612343051989,0.00126961378719308,COMPLETE
179,179,0.7585539442227501,2023-04-05 06:08:35.274789,2023-04-05 06:08:38.971819,0 days 00:00:03.697030,0.0009071791638519946,friedman_mse,0.0021185423320312594,log_loss,4,sqrt,0.4449948023665989,9,9,0.017085061228809734,483,0.6887901438048094,0.0020804668454401662,COMPLETE
180,180,0.6777856367550092,2023-04-05 06:08:38.972525,2023-04-05 06:08:42.667454,0 days 00:00:03.694929,0.01678274926895494,friedman_mse,0.002128934599113986,log_loss,4,sqrt,0.4846511148670408,9,8,0.016618960938592706,548,0.7001738320445775,0.002236069653022254,COMPLETE
181,181,0.6777856367550092,2023-04-05 06:08:42.668148,2023-04-05 06:08:45.850210,0 days 00:00:03.182062,0.016955522164616443,friedman_mse,0.0013573954780928784,log_loss,4,sqrt,0.4652885871325644,9,9,0.029270726584954422,480,0.6546069058376996,0.0014431717634315613,COMPLETE
182,182,0.7560267829329372,2023-04-05 06:08:45.851230,2023-04-05 06:08:49.055479,0 days 00:00:03.204249,0.0010785643251664037,friedman_mse,0.001779959712856424,log_loss,4,sqrt,0.4462704405548833,9,9,0.024268327839636113,459,0.6234633060108323,0.001684737138259075,COMPLETE
183,183,0.7578524901555135,2023-04-05 06:08:49.056169,2023-04-05 06:08:52.154309,0 days 00:00:03.098140,0.0008840935648874394,friedman_mse,0.0022606260083230874,log_loss,4,sqrt,0.4725107359399298,9,9,0.013477612178731524,441,0.5905284521407673,0.0019312192022931539,COMPLETE
184,184,0.7637895918768777,2023-04-05 06:08:52.155000,2023-04-05 06:08:55.794504,0 days 00:00:03.639504,6.939913149276129e-05,friedman_mse,0.0023017059350470895,log_loss,4,sqrt,0.4738158429391881,9,9,0.014709689402893127,497,0.5900846426336471,0.0022481396322706557,COMPLETE
185,185,0.5,2023-04-05 06:08:55.795150,2023-04-05 06:08:58.276446,0 days 00:00:02.481296,0.03692393442335632,friedman_mse,0.002246803364205072,log_loss,4,sqrt,0.4718226049316979,9,9,0.011743754349368713,378,0.5870600100058488,0.002140056640504568,COMPLETE
186,186,0.6777856367550092,2023-04-05 06:08:58.277147,2023-04-05 06:09:00.939609,0 days 00:00:02.662462,0.014641209267600548,friedman_mse,0.0022552045736218126,log_loss,4,sqrt,0.42615047248679694,9,9,0.01452820212267215,405,0.594971477359722,0.0019244974384950964,COMPLETE
187,187,0.5,2023-04-05 06:09:00.940310,2023-04-05 06:09:04.331588,0 days 00:00:03.391278,0.20675976065142304,friedman_mse,0.0030328478307642503,log_loss,4,sqrt,0.48444807941341167,9,9,0.021453466053863536,515,0.6650874391827237,0.0018675387082016217,COMPLETE
188,188,0.5,2023-04-05 06:09:04.332315,2023-04-05 06:09:07.666882,0 days 00:00:03.334567,0.027545184089256637,friedman_mse,0.001985977110420496,log_loss,4,sqrt,0.45576516115287746,9,9,0.030121240158093414,479,0.6923012203117885,0.0021413874699169723,COMPLETE
189,189,0.6777856367550092,2023-04-05 06:09:07.667571,2023-04-05 06:09:10.898846,0 days 00:00:03.231275,0.015373658064098154,friedman_mse,0.0015342779044908935,log_loss,5,sqrt,0.43948264951193394,9,9,0.01632614983205108,442,0.6046594744462578,0.0023122691627122096,COMPLETE
190,190,0.7590320834866519,2023-04-05 06:09:10.899576,2023-04-05 06:09:14.336169,0 days 00:00:03.436593,0.00024778404048868757,friedman_mse,0.00171514838872896,log_loss,4,sqrt,0.4727381801894486,9,9,0.029117518809674794,345,0.7105235009316345,0.001674372619441547,COMPLETE
191,191,0.7573711122932164,2023-04-05 06:09:14.336896,2023-04-05 06:09:17.049208,0 days 00:00:02.712312,0.0011120334444313061,friedman_mse,0.0023036217539009027,log_loss,4,sqrt,0.47481841118038587,9,9,0.011056818007641233,345,0.7137663257587011,0.0018794737820538535,COMPLETE
192,192,0.7198954556002837,2023-04-05 06:09:17.049935,2023-04-05 06:09:19.581899,0 days 00:00:02.531964,0.011895466499951716,friedman_mse,0.0017501098689745363,log_loss,4,sqrt,0.4843869204044263,9,9,0.028826290836965394,375,0.6760640612321546,0.0016239083280070686,COMPLETE
193,193,0.7444712341868359,2023-04-05 06:09:19.582610,2023-04-05 06:09:22.123430,0 days 00:00:02.540820,0.009666621266922179,friedman_mse,0.0015772649942605308,log_loss,4,sqrt,0.4669967245954018,9,9,0.011118130256692615,355,0.6464841606622836,0.0015654312638931755,COMPLETE
194,194,0.5,2023-04-05 06:09:22.124203,2023-04-05 06:09:25.248706,0 days 00:00:03.124503,0.02495844421234515,friedman_mse,0.0019974239339418764,log_loss,4,sqrt,0.48376187863098186,9,9,0.022788288704808618,407,0.7310138944810198,0.0022292566187414975,COMPLETE
195,195,0.5,2023-04-05 06:09:25.249419,2023-04-05 06:09:28.223413,0 days 00:00:02.973994,0.1298054115312867,friedman_mse,0.0013506165354047104,log_loss,4,sqrt,0.47095803137993664,9,9,0.031724099076007505,459,0.5592258662920476,0.0011271380311848368,COMPLETE
196,196,0.7561999027993702,2023-04-05 06:09:28.224333,2023-04-05 06:09:31.603452,0 days 00:00:03.379119,0.000890918810006784,friedman_mse,0.002342020533241584,log_loss,4,sqrt,0.4507135019309329,9,9,0.050505963100660245,499,0.584968142676203,0.0017584404775816199,COMPLETE
197,197,0.6663514854051387,2023-04-05 06:09:31.604057,2023-04-05 06:09:34.538640,0 days 00:00:02.934583,0.01747407917500706,friedman_mse,0.0028299081609959057,log_loss,4,sqrt,0.4599754428732759,9,9,0.010108491372599917,433,0.6299887991998394,0.0013709415451416077,COMPLETE
198,198,0.7608535447667208,2023-04-05 06:09:34.539303,2023-04-05 06:09:37.095854,0 days 00:00:02.556551,0.00017307031521396078,friedman_mse,0.0017263659990828788,log_loss,4,sqrt,0.484596765991837,9,8,0.0012177454038826245,330,0.6018839540833024,0.0019998864052800584,COMPLETE
199,199,0.7315412202550158,2023-04-05 06:09:37.096470,2023-04-05 06:09:40.057898,0 days 00:00:02.961428,0.011115152164533498,friedman_mse,0.0018144739388393128,log_loss,4,sqrt,0.48135602307253783,9,8,0.0037616078305708857,325,0.5443270648161691,0.0019585560522967396,COMPLETE
200,200,0.5,2023-04-05 06:09:40.058523,2023-04-05 06:09:41.474440,0 days 00:00:01.415917,0.03533889378378201,squared_error,0.0022219186089223885,log_loss,4,sqrt,0.4883546056968451,9,8,0.04267162306035228,349,0.6138999652904874,0.0023654303409394125,COMPLETE
201,201,0.7417275280612106,2023-04-05 06:09:41.475097,2023-04-05 06:09:44.154536,0 days 00:00:02.679439,0.009988869459568629,friedman_mse,0.001581241076502263,log_loss,4,sqrt,0.47516625260781364,9,9,0.00043419584844171105,403,0.5951374987119632,0.0016290122670644081,COMPLETE
202,202,0.7558214760866022,2023-04-05 06:09:44.155264,2023-04-05 06:09:46.867639,0 days 00:00:02.712375,0.000759429834562161,friedman_mse,0.0012207357399361156,log_loss,4,sqrt,0.2907898682420714,9,9,0.018936121394020063,374,0.5843284157332178,0.002038591947521956,COMPLETE
203,203,0.6229400462211727,2023-04-05 06:09:46.868323,2023-04-05 06:09:48.897460,0 days 00:00:02.029137,0.02346317431766942,friedman_mse,0.0019360339913136841,log_loss,4,sqrt,0.4662516829278492,9,9,0.021944313603052185,332,0.5614473913117211,0.0014978950224848965,COMPLETE
204,204,0.747793415988813,2023-04-05 06:09:48.898235,2023-04-05 06:09:51.546723,0 days 00:00:02.648488,0.0089456338312309,friedman_mse,0.002958947274744847,log_loss,4,sqrt,0.36791972055334976,9,9,0.012997563221182529,391,0.6304545782772902,0.0018269922374223124,COMPLETE
205,205,0.7600531224352669,2023-04-05 06:09:51.547452,2023-04-05 06:09:55.060912,0 days 00:00:03.513460,8.8360821757989e-05,friedman_mse,0.0017159619606925349,log_loss,4,sqrt,0.48596540829734436,9,9,0.03433452302749,469,0.658430141936099,0.0011835977200562293,COMPLETE
206,206,0.6229400462211727,2023-04-05 06:09:55.061668,2023-04-05 06:09:58.100874,0 days 00:00:03.039206,0.019253204288255794,friedman_mse,0.0023978063565581334,log_loss,4,sqrt,0.4868655791545072,9,9,0.033717714595980844,471,0.6611732995023398,0.0010071768444895495,COMPLETE
207,207,0.7564254613592342,2023-04-05 06:09:58.101609,2023-04-05 06:10:01.960066,0 days 00:00:03.858457,0.0002275821590656962,friedman_mse,0.002019830020996764,log_loss,4,sqrt,0.18553056337823814,9,8,0.05712050812449844,532,0.6487028942091505,0.001164351825826681,COMPLETE
208,208,0.5,2023-04-05 06:10:01.960773,2023-04-05 06:10:05.267463,0 days 00:00:03.306690,0.16990321808240375,friedman_mse,0.001780335165479329,log_loss,4,sqrt,0.32590903853069964,9,9,0.03211713953131156,485,0.6807838904412706,0.0013256448912025663,COMPLETE
209,209,0.7211101347684036,2023-04-05 06:10:05.268217,2023-04-05 06:10:08.337398,0 days 00:00:03.069181,0.011730545634632633,friedman_mse,0.001516909408424064,log_loss,4,sqrt,0.48602919128826316,8,9,0.047325613969014094,434,0.6110320258428787,0.002304097813604904,COMPLETE
210,210,0.5,2023-04-05 06:10:08.338145,2023-04-05 06:10:11.254076,0 days 00:00:02.915931,0.027720862846478792,friedman_mse,0.002358026483685974,log_loss,4,sqrt,0.4756955979725722,9,9,0.009787417034382571,453,0.5794651601434683,0.0017012183781115328,COMPLETE
211,211,0.7580552449836011,2023-04-05 06:10:11.254794,2023-04-05 06:10:14.286498,0 days 00:00:03.031704,0.0005805967048411857,friedman_mse,0.0016900141304479414,log_loss,4,sqrt,0.4992820424551804,9,9,0.02259140738163276,424,0.6085628626342819,0.0015632374335401602,COMPLETE
212,212,0.7416013241408684,2023-04-05 06:10:14.287218,2023-04-05 06:10:18.121407,0 days 00:00:03.834189,0.009975734464910645,friedman_mse,0.0017401370272127454,log_loss,4,sqrt,0.498137107671908,9,9,0.026242028242385383,422,0.6245010492931539,0.001342891177568433,COMPLETE
213,213,0.7598009068906555,2023-04-05 06:10:18.122162,2023-04-05 06:10:22.034524,0 days 00:00:03.912362,0.00014016214920262724,friedman_mse,0.002062546263356792,log_loss,4,sqrt,0.48660479434638976,9,9,0.03813652868852559,507,0.7038314957502778,0.001971883314967572,COMPLETE
214,214,0.632348100975401,2023-04-05 06:10:22.035243,2023-04-05 06:10:25.458184,0 days 00:00:03.422941,0.0184795221566247,friedman_mse,0.002125795971538797,log_loss,4,sqrt,0.4864597655365198,9,9,0.03756611551396805,500,0.7026621638668347,0.002022204259373532,COMPLETE
215,215,0.7581780314322607,2023-04-05 06:10:25.458843,2023-04-05 06:10:29.031642,0 days 00:00:03.572799,0.0003096496153144804,friedman_mse,0.0016046753793314851,log_loss,4,sqrt,0.49926899639819333,9,9,0.04583127444992833,525,0.6042945716811682,0.0025137913393133192,COMPLETE
216,216,0.7192467057116266,2023-04-05 06:10:29.032324,2023-04-05 06:10:32.238439,0 days 00:00:03.206115,0.011598851825900185,friedman_mse,0.0014487332051067736,log_loss,4,sqrt,0.49932233675125054,9,9,0.06317722011687746,471,0.728268495394715,0.0023285529346419274,COMPLETE
217,217,0.5,2023-04-05 06:10:32.239087,2023-04-05 06:10:35.666366,0 days 00:00:03.427279,0.32474059216842976,friedman_mse,0.002836067147366507,log_loss,4,sqrt,0.4888593687888035,9,9,0.05025612661196366,563,0.6041956517281738,0.002536112542113444,COMPLETE
218,218,0.5,2023-04-05 06:10:35.666999,2023-04-05 06:10:39.226661,0 days 00:00:03.559662,0.3748953262796954,friedman_mse,0.001618342887316066,log_loss,4,sqrt,0.48827290969357035,9,9,0.03878299221913432,594,0.5680687681966244,0.002035557256273311,COMPLETE
219,219,0.7532999935747379,2023-04-05 06:10:39.227313,2023-04-05 06:10:42.611780,0 days 00:00:03.384467,0.0006343311818792167,friedman_mse,0.0024137390475238844,log_loss,4,sqrt,0.34884614068765696,9,9,0.06761478417325717,524,0.5836415110513468,0.001864409735219069,COMPLETE
220,220,0.5,2023-04-05 06:10:42.612435,2023-04-05 06:10:44.887501,0 days 00:00:02.275066,0.2770336162859301,friedman_mse,0.0020989935468542905,log_loss,4,sqrt,0.4986387598649672,8,9,0.0006611345802133885,360,0.5486562126528082,0.0008729668220440912,COMPLETE
221,221,0.7472963640855846,2023-04-05 06:10:44.888216,2023-04-05 06:10:48.229943,0 days 00:00:03.341727,0.009202642145333232,friedman_mse,0.0017966949984702595,log_loss,4,sqrt,0.48141445320700754,9,9,0.027676540162750236,504,0.6333148795228792,0.0017303675140084797,COMPLETE
222,222,0.7586452346102183,2023-04-05 06:10:48.230658,2023-04-05 06:10:52.087610,0 days 00:00:03.856952,0.000724151844931414,friedman_mse,0.0015982879392032437,log_loss,4,sqrt,0.4761226119857141,9,9,0.01305585709489153,541,0.6072705470023039,0.001213408302167682,COMPLETE
223,223,0.6229400462211727,2023-04-05 06:10:52.088337,2023-04-05 06:10:55.589125,0 days 00:00:03.500788,0.018775295085325536,friedman_mse,0.001480643219054438,log_loss,4,sqrt,0.2640868381394101,9,9,0.009848952581871299,542,0.6062074882533746,0.0011609839004436708,COMPLETE
224,224,0.7578145711473031,2023-04-05 06:10:55.589867,2023-04-05 06:10:58.313244,0 days 00:00:02.723377,0.0008235449451195115,friedman_mse,0.002009300801884431,log_loss,4,sqrt,0.4897493653452408,9,9,0.014384600637153688,382,0.5848730886367304,0.001326951400399277,COMPLETE
225,225,0.741235533460973,2023-04-05 06:10:58.313995,2023-04-05 06:11:00.727321,0 days 00:00:02.413326,0.010436514101734285,friedman_mse,0.0021104149221934437,log_loss,4,sqrt,0.4986405264892226,9,9,0.011799025416830549,382,0.5691761203124941,0.0010075620596880393,COMPLETE
226,226,0.763498616037191,2023-04-05 06:11:00.728070,2023-04-05 06:11:03.330677,0 days 00:00:02.602607,8.020311350410444e-05,friedman_mse,0.0025970526498686653,log_loss,4,sqrt,0.48489720005038844,9,9,0.00015592501493619758,344,0.5908349803508457,0.0012584412106198379,COMPLETE
227,227,0.5,2023-04-05 06:11:03.331425,2023-04-05 06:11:05.427153,0 days 00:00:02.095728,0.2575854071456584,friedman_mse,0.002700773482243211,log_loss,4,sqrt,0.4783243112047241,9,9,0.0031554739551290095,318,0.6029690151229451,0.002591060643754545,COMPLETE
228,228,0.6229400462211727,2023-04-05 06:11:05.427874,2023-04-05 06:11:07.766513,0 days 00:00:02.338639,0.02102521217959427,friedman_mse,0.003083576241807801,log_loss,4,sqrt,0.49980083753402005,9,9,0.027530636492209,335,0.6976366140902099,0.002167939887696912,COMPLETE
229,229,0.7620581191828607,2023-04-05 06:11:07.767256,2023-04-05 06:11:10.303032,0 days 00:00:02.535776,0.00018611718124287023,friedman_mse,0.0024114642767237068,log_loss,4,sqrt,0.48561969835302626,9,9,0.0008025817791192241,349,0.5629968493196856,0.0011937725211239993,COMPLETE
230,230,0.7060645236454832,2023-04-05 06:11:10.303752,2023-04-05 06:11:12.437954,0 days 00:00:02.134202,0.012514286468748236,friedman_mse,0.0008833394140006749,log_loss,4,sqrt,0.48733056788269874,9,9,0.0022320943813392653,357,0.5644722707020573,0.001179050364777358,COMPLETE
231,231,0.7424988686260476,2023-04-05 06:11:12.438706,2023-04-05 06:11:14.680868,0 days 00:00:02.242162,0.00986189546222268,friedman_mse,0.0024702090589271697,log_loss,4,sqrt,0.48312140070669946,9,9,0.01267175510174299,352,0.5883567905594491,0.0009343197994483167,COMPLETE
232,232,0.7451171504023224,2023-04-05 06:11:14.681557,2023-04-05 06:11:17.208442,0 days 00:00:02.526885,0.009003445738780577,friedman_mse,0.0034325759393886335,log_loss,4,sqrt,0.08918748693649847,9,9,0.019394944760750814,415,0.5482012045843485,0.0014669155923383115,COMPLETE
233,233,0.7587616978052384,2023-04-05 06:11:17.209087,2023-04-05 06:11:19.695075,0 days 00:00:02.485988,0.000784363025076048,friedman_mse,0.0022908274027323883,log_loss,4,sqrt,0.2438944082322544,9,9,0.010107430434558529,344,0.577947600299355,0.0011442113829185391,COMPLETE
234,234,0.7582650195598651,2023-04-05 06:11:19.695726,2023-04-05 06:11:22.049555,0 days 00:00:02.353829,0.0007037570212486742,friedman_mse,0.0016695741272432518,log_loss,4,sqrt,0.23431588312207957,9,9,0.00033672148478494646,338,0.5723837425497794,0.0010467604519681236,COMPLETE
235,235,0.6229400462211727,2023-04-05 06:11:22.050250,2023-04-05 06:11:24.186183,0 days 00:00:02.135933,0.019620866993851398,friedman_mse,0.001655852643523236,log_loss,4,sqrt,0.4908866326990313,9,9,0.0008835316827644959,337,0.574160632789531,0.000777589422033124,COMPLETE
236,236,0.7632051316863235,2023-04-05 06:11:24.186849,2023-04-05 06:11:26.767520,0 days 00:00:02.580671,0.0001369120437135305,friedman_mse,0.002663900118006882,log_loss,4,sqrt,0.2763133051235629,9,9,0.008870633542516555,363,0.5480670630105468,0.0010349075283383308,COMPLETE
237,237,0.5,2023-04-05 06:11:26.768254,2023-04-05 06:11:29.089477,0 days 00:00:02.321223,0.02685431141794789,friedman_mse,0.0026954770113650564,log_loss,4,sqrt,0.25937792699908657,9,9,0.006320756715903962,307,0.5406148107871329,0.0010057990443952986,COMPLETE
