,number,value,datetime_start,datetime_complete,duration,params_bootstrap,params_criterion,params_max_depth,params_max_leaf_nodes,params_min_samples_leaf,params_n_estimators,state
954,954,0.8064261468243108,2023-04-04 20:51:43.880099,2023-04-04 20:51:55.325498,0 days 00:00:11.445399,True,entropy,9,10,7,970,COMPLETE
955,955,0.8065487891678845,2023-04-04 20:51:55.326278,2023-04-04 20:52:06.030644,0 days 00:00:10.704366,True,entropy,7,10,6,844,COMPLETE
956,956,0.8064899952114392,2023-04-04 20:52:06.031773,2023-04-04 20:52:16.450329,0 days 00:00:10.418556,True,entropy,8,10,8,721,COMPLETE
957,957,0.8066309307757422,2023-04-04 20:52:16.451033,2023-04-04 20:52:27.156533,0 days 00:00:10.705500,True,entropy,10,10,9,903,COMPLETE
958,958,0.8073332280575075,2023-04-04 20:52:27.158865,2023-04-04 20:52:36.359957,0 days 00:00:09.201092,True,entropy,8,10,6,799,COMPLETE
959,959,0.8026968498077975,2023-04-04 20:52:36.361834,2023-04-04 20:52:43.333198,0 days 00:00:06.971364,True,entropy,3,10,6,797,COMPLETE
960,960,0.8062509947023191,2023-04-04 20:52:43.334353,2023-04-04 20:52:52.071054,0 days 00:00:08.736701,True,entropy,6,10,6,771,COMPLETE
961,961,0.8071005455021186,2023-04-04 20:52:52.073416,2023-04-04 20:53:01.991713,0 days 00:00:09.918297,True,entropy,8,10,6,795,COMPLETE
962,962,0.8060168804532367,2023-04-04 20:53:01.994266,2023-04-04 20:53:12.743656,0 days 00:00:10.749390,True,gini,9,10,6,756,COMPLETE
963,963,0.8063084467036742,2023-04-04 20:53:12.746274,2023-04-04 20:53:31.148224,0 days 00:00:18.401950,False,entropy,10,10,6,828,COMPLETE
964,964,0.8065678540950871,2023-04-04 20:53:31.149019,2023-04-04 20:53:42.003519,0 days 00:00:10.854500,True,entropy,8,10,6,783,COMPLETE
965,965,0.8066666009163403,2023-04-04 20:53:42.005960,2023-04-04 20:53:52.949898,0 days 00:00:10.943938,True,entropy,7,10,6,808,COMPLETE
966,966,0.8065904190210695,2023-04-04 20:53:52.954678,2023-04-04 20:54:02.810931,0 days 00:00:09.856253,True,entropy,8,10,6,814,COMPLETE
967,967,0.8053765978448875,2023-04-04 20:54:02.813158,2023-04-04 20:54:14.669686,0 days 00:00:11.856528,True,entropy,10,9,6,787,COMPLETE
968,968,0.8072447909648144,2023-04-04 20:54:14.670420,2023-04-04 20:54:25.593854,0 days 00:00:10.923434,True,entropy,8,10,6,809,COMPLETE
969,969,0.8072713589518405,2023-04-04 20:54:25.595163,2023-04-04 20:54:36.542706,0 days 00:00:10.947543,True,entropy,9,10,6,813,COMPLETE
970,970,0.8067682998711513,2023-04-04 20:54:36.543579,2023-04-04 20:54:46.720472,0 days 00:00:10.176893,True,entropy,9,10,6,809,COMPLETE
971,971,0.8067122226680169,2023-04-04 20:54:46.723082,2023-04-04 20:54:56.136730,0 days 00:00:09.413648,True,entropy,9,10,6,806,COMPLETE
972,972,0.8065427621291151,2023-04-04 20:54:56.139468,2023-04-04 20:55:05.963351,0 days 00:00:09.823883,True,entropy,9,10,6,821,COMPLETE
973,973,0.806552546283041,2023-04-04 20:55:05.965188,2023-04-04 20:55:20.429180,0 days 00:00:14.463992,False,entropy,9,10,6,822,COMPLETE
974,974,0.8066225445291231,2023-04-04 20:55:20.431509,2023-04-04 20:55:30.102980,0 days 00:00:09.671471,True,entropy,9,10,6,829,COMPLETE
975,975,0.8072180216659508,2023-04-04 20:55:30.105704,2023-04-04 20:55:39.857644,0 days 00:00:09.751940,True,entropy,9,10,6,839,COMPLETE
976,976,0.8068297102694395,2023-04-04 20:55:39.859897,2023-04-04 20:55:49.819347,0 days 00:00:09.959450,True,entropy,9,10,6,839,COMPLETE
977,977,0.8070435628073319,2023-04-04 20:55:49.820478,2023-04-04 20:55:59.644910,0 days 00:00:09.824432,True,entropy,9,10,6,833,COMPLETE
978,978,0.8063729323841944,2023-04-04 20:55:59.647121,2023-04-04 20:56:09.374427,0 days 00:00:09.727306,True,entropy,9,10,6,844,COMPLETE
979,979,0.8029269047472904,2023-04-04 20:56:09.375060,2023-04-04 20:56:18.440740,0 days 00:00:09.065680,True,entropy,9,8,6,823,COMPLETE
980,980,0.8065170551574958,2023-04-04 20:56:18.443582,2023-04-04 20:56:28.406019,0 days 00:00:09.962437,True,entropy,9,10,6,845,COMPLETE
981,981,0.8069209652732425,2023-04-04 20:56:28.408166,2023-04-04 20:56:37.923824,0 days 00:00:09.515658,True,entropy,9,10,6,809,COMPLETE
982,982,0.8064480855834362,2023-04-04 20:56:37.926564,2023-04-04 20:56:47.885196,0 days 00:00:09.958632,True,gini,9,10,6,853,COMPLETE
983,983,0.8044307826570817,2023-04-04 20:56:47.887199,2023-04-04 20:56:57.435293,0 days 00:00:09.548094,True,entropy,9,9,5,813,COMPLETE
984,984,0.8063667266279164,2023-04-04 20:56:57.437979,2023-04-04 20:57:07.436554,0 days 00:00:09.998575,True,entropy,9,10,6,837,COMPLETE
985,985,0.8067200835457745,2023-04-04 20:57:07.438763,2023-04-04 20:57:22.448477,0 days 00:00:15.009714,False,entropy,9,10,6,854,COMPLETE
986,986,0.806312707140739,2023-04-04 20:57:22.452062,2023-04-04 20:57:32.066693,0 days 00:00:09.614631,True,entropy,9,10,6,824,COMPLETE
987,987,0.8068342501059973,2023-04-04 20:57:32.068523,2023-04-04 20:57:42.057625,0 days 00:00:09.989102,True,entropy,9,10,6,856,COMPLETE
988,988,0.8064396320978678,2023-04-04 20:57:42.060978,2023-04-04 20:57:51.624213,0 days 00:00:09.563235,True,entropy,9,10,5,802,COMPLETE
989,989,0.8066669025996394,2023-04-04 20:57:51.626405,2023-04-04 20:58:02.077228,0 days 00:00:10.450823,True,entropy,9,10,6,834,COMPLETE
990,990,0.8062756393128003,2023-04-04 20:58:02.079506,2023-04-04 20:58:11.572669,0 days 00:00:09.493163,True,entropy,9,10,6,816,COMPLETE
991,991,0.8068698864769009,2023-04-04 20:58:11.574504,2023-04-04 20:58:21.465212,0 days 00:00:09.890708,True,entropy,9,10,6,863,COMPLETE
992,992,0.8070294848908699,2023-04-04 20:58:21.465928,2023-04-04 20:58:31.405357,0 days 00:00:09.939429,True,entropy,9,10,6,842,COMPLETE
993,993,0.8066460485863228,2023-04-04 20:58:31.407688,2023-04-04 20:58:40.749433,0 days 00:00:09.341745,True,entropy,9,10,6,803,COMPLETE
994,994,0.8059688210770772,2023-04-04 20:58:40.750956,2023-04-04 20:58:47.161314,0 days 00:00:06.410358,True,entropy,9,10,6,550,COMPLETE
995,995,0.8067379410750439,2023-04-04 20:58:47.162298,2023-04-04 20:58:56.680391,0 days 00:00:09.518093,True,entropy,9,10,5,824,COMPLETE
996,996,0.7913154340961128,2023-04-04 20:58:56.683433,2023-04-04 20:59:04.466497,0 days 00:00:07.783064,True,entropy,9,3,7,865,COMPLETE
997,997,0.8052492814169435,2023-04-04 20:59:04.467421,2023-04-04 20:59:21.176156,0 days 00:00:16.708735,False,entropy,9,9,6,848,COMPLETE
998,998,0.8062665934208797,2023-04-04 20:59:21.177497,2023-04-04 20:59:30.923032,0 days 00:00:09.745535,True,entropy,9,10,6,798,COMPLETE
999,999,0.8060478652938283,2023-04-04 20:59:30.925187,2023-04-04 20:59:35.421662,0 days 00:00:04.496475,True,entropy,9,10,6,378,COMPLETE
