,number,value,datetime_start,datetime_complete,duration,params_bootstrap,params_criterion,params_max_depth,params_max_leaf_nodes,params_min_samples_leaf,params_n_estimators,state
795,795,0.8067217160912902,2023-04-04 20:24:39.271383,2023-04-04 20:24:49.761142,0 days 00:00:10.489759,True,entropy,8,10,6,884,COMPLETE
796,796,0.807154609620713,2023-04-04 20:24:49.763195,2023-04-04 20:25:00.599152,0 days 00:00:10.835957,True,entropy,8,10,9,921,COMPLETE
797,797,0.8009635092779174,2023-04-04 20:25:00.600836,2023-04-04 20:25:11.256172,0 days 00:00:10.655336,True,entropy,10,7,6,926,COMPLETE
798,798,0.8051489021174753,2023-04-04 20:25:11.257778,2023-04-04 20:25:22.942946,0 days 00:00:11.685168,True,entropy,8,9,7,951,COMPLETE
799,799,0.8022106635961517,2023-04-04 20:25:22.944217,2023-04-04 20:25:32.311324,0 days 00:00:09.367107,True,entropy,3,10,3,940,COMPLETE
800,800,0.8064795288068625,2023-04-04 20:25:32.312031,2023-04-04 20:25:44.948247,0 days 00:00:12.636216,True,entropy,7,10,9,980,COMPLETE
801,801,0.8066055369901373,2023-04-04 20:25:44.950925,2023-04-04 20:25:56.818315,0 days 00:00:11.867390,True,entropy,8,10,6,914,COMPLETE
802,802,0.8064895476710315,2023-04-04 20:25:56.819166,2023-04-04 20:26:14.588262,0 days 00:00:17.769096,False,entropy,9,10,5,925,COMPLETE
803,803,0.806271748314016,2023-04-04 20:26:14.589101,2023-04-04 20:26:19.930781,0 days 00:00:05.341680,True,entropy,8,10,6,444,COMPLETE
804,804,0.8064820447923061,2023-04-04 20:26:19.931352,2023-04-04 20:26:31.316150,0 days 00:00:11.384798,True,entropy,9,10,10,938,COMPLETE
805,805,0.8069039576343903,2023-04-04 20:26:31.318499,2023-04-04 20:26:42.420407,0 days 00:00:11.101908,True,entropy,10,10,9,910,COMPLETE
806,806,0.8050375087966746,2023-04-04 20:26:42.421718,2023-04-04 20:26:53.710976,0 days 00:00:11.289258,True,entropy,8,9,7,972,COMPLETE
807,807,0.8065255757146061,2023-04-04 20:26:53.713428,2023-04-04 20:27:05.226722,0 days 00:00:11.513294,True,entropy,7,10,6,958,COMPLETE
808,808,0.8067167849091407,2023-04-04 20:27:05.229036,2023-04-04 20:27:14.424467,0 days 00:00:09.195431,True,entropy,8,10,1,753,COMPLETE
809,809,0.793097314914619,2023-04-04 20:27:14.426130,2023-04-04 20:27:23.651928,0 days 00:00:09.225798,True,gini,8,4,4,929,COMPLETE
810,810,0.8065252178388768,2023-04-04 20:27:23.653473,2023-04-04 20:27:35.151019,0 days 00:00:11.497546,True,entropy,9,10,9,907,COMPLETE
811,811,0.8065509472067349,2023-04-04 20:27:35.153671,2023-04-04 20:27:45.190938,0 days 00:00:10.037267,True,entropy,10,10,6,789,COMPLETE
812,812,0.8066706150585251,2023-04-04 20:27:45.192721,2023-04-04 20:27:56.801096,0 days 00:00:11.608375,True,entropy,7,10,8,943,COMPLETE
813,813,0.8071127446646154,2023-04-04 20:27:56.803617,2023-04-04 20:28:13.431686,0 days 00:00:16.628069,False,entropy,8,10,5,910,COMPLETE
814,814,0.8063547395343867,2023-04-04 20:28:13.433169,2023-04-04 20:28:24.130195,0 days 00:00:10.697026,True,entropy,8,10,9,895,COMPLETE
815,815,0.806691290368452,2023-04-04 20:28:24.132187,2023-04-04 20:28:34.926400,0 days 00:00:10.794213,True,entropy,8,10,8,926,COMPLETE
816,816,0.806465283216695,2023-04-04 20:28:34.928477,2023-04-04 20:28:43.698310,0 days 00:00:08.769833,True,entropy,10,10,6,722,COMPLETE
817,817,0.8058819271915958,2023-04-04 20:28:43.700445,2023-04-04 20:28:50.359892,0 days 00:00:06.659447,True,entropy,8,10,7,535,COMPLETE
818,818,0.8060815339978031,2023-04-04 20:28:50.362394,2023-04-04 20:28:59.774911,0 days 00:00:09.412517,True,entropy,7,10,9,807,COMPLETE
819,819,0.8070856288592921,2023-04-04 20:28:59.776683,2023-04-04 20:29:10.971118,0 days 00:00:11.194435,True,entropy,8,10,6,955,COMPLETE
820,820,0.8064759617490541,2023-04-04 20:29:10.971845,2023-04-04 20:29:19.074446,0 days 00:00:08.102601,True,entropy,9,10,8,617,COMPLETE
821,821,0.8068734536505552,2023-04-04 20:29:19.076793,2023-04-04 20:29:29.831833,0 days 00:00:10.755040,True,entropy,10,10,9,889,COMPLETE
822,822,0.8052813846749572,2023-04-04 20:29:29.833360,2023-04-04 20:29:40.319031,0 days 00:00:10.485671,True,entropy,6,9,6,902,COMPLETE
823,823,0.8068220619381059,2023-04-04 20:29:40.321410,2023-04-04 20:29:51.317176,0 days 00:00:10.995766,True,entropy,7,10,8,920,COMPLETE
824,824,0.8067445047101046,2023-04-04 20:29:51.319435,2023-04-04 20:30:01.977045,0 days 00:00:10.657610,True,entropy,8,10,7,864,COMPLETE
825,825,0.8067786316162209,2023-04-04 20:30:01.979307,2023-04-04 20:30:20.182293,0 days 00:00:18.202986,False,entropy,9,10,6,980,COMPLETE
826,826,0.8071621237296812,2023-04-04 20:30:20.183886,2023-04-04 20:30:30.789228,0 days 00:00:10.605342,True,entropy,8,10,8,840,COMPLETE
827,827,0.806273503660751,2023-04-04 20:30:30.790592,2023-04-04 20:30:34.759318,0 days 00:00:03.968726,True,entropy,8,10,9,298,COMPLETE
828,828,0.8067814048437375,2023-04-04 20:30:34.761490,2023-04-04 20:30:45.118347,0 days 00:00:10.356857,True,entropy,8,10,10,815,COMPLETE
829,829,0.8058508080993512,2023-04-04 20:30:45.119762,2023-04-04 20:30:55.144772,0 days 00:00:10.025010,True,gini,8,10,6,832,COMPLETE
830,830,0.8066312550667536,2023-04-04 20:30:55.146607,2023-04-04 20:31:06.108198,0 days 00:00:10.961591,True,entropy,8,10,8,836,COMPLETE
831,831,0.8068747953119274,2023-04-04 20:31:06.109758,2023-04-04 20:31:16.528727,0 days 00:00:10.418969,True,entropy,8,10,5,797,COMPLETE
832,832,0.8064224790885917,2023-04-04 20:31:16.531224,2023-04-04 20:31:26.518663,0 days 00:00:09.987439,True,entropy,8,10,9,811,COMPLETE
833,833,0.8061776976243639,2023-04-04 20:31:26.520866,2023-04-04 20:31:36.645795,0 days 00:00:10.124929,True,entropy,8,10,3,833,COMPLETE
834,834,0.8063948265146713,2023-04-04 20:31:36.647804,2023-04-04 20:31:47.270187,0 days 00:00:10.622383,True,entropy,8,10,7,850,COMPLETE
835,835,0.8068317677246867,2023-04-04 20:31:47.272814,2023-04-04 20:31:56.778348,0 days 00:00:09.505534,True,entropy,8,10,8,785,COMPLETE
836,836,0.8069119526497708,2023-04-04 20:31:56.780475,2023-04-04 20:32:05.983713,0 days 00:00:09.203238,True,entropy,8,10,6,667,COMPLETE
837,837,0.8048655658026573,2023-04-04 20:32:05.986690,2023-04-04 20:32:19.357919,0 days 00:00:13.371229,False,entropy,8,9,8,769,COMPLETE
838,838,0.8062998591388034,2023-04-04 20:32:19.358964,2023-04-04 20:32:29.632524,0 days 00:00:10.273560,True,entropy,8,10,9,847,COMPLETE
839,839,0.8057948766310954,2023-04-04 20:32:29.633575,2023-04-04 20:32:39.452523,0 days 00:00:09.818948,True,entropy,8,10,6,814,COMPLETE
840,840,0.806507125689981,2023-04-04 20:32:39.455016,2023-04-04 20:32:49.537383,0 days 00:00:10.082367,True,entropy,8,10,9,825,COMPLETE
841,841,0.8062441735864645,2023-04-04 20:32:49.540042,2023-04-04 20:32:58.700332,0 days 00:00:09.160290,True,entropy,9,10,6,743,COMPLETE
842,842,0.8064573553477491,2023-04-04 20:32:58.702238,2023-04-04 20:33:10.134433,0 days 00:00:11.432195,True,entropy,8,10,8,936,COMPLETE
843,843,0.8062466002597188,2023-04-04 20:33:10.136319,2023-04-04 20:33:21.606330,0 days 00:00:11.470011,True,entropy,8,10,9,956,COMPLETE
844,844,0.8068762156344679,2023-04-04 20:33:21.608817,2023-04-04 20:33:27.278337,0 days 00:00:05.669520,True,entropy,10,10,6,471,COMPLETE
845,845,0.7986693441078117,2023-04-04 20:33:27.280371,2023-04-04 20:33:36.447373,0 days 00:00:09.167002,True,entropy,8,6,8,859,COMPLETE
846,846,0.7964110727821865,2023-04-04 20:33:36.449157,2023-04-04 20:33:46.020523,0 days 00:00:09.571366,True,entropy,8,5,7,937,COMPLETE
847,847,0.8065132085096887,2023-04-04 20:33:46.022991,2023-04-04 20:33:56.316320,0 days 00:00:10.293329,True,entropy,9,10,6,833,COMPLETE
848,848,0.8069280096665509,2023-04-04 20:33:56.318150,2023-04-04 20:34:09.383575,0 days 00:00:13.065425,False,gini,10,10,2,698,COMPLETE
849,849,0.8071551238750125,2023-04-04 20:34:09.385792,2023-04-04 20:34:18.950067,0 days 00:00:09.564275,True,entropy,8,10,9,796,COMPLETE
850,850,0.8048665049968541,2023-04-04 20:34:18.952257,2023-04-04 20:34:28.198383,0 days 00:00:09.246126,True,entropy,8,9,6,790,COMPLETE
851,851,0.8066407931256748,2023-04-04 20:34:28.200405,2023-04-04 20:34:37.284741,0 days 00:00:09.084336,True,entropy,9,10,5,769,COMPLETE
852,852,0.7904256956652677,2023-04-04 20:34:37.286954,2023-04-04 20:34:44.114099,0 days 00:00:06.827145,True,entropy,8,3,1,805,COMPLETE
853,853,0.8065710410039004,2023-04-04 20:34:44.116088,2023-04-04 20:34:53.036539,0 days 00:00:08.920451,True,entropy,8,10,8,763,COMPLETE
854,854,0.8068520067033159,2023-04-04 20:34:53.038676,2023-04-04 20:35:02.302258,0 days 00:00:09.263582,True,entropy,10,10,9,798,COMPLETE
855,855,0.8064510709835145,2023-04-04 20:35:02.303964,2023-04-04 20:35:11.413821,0 days 00:00:09.109857,True,entropy,8,10,10,778,COMPLETE
856,856,0.8067874317457756,2023-04-04 20:35:11.415820,2023-04-04 20:35:20.768333,0 days 00:00:09.352513,True,entropy,8,10,4,796,COMPLETE
857,857,0.8067229796320057,2023-04-04 20:35:20.770590,2023-04-04 20:35:30.425007,0 days 00:00:09.654417,True,entropy,9,10,8,819,COMPLETE
858,858,0.8065269957091292,2023-04-04 20:35:30.426604,2023-04-04 20:35:39.577728,0 days 00:00:09.151124,True,entropy,8,10,7,784,COMPLETE
859,859,0.8068619586510465,2023-04-04 20:35:39.580650,2023-04-04 20:35:48.440650,0 days 00:00:08.860000,True,entropy,10,10,9,754,COMPLETE
860,860,0.8064482086095504,2023-04-04 20:35:48.442109,2023-04-04 20:36:02.743455,0 days 00:00:14.301346,False,entropy,8,10,6,816,COMPLETE
861,861,0.8049485013039888,2023-04-04 20:36:02.744988,2023-04-04 20:36:11.969730,0 days 00:00:09.224742,True,entropy,8,9,8,802,COMPLETE
862,862,0.8067845467371291,2023-04-04 20:36:11.971331,2023-04-04 20:36:21.761000,0 days 00:00:09.789669,True,entropy,9,10,6,838,COMPLETE
863,863,0.8065525908729793,2023-04-04 20:36:21.762706,2023-04-04 20:36:31.292255,0 days 00:00:09.529549,True,entropy,8,10,9,818,COMPLETE
864,864,0.8062095209902285,2023-04-04 20:36:31.294251,2023-04-04 20:36:35.476963,0 days 00:00:04.182712,True,entropy,10,10,8,347,COMPLETE
865,865,0.8064136344150785,2023-04-04 20:36:35.478701,2023-04-04 20:36:44.618137,0 days 00:00:09.139436,True,entropy,8,10,5,780,COMPLETE
866,866,0.8065255868527771,2023-04-04 20:36:44.620813,2023-04-04 20:36:54.609495,0 days 00:00:09.988682,True,entropy,8,10,6,848,COMPLETE
867,867,0.8061313044064502,2023-04-04 20:36:54.611920,2023-04-04 20:37:04.394689,0 days 00:00:09.782769,True,gini,8,10,7,851,COMPLETE
868,868,0.8064623647488617,2023-04-04 20:37:04.397237,2023-04-04 20:37:14.223887,0 days 00:00:09.826650,True,entropy,9,10,9,825,COMPLETE
869,869,0.806097054379987,2023-04-04 20:37:14.225432,2023-04-04 20:37:22.910190,0 days 00:00:08.684758,True,entropy,10,10,8,737,COMPLETE
870,870,0.8065110168999089,2023-04-04 20:37:22.911823,2023-04-04 20:37:32.251083,0 days 00:00:09.339260,True,entropy,8,10,6,798,COMPLETE
871,871,0.806963556754613,2023-04-04 20:37:32.252796,2023-04-04 20:37:47.380673,0 days 00:00:15.127877,False,entropy,8,10,6,868,COMPLETE
872,872,0.8069267575027725,2023-04-04 20:37:47.382447,2023-04-04 20:37:55.777359,0 days 00:00:08.394912,True,entropy,9,10,9,713,COMPLETE
873,873,0.8070479237537755,2023-04-04 20:37:55.779182,2023-04-04 20:38:02.850507,0 days 00:00:07.071325,True,entropy,8,10,8,601,COMPLETE
874,874,0.8071779796106661,2023-04-04 20:38:02.852321,2023-04-04 20:38:12.667158,0 days 00:00:09.814837,True,entropy,10,10,6,840,COMPLETE
875,875,0.80671489531118,2023-04-04 20:38:12.669360,2023-04-04 20:38:22.272740,0 days 00:00:09.603380,True,entropy,10,10,6,830,COMPLETE
876,876,0.7990045418610914,2023-04-04 20:38:22.274837,2023-04-04 20:38:30.770033,0 days 00:00:08.495196,True,entropy,10,6,6,812,COMPLETE
877,877,0.8066351465095736,2023-04-04 20:38:30.771732,2023-04-04 20:38:40.448835,0 days 00:00:09.677103,True,entropy,10,10,6,830,COMPLETE
878,878,0.8066917935873954,2023-04-04 20:38:40.451715,2023-04-04 20:38:50.263936,0 days 00:00:09.812221,True,entropy,10,10,6,839,COMPLETE
879,879,0.8065613462905155,2023-04-04 20:38:50.266306,2023-04-04 20:38:59.751524,0 days 00:00:09.485218,True,entropy,10,10,6,801,COMPLETE
880,880,0.8051564500201295,2023-04-04 20:38:59.754447,2023-04-04 20:39:08.589787,0 days 00:00:08.835340,True,entropy,10,9,6,770,COMPLETE
881,881,0.8063659550119848,2023-04-04 20:39:08.590834,2023-04-04 20:39:18.490847,0 days 00:00:09.900013,True,entropy,10,10,6,846,COMPLETE
882,882,0.8014168989658206,2023-04-04 20:39:18.492765,2023-04-04 20:39:27.407228,0 days 00:00:08.914463,True,entropy,10,7,6,825,COMPLETE
883,883,0.8064892683037522,2023-04-04 20:39:27.409181,2023-04-04 20:39:36.823375,0 days 00:00:09.414194,True,entropy,10,10,7,813,COMPLETE
884,884,0.806909168305779,2023-04-04 20:39:36.825483,2023-04-04 20:39:51.893664,0 days 00:00:15.068181,False,entropy,10,10,6,851,COMPLETE
885,885,0.806316922621783,2023-04-04 20:39:51.895228,2023-04-04 20:40:01.225038,0 days 00:00:09.329810,True,entropy,10,10,6,789,COMPLETE
886,886,0.8065412749508877,2023-04-04 20:40:01.226706,2023-04-04 20:40:06.240231,0 days 00:00:05.013525,True,entropy,10,10,8,421,COMPLETE
887,887,0.8064959550836687,2023-04-04 20:40:06.242044,2023-04-04 20:40:16.257840,0 days 00:00:10.015796,True,gini,10,10,9,864,COMPLETE
888,888,0.8068100637610798,2023-04-04 20:40:16.259813,2023-04-04 20:40:26.132734,0 days 00:00:09.872921,True,entropy,10,10,6,842,COMPLETE
889,889,0.8050719823355841,2023-04-04 20:40:26.134641,2023-04-04 20:40:33.902100,0 days 00:00:07.767459,True,entropy,10,9,7,681,COMPLETE
890,890,0.8029517954188149,2023-04-04 20:40:33.904452,2023-04-04 20:40:42.330876,0 days 00:00:08.426424,True,entropy,10,8,9,748,COMPLETE
891,891,0.8062443077917255,2023-04-04 20:40:42.332341,2023-04-04 20:40:49.943861,0 days 00:00:07.611520,True,entropy,10,10,6,649,COMPLETE
892,892,0.8069332428374736,2023-04-04 20:40:49.945951,2023-04-04 20:41:01.422661,0 days 00:00:11.476710,True,entropy,9,10,8,976,COMPLETE
893,893,0.8055939055029293,2023-04-04 20:41:01.424539,2023-04-04 20:41:09.816259,0 days 00:00:08.391720,True,entropy,4,10,9,823,COMPLETE
894,894,0.8068202505470602,2023-04-04 20:41:09.818119,2023-04-04 20:41:23.775764,0 days 00:00:13.957645,False,entropy,10,10,10,807,COMPLETE
895,895,0.8070865122020768,2023-04-04 20:41:23.778651,2023-04-04 20:41:33.588096,0 days 00:00:09.809445,True,entropy,6,10,6,863,COMPLETE
896,896,0.8061680365050968,2023-04-04 20:41:33.590568,2023-04-04 20:41:42.841515,0 days 00:00:09.250947,True,entropy,10,10,8,784,COMPLETE
897,897,0.806665583434965,2023-04-04 20:41:42.843251,2023-04-04 20:41:52.214599,0 days 00:00:09.371348,True,entropy,5,10,9,834,COMPLETE
898,898,0.8064705722257959,2023-04-04 20:41:52.218392,2023-04-04 20:42:02.172071,0 days 00:00:09.953679,True,entropy,9,10,6,855,COMPLETE
899,899,0.8069691141198986,2023-04-04 20:42:02.174433,2023-04-04 20:42:11.097934,0 days 00:00:08.923501,True,entropy,9,10,8,766,COMPLETE
900,900,0.8050205235122071,2023-04-04 20:42:11.099369,2023-04-04 20:42:21.213989,0 days 00:00:10.114620,True,entropy,10,9,6,879,COMPLETE
901,901,0.8067904059795655,2023-04-04 20:42:21.215739,2023-04-04 20:42:30.664894,0 days 00:00:09.449155,True,entropy,9,10,9,809,COMPLETE
902,902,0.8063622314761298,2023-04-04 20:42:30.666816,2023-04-04 20:42:42.059114,0 days 00:00:11.392298,True,entropy,10,10,7,986,COMPLETE
903,903,0.8068110924662161,2023-04-04 20:42:42.061088,2023-04-04 20:42:53.108649,0 days 00:00:11.047561,True,entropy,10,10,8,962,COMPLETE
904,904,0.806814871935825,2023-04-04 20:42:53.110341,2023-04-04 20:43:03.015927,0 days 00:00:09.905586,True,entropy,9,10,6,850,COMPLETE
905,905,0.8063618177611043,2023-04-04 20:43:03.017571,2023-04-04 20:43:20.233080,0 days 00:00:17.215509,False,gini,8,10,9,871,COMPLETE
906,906,0.8066225444592344,2023-04-04 20:43:20.234496,2023-04-04 20:43:30.999308,0 days 00:00:10.764812,True,entropy,9,10,8,727,COMPLETE
907,907,0.8065415879875749,2023-04-04 20:43:31.000136,2023-04-04 20:43:42.687545,0 days 00:00:11.687409,True,entropy,8,10,6,818,COMPLETE
908,908,0.8066557434334533,2023-04-04 20:43:42.689331,2023-04-04 20:43:53.378440,0 days 00:00:10.689109,True,entropy,10,10,2,837,COMPLETE
909,909,0.8068842999615201,2023-04-04 20:43:53.382376,2023-04-04 20:44:04.179219,0 days 00:00:10.796843,True,entropy,10,10,9,876,COMPLETE
910,910,0.8065705153618836,2023-04-04 20:44:04.181163,2023-04-04 20:44:13.688206,0 days 00:00:09.507043,True,entropy,8,10,8,789,COMPLETE
911,911,0.8064445074336918,2023-04-04 20:44:13.689373,2023-04-04 20:44:24.959754,0 days 00:00:11.270381,True,entropy,8,10,6,946,COMPLETE
912,912,0.8053507788852781,2023-04-04 20:44:24.961791,2023-04-04 20:44:35.548542,0 days 00:00:10.586751,True,entropy,9,9,7,895,COMPLETE
913,913,0.8066179824921361,2023-04-04 20:44:35.550509,2023-04-04 20:44:41.808333,0 days 00:00:06.257824,True,entropy,8,10,7,516,COMPLETE
914,914,0.8064197732198762,2023-04-04 20:44:41.810622,2023-04-04 20:44:52.034899,0 days 00:00:10.224277,True,entropy,9,10,1,860,COMPLETE
915,915,0.8071354439509623,2023-04-04 20:44:52.036614,2023-04-04 20:45:02.823120,0 days 00:00:10.786506,True,entropy,8,10,6,914,COMPLETE
916,916,0.8061678465441418,2023-04-04 20:45:02.824600,2023-04-04 20:45:12.812605,0 days 00:00:09.988005,True,entropy,10,10,8,829,COMPLETE
917,917,0.8065487444843964,2023-04-04 20:45:12.814672,2023-04-04 20:45:28.970247,0 days 00:00:16.155575,False,entropy,8,10,9,887,COMPLETE
918,918,0.8068272727107793,2023-04-04 20:45:28.972514,2023-04-04 20:45:39.787584,0 days 00:00:10.815070,True,entropy,8,10,6,845,COMPLETE
919,919,0.8058816029518155,2023-04-04 20:45:39.788406,2023-04-04 20:45:49.613300,0 days 00:00:09.824894,True,entropy,10,10,10,762,COMPLETE
920,920,0.8066360743987999,2023-04-04 20:45:49.614324,2023-04-04 20:46:00.269909,0 days 00:00:10.655585,True,entropy,8,10,9,808,COMPLETE
921,921,0.8067011081492568,2023-04-04 20:46:00.270877,2023-04-04 20:46:08.666919,0 days 00:00:08.396042,True,entropy,9,10,6,631,COMPLETE
922,922,0.806297220412884,2023-04-04 20:46:08.668770,2023-04-04 20:46:21.844995,0 days 00:00:13.176225,True,entropy,8,10,8,955,COMPLETE
923,923,0.8068121883639844,2023-04-04 20:46:21.847827,2023-04-04 20:46:34.669336,0 days 00:00:12.821509,True,entropy,10,10,9,924,COMPLETE
924,924,0.8057776677245624,2023-04-04 20:46:34.670602,2023-04-04 20:46:42.160600,0 days 00:00:07.489998,True,gini,8,10,8,569,COMPLETE
925,925,0.8052461058125828,2023-04-04 20:46:42.162649,2023-04-04 20:46:55.287329,0 days 00:00:13.124680,True,entropy,6,9,6,1000,COMPLETE
926,926,0.8066471444603021,2023-04-04 20:46:55.288289,2023-04-04 20:47:07.406348,0 days 00:00:12.118059,True,entropy,8,10,8,879,COMPLETE
927,927,0.8062352058061533,2023-04-04 20:47:07.408379,2023-04-04 20:47:18.873772,0 days 00:00:11.465393,True,entropy,8,10,6,860,COMPLETE
928,928,0.7921220129460893,2023-04-04 20:47:18.875440,2023-04-04 20:47:22.458913,0 days 00:00:03.583473,False,entropy,9,4,6,262,COMPLETE
929,929,0.8068477464223225,2023-04-04 20:47:22.460955,2023-04-04 20:47:32.040362,0 days 00:00:09.579407,True,entropy,9,10,9,795,COMPLETE
930,930,0.8065253856687438,2023-04-04 20:47:32.042296,2023-04-04 20:47:42.753737,0 days 00:00:10.711441,True,entropy,10,10,8,902,COMPLETE
931,931,0.8065550286171416,2023-04-04 20:47:42.755531,2023-04-04 20:47:53.853195,0 days 00:00:11.097664,True,entropy,8,10,7,940,COMPLETE
932,932,0.8068548134860073,2023-04-04 20:47:53.855172,2023-04-04 20:48:05.456070,0 days 00:00:11.600898,True,entropy,8,10,6,969,COMPLETE
933,933,0.8066362980813242,2023-04-04 20:48:05.456878,2023-04-04 20:48:15.397049,0 days 00:00:09.940171,True,entropy,8,10,8,841,COMPLETE
934,934,0.8065740265283919,2023-04-04 20:48:15.399326,2023-04-04 20:48:25.681992,0 days 00:00:10.282666,True,entropy,10,10,9,868,COMPLETE
935,935,0.8058828438970016,2023-04-04 20:48:25.683660,2023-04-04 20:48:35.465068,0 days 00:00:09.781408,True,entropy,8,10,9,829,COMPLETE
936,936,0.8068880904700858,2023-04-04 20:48:35.467164,2023-04-04 20:48:46.149159,0 days 00:00:10.681995,True,entropy,9,10,6,890,COMPLETE
937,937,0.8069089783376299,2023-04-04 20:48:46.151060,2023-04-04 20:48:54.939314,0 days 00:00:08.788254,True,entropy,8,10,7,742,COMPLETE
938,938,0.8069491545153606,2023-04-04 20:48:54.941595,2023-04-04 20:49:04.070635,0 days 00:00:09.129040,True,entropy,7,10,8,779,COMPLETE
939,939,0.8064498075383522,2023-04-04 20:49:04.072063,2023-04-04 20:49:20.559138,0 days 00:00:16.487075,False,entropy,10,10,6,929,COMPLETE
940,940,0.8063491711115539,2023-04-04 20:49:20.561803,2023-04-04 20:49:31.491732,0 days 00:00:10.929929,True,entropy,8,10,9,916,COMPLETE
941,941,0.8068712061833245,2023-04-04 20:49:31.494221,2023-04-04 20:49:41.615991,0 days 00:00:10.121770,True,entropy,8,10,10,850,COMPLETE
942,942,0.8060669976361423,2023-04-04 20:49:41.616743,2023-04-04 20:49:51.273090,0 days 00:00:09.656347,True,entropy,10,10,6,819,COMPLETE
943,943,0.8047199223188872,2023-04-04 20:49:51.275734,2023-04-04 20:50:01.686612,0 days 00:00:10.410878,True,gini,8,9,8,904,COMPLETE
944,944,0.8071142878643777,2023-04-04 20:50:01.690028,2023-04-04 20:50:12.246592,0 days 00:00:10.556564,True,entropy,9,10,6,880,COMPLETE
945,945,0.8065385240946655,2023-04-04 20:50:12.248607,2023-04-04 20:50:23.762562,0 days 00:00:11.513955,True,entropy,8,10,9,861,COMPLETE
946,946,0.8063904878755153,2023-04-04 20:50:23.765341,2023-04-04 20:50:32.858422,0 days 00:00:09.093081,True,entropy,10,10,8,698,COMPLETE
947,947,0.8069691251844524,2023-04-04 20:50:32.859352,2023-04-04 20:50:43.120020,0 days 00:00:10.260668,True,entropy,8,10,9,800,COMPLETE
948,948,0.7871105850302207,2023-04-04 20:50:43.121196,2023-04-04 20:50:50.109045,0 days 00:00:06.987849,True,entropy,9,2,7,949,COMPLETE
949,949,0.8064342425272871,2023-04-04 20:50:50.110945,2023-04-04 20:51:00.460023,0 days 00:00:10.349078,True,entropy,8,10,6,890,COMPLETE
950,950,0.8062452806472503,2023-04-04 20:51:00.461960,2023-04-04 20:51:14.491191,0 days 00:00:14.029231,False,entropy,7,10,8,829,COMPLETE
951,951,0.8049379903477941,2023-04-04 20:51:14.492582,2023-04-04 20:51:24.803172,0 days 00:00:10.310590,True,entropy,10,9,6,917,COMPLETE
952,952,0.8064896036094293,2023-04-04 20:51:24.805181,2023-04-04 20:51:34.867749,0 days 00:00:10.062568,True,entropy,8,10,9,867,COMPLETE
953,953,0.806418341901988,2023-04-04 20:51:34.868816,2023-04-04 20:51:43.876830,0 days 00:00:09.008014,True,entropy,8,10,8,772,COMPLETE
