,number,value,datetime_start,datetime_complete,duration,params_bootstrap,params_criterion,params_max_depth,params_max_leaf_nodes,params_min_samples_leaf,params_n_estimators,state
636,636,0.8064355842164993,2023-04-04 19:59:04.799340,2023-04-04 19:59:14.192024,0 days 00:00:09.392684,True,entropy,8,10,9,870,COMPLETE
637,637,0.8062740403525652,2023-04-04 19:59:14.194892,2023-04-04 19:59:23.696931,0 days 00:00:09.502039,True,entropy,9,10,10,884,COMPLETE
638,638,0.7954899023685631,2023-04-04 19:59:23.699999,2023-04-04 19:59:31.933858,0 days 00:00:08.233859,True,gini,10,5,9,914,COMPLETE
639,639,0.8070729598195502,2023-04-04 19:59:31.936523,2023-04-04 19:59:41.033780,0 days 00:00:09.097257,True,entropy,7,10,9,841,COMPLETE
640,640,0.7869159878220382,2023-04-04 19:59:41.036648,2023-04-04 19:59:47.050176,0 days 00:00:06.013528,True,entropy,9,2,9,894,COMPLETE
641,641,0.8062028791994769,2023-04-04 19:59:47.052989,2023-04-04 19:59:56.285961,0 days 00:00:09.232972,True,entropy,8,10,9,862,COMPLETE
642,642,0.8059573150646285,2023-04-04 19:59:56.288672,2023-04-04 20:00:05.361907,0 days 00:00:09.073235,False,entropy,8,10,9,560,COMPLETE
643,643,0.8051606766878148,2023-04-04 20:00:05.364711,2023-04-04 20:00:14.037799,0 days 00:00:08.673088,True,entropy,10,9,8,825,COMPLETE
644,644,0.8065123474485721,2023-04-04 20:00:14.040983,2023-04-04 20:00:18.242283,0 days 00:00:04.201300,True,entropy,7,10,2,379,COMPLETE
645,645,0.8062669735219747,2023-04-04 20:00:18.245821,2023-04-04 20:00:27.661172,0 days 00:00:09.415351,True,entropy,8,10,8,878,COMPLETE
646,646,0.8071342027467321,2023-04-04 20:00:27.664209,2023-04-04 20:00:37.455921,0 days 00:00:09.791712,True,entropy,8,10,8,920,COMPLETE
647,647,0.807038363237677,2023-04-04 20:00:37.458871,2023-04-04 20:00:48.464494,0 days 00:00:11.005623,True,entropy,8,10,8,955,COMPLETE
648,648,0.8064967488708165,2023-04-04 20:00:48.467876,2023-04-04 20:00:58.543558,0 days 00:00:10.075682,True,entropy,8,10,8,938,COMPLETE
649,649,0.8051264712611703,2023-04-04 20:00:58.546460,2023-04-04 20:01:08.167383,0 days 00:00:09.620923,True,entropy,8,9,8,925,COMPLETE
650,650,0.8068833719502513,2023-04-04 20:01:08.169524,2023-04-04 20:01:18.235586,0 days 00:00:10.066062,True,entropy,8,10,8,946,COMPLETE
651,651,0.806665740026547,2023-04-04 20:01:18.238339,2023-04-04 20:01:28.042129,0 days 00:00:09.803790,True,entropy,8,10,8,914,COMPLETE
652,652,0.8070455084551849,2023-04-04 20:01:28.045375,2023-04-04 20:01:38.012569,0 days 00:00:09.967194,True,entropy,8,10,8,925,COMPLETE
653,653,0.8065476485519689,2023-04-04 20:01:38.015581,2023-04-04 20:01:48.332035,0 days 00:00:10.316454,True,entropy,8,10,8,962,COMPLETE
654,654,0.8066642414388463,2023-04-04 20:01:48.334955,2023-04-04 20:01:57.964463,0 days 00:00:09.629508,True,entropy,8,10,8,902,COMPLETE
655,655,0.8063504010931635,2023-04-04 20:01:57.967619,2023-04-04 20:02:07.119486,0 days 00:00:09.151867,True,entropy,8,10,8,850,COMPLETE
656,656,0.8062081458340122,2023-04-04 20:02:07.121994,2023-04-04 20:02:22.853643,0 days 00:00:15.731649,False,entropy,8,10,9,984,COMPLETE
657,657,0.806346319779345,2023-04-04 20:02:22.856879,2023-04-04 20:02:29.479193,0 days 00:00:06.622314,True,gini,9,10,10,612,COMPLETE
658,658,0.8070367083380612,2023-04-04 20:02:29.482422,2023-04-04 20:02:38.297545,0 days 00:00:08.815123,True,entropy,8,10,8,828,COMPLETE
659,659,0.8071355668093243,2023-04-04 20:02:38.302767,2023-04-04 20:02:47.785951,0 days 00:00:09.483184,True,entropy,8,10,9,875,COMPLETE
660,660,0.8064256436326971,2023-04-04 20:02:47.789541,2023-04-04 20:02:57.171761,0 days 00:00:09.382220,True,entropy,10,10,8,863,COMPLETE
661,661,0.8073490839215077,2023-04-04 20:02:57.174808,2023-04-04 20:03:06.548649,0 days 00:00:09.373841,True,entropy,8,10,9,872,COMPLETE
662,662,0.8065565492807382,2023-04-04 20:03:06.551882,2023-04-04 20:03:16.139320,0 days 00:00:09.587438,True,entropy,9,10,8,896,COMPLETE
663,663,0.8046994035770985,2023-04-04 20:03:16.142893,2023-04-04 20:03:25.447829,0 days 00:00:09.304936,True,entropy,8,9,8,879,COMPLETE
664,664,0.8069098392590816,2023-04-04 20:03:25.451625,2023-04-04 20:03:34.913635,0 days 00:00:09.462010,True,entropy,8,10,9,877,COMPLETE
665,665,0.8061717266974983,2023-04-04 20:03:34.916675,2023-04-04 20:03:44.412225,0 days 00:00:09.495550,True,entropy,10,10,7,885,COMPLETE
666,666,0.8066949804156822,2023-04-04 20:03:44.416072,2023-04-04 20:03:58.207635,0 days 00:00:13.791563,False,entropy,8,10,8,869,COMPLETE
667,667,0.8060767258356087,2023-04-04 20:03:58.210756,2023-04-04 20:04:07.509146,0 days 00:00:09.298390,True,entropy,9,10,8,848,COMPLETE
668,668,0.8069600792455993,2023-04-04 20:04:07.512255,2023-04-04 20:04:17.445497,0 days 00:00:09.933242,True,entropy,8,10,9,905,COMPLETE
669,669,0.8067978979592011,2023-04-04 20:04:17.448197,2023-04-04 20:04:26.389407,0 days 00:00:08.941210,True,entropy,8,10,7,831,COMPLETE
670,670,0.8030765621168421,2023-04-04 20:04:26.393710,2023-04-04 20:04:35.735902,0 days 00:00:09.342192,True,entropy,10,8,9,888,COMPLETE
671,671,0.8067312432075502,2023-04-04 20:04:35.738906,2023-04-04 20:04:45.347253,0 days 00:00:09.608347,True,entropy,9,10,8,868,COMPLETE
672,672,0.7898200992582175,2023-04-04 20:04:45.351577,2023-04-04 20:04:50.599809,0 days 00:00:05.248232,True,entropy,8,3,7,666,COMPLETE
673,673,0.8067645648824915,2023-04-04 20:04:50.602722,2023-04-04 20:04:59.442397,0 days 00:00:08.839675,True,entropy,8,10,8,817,COMPLETE
674,674,0.8064490695917834,2023-04-04 20:04:59.445469,2023-04-04 20:05:09.174196,0 days 00:00:09.728727,True,entropy,10,10,9,905,COMPLETE
675,675,0.8069101859694454,2023-04-04 20:05:09.177103,2023-04-04 20:05:18.265290,0 days 00:00:09.088187,True,entropy,8,10,5,845,COMPLETE
676,676,0.806019586589796,2023-04-04 20:05:18.268271,2023-04-04 20:05:27.797710,0 days 00:00:09.529439,True,gini,8,10,8,881,COMPLETE
677,677,0.8065150870659317,2023-04-04 20:05:27.800881,2023-04-04 20:05:37.117546,0 days 00:00:09.316665,True,entropy,10,10,8,864,COMPLETE
678,678,0.8065554645780658,2023-04-04 20:05:37.121403,2023-04-04 20:05:51.239810,0 days 00:00:14.118407,False,entropy,9,10,9,890,COMPLETE
679,679,0.806568927521837,2023-04-04 20:05:51.241903,2023-04-04 20:05:58.487930,0 days 00:00:07.246027,True,entropy,6,10,10,692,COMPLETE
680,680,0.8067355702990163,2023-04-04 20:05:58.491311,2023-04-04 20:06:08.351355,0 days 00:00:09.860044,True,entropy,8,10,9,913,COMPLETE
681,681,0.8069894091147287,2023-04-04 20:06:08.354418,2023-04-04 20:06:14.780708,0 days 00:00:06.426290,True,entropy,9,10,1,593,COMPLETE
682,682,0.8060487377518146,2023-04-04 20:06:14.783839,2023-04-04 20:06:16.482730,0 days 00:00:01.698891,True,entropy,8,10,4,145,COMPLETE
683,683,0.8067034899022149,2023-04-04 20:06:16.485980,2023-04-04 20:06:25.705306,0 days 00:00:09.219326,True,entropy,8,10,8,846,COMPLETE
684,684,0.8053227237746686,2023-04-04 20:06:25.707964,2023-04-04 20:06:34.242997,0 days 00:00:08.535033,True,entropy,8,9,8,800,COMPLETE
685,685,0.806945341548522,2023-04-04 20:06:34.246064,2023-04-04 20:06:43.607717,0 days 00:00:09.361653,True,entropy,10,10,7,870,COMPLETE
686,686,0.806585979923361,2023-04-04 20:06:43.610728,2023-04-04 20:06:53.190781,0 days 00:00:09.580053,True,entropy,8,10,8,898,COMPLETE
687,687,0.8065120903213174,2023-04-04 20:06:53.193477,2023-04-04 20:07:03.024783,0 days 00:00:09.831306,True,entropy,9,10,9,922,COMPLETE
688,688,0.8064481637732239,2023-04-04 20:07:03.027965,2023-04-04 20:07:11.763268,0 days 00:00:08.735303,True,entropy,6,10,8,825,COMPLETE
689,689,0.8062816775121414,2023-04-04 20:07:11.766293,2023-04-04 20:07:25.754119,0 days 00:00:13.987826,False,entropy,8,10,5,880,COMPLETE
690,690,0.8068864244406942,2023-04-04 20:07:25.757430,2023-04-04 20:07:34.884284,0 days 00:00:09.126854,True,entropy,10,10,9,857,COMPLETE
691,691,0.8068602366668879,2023-04-04 20:07:34.887281,2023-04-04 20:07:44.906477,0 days 00:00:10.019196,True,entropy,8,10,7,935,COMPLETE
692,692,0.8065993645072069,2023-04-04 20:07:44.909563,2023-04-04 20:07:54.602226,0 days 00:00:09.692663,True,entropy,9,10,8,898,COMPLETE
693,693,0.804859505125771,2023-04-04 20:07:54.605808,2023-04-04 20:08:03.488407,0 days 00:00:08.882599,True,entropy,8,9,8,842,COMPLETE
694,694,0.806253879393241,2023-04-04 20:08:03.491451,2023-04-04 20:08:13.170527,0 days 00:00:09.679076,True,entropy,10,10,9,909,COMPLETE
695,695,0.8064139809432337,2023-04-04 20:08:13.173864,2023-04-04 20:08:22.622776,0 days 00:00:09.448912,True,gini,8,10,8,883,COMPLETE
696,696,0.8017579671256568,2023-04-04 20:08:22.625884,2023-04-04 20:08:31.281236,0 days 00:00:08.655352,True,entropy,8,7,7,869,COMPLETE
697,697,0.8060031157782289,2023-04-04 20:08:31.284776,2023-04-04 20:08:36.935986,0 days 00:00:05.651210,True,entropy,9,10,9,520,COMPLETE
698,698,0.806859957156688,2023-04-04 20:08:36.938852,2023-04-04 20:08:45.541152,0 days 00:00:08.602300,True,entropy,8,10,8,806,COMPLETE
699,699,0.8070560975658857,2023-04-04 20:08:45.544759,2023-04-04 20:08:55.266475,0 days 00:00:09.721716,True,entropy,10,10,5,913,COMPLETE
700,700,0.8069050422319595,2023-04-04 20:08:55.269452,2023-04-04 20:09:04.863331,0 days 00:00:09.593879,True,entropy,8,10,10,890,COMPLETE
701,701,0.7959832339760244,2023-04-04 20:09:04.866352,2023-04-04 20:09:15.965991,0 days 00:00:11.099639,False,entropy,9,5,2,857,COMPLETE
702,702,0.807156789967211,2023-04-04 20:09:15.969337,2023-04-04 20:09:25.972893,0 days 00:00:10.003556,True,entropy,8,10,9,938,COMPLETE
703,703,0.8066622065086169,2023-04-04 20:09:25.976041,2023-04-04 20:09:35.812781,0 days 00:00:09.836740,True,entropy,8,10,9,922,COMPLETE
704,704,0.8066331002941645,2023-04-04 20:09:35.815849,2023-04-04 20:09:46.170564,0 days 00:00:10.354715,True,entropy,8,10,9,963,COMPLETE
705,705,0.8063606324547082,2023-04-04 20:09:46.173735,2023-04-04 20:09:56.399522,0 days 00:00:10.225787,True,entropy,8,10,9,951,COMPLETE
706,706,0.8059808415888107,2023-04-04 20:09:56.402350,2023-04-04 20:10:06.478801,0 days 00:00:10.076451,True,entropy,8,10,9,944,COMPLETE
707,707,0.8065649691692254,2023-04-04 20:10:06.482064,2023-04-04 20:10:16.876627,0 days 00:00:10.394563,True,entropy,8,10,9,978,COMPLETE
708,708,0.8054875776149487,2023-04-04 20:10:16.880059,2023-04-04 20:10:27.173645,0 days 00:00:10.293586,True,entropy,8,9,9,971,COMPLETE
709,709,0.80686185789537,2023-04-04 20:10:27.178254,2023-04-04 20:10:37.194252,0 days 00:00:10.015998,True,entropy,8,10,9,937,COMPLETE
710,710,0.806949959674982,2023-04-04 20:10:37.197215,2023-04-04 20:10:47.257178,0 days 00:00:10.059963,True,entropy,8,10,9,944,COMPLETE
711,711,0.8062117911357054,2023-04-04 20:10:47.260180,2023-04-04 20:10:54.085998,0 days 00:00:06.825818,True,entropy,8,10,9,635,COMPLETE
712,712,0.8057036215802696,2023-04-04 20:10:54.088980,2023-04-04 20:11:08.996465,0 days 00:00:14.907485,False,entropy,8,10,10,930,COMPLETE
713,713,0.8064029333354281,2023-04-04 20:11:08.999247,2023-04-04 20:11:19.275110,0 days 00:00:10.275863,True,entropy,8,10,9,953,COMPLETE
714,714,0.8066418778662697,2023-04-04 20:11:19.278209,2023-04-04 20:11:28.067526,0 days 00:00:08.789317,True,entropy,9,10,9,818,COMPLETE
715,715,0.8071203485114363,2023-04-04 20:11:28.070708,2023-04-04 20:11:38.550505,0 days 00:00:10.479797,True,entropy,8,10,9,986,COMPLETE
716,716,0.8069032531159428,2023-04-04 20:11:38.553446,2023-04-04 20:11:48.551626,0 days 00:00:09.998180,True,entropy,8,10,9,928,COMPLETE
717,717,0.806618854411074,2023-04-04 20:11:48.554651,2023-04-04 20:11:58.345670,0 days 00:00:09.791019,True,entropy,8,10,4,917,COMPLETE
718,718,0.7990713981964972,2023-04-04 20:11:58.348413,2023-04-04 20:12:06.227911,0 days 00:00:07.879498,True,entropy,10,6,9,829,COMPLETE
719,719,0.8063646020300231,2023-04-04 20:12:06.231744,2023-04-04 20:12:15.147164,0 days 00:00:08.915420,True,gini,8,10,5,840,COMPLETE
720,720,0.8052984590802756,2023-04-04 20:12:15.150379,2023-04-04 20:12:23.539472,0 days 00:00:08.389093,True,entropy,9,9,6,793,COMPLETE
721,721,0.8063940772990369,2023-04-04 20:12:23.542708,2023-04-04 20:12:33.263068,0 days 00:00:09.720360,True,entropy,8,10,7,902,COMPLETE
722,722,0.8068113161631215,2023-04-04 20:12:33.266145,2023-04-04 20:12:40.835966,0 days 00:00:07.569821,True,entropy,8,10,9,710,COMPLETE
723,723,0.806335875807294,2023-04-04 20:12:40.838879,2023-04-04 20:12:51.042220,0 days 00:00:10.203341,True,entropy,10,10,10,960,COMPLETE
724,724,0.806454448030105,2023-04-04 20:12:51.044995,2023-04-04 20:13:04.922273,0 days 00:00:13.877278,False,entropy,8,10,6,863,COMPLETE
725,725,0.8066629445149841,2023-04-04 20:13:04.925384,2023-04-04 20:13:14.994345,0 days 00:00:10.068961,True,entropy,9,10,6,938,COMPLETE
726,726,0.8067299795412064,2023-04-04 20:13:14.997428,2023-04-04 20:13:24.385759,0 days 00:00:09.388331,True,entropy,8,10,9,884,COMPLETE
727,727,0.8068948556973787,2023-04-04 20:13:24.388743,2023-04-04 20:13:34.219097,0 days 00:00:09.830354,True,entropy,10,10,6,915,COMPLETE
728,728,0.8065424042833339,2023-04-04 20:13:34.222494,2023-04-04 20:13:38.649331,0 days 00:00:04.426837,True,entropy,8,10,5,398,COMPLETE
729,729,0.8065693637109046,2023-04-04 20:13:38.653728,2023-04-04 20:13:48.228481,0 days 00:00:09.574753,True,entropy,9,10,7,873,COMPLETE
730,730,0.8056026832370028,2023-04-04 20:13:48.229717,2023-04-04 20:13:55.956246,0 days 00:00:07.726529,True,entropy,4,9,4,813,COMPLETE
731,731,0.8069468287004552,2023-04-04 20:13:55.958859,2023-04-04 20:14:05.047463,0 days 00:00:09.088604,True,entropy,8,10,9,846,COMPLETE
732,732,0.807058412199251,2023-04-04 20:14:05.051004,2023-04-04 20:14:13.524023,0 days 00:00:08.473019,True,entropy,10,10,6,779,COMPLETE
733,733,0.8061577494292165,2023-04-04 20:14:13.527320,2023-04-04 20:14:23.262813,0 days 00:00:09.735493,True,gini,8,10,2,898,COMPLETE
734,734,0.8068056246607606,2023-04-04 20:14:23.266004,2023-04-04 20:14:32.131271,0 days 00:00:08.865267,False,entropy,9,10,9,551,COMPLETE
735,735,0.8067348995392578,2023-04-04 20:14:32.134019,2023-04-04 20:14:42.565374,0 days 00:00:10.431355,True,entropy,8,10,3,916,COMPLETE
736,736,0.8060605121491806,2023-04-04 20:14:42.568387,2023-04-04 20:14:52.106011,0 days 00:00:09.537624,True,entropy,8,10,8,886,COMPLETE
737,737,0.8069347411571577,2023-04-04 20:14:52.109058,2023-04-04 20:15:01.120518,0 days 00:00:09.011460,True,entropy,8,10,6,836,COMPLETE
738,738,0.8068758352997607,2023-04-04 20:15:01.123720,2023-04-04 20:15:11.085455,0 days 00:00:09.961735,True,entropy,8,10,9,933,COMPLETE
739,739,0.8066136215341771,2023-04-04 20:15:11.088490,2023-04-04 20:15:18.976195,0 days 00:00:07.887705,True,entropy,10,10,7,738,COMPLETE
740,740,0.8067473895187627,2023-04-04 20:15:18.979167,2023-04-04 20:15:29.450043,0 days 00:00:10.470876,True,entropy,9,10,8,968,COMPLETE
741,741,0.8065552634223824,2023-04-04 20:15:29.453548,2023-04-04 20:15:38.723356,0 days 00:00:09.269808,True,entropy,8,10,6,861,COMPLETE
742,742,0.8063822021564221,2023-04-04 20:15:38.726142,2023-04-04 20:15:48.370024,0 days 00:00:09.643882,True,entropy,10,10,5,908,COMPLETE
743,743,0.8066561682240156,2023-04-04 20:15:48.372057,2023-04-04 20:15:57.682387,0 days 00:00:09.310330,True,entropy,8,10,8,874,COMPLETE
744,744,0.8064524352825397,2023-04-04 20:15:57.686180,2023-04-04 20:16:07.292661,0 days 00:00:09.606481,True,entropy,8,10,9,893,COMPLETE
745,745,0.8067095949766359,2023-04-04 20:16:07.296311,2023-04-04 20:16:17.846732,0 days 00:00:10.550421,False,entropy,8,10,7,653,COMPLETE
746,746,0.8065779847647377,2023-04-04 20:16:17.849869,2023-04-04 20:16:23.136652,0 days 00:00:05.286783,True,entropy,6,10,10,492,COMPLETE
747,747,0.8062947714298441,2023-04-04 20:16:23.139784,2023-04-04 20:16:33.216817,0 days 00:00:10.077033,True,entropy,9,10,6,940,COMPLETE
748,748,0.8067249142111936,2023-04-04 20:16:33.220271,2023-04-04 20:16:42.454362,0 days 00:00:09.234091,True,entropy,10,10,9,854,COMPLETE
749,749,0.8065805232437206,2023-04-04 20:16:42.457651,2023-04-04 20:16:51.051264,0 days 00:00:08.593613,True,entropy,8,10,1,799,COMPLETE
750,750,0.8052195265929207,2023-04-04 20:16:51.054551,2023-04-04 20:16:59.746647,0 days 00:00:08.692096,True,entropy,8,9,8,827,COMPLETE
751,751,0.8066149184911982,2023-04-04 20:16:59.749422,2023-04-04 20:17:07.967583,0 days 00:00:08.218161,True,entropy,8,10,8,771,COMPLETE
752,752,0.8058407555455037,2023-04-04 20:17:07.970855,2023-04-04 20:17:17.766450,0 days 00:00:09.795595,True,gini,9,10,9,919,COMPLETE
753,753,0.8063605205913416,2023-04-04 20:17:17.769490,2023-04-04 20:17:25.184058,0 days 00:00:07.414568,True,entropy,10,10,6,685,COMPLETE
754,754,0.806635392436166,2023-04-04 20:17:25.187067,2023-04-04 20:17:34.539340,0 days 00:00:09.352273,True,entropy,8,10,8,878,COMPLETE
755,755,0.8072688095470155,2023-04-04 20:17:34.542935,2023-04-04 20:17:44.698991,0 days 00:00:10.156056,True,entropy,8,10,6,953,COMPLETE
756,756,0.8068921608309354,2023-04-04 20:17:44.700838,2023-04-04 20:17:55.476920,0 days 00:00:10.776082,True,entropy,10,10,6,990,COMPLETE
757,757,0.806253186283081,2023-04-04 20:17:55.479863,2023-04-04 20:18:11.104539,0 days 00:00:15.624676,False,entropy,8,10,6,972,COMPLETE
758,758,0.8068011966661587,2023-04-04 20:18:11.107644,2023-04-04 20:18:21.487348,0 days 00:00:10.379704,True,entropy,9,10,6,969,COMPLETE
759,759,0.8048849550944063,2023-04-04 20:18:21.490373,2023-04-04 20:18:31.786756,0 days 00:00:10.296383,True,entropy,8,9,6,991,COMPLETE
760,760,0.8067523207381522,2023-04-04 20:18:31.789808,2023-04-04 20:18:42.543904,0 days 00:00:10.754096,True,entropy,8,10,6,944,COMPLETE
761,761,0.8066955168738617,2023-04-04 20:18:42.544426,2023-04-04 20:18:50.071499,0 days 00:00:07.527073,True,entropy,8,10,6,577,COMPLETE
762,762,0.8064305302172261,2023-04-04 20:18:50.072421,2023-04-04 20:18:59.924190,0 days 00:00:09.851769,True,entropy,9,10,6,816,COMPLETE
763,763,0.8068288492199587,2023-04-04 20:18:59.924783,2023-04-04 20:19:11.296915,0 days 00:00:11.372132,True,entropy,10,10,6,971,COMPLETE
764,764,0.8064206900760347,2023-04-04 20:19:11.297563,2023-04-04 20:19:22.137528,0 days 00:00:10.839965,True,entropy,8,10,6,958,COMPLETE
765,765,0.8067765070095805,2023-04-04 20:19:22.140539,2023-04-04 20:19:32.611406,0 days 00:00:10.470867,True,entropy,8,10,5,949,COMPLETE
766,766,0.8063361217900915,2023-04-04 20:19:32.614456,2023-04-04 20:19:43.793064,0 days 00:00:11.178608,True,entropy,9,10,6,843,COMPLETE
767,767,0.8065855437813088,2023-04-04 20:19:43.794962,2023-04-04 20:19:53.868551,0 days 00:00:10.073589,True,entropy,8,10,6,866,COMPLETE
768,768,0.8062617068066575,2023-04-04 20:19:53.871886,2023-04-04 20:20:09.144315,0 days 00:00:15.272429,False,entropy,10,10,6,796,COMPLETE
769,769,0.8036414346028469,2023-04-04 20:20:09.147314,2023-04-04 20:20:11.535206,0 days 00:00:02.387892,True,entropy,8,9,5,179,COMPLETE
770,770,0.8067620713225067,2023-04-04 20:20:11.536080,2023-04-04 20:20:22.269761,0 days 00:00:10.733681,True,entropy,9,10,7,902,COMPLETE
771,771,0.8062814761742422,2023-04-04 20:20:22.271756,2023-04-04 20:20:33.222350,0 days 00:00:10.950594,True,entropy,8,10,6,855,COMPLETE
772,772,0.8062114668824065,2023-04-04 20:20:33.223019,2023-04-04 20:20:43.014317,0 days 00:00:09.791298,True,gini,8,10,6,729,COMPLETE
773,773,0.8063470353370497,2023-04-04 20:20:43.014967,2023-04-04 20:20:54.520190,0 days 00:00:11.505223,True,entropy,10,10,9,953,COMPLETE
774,774,0.7866080401594562,2023-04-04 20:20:54.521940,2023-04-04 20:20:59.757497,0 days 00:00:05.235557,True,entropy,7,2,7,704,COMPLETE
775,775,0.8065141031219142,2023-04-04 20:20:59.759309,2023-04-04 20:21:10.788174,0 days 00:00:11.028865,True,entropy,9,10,6,888,COMPLETE
776,776,0.8067713076512113,2023-04-04 20:21:10.788834,2023-04-04 20:21:22.608783,0 days 00:00:11.819949,True,entropy,8,10,9,929,COMPLETE
777,777,0.806760081036275,2023-04-04 20:21:22.610771,2023-04-04 20:21:34.702825,0 days 00:00:12.092054,True,entropy,8,10,6,1000,COMPLETE
778,778,0.8065365339483386,2023-04-04 20:21:34.704329,2023-04-04 20:21:45.364068,0 days 00:00:10.659739,True,entropy,10,10,5,832,COMPLETE
779,779,0.8065359521523993,2023-04-04 20:21:45.365954,2023-04-04 20:21:58.895254,0 days 00:00:13.529300,False,entropy,6,10,6,761,COMPLETE
780,780,0.806209599400845,2023-04-04 20:21:58.897403,2023-04-04 20:22:09.368747,0 days 00:00:10.471344,True,entropy,8,10,9,874,COMPLETE
781,781,0.8069139652491563,2023-04-04 20:22:09.370123,2023-04-04 20:22:19.349248,0 days 00:00:09.979125,True,entropy,9,10,6,852,COMPLETE
782,782,0.806520096408776,2023-04-04 20:22:19.350474,2023-04-04 20:22:30.770340,0 days 00:00:11.419866,True,entropy,8,10,7,893,COMPLETE
783,783,0.8048350953498634,2023-04-04 20:22:30.772151,2023-04-04 20:22:41.570980,0 days 00:00:10.798829,True,entropy,8,9,4,904,COMPLETE
784,784,0.8058825755916429,2023-04-04 20:22:41.572394,2023-04-04 20:22:44.538882,0 days 00:00:02.966488,True,entropy,7,10,9,235,COMPLETE
785,785,0.8062882634964407,2023-04-04 20:22:44.541065,2023-04-04 20:22:55.868650,0 days 00:00:11.327585,True,entropy,8,10,9,924,COMPLETE
786,786,0.8069014081748156,2023-04-04 20:22:55.870987,2023-04-04 20:23:07.431860,0 days 00:00:11.560873,True,entropy,10,10,10,811,COMPLETE
787,787,0.8068698977726136,2023-04-04 20:23:07.432753,2023-04-04 20:23:18.456845,0 days 00:00:11.024092,True,entropy,7,10,6,876,COMPLETE
788,788,0.8068132506165462,2023-04-04 20:23:18.457499,2023-04-04 20:23:31.468933,0 days 00:00:13.011434,True,entropy,8,10,6,941,COMPLETE
789,789,0.8033503829340738,2023-04-04 20:23:31.471790,2023-04-04 20:23:42.086753,0 days 00:00:10.614963,True,entropy,9,8,9,860,COMPLETE
790,790,0.8070225968774221,2023-04-04 20:23:42.087434,2023-04-04 20:23:51.696660,0 days 00:00:09.609226,True,entropy,8,10,7,782,COMPLETE
791,791,0.8058507745298172,2023-04-04 20:23:51.697270,2023-04-04 20:24:08.067368,0 days 00:00:16.370098,False,gini,10,10,6,898,COMPLETE
792,792,0.8064783547854892,2023-04-04 20:24:08.069110,2023-04-04 20:24:18.075733,0 days 00:00:10.006623,True,entropy,8,10,5,840,COMPLETE
793,793,0.8069671461116217,2023-04-04 20:24:18.077192,2023-04-04 20:24:29.437824,0 days 00:00:11.360632,True,entropy,9,10,9,960,COMPLETE
794,794,0.8066487993208098,2023-04-04 20:24:29.439226,2023-04-04 20:24:39.269389,0 days 00:00:09.830163,True,entropy,7,10,2,822,COMPLETE
