,number,value,datetime_start,datetime_complete,duration,params_bootstrap,params_criterion,params_max_depth,params_max_leaf_nodes,params_min_samples_leaf,params_n_estimators,state
477,477,0.8063562605195713,2023-04-04 19:34:00.472824,2023-04-04 19:34:09.247464,0 days 00:00:08.774640,True,entropy,9,10,6,817,COMPLETE
478,478,0.806836106256099,2023-04-04 19:34:09.250519,2023-04-04 19:34:18.540982,0 days 00:00:09.290463,True,entropy,7,10,8,859,COMPLETE
479,479,0.8067588062255411,2023-04-04 19:34:18.550372,2023-04-04 19:34:29.484663,0 days 00:00:10.934291,True,entropy,8,10,9,973,COMPLETE
480,480,0.8065810262829165,2023-04-04 19:34:29.487454,2023-04-04 19:34:37.619993,0 days 00:00:08.132539,True,entropy,8,10,6,739,COMPLETE
481,481,0.8063674086811148,2023-04-04 19:34:37.622931,2023-04-04 19:34:47.034212,0 days 00:00:09.411281,True,entropy,10,10,8,880,COMPLETE
482,482,0.806133775480675,2023-04-04 19:34:47.037001,2023-04-04 19:34:56.844207,0 days 00:00:09.807206,True,entropy,7,10,6,926,COMPLETE
483,483,0.8057298431559093,2023-04-04 19:34:56.846789,2023-04-04 19:35:06.540331,0 days 00:00:09.693542,True,entropy,8,9,2,904,COMPLETE
484,484,0.8050680016547546,2023-04-04 19:35:06.542924,2023-04-04 19:35:15.606616,0 days 00:00:09.063692,True,gini,9,10,8,825,COMPLETE
485,485,0.806738880256097,2023-04-04 19:35:15.609440,2023-04-04 19:35:25.655235,0 days 00:00:10.045795,True,entropy,7,10,7,945,COMPLETE
486,486,0.8065692071810716,2023-04-04 19:35:25.658675,2023-04-04 19:35:34.733965,0 days 00:00:09.075290,True,entropy,8,10,8,850,COMPLETE
487,487,0.8062035835993029,2023-04-04 19:35:34.737362,2023-04-04 19:35:41.418998,0 days 00:00:06.681636,True,entropy,9,10,4,607,COMPLETE
488,488,0.8067349443039251,2023-04-04 19:35:41.422532,2023-04-04 19:35:51.006451,0 days 00:00:09.583919,True,entropy,8,10,6,884,COMPLETE
489,489,0.8058835371034796,2023-04-04 19:35:51.009284,2023-04-04 19:36:00.881495,0 days 00:00:09.872211,True,entropy,10,10,9,919,COMPLETE
490,490,0.8064273656105841,2023-04-04 19:36:00.884549,2023-04-04 19:36:09.026964,0 days 00:00:08.142415,True,entropy,7,10,6,766,COMPLETE
491,491,0.8068235825540873,2023-04-04 19:36:09.029860,2023-04-04 19:36:18.316190,0 days 00:00:09.286330,True,entropy,8,10,3,866,COMPLETE
492,492,0.8065600715393699,2023-04-04 19:36:18.320164,2023-04-04 19:36:27.097394,0 days 00:00:08.777230,True,entropy,9,10,8,797,COMPLETE
493,493,0.8052009425492717,2023-04-04 19:36:27.100683,2023-04-04 19:36:36.486215,0 days 00:00:09.385532,True,entropy,8,9,5,899,COMPLETE
494,494,0.8069578764974988,2023-04-04 19:36:36.488974,2023-04-04 19:36:45.351317,0 days 00:00:08.862343,True,entropy,7,10,6,838,COMPLETE
495,495,0.8067575650968937,2023-04-04 19:36:45.354389,2023-04-04 19:36:59.507653,0 days 00:00:14.153264,False,entropy,8,10,9,883,COMPLETE
496,496,0.7994450613401182,2023-04-04 19:36:59.510527,2023-04-04 19:37:08.416362,0 days 00:00:08.905835,True,entropy,8,6,8,931,COMPLETE
497,497,0.8068892088481376,2023-04-04 19:37:08.420122,2023-04-04 19:37:18.172175,0 days 00:00:09.752053,True,entropy,10,10,10,910,COMPLETE
498,498,0.8067775916473303,2023-04-04 19:37:18.174903,2023-04-04 19:37:28.351526,0 days 00:00:10.176623,True,entropy,7,10,7,954,COMPLETE
499,499,0.8068322598110109,2023-04-04 19:37:28.354470,2023-04-04 19:37:37.623684,0 days 00:00:09.269214,True,entropy,8,10,6,865,COMPLETE
500,500,0.8067445046494658,2023-04-04 19:37:37.626468,2023-04-04 19:37:47.341350,0 days 00:00:09.714882,True,entropy,9,10,8,896,COMPLETE
501,501,0.8065459600864354,2023-04-04 19:37:47.344066,2023-04-04 19:37:56.011660,0 days 00:00:08.667594,True,entropy,8,10,9,808,COMPLETE
502,502,0.8070865233479221,2023-04-04 19:37:56.014767,2023-04-04 19:38:04.257776,0 days 00:00:08.243009,True,entropy,7,10,1,775,COMPLETE
503,503,0.8058276057018867,2023-04-04 19:38:04.260463,2023-04-04 19:38:13.302223,0 days 00:00:09.041760,True,entropy,10,10,6,842,COMPLETE
504,504,0.8062325446854359,2023-04-04 19:38:13.305056,2023-04-04 19:38:22.718984,0 days 00:00:09.413928,True,gini,8,10,7,878,COMPLETE
505,505,0.8065887865543774,2023-04-04 19:38:22.722060,2023-04-04 19:38:32.393632,0 days 00:00:09.671572,True,entropy,6,10,8,917,COMPLETE
506,506,0.8053017802396318,2023-04-04 19:38:32.396420,2023-04-04 19:38:40.068695,0 days 00:00:07.672275,True,entropy,8,9,6,725,COMPLETE
507,507,0.8061480992954395,2023-04-04 19:38:40.071626,2023-04-04 19:38:49.182924,0 days 00:00:09.111298,True,entropy,9,10,9,857,COMPLETE
508,508,0.8065663446594155,2023-04-04 19:38:49.185870,2023-04-04 19:38:56.330413,0 days 00:00:07.144543,True,entropy,7,10,5,660,COMPLETE
509,509,0.8068938157149395,2023-04-04 19:38:56.333149,2023-04-04 19:39:06.833643,0 days 00:00:10.500494,True,entropy,8,10,8,983,COMPLETE
510,510,0.806769205364424,2023-04-04 19:39:06.836312,2023-04-04 19:39:16.868332,0 days 00:00:10.032020,True,entropy,9,10,6,937,COMPLETE
511,511,0.8066363428748519,2023-04-04 19:39:16.871410,2023-04-04 19:39:24.899904,0 days 00:00:08.028494,True,entropy,8,10,9,751,COMPLETE
512,512,0.7925998126103758,2023-04-04 19:39:24.903575,2023-04-04 19:39:32.530908,0 days 00:00:07.627333,True,entropy,7,4,5,895,COMPLETE
513,513,0.8073381704786098,2023-04-04 19:39:32.532278,2023-04-04 19:39:45.836447,0 days 00:00:13.304169,False,entropy,10,10,8,822,COMPLETE
514,514,0.8065970276057668,2023-04-04 19:39:45.839330,2023-04-04 19:39:58.925743,0 days 00:00:13.086413,False,entropy,10,10,6,816,COMPLETE
515,515,0.8066001136896676,2023-04-04 19:39:58.928563,2023-04-04 19:40:11.668566,0 days 00:00:12.740003,False,entropy,10,10,8,794,COMPLETE
516,516,0.8064522787380554,2023-04-04 19:40:11.670522,2023-04-04 19:40:20.607148,0 days 00:00:08.936626,True,entropy,10,10,8,827,COMPLETE
517,517,0.806426370373712,2023-04-04 19:40:20.608219,2023-04-04 19:40:33.760550,0 days 00:00:13.152331,False,entropy,10,10,6,821,COMPLETE
518,518,0.806696501123773,2023-04-04 19:40:33.762640,2023-04-04 19:40:46.251074,0 days 00:00:12.488434,False,entropy,10,10,9,782,COMPLETE
519,519,0.8066952598749134,2023-04-04 19:40:46.254432,2023-04-04 19:40:59.125531,0 days 00:00:12.871099,False,entropy,10,10,7,804,COMPLETE
520,520,0.8063727313014757,2023-04-04 19:40:59.128149,2023-04-04 19:41:13.862311,0 days 00:00:14.734162,False,entropy,10,10,4,917,COMPLETE
521,521,0.806918404571482,2023-04-04 19:41:13.864130,2023-04-04 19:41:29.367797,0 days 00:00:15.503667,False,entropy,10,10,6,960,COMPLETE
522,522,0.806778363193861,2023-04-04 19:41:29.370719,2023-04-04 19:41:44.249143,0 days 00:00:14.878424,False,entropy,10,10,6,932,COMPLETE
523,523,0.8046130912237113,2023-04-04 19:41:44.252414,2023-04-04 19:41:57.290350,0 days 00:00:13.037936,False,gini,10,9,8,839,COMPLETE
524,524,0.806195722752941,2023-04-04 19:41:57.293156,2023-04-04 19:42:11.695425,0 days 00:00:14.402269,False,entropy,10,10,9,893,COMPLETE
525,525,0.8065096303959912,2023-04-04 19:42:11.698010,2023-04-04 19:42:23.865431,0 days 00:00:12.167421,False,entropy,7,10,1,764,COMPLETE
526,526,0.8067694402045792,2023-04-04 19:42:23.868324,2023-04-04 19:42:31.277397,0 days 00:00:07.409073,True,entropy,9,10,3,685,COMPLETE
527,527,0.8069220273860498,2023-04-04 19:42:31.280419,2023-04-04 19:42:38.032996,0 days 00:00:06.752577,True,entropy,7,10,7,628,COMPLETE
528,528,0.8032002109907351,2023-04-04 19:42:38.036177,2023-04-04 19:42:47.418061,0 days 00:00:09.381884,True,entropy,10,8,8,910,COMPLETE
529,529,0.7965535743907874,2023-04-04 19:42:47.420866,2023-04-04 19:42:55.282792,0 days 00:00:07.861926,True,entropy,9,5,6,868,COMPLETE
530,530,0.8065186988505972,2023-04-04 19:42:55.284175,2023-04-04 19:43:04.628159,0 days 00:00:09.343984,True,entropy,7,10,5,881,COMPLETE
531,531,0.8068475453062346,2023-04-04 19:43:04.631164,2023-04-04 19:43:13.091531,0 days 00:00:08.460367,True,entropy,9,10,9,786,COMPLETE
532,532,0.806788192133865,2023-04-04 19:43:13.094133,2023-04-04 19:43:23.316063,0 days 00:00:10.221930,True,entropy,10,10,8,942,COMPLETE
533,533,0.8067636367840494,2023-04-04 19:43:23.318930,2023-04-04 19:43:32.402976,0 days 00:00:09.084046,True,entropy,7,10,7,850,COMPLETE
534,534,0.8063187789983554,2023-04-04 19:43:32.405832,2023-04-04 19:43:38.217586,0 days 00:00:05.811754,True,entropy,8,10,10,534,COMPLETE
535,535,0.8071851359368095,2023-04-04 19:43:38.218748,2023-04-04 19:43:47.926762,0 days 00:00:09.708014,True,entropy,7,10,6,903,COMPLETE
536,536,0.8069743694452478,2023-04-04 19:43:47.930255,2023-04-04 19:43:58.235525,0 days 00:00:10.305270,True,entropy,9,10,6,896,COMPLETE
537,537,0.8062895943091668,2023-04-04 19:43:58.238491,2023-04-04 19:44:07.460990,0 days 00:00:09.222499,True,entropy,6,10,6,877,COMPLETE
538,538,0.8051318721863318,2023-04-04 19:44:07.463623,2023-04-04 19:44:16.621739,0 days 00:00:09.158116,False,entropy,8,9,6,581,COMPLETE
539,539,0.8065525348962991,2023-04-04 19:44:16.624643,2023-04-04 19:44:25.296897,0 days 00:00:08.672254,True,entropy,10,10,6,811,COMPLETE
540,540,0.8068864579895825,2023-04-04 19:44:25.300489,2023-04-04 19:44:34.278128,0 days 00:00:08.977639,True,entropy,7,10,6,836,COMPLETE
541,541,0.8061021980345231,2023-04-04 19:44:34.281281,2023-04-04 19:44:43.957534,0 days 00:00:09.676253,True,entropy,8,10,6,903,COMPLETE
542,542,0.8065930468686495,2023-04-04 19:44:43.960677,2023-04-04 19:44:53.058660,0 days 00:00:09.097983,True,entropy,9,10,6,855,COMPLETE
543,543,0.806525329633908,2023-04-04 19:44:53.061726,2023-04-04 19:45:01.100845,0 days 00:00:08.039119,True,entropy,8,10,7,746,COMPLETE
544,544,0.805970610221632,2023-04-04 19:45:01.103441,2023-04-04 19:45:10.642906,0 days 00:00:09.539465,True,gini,10,10,6,878,COMPLETE
545,545,0.806592487698555,2023-04-04 19:45:10.646352,2023-04-04 19:45:20.497136,0 days 00:00:09.850784,True,entropy,7,10,8,923,COMPLETE
546,546,0.8068270154114211,2023-04-04 19:45:20.500471,2023-04-04 19:45:30.014982,0 days 00:00:09.514511,True,entropy,8,10,6,893,COMPLETE
547,547,0.8065735569402737,2023-04-04 19:45:30.018495,2023-04-04 19:45:39.303657,0 days 00:00:09.285162,True,entropy,8,10,6,867,COMPLETE
548,548,0.8065120679932644,2023-04-04 19:45:39.306860,2023-04-04 19:45:47.975836,0 days 00:00:08.668976,True,entropy,9,10,9,795,COMPLETE
549,549,0.8065729084362863,2023-04-04 19:45:47.978708,2023-04-04 19:45:55.648971,0 days 00:00:07.670263,True,entropy,7,10,8,715,COMPLETE
550,550,0.8065276554037789,2023-04-04 19:45:55.652094,2023-04-04 19:46:05.402712,0 days 00:00:09.750618,True,entropy,8,10,7,905,COMPLETE
551,551,0.8067241760968953,2023-04-04 19:46:05.405295,2023-04-04 19:46:14.291700,0 days 00:00:08.886405,True,entropy,10,10,6,829,COMPLETE
552,552,0.8067723474074429,2023-04-04 19:46:14.294295,2023-04-04 19:46:24.730895,0 days 00:00:10.436600,True,entropy,8,10,8,964,COMPLETE
553,553,0.8065344094181357,2023-04-04 19:46:24.733909,2023-04-04 19:46:37.032174,0 days 00:00:12.298265,False,entropy,7,10,6,773,COMPLETE
554,554,0.80529261101388,2023-04-04 19:46:37.035066,2023-04-04 19:46:41.899230,0 days 00:00:04.864164,True,entropy,9,9,9,453,COMPLETE
555,555,0.8065186875856651,2023-04-04 19:46:41.902116,2023-04-04 19:46:51.041667,0 days 00:00:09.139551,True,entropy,8,10,6,857,COMPLETE
556,556,0.8017667114781742,2023-04-04 19:46:51.044518,2023-04-04 19:46:58.673988,0 days 00:00:07.629470,True,entropy,3,10,8,930,COMPLETE
557,557,0.8067831602637595,2023-04-04 19:46:58.676865,2023-04-04 19:47:08.171980,0 days 00:00:09.495115,True,entropy,10,10,8,886,COMPLETE
558,558,0.8065397207517264,2023-04-04 19:47:08.175018,2023-04-04 19:47:17.942570,0 days 00:00:09.767552,True,entropy,8,10,7,915,COMPLETE
559,559,0.8069353450518066,2023-04-04 19:47:17.945529,2023-04-04 19:47:27.190888,0 days 00:00:09.245359,True,entropy,7,10,6,874,COMPLETE
560,560,0.806762462749375,2023-04-04 19:47:27.193735,2023-04-04 19:47:36.057448,0 days 00:00:08.863713,True,entropy,9,10,9,814,COMPLETE
561,561,0.8060302764253773,2023-04-04 19:47:36.060778,2023-04-04 19:47:45.292354,0 days 00:00:09.231576,True,gini,8,10,8,843,COMPLETE
562,562,0.8068386222045427,2023-04-04 19:47:45.295663,2023-04-04 19:47:55.477949,0 days 00:00:10.182286,True,entropy,10,10,6,950,COMPLETE
563,563,0.8046691904426201,2023-04-04 19:47:55.481561,2023-04-04 19:48:06.589047,0 days 00:00:11.107486,False,entropy,6,9,10,731,COMPLETE
564,564,0.8061768815167248,2023-04-04 19:48:06.592011,2023-04-04 19:48:16.191434,0 days 00:00:09.599423,True,entropy,7,10,9,892,COMPLETE
565,565,0.8061694790458158,2023-04-04 19:48:16.194039,2023-04-04 19:48:25.891671,0 days 00:00:09.697632,True,entropy,8,10,8,904,COMPLETE
566,566,0.8069015313291314,2023-04-04 19:48:25.894935,2023-04-04 19:48:33.475737,0 days 00:00:07.580802,True,entropy,8,10,5,700,COMPLETE
567,567,0.7890995977558365,2023-04-04 19:48:33.479243,2023-04-04 19:48:40.175639,0 days 00:00:06.696396,True,entropy,7,3,7,866,COMPLETE
568,568,0.8064259232015024,2023-04-04 19:48:40.178247,2023-04-04 19:48:50.289454,0 days 00:00:10.111207,True,entropy,8,10,6,934,COMPLETE
569,569,0.8066150527013878,2023-04-04 19:48:50.292488,2023-04-04 19:48:59.304885,0 days 00:00:09.012397,True,entropy,10,10,6,835,COMPLETE
570,570,0.8067921951868516,2023-04-04 19:48:59.307852,2023-04-04 19:49:09.858596,0 days 00:00:10.550744,True,entropy,9,10,8,983,COMPLETE
571,571,0.8068493901877882,2023-04-04 19:49:09.861765,2023-04-04 19:49:15.015694,0 days 00:00:05.153929,True,entropy,8,10,9,473,COMPLETE
572,572,0.8064127620810776,2023-04-04 19:49:15.018812,2023-04-04 19:49:23.174003,0 days 00:00:08.155191,True,entropy,7,10,6,754,COMPLETE
573,573,0.8062826838686921,2023-04-04 19:49:23.177040,2023-04-04 19:49:33.227508,0 days 00:00:10.050468,True,entropy,8,10,8,917,COMPLETE
574,574,0.8067097740857563,2023-04-04 19:49:33.230418,2023-04-04 19:49:47.284220,0 days 00:00:14.053802,False,entropy,10,10,6,880,COMPLETE
575,575,0.8067873199847211,2023-04-04 19:49:47.287088,2023-04-04 19:49:55.825003,0 days 00:00:08.537915,True,entropy,9,10,8,798,COMPLETE
576,576,0.8064045546014654,2023-04-04 19:49:55.827965,2023-04-04 19:50:00.565853,0 days 00:00:04.737888,True,entropy,7,10,6,430,COMPLETE
577,577,0.8012223353738269,2023-04-04 19:50:00.568686,2023-04-04 19:50:05.687206,0 days 00:00:05.118520,True,entropy,8,7,9,503,COMPLETE
578,578,0.8048019745357996,2023-04-04 19:50:05.690256,2023-04-04 19:50:15.081121,0 days 00:00:09.390865,True,entropy,8,9,7,897,COMPLETE
579,579,0.8059624920965425,2023-04-04 19:50:15.083784,2023-04-04 19:50:21.979394,0 days 00:00:06.895610,True,entropy,7,10,8,646,COMPLETE
580,580,0.8066075496229518,2023-04-04 19:50:21.982313,2023-04-04 19:50:25.888892,0 days 00:00:03.906579,True,entropy,8,10,6,344,COMPLETE
581,581,0.8059521378239417,2023-04-04 19:50:25.892260,2023-04-04 19:50:35.044754,0 days 00:00:09.152494,True,gini,10,10,9,859,COMPLETE
582,582,0.8064979676968804,2023-04-04 19:50:35.047728,2023-04-04 19:50:43.358375,0 days 00:00:08.310647,True,entropy,9,10,6,777,COMPLETE
583,583,0.8066631343567098,2023-04-04 19:50:43.361345,2023-04-04 19:50:53.000709,0 days 00:00:09.639364,True,entropy,8,10,8,906,COMPLETE
584,584,0.8064797637204698,2023-04-04 19:50:53.003622,2023-04-04 19:51:02.481807,0 days 00:00:09.478185,True,entropy,7,10,5,881,COMPLETE
585,585,0.8068462482814557,2023-04-04 19:51:02.485571,2023-04-04 19:51:15.621247,0 days 00:00:13.135676,False,entropy,8,10,7,824,COMPLETE
586,586,0.8067725039838782,2023-04-04 19:51:15.622924,2023-04-04 19:51:25.802804,0 days 00:00:10.179880,True,entropy,9,10,8,945,COMPLETE
587,587,0.8070463247234041,2023-04-04 19:51:25.806020,2023-04-04 19:51:34.927536,0 days 00:00:09.121516,True,entropy,8,10,9,851,COMPLETE
588,588,0.8065201300958886,2023-04-04 19:51:34.930520,2023-04-04 19:51:44.922395,0 days 00:00:09.991875,True,entropy,10,10,6,926,COMPLETE
589,589,0.8070790651090833,2023-04-04 19:51:44.926134,2023-04-04 19:51:54.410755,0 days 00:00:09.484621,True,entropy,7,10,8,889,COMPLETE
590,590,0.8046803722112224,2023-04-04 19:51:54.411662,2023-04-04 19:52:02.941049,0 days 00:00:08.529387,True,entropy,8,9,6,809,COMPLETE
591,591,0.8070337340085608,2023-04-04 19:52:02.944095,2023-04-04 19:52:12.641062,0 days 00:00:09.696967,True,entropy,7,10,7,911,COMPLETE
592,592,0.807042578773373,2023-04-04 19:52:12.644042,2023-04-04 19:52:23.032881,0 days 00:00:10.388839,True,entropy,8,10,5,964,COMPLETE
593,593,0.8069022691518424,2023-04-04 19:52:23.035764,2023-04-04 19:52:32.382994,0 days 00:00:09.347230,True,entropy,9,10,9,871,COMPLETE
594,594,0.8066792699159168,2023-04-04 19:52:32.385904,2023-04-04 19:52:41.469080,0 days 00:00:09.083176,True,entropy,10,10,6,853,COMPLETE
595,595,0.8067621832267367,2023-04-04 19:52:41.472096,2023-04-04 19:52:51.202070,0 days 00:00:09.729974,True,entropy,6,10,8,929,COMPLETE
596,596,0.8067180485872552,2023-04-04 19:52:51.204963,2023-04-04 19:52:59.755253,0 days 00:00:08.550290,True,entropy,8,10,6,789,COMPLETE
597,597,0.8063820904309271,2023-04-04 19:52:59.758270,2023-04-04 19:53:11.784350,0 days 00:00:12.026080,False,entropy,4,10,8,895,COMPLETE
598,598,0.806547469686611,2023-04-04 19:53:11.788188,2023-04-04 19:53:20.762915,0 days 00:00:08.974727,True,entropy,9,10,7,839,COMPLETE
599,599,0.8058420526860461,2023-04-04 19:53:20.765864,2023-04-04 19:53:28.016132,0 days 00:00:07.250268,True,gini,8,10,8,678,COMPLETE
600,600,0.8034467591534955,2023-04-04 19:53:28.019137,2023-04-04 19:53:35.903794,0 days 00:00:07.884657,True,entropy,7,8,9,762,COMPLETE
601,601,0.8068317228686752,2023-04-04 19:53:35.906483,2023-04-04 19:53:45.276149,0 days 00:00:09.369666,True,entropy,10,10,6,874,COMPLETE
602,602,0.8067010857163559,2023-04-04 19:53:45.279130,2023-04-04 19:53:55.861225,0 days 00:00:10.582095,True,entropy,8,10,10,999,COMPLETE
603,603,0.8068843559018306,2023-04-04 19:53:55.864225,2023-04-04 19:54:05.605540,0 days 00:00:09.741315,True,entropy,8,10,9,907,COMPLETE
604,604,0.8053221087669057,2023-04-04 19:54:05.608035,2023-04-04 19:54:15.627323,0 days 00:00:10.019288,True,entropy,7,9,6,942,COMPLETE
605,605,0.8065487111596752,2023-04-04 19:54:15.630259,2023-04-04 19:54:24.851492,0 days 00:00:09.221233,True,entropy,9,10,8,824,COMPLETE
606,606,0.8065336712290725,2023-04-04 19:54:24.854368,2023-04-04 19:54:34.329238,0 days 00:00:09.474870,True,entropy,10,10,6,887,COMPLETE
607,607,0.8070010494799649,2023-04-04 19:54:34.330341,2023-04-04 19:54:44.134988,0 days 00:00:09.804647,True,entropy,7,10,5,920,COMPLETE
608,608,0.8064149202201548,2023-04-04 19:54:44.138880,2023-04-04 19:54:58.132072,0 days 00:00:13.993192,False,entropy,8,10,8,867,COMPLETE
609,609,0.80637727117171,2023-04-04 19:54:58.135227,2023-04-04 19:55:07.202721,0 days 00:00:09.067494,True,entropy,6,10,6,852,COMPLETE
610,610,0.8070215122144353,2023-04-04 19:55:07.205360,2023-04-04 19:55:15.047948,0 days 00:00:07.842588,True,entropy,8,10,9,735,COMPLETE
611,611,0.8065659979805826,2023-04-04 19:55:15.051003,2023-04-04 19:55:24.815311,0 days 00:00:09.764308,True,entropy,7,10,8,908,COMPLETE
612,612,0.8070184818907972,2023-04-04 19:55:24.818271,2023-04-04 19:55:33.638003,0 days 00:00:08.819732,True,entropy,8,10,7,807,COMPLETE
613,613,0.8069011510468558,2023-04-04 19:55:33.641354,2023-04-04 19:55:43.152046,0 days 00:00:09.510692,True,entropy,9,10,6,889,COMPLETE
614,614,0.8063548179083859,2023-04-04 19:55:43.155516,2023-04-04 19:55:52.121193,0 days 00:00:08.965677,True,entropy,10,10,7,836,COMPLETE
615,615,0.7930800946697467,2023-04-04 19:55:52.124355,2023-04-04 19:56:00.259169,0 days 00:00:08.134814,True,entropy,8,4,8,950,COMPLETE
616,616,0.8051701141953241,2023-04-04 19:56:00.262394,2023-04-04 19:56:09.491661,0 days 00:00:09.229267,True,entropy,7,9,6,877,COMPLETE
617,617,0.8061643913398274,2023-04-04 19:56:09.495363,2023-04-04 19:56:19.418425,0 days 00:00:09.923062,True,entropy,8,10,9,924,COMPLETE
618,618,0.7974529288674878,2023-04-04 19:56:19.421915,2023-04-04 19:56:26.889390,0 days 00:00:07.467475,True,gini,9,6,6,784,COMPLETE
619,619,0.806974570853561,2023-04-04 19:56:26.892606,2023-04-04 19:56:41.220319,0 days 00:00:14.327713,False,entropy,10,10,8,898,COMPLETE
620,620,0.8066539317093937,2023-04-04 19:56:41.223341,2023-04-04 19:56:42.590368,0 days 00:00:01.367027,True,entropy,8,10,5,107,COMPLETE
621,621,0.8070253027565351,2023-04-04 19:56:42.593022,2023-04-04 19:56:51.700914,0 days 00:00:09.107892,True,entropy,7,10,8,858,COMPLETE
622,622,0.8064517979226276,2023-04-04 19:56:51.703890,2023-04-04 19:57:02.054390,0 days 00:00:10.350500,True,entropy,8,10,6,969,COMPLETE
623,623,0.8064014125784542,2023-04-04 19:57:02.057458,2023-04-04 19:57:11.874162,0 days 00:00:09.816704,True,entropy,10,10,9,907,COMPLETE
624,624,0.806235608343405,2023-04-04 19:57:11.876810,2023-04-04 19:57:21.929971,0 days 00:00:10.053161,True,entropy,9,10,6,933,COMPLETE
625,625,0.806339767246153,2023-04-04 19:57:21.932904,2023-04-04 19:57:31.405761,0 days 00:00:09.472857,True,entropy,8,10,8,876,COMPLETE
626,626,0.8065251954498477,2023-04-04 19:57:31.408449,2023-04-04 19:57:39.425852,0 days 00:00:08.017403,True,entropy,7,10,6,752,COMPLETE
627,627,0.8065999683252976,2023-04-04 19:57:39.428743,2023-04-04 19:57:48.202486,0 days 00:00:08.773743,True,entropy,8,10,9,812,COMPLETE
628,628,0.8053030996108135,2023-04-04 19:57:48.205147,2023-04-04 19:57:55.813993,0 days 00:00:07.608846,True,entropy,8,9,7,718,COMPLETE
629,629,0.8068787986280167,2023-04-04 19:57:55.816888,2023-04-04 19:58:04.733221,0 days 00:00:08.916333,True,entropy,7,10,6,833,COMPLETE
630,630,0.8062016714669094,2023-04-04 19:58:04.736175,2023-04-04 19:58:18.971770,0 days 00:00:14.235595,False,entropy,9,10,8,892,COMPLETE
631,631,0.8071176871313671,2023-04-04 19:58:18.974768,2023-04-04 19:58:28.184230,0 days 00:00:09.209462,True,entropy,8,10,9,857,COMPLETE
632,632,0.8067781284926128,2023-04-04 19:58:28.187339,2023-04-04 19:58:37.452416,0 days 00:00:09.265077,True,entropy,8,10,9,856,COMPLETE
633,633,0.8067358723991862,2023-04-04 19:58:37.456596,2023-04-04 19:58:46.481963,0 days 00:00:09.025367,True,entropy,10,10,9,843,COMPLETE
634,634,0.8063255996901517,2023-04-04 19:58:46.484903,2023-04-04 19:58:55.642680,0 days 00:00:09.157777,True,entropy,7,10,9,866,COMPLETE
635,635,0.8066707717058093,2023-04-04 19:58:55.645682,2023-04-04 19:59:04.795544,0 days 00:00:09.149862,True,entropy,8,10,9,850,COMPLETE
